nouns,link
산촌 희망 부부 극복 농산 희망 열매 해석 이선경 부부 햇살 농장 곡성군 죽곡면 통명산 자락,https://blog.naver.com/kangts0001/110089997528
극복 경쟁력 외로움 특화 품종 승부 기회 생각,https://blog.naver.com/gny0607/220634485674
은퇴 이후 가지 현실 포기 현실 도시 직장 은퇴 농어촌 지역 이주 자금 지원,https://blog.naver.com/insidernews/223442017003
가족 반대 설명 의논 과정 중요 탐색 정보 공유 사전 이야기 필요,https://kofpi.tistory.com/55
물집 피곤 입술 수포 처음 부족 부분,https://blog.naver.com/binna2/223432453251
한국 토지 주택 공사 해소 활성 전국 지역 주택 공급 사업 진행 주택 공급,https://blog.naver.com/bloglh/220965631457
방송 댓글 공감 상임 종상 공감 남편 새벽 모습 아내,https://blog.naver.com/ytm1300/223129794139
정착지 생각 임자도 나이 마음 문제 예전 이모,https://blog.naver.com/sycho81/220698624812
허가 과정 소요 현재 협업 판매 최소 자리,https://blog.naver.com/hotcocoshop/223488233569
의원 기회 과정 지원 효과 현장 목소리 계기 우수 사례 공유 예산군,https://blog.naver.com/jesus53-/223270736226
지원 이용 시작 지역 창업 사전 답사 상권 분석 타깃 설정 구체 사업 프로세스 고민 창업,https://blog.naver.com/itemdebak001/223201942331
오늘 은퇴 생활 정확 재무 예상 경제 문제 계획 무산 건강,https://blog.naver.com/dbstmddk818/223162319368
창업 창업 센터 도움 요청 창업 센터 창업자 예산 창업 도움 요청 자금 부족 정부,https://blog.naver.com/essekiller/223184921999
며칠 방송 아침 작가 이야기 전화 이야기 준비 아쉬움 생각,https://blog.naver.com/ysy0641/221394484681
가족 반대 설명 의논 과정 중요 탐색 정보 공유 사전 이야기 필요,https://blog.naver.com/kofpi/140178491494
최근 도시 생활 스트레스 경제 선택 지원 제도 발전 지원금,https://blog.naver.com/werf0101/223456163403
지원금 호소 시작 세상 단순 관심 현실,https://blog.naver.com/bmwadog/221247875655
교육 초기 사항 해결 안정 도움 기대 교육 프로그램 인기 조기 마감 고보,https://blog.naver.com/jejumarket09/221813515217
사업 주거 측면 지원 주택 수리비 지원 사업 사업 기존 개소 개소 확대 농인 조성 사업 기존,https://blog.naver.com/hadongblog/223256923903
현실 이야기 매력 선택지 골살이 교차 헬로 파머 메시지 마찬가지,https://blog.naver.com/nong-up/221316974473
예산군 농업기술센터 지원 오가면 여성 협업 농장 농장 운영 작물 연습 공간 이야기,https://blog.naver.com/cskcr/222629702107
황소걸음 대로 화이팅,https://blog.naver.com/kdi5179/10168338460
초기 극복 안정 주거 환경 제공 빈집 임대료 주택 수리비 지원 사업 추진 빈집 임대료 도심 거주,https://blog.naver.com/hiksanin/221571188194
도시 회귀 딸딸이 고급 농인 전유물 농사일 생각,https://blog.naver.com/3kingz/220709573411
외로움 부족 일손 시기 생각 말씀 세상,https://blog.naver.com/railroad7/40208833364
예상 곤충 동물 습격 증열 혈소판 감소 증후군 진드기 살인 진드기 진드기 사고 진드기 환경 제주 제주도,https://blog.naver.com/kit6242/223166118887
극복 최고 가족 가족 도시 공동체 사회 이웃 소통,https://blog.naver.com/ytm1300/223004207677
전북 순창 가이아 농장 유기농 재배 미나리 연을 주제 사례 교육 체험 운영 순창 발효 테마파크 장류 문화 본고장 순창 고추장,https://blog.naver.com/ytm1300/223222956293
교육장 준비 교육 실습 과정 파종 출하 과정 교육 프로그램 준비 단계 내년,https://blog.naver.com/nicearra/220829887465
존재 가족 일부분 개월 모습 변신 경북 봉화,https://blog.naver.com/pineforest455/223487769244
사건 이해 설명 영상 전북 방송 뉴스 소개 남원시 사기 피해 내용 내용 참고 링크 추적,https://blog.naver.com/smartboy1989/222296098519
분과 이야기 오후 체육 대회 선배 강의 박일 일정 철쭉 작업,https://blog.naver.com/madam2520/221709287977
미디어 낭만 생활 편의 시설 텃세 주민 갈등 고강 육체 노동 다양 현실 문제,https://blog.naver.com/mosfnet/222649971669
국가 자원 확보 산업 경쟁력 가치 노력 필요 시점,https://blog.naver.com/sejong_story/220643339286
인물 배경 재배 작목 생활 중요 생각 요소 대한민국 방방곡곡 저자 지역,https://blog.naver.com/five_golden_keys/223386770522
과정 극복 방법 준비 실행 준비 필요 준비 기간 경제 출혈 준비,https://blog.naver.com/nong-up/222293737865
지역 문제 고민 최근 도시 이동 소멸 박람회 체험,https://blog.naver.com/letsgoyang/222860954423
교육 준택 정장 코로나 교육 중단 재기 교육 현실 다양 제도 생활,https://blog.naver.com/hwa3789/222139377501
실제 파악 대비 은퇴 체계 준비 필수 전문 기관 활용 관련 박람회 참관 정착지 사전 탐방,https://blog.naver.com/twinskj/223485808610
부부 순간 사회생활 건강 적신호 선택 김농 부네 부부,https://blog.naver.com/kjo589/222989606305
이야기 좌절 수고 생산 농산물 판매 무상,https://blog.naver.com/tjd1000/223407818437
문화 의성군 정보 초보 인과 예비 대상 진행 교육 정보 사례 선도 농가 농장 견학 초기,https://blog.naver.com/uiseong-good/221359178868
인과 현지인 차이점 한국 사회 전통문화 전통 가치관 가운데 취업 결혼 계기 이주민 다양 경험,https://blog.naver.com/cheolsu96/223347327109
카페 창업 나만 시골 카페 도움 필요 도심 창업자 각계 전문가 재능기부 지원 오랫동안 유지 가능 매장이,https://blog.naver.com/hongsampw/223173507420
물건 유튜브 도움 튜버 최종 목표 튜버 최종 목표,https://blog.naver.com/daeyu6293/222442706182
농기 마스터 교육 초기 해소 품목 기술 습득 원주민 소통 이해 도움 교육 과정 차례,https://blog.naver.com/kbc5995/220712251631
간담회 무주군 현황 공유 요구사항 청취 마련 지역 주민 소통 협력 강화,https://blog.naver.com/bo114114/223426035519
음성군 참가 유일 우수 지자체 선정 박람회 극복 조병옥 안정 지역 활력,https://blog.naver.com/agpeople/223203563217
필리아 가든 생활 망고 애플 망고 생활,https://blog.naver.com/cumbarm/223040452100
마음 표고버섯 연락 선배 상담,https://blog.naver.com/nongbufarm/220721318699
김기 결심 실천 마을 주민 시설 하우스 현장 경험 주말 고향,https://blog.naver.com/ytm1300/223072511012
민박 개업 영업 교육 출력 체크 첨부 파일 마룸 리뷰 민박,https://blog.naver.com/mysecondroom/223488302973
피해 유형 다양 텃세 방지법 폐기 처분 위기 대책 수혜 맞춤 필요 직면 일자리 소득 주거 복지 문화 사회 참여 차원 생활,https://blog.naver.com/mrbean7/223474354353
편안 노후 생활 거주자 거리감 수도,https://blog.naver.com/oyh3235/205692018
농인 여유 자금 아르바이트 생계 호소 정부 지방 자치 단체 지원 일정 부분 도움 적극 관심 지원,https://blog.naver.com/loveacrc/223128805525
단어 귀어 단어 귀어 어선 임대 사업 어업 시작 어선 구매 비용 진입 이하,https://blog.naver.com/ggaf2007/223156462322
국민 일보 서울 센터 전시장 일간 박람회 출동 사유 행사 개최 연락 서비스 제공,https://blog.naver.com/hansu0258/223486442433
이야기 도시 소란 자연 공동체 상기 고려 계기 유진국,https://blog.naver.com/romns31658/223376221554
이야기 오미자 농부 일기 해결 거창군 기술 센터 블로그 마케팅 교육,https://blog.naver.com/krcpolicy/222244133665
청년층 시작 수미 마을 교육 현재 진행 도움 추천,https://blog.naver.com/shine90172/223425692570
익산시 농업기술센터 소장 박내현 최근 인생 익산 사전 준비 부족 사항 해결 교육,https://blog.naver.com/hiksanin/20189993959
준비 가지 생업 철저 준비 필요 지역 자금 지원 지역 농업기술센터 관공서 농협,https://blog.naver.com/kjdfarmer/220255619981
제주 시민 제주도 제주도 토박이 변형 제주도 포기 시골,https://blog.naver.com/ytm1300/223013776463
경험 생활 장점 단점 극복 방법 노하우 구례군 관련 교육 지역 역사 문화 교육 탐방,https://blog.naver.com/nong-up/222158670158
안동 시골 생활 시작 주변 반대 걱정 자연 여유 시작 텐데요,https://blog.naver.com/krcpolicy/222680627877
생각 만만 준비 실행 준비 아름드리 고민,https://blog.naver.com/areumdri_09/10105089626
농지 은행 열쇠 청송 농부 주석 농지 은행 지원 농지 마련 농지 은행 덕분 해결 창업 선정,https://blog.naver.com/krcpolicy/222127665936
평생 농부 말씀 희생 동반 여유 자금 건강 대출 감격 금물 함정,https://blog.naver.com/amara801/185764503
년차 극복 연꽃 기설 전화 번호 블로그 년차 극복 주변,https://blog.naver.com/patorry/220455376589
생활 열정 희망 중요 긍정 도전 마인드 중요 적응,https://blog.naver.com/kjo589/223429033465
출발 복합 요인 야기 문제 규정 결심 준비 귀향,https://blog.naver.com/9365031/221300218424
관심 교육 신박 정보 전라북도 지원 센터 강사 활동도 발효 식품 노력 계속,https://blog.naver.com/fabist/221353978812
생각 준비 초보 정보지 생각 정보 공유 초보,https://blog.naver.com/parkjungsoon77/220485701614
교육 실패담 교육 확률 사진 경상북도 종합 지원 센터 경북 울진군 우수 사례,https://blog.naver.com/ytm1300/223109247349
마을 어둠 야간 통행 불편 해소 방범 효과 보안등 설치 호응 올해 월말 면사무소,https://blog.naver.com/boryeongsi/220608004181
자금 대출 개인 경영 상환 개인 회생 절차 금융 기관 타협 의사 혜택 자금 개인 회생 혜택,https://blog.naver.com/rkbbyek/223478281750
교육 참여 학생 최근 충남 시군 희망 터전 충남 기술원 교육 초기 상당 부분,https://blog.naver.com/sinmunman/70090248485
마련 준비 요소 동기 준비 완벽 이해 건축물 확보 살집 마련 수입 지속 사업 계획서,https://blog.naver.com/rnrals8/222930931993
가능 선배 농장 방문 준비 방안 설명 마지막 철저 계획 상황,https://blog.naver.com/goesan-gun/221344617780
박준호 회사 법인 주담 전남 고흥 지역 온실 버섯 재배 이주,https://blog.naver.com/fabist/222198030236
마을 주민 동제 참석 마을 친분 처음 마을 마을,https://blog.naver.com/allie2766/220087963367
단체 교육 프로그램 월세 평과 제공 가지 기법 노하우 전수 체험 프로그램 분도 부인 반대,https://blog.naver.com/sbkim527/220999414652
코로나 지원 경기 식품 유통 흥원 체험 프로그램 진행 발표 프로그램 포천,https://blog.naver.com/newspcs21/222148430513
직면 주위 친구 부모 사업 친구 본인 능력,https://blog.naver.com/jwkimch/10143695784
서울 박람회 서울 수도 계획 딸기 재배 시작 처음 가지 포기 물의,https://blog.naver.com/fabist/221586158168
자살 이야기 한겨레 기사 일반 거리 내용 지방 거기 단체 내용 대부분 대출,https://blog.naver.com/egeyouri/223431734927
준비 희망 시민 전입 초기 분야 전문가 소개 맞춤 상담 관련 정보 제공 현장,https://blog.naver.com/go2pc/223369168213
생활 여유 생각 결정 시작 도시 생활 생활 패턴 수확기 각지 발생,https://blog.naver.com/hi_nso/221309185925
사농 생활 이웃 도움 시골,https://blog.naver.com/s_rammi/221368608014
관련 정보 부족 갈등 호소 예비 의미 행사 극복 취지 도약,https://blog.naver.com/ky12812/222858227373
태도 희망 현재 응답,http://wjyang.egloos.com/11167429
교육 지도 과정 복습 응시 합격 느낌 마무리 결과,https://blog.naver.com/wwwleiorkr/223435601550
시골 사업 시작 의미 외국 이민 도시 환경 문제,https://blog.naver.com/cumbarm/222121827535
초기 토양 관리 당시 완숙 퇴비 사용 년차 재배 생육 연작 토양 관리 중요 경험 지인 추천,https://blog.naver.com/agrostory/222899254202
현수막 박람회 양재 시민 주변 센터 온라인 사전 등록 무료 입장,https://blog.naver.com/gbjgg/223475181183
교육 과정 생활 운영 교육 맞춤 학습 제공 도움,https://blog.naver.com/2000happy_/220079129252
경기도 멘토 사업 초보 해결 시행착오 기여 프로그램 전문가 초보 연결 준비 기술,https://blog.naver.com/juminjachi/223365209253
친구 소통 문화 취미 활동 감수 부분 생각 처음 농민 소통 고생,https://blog.naver.com/ytm1300/223091075104
경험 부족 적응 생활 인프라 서비스 제한 고려 장단점 고려 방식,https://blog.naver.com/dbstmddk818/223064479053
은행 방문 대출 창구 진흥 자금 문제 호소 농부 농어촌 진흥 자금 불똥 제주 제주도 수호 농원 공방 제주 농부 제주 일상,https://blog.naver.com/kit6242/223255004197
시작 차정환 차원석 부자 이야기 용기 희망 서로 의지 모습,https://blog.naver.com/dnbnnews/223482861403
통영 여행 단체 일기 문의 좌석 연말연시 단체 예약 식사 아기,https://blog.naver.com/jwh6514/223273362671
내용 심사숙고 결과 대출 의지 결과 초래 확률 농민 신문 오늘 뉴스,https://blog.naver.com/first6842/220390590949
예전 마인드 준비 농어 분야 예전 치열 경쟁 대외 요소 현실 그중,https://blog.naver.com/gangsaenter/223344971960
다행 경작지 상당수 계약 상태 포기,https://blog.naver.com/bonggani/221419617923
가구 관련 부분 소득 비율 정부 실태 조사 결과 발표 관련 확대,https://blog.naver.com/futurehope2017/222795084514
관련 정보 구입 절차 농작물 재배 방법 대부분 경험,https://blog.naver.com/uiseong-good/220820906159
통합 플랫 데이터 기술 접목 구축 인프라 시스템 이미지 설명 정보 제공,https://blog.naver.com/aedata/222960933061
농지 획득 여건 마련 농지 확보 형편,https://blog.naver.com/toj0825/221224824467
여행 지역 마지막 초보 맞춤 정보 추가 초보,https://blog.naver.com/rda2448/221498417237
연고 경험 사실 협업 농장 친환경 유기 교육 제공 농장,https://blog.naver.com/rda2448/222254738441
종합 센터 통계 자료 이용 발생 관련 피해 사례 예방 안내 준비 과정 경험 피해,https://blog.naver.com/mifaffgov/221692986222
게임 스타 밸리 리뷰 이름 장르 출시 날짜 가격 덕분 유저 경험 정보 초반 상당,https://blog.naver.com/khk7724/220845496198
기본 공통 과정 초기 해소 입문 필수 정보 기초 소양 교육 지원 유형 특화 과정 탐색 준비 생활 기술 경영 전반 기초 이론 사례 궁금증 해소,https://blog.naver.com/yanghwabong/222905272770
주위 용접 도배 전기 속도 방향 중요 지속 성장 경영 말씀 대부분,https://blog.naver.com/agasehs/220670450721
아버님 어깨 실제 부족 현실 준비 계기,https://blog.naver.com/jbgokr/222248763260
설명 주변 교통편 소개 자가용 필요 강조 부족 문제 옥집 수정 가치 판단 동관 도로 환영 교통 정보 제시,https://blog.naver.com/suna778/223486819631
홍상철 회사 간부 남편 전업 주부 굼벵이 부부 전업주부 홍상철 판매처 박람회 직판장,https://blog.naver.com/nong-up/222993632656
포스팅 경험 생각 해결책 조언 소개 생활 환경 변화 도시 인프라 서비스 부족,https://farming-start.tistory.com/372
과정 여유 자금 부족 기술 습득 생활 불편 농지 구입 조사 기간 도시 이주한,https://blog.naver.com/rda2448/221602361687
초기 도시민 전문 성장 딸기 재배 작물 작물 딸기 규모 경작 처음,https://blog.naver.com/tymsns/223008966754
직장 생활 퇴직 재취업 도심 일자리 가지 상대 유리 생각,https://blog.naver.com/kky6969/221199443928
연고지 지역 작물 선택 창업 정보 준비 시작 상담 종합 센터,https://blog.naver.com/rda2448/221850151732
고향 나름 기자 형편 현실 동감 표현 사진 출처 프리 기사 준비 부부 고민,https://blog.naver.com/mkkwon8282/223173477712
봉착 내게 돌파구 선물 교육 처음 시작 마음 정보 교육 농기계 교육 현장 학습 약초 교육 전남 기술원 농업기술센터,https://blog.naver.com/kimdh5760/120176613446
희망 시골 생활 소금 나무 재배 재배 노하우 수익 결심 화훼,https://blog.naver.com/kyoungago/50171222656
초기 트랙터 지원 해당 사이트 참가 신청서 다운로드 참여 종합 센터 귀어 종합 센터,https://blog.naver.com/sangsangin_fin/222442194417
카페 블로그 활용 간접 확인 사전 예비 카페 블로그 준비 과정 과정 일기,https://blog.naver.com/jdw6173/222044437283
행사 수해 아픔 생산 햅쌀 고구마 사과 가공품 포함 친환경 고품질 우수 농산물 시중 매장 가격 판매,https://blog.naver.com/jesus53-/223246829754
희망 도시민 초보 대상 멘토 관련 분야 전문가 상담 지원 초보 해결 시행착오,https://blog.naver.com/ggaf2007/223044996311
완료 직후 임차 농지 가지 농지 구입 농지 마지막 대출 실행 단계 마음,https://blog.naver.com/yesdryfish/221228398261
처음 딸기 시작 가지 마을 도움 정직,https://blog.naver.com/gnfeel/140206444741
자금 마련 정부 지원 창업 지원금 주택 구입 지원금 도움 농지 자금 관련 정보,https://blog.naver.com/karma56/220482933201
왕자 주지훈 이야기 주지훈 데뷔작 주연 배경 공개 모델 출신 연기 경험 왈츠,https://blog.naver.com/yolos7942/223395002509
도심 친인 척분 시골 아버님 공직 우스 소리,https://blog.naver.com/itsduck/222434343570
정년 퇴직 생각 초기 자본 의외 초기 자본 포기 도시 생활 투자 생각 정년 퇴직 생각,https://blog.naver.com/tcone/223102675925
반면 창녕 주위 창녕읍 본인 노력 무료 창녕,https://blog.naver.com/cngblog/221814039486
경제 생각 타계 방법 수단 농장 담보 대출 위기 가능,https://blog.naver.com/stvdp/221170274891
현실 다양 개인 준비 예비 농인 지방 지자체 시행,https://blog.naver.com/yesworker/222663212619
하우스 실습 창녕군 초기 감안 이후 전입자 정도 선정 보조금 천만 지원 창업,https://blog.naver.com/cngblog/221820291782
대가 이명우 초년생 개천면 김외곤 로컬 푸드 방식 판매 전략 블루베리 수확,https://blog.naver.com/dinogoseong/130144634152
회장 김동재 시골 추억 이후 생각 경험 정보 교환 모임 시작,https://blog.naver.com/uiryeonginfo/222726252337
우울 준비 자금 투자 경험담 조언 나귀 산양 농장 체험 거리,https://blog.naver.com/songc1247/221097111288
반복 연습 실기 시험 합격률 자격 취득 가능 종합 센터 대로 지원 일자리 농작업 안전 보건 기사 자격증 준비,https://blog.naver.com/cm543/223453278507
열정 농부 충북 음성 산업 농장 마음 계획 사업,https://blog.naver.com/rda2448/221106191654
경험 극복 스토리 도시 실전 작가 경험 토대 지침서 내용 작가,https://blog.naver.com/pilatus64/222897765317
사업 계획서 초기 중기 장기 비전 목표 실행 계획 상환 계획,https://blog.naver.com/ulsanlaa/223454857828
갈망 도전 파란만장 오늘 제도 시정 바램 진솔 마음 포스팅,https://blog.naver.com/kane41/171882852
초기 아내 병간호 중요 집중 수입 태관 작년 병충해 고추 고춧가루 인기리,https://blog.naver.com/nong-up/221416269042
체계 활성 종합 센터 스톱 정보 서비스 활동 관련 어려 시설 농지 자금 부족 소득 추가 농지 확보 기술,https://blog.naver.com/limcd_2002/223434026247
내달 오프라인 교육 개최 타개 인구 유입 양양군 아카데미 온라인 교육 참여 교육 내달 모집 교육 프로그램 다양 표준,https://blog.naver.com/likeyyang/222884578386
초반 이제 트랙터 사용 마을 어르신 트랙터 양파 입구,https://blog.naver.com/tymsns/223008955246
고창군 창업 주택 구입 대출자 자부담 군비 추가 보전 초기 소득 재정 안정,https://blog.naver.com/klan9800/223455858926
고향 사업가 고향 대추 심지 농원 할아버지 고향 주변 공부,https://blog.naver.com/jincheongun/221694003965
농업기술센터 초기 해결 지역 대상 멘토 선정 토단 준비 단계 단계 생활 전반 종합,https://blog.naver.com/hiksanin/221835796122
식품 귀어 창업 자금 융자 대상 사업 신청 기준 산업 재직 제외 사업 지침 퇴직 예정자 준비 지적,https://blog.naver.com/sejong_story/60187225565
하원 병행 정부 차원 양성 권장 미래 보장 현실,https://blog.naver.com/nong-up/221453027484
보관 존재 우연 기회 작약 김선엽 학교 농림 수산 식품 교육 문화 정보원 인연,https://blog.naver.com/nong-up/221420669856
법인 법률 바시 경영 연구소 강소 대학 농산물 유통 자연재해 극복 기원 마음 바시 경영 연구소 강의 컨설팅,https://blog.naver.com/kyouyeol/223176587773
일자리 제공 문화 가정 제안 요약 목적 문화 가정 만족 환경 조성 지자체 인구 감소 문제 해결 일손 상시 부족 문제 해결 대상 도심 결혼 이민자,https://blog.naver.com/1jobmarket/223467250306
올해 차이 처음 친환경 생각 처음 도움 자료 전적 부족 유튜브 자료,https://blog.naver.com/mukhai/223490175100
안녕 재단법인 경상북도 식품 유통 교육 흥원 경북 종합 지원 센터 작성 업무 진행 처음 도움,https://blog.naver.com/pcafrp/223453839496
시작 소송 포기 농지 주택 구입 소개 계약 과정 갈등,https://blog.naver.com/nong-up/221096115600
나이 습득 미용 자격증 동네 민원 행정 차량 민원 행정 서비스 주민 고충 해결,https://blog.naver.com/ekahdk367/222682768643
도시 생활 불편 크기 차지 문제 일정 부분 해결 의성 선택 최적 자연환경,https://blog.naver.com/uiseong-good/221412489700
생활 물심 양면 지원 강진 농업기술센터 관계자 감사 계속 격려 관심 한국 농원,https://blog.naver.com/koreajoy7/220598945259
증가 만큼 협의회 정보 교류 앞장 봉사 신임 회장 포부 아산 협의회,https://blog.naver.com/kls1920/222585626236
창업 어딘가 틈새시장 블루 오션 오늘 창업 교육 최선 계절 자연 생리,https://blog.naver.com/kane41/154616443
농장 처음 초기 비용 준비 적극 동수,https://blog.naver.com/boryeongsi/221598785491
결심 사전 관련 기관 경험 정보 수집 체험 소규모 텃밭 재배 주말농장 운영 시행착오 체험 계획 참고,https://blog.naver.com/cleanhwasun/222694069135
고향 준비 도시 가족 특별 시부모 생활,https://blog.naver.com/88skrmsp/90112984487
목표 곤란 지경 도움 진심 상담 생각,https://blog.naver.com/kevinsj007/221641048821
참여 사례 공유 해결책 모색 하동군 주제 토론 방향 사업 제안,https://blog.naver.com/yong0275/223484227457
지역 지역 체험담 시골 차후 곤란 심리,https://blog.naver.com/semofarm/223383527792
이유 기술 노지 필요 보조 사업 대출,https://blog.naver.com/heythegoodlife/223439604145
강소 경영 개선 실천 교육 기초 과정 신규 교육 정보 농업기술센터 지원 사업,https://blog.naver.com/neomi963/223034992593
묘목 정성 관리 성장 전역 실행 성목 수준 성장 작년,https://blog.naver.com/khj00675/220869046625
강사진 년차 유기 고수 배치 단순 기술 전수 고민 현실 교육,https://blog.naver.com/hsgstory/220469481643
바람 일요일 작년 신축 건축 허가 생각,https://blog.naver.com/jenny8464/220626737220
현장 즐거움 작가 소개 김영주 백두대간 오대산 노인봉 자락,https://blog.naver.com/essaybook/223152106567
신중 신중 여름 두릅 식재 판매 전략 생산자 생산,https://blog.naver.com/mosh6789/221997686022
선배 현실 이야기 철저 준비 나름 확신,https://blog.naver.com/isij21/221028130812
자연 고향 지역 만족 최근 사업 지역 일자리 창출,https://blog.naver.com/mopaspr/222069384892
초기 태안 무화과 재배 주변 의아 눈초리 무화과 반복 극복 필요 무화과 노지 재배 시작,https://blog.naver.com/ym03038/223468352854
주말농장 토지 물건 관심 행위 가능 행위 가능 확인,https://blog.naver.com/samunjin0089/223465736926
현실 도시 생활 다양 경험 현지 다년간 축적 경험 조화 상생 구현 그날,https://blog.naver.com/ayum9246/223247741819
지원 혜택 사전 공부 답사 준비 창업 희망 베이비 부머 예비,https://blog.naver.com/joins_land/220271288670
해결 방안 과정 고민 자금 조달 청양군 농업기술센터 초기 투자 비용 지원 청양군 농업기술센터 대상자,https://blog.naver.com/nong-up/222299477063
선택 품목 선진 농가 생활 실습 교육 진행 지난주 견학 방문 선진 농가 견학 소식 조류 독감 여파 양계 농장 딸기 농장,https://blog.naver.com/songc1247/221009648414
사업 목적 착의 극복 중소형 기계 지원 업명 중소형 기계 지원 사업 지원 내용 개소 중소형 기계 구입 지원 보조 한도 기계,https://blog.naver.com/krsc0412/223370542421
도시 중요 시골,https://blog.naver.com/ggikim99/70132641042
화순군 기술 센터 여분 강소 선진 사례 강연 화순 수용 사실 거절 마음,https://blog.naver.com/hmj8060/222807373947
