nouns,link
처음 가정 경제 안정 검정 부직포 유기농 납품 판매,https://blog.naver.com/108baeg/100206824130
야생 말씀 기억 가지 추가 마음 흔적 이추 이웃,https://blog.naver.com/khj57942/223141134333
지역 농업기술센터 적극 이용 추천 견학 마녀 포레스트 방송 생산 공정 방송 영상,https://blog.naver.com/hmj8060/222868514018
영주시 예비 부문 주거 기술 습득 문제 타운 해결 도시민 영주 기대,https://blog.naver.com/yeongju_city/221298488531
화훼 농가 가지 겨울 다발 다발 사랑 인생 반려자 채소 경영 계획,https://blog.naver.com/kane41/154160123
도움 유튜브 채널 개설 정보 구자훈 임실군 지원 센터 멘토,https://blog.naver.com/jbreturn/222624112872
도시 중요 시골,https://blog.naver.com/ggikim99/70082537762
앵무새 지원 사업 합격 사안 항목 세부,https://blog.naver.com/morangoum/222524902487
명실 농부 역할 멀티 플레이 가능 역할 수행 정부,https://blog.naver.com/jeju-farm/222717293386
호텔 리어 만세 보령 딸기 농장 농부 보령 이야기 보령 김한나 보령 딸기 농장 캐나다 호텔 리어 준비 영주 발급 개월 부모 연락,https://blog.naver.com/boryeongsi/221747698902
가족 의논 협의 준비 작목 선택 일반 생활 경제 수입 전반 의지,https://blog.naver.com/bloglh/150178454091
로망 시작 생각 생활 토로 처음 마음,https://blog.naver.com/goodchungju/220932159266
주변 수천만 적자 재배 작물 교체 농장 견학 농산물 수입 개방 중국 개방 시대 시장 경쟁,https://blog.naver.com/djwjs190/220645785131
예비 현장 직면 이야기 시작 전공 건축 설계 데이터,https://blog.naver.com/nong-up/223009245981
월일 첫선 보름 카카오톡 채널 추가 이용자 반응 지역 갈등,https://blog.naver.com/nong-up/222147755182
경기 농수 산진 흥원 경기 대학 약용식물 치유 농장 정원사 과정 개강 과정 특화 교육 교육 준비 각오 사업비 교육 기간,https://blog.naver.com/happynep/223445988026
문제점 생산 구체 데이터 정리 농민 진행 과정 동영상,https://blog.naver.com/seulyoun/220319098604
선택 난관 순간 과정 오늘 결과,https://blog.naver.com/ccoccomam/222809445184
실행 이만저만 주거 공간 마련 자립생활 기초 기술,https://blog.naver.com/nong-up/221308465552
아무 상태 진행 감사 마음 준비 진행,https://blog.naver.com/anboo8/222925616360
초기 자금 필요 안정 마련 천안시 안정 상반기,https://blog.naver.com/fastcheonan/222982155466
산초 거창 거창 관심 도심 제의 도움,https://blog.naver.com/skkkk5/110168314850
계농 관련 계속 데이터 공직 경험 기반 바시 경영 연구소 바시 공인 행정사 신설 올해,https://blog.naver.com/kyouyeol/223069205507
이해 초기 지속 김영식 시기 노하우 주옥 이야기 초보 농부,https://blog.naver.com/uiseong-good/220873300465
이전 퇴직 단기 근로자 자금 신청 은퇴 예정자 자금 계획 자금 신청 교육,https://blog.naver.com/donginthink9/223443188577
관공서 야등 자체 개발 프로그램 접목 준비 도시민 해결책 제시 기회 마련 평가,https://blog.naver.com/kbcd2008/222570112523
교육 장면 사진 선별 주간 강의 실습 지면 상반기 교육 시작,https://blog.naver.com/songc1247/220956331964
임야 재배 임산물 수확 기간 조건 검토 박성종 더덕 두릅 재배 품목 수확 시기 고려 임산물,https://kofpi.tistory.com/90
기술력 경험 부족 현장 초기 농인 경기 멘토 자부담 연간 최대 회의 멘토링 지원,https://blog.naver.com/ggaf2007/223069954768
제빵 발효 케익 마들렌 치자 제주도 조수리 수호 농원 초보 농부 레몬 착즙 마들렌 크리스마스 농부 일상 제주도,https://blog.naver.com/kit6242/222185513441
지원 자립 기반 구축 과정 자금 부족 농림 축산 식품 농인 자금난 지자체 상반기 하반기,https://richcat.tistory.com/8758
회장 임기 나이 제주도 제주 제주도 농부 제주 농부 농부 이야기,https://blog.naver.com/kit6242/222601327004
가족 갈등 가족 반대 본인 실행 자녀 학업 몰두 고등학생,https://blog.naver.com/woxozm77/220398012548
토지 주택 자산 자산 자산 협동조합 조합원 여유 대안,https://blog.naver.com/scenek/221424921161
케이 박람회 목토 수원 메쎄 코로나 박람회 개최 케이 박람회 활력,https://blog.naver.com/guryesns/222439361680
결심 실행 텐데 준비 가족 의견 차이 계획 아내 부부 싸움,https://blog.naver.com/geps_hongbo/50138207930
전업 요인 지역 공동체 활성 노력 지역 자원 활용 협력체 구축 도시 다양 경험 활용 마을 탐방 여민동락 교육 춘천 별빛 산촌 교육 센터 도시 관계,https://blog.naver.com/jmkjmkjmk7235/221767880616
활동 목공예 편백 나무 활용 도움 도전 가치 제회 박람회,https://blog.naver.com/wanjugun/221032379156
운동 개별 한계 극복 조직 지속 운동 전개 운동 본부 학교 운영 후원 활동 자의,https://blog.naver.com/leedw0612/70032161303
도시 소비자 직거래 시작 농장 브랜드 배송 포장 박스 파손 상품 고객 불만 고생 손씨,https://blog.naver.com/kimdh5760/120177142779
금년 처음 실시 실태 조사 결과 초기 기술 일자리 부족 주거 부족 주요 사항,https://blog.naver.com/mifaffgov/220867679874
여주 프로 미스 랜드 독특 방법 전원생활 소득 문화 교육 의료 시설 스톱 전원생활 제안,https://blog.naver.com/rhosd21/222580783664
김재동 진행 걱정 그대 김재동 재담 방청객 면모 볼거리 제도 본방 사수 얘기,https://blog.naver.com/i972326/220425405144
정서 특수 대상자 국민 치유 대상자 대상 일반인 대상자 문제 특성 파악 문제 해결 치유,https://blog.naver.com/cumbarm/223345861430
남원시 농업기술센터 초기 극복 안정 도모 교육 사업 추진 관심 집중,https://blog.naver.com/goodnamwon/220980499962
응의 환경 적응 처음 주변 주변 텃새 얘기,https://blog.naver.com/momzo112/222716198031
도시민 유치 활동 지역 주민 화합 마련 이날 행사장 체험 특산물 판매 홍보 상담 진행,https://blog.naver.com/hcgnews/221380345451
의지 구체 방법 현실 부분 길잡이 플래너 플래너 필요 능력,https://blog.naver.com/krcpolicy/222302586995
이웃 기술 학문 체계 교육 시군 농업기술센터 지원 기술 습득 농업기술센터 이웃 농민 교육 프로 그램,https://blog.naver.com/88skrmsp/90109408327
상담 상담소 한눈 상담 풍작 소득 풍요 기원 황토 고구마 구마 고구마,https://blog.naver.com/ekahdk367/222676409755
농인 역량 강화 겸손 내심 봉사 건강 마을 적극 동참 기회 교육 받자 인내 중요 생각 말자 농가 경영 실천 노력 선행,https://blog.naver.com/djwjs190/220606650039
봄날 인생 시작 이희 이야기 인천광역시 작목 배정 대로 판로,https://blog.naver.com/jbreturn/221834985125
최근 교육 진행 의령군 기술 센터 추진 신규 교육 이용 수업 진행 설치 참여 교육 진행,https://blog.naver.com/hup2014/222540616248
갈등 해결 안정 지역 주민 마을 공동체 의식 형성 목적 지역 주민,https://blog.naver.com/ahelpinghand/223279206131
황토 고향 해남 황토 동네 세월 황토 동네 이웃 친환경 농산물 소개 농산물 제때 공급,https://blog.naver.com/khlim12/40182996920
욕심 형태 부메랑 직업 선택 인생 선택 결정 준비,https://blog.naver.com/geosmam/220887588707
보성군 협의회 선진 견학 보성군 협의회 올해 선진 견학 사실 도시 섭렵 기업 업무 확장,https://blog.naver.com/bossshim/220207439091
그림 펜션 지리산 펜션 산수유 펜션 이야기 지리산 농원 채널 시대 외국 이야기,https://blog.naver.com/a630203/120166374514
코로나 오프라인 교육 개최 타개 인구 유입 양양군 도시민 유지 아카데미 온라인 교육 실시 아카데미 양양군,https://blog.naver.com/likeyyang/222720748445
요즈음 적응 단어 낭만 목가 분위기 단어 산산조각,https://blog.naver.com/gurumjan/221287139146
창업 계획서 작성 예시 전라북도 지원 센터 창업 계획서 예시 자료 게시 정부 지원 사업 신청 사업 계획서 작성,https://blog.naver.com/so_sostory/220301359597
종합 센터 확인 관련 교육 내용 기본 공통 과정 초기 필수 정보 기초 소양 교육 지원,https://blog.naver.com/gotgandata/223311136253
농산물 생산 극복 결실 마음 부부 논산 와송 마을 와송 건조식품 가공 식품 홍보,https://blog.naver.com/kreiaglook/221320048120
일부 지원금 우려 지원금 생각,https://blog.naver.com/krcpolicy/20157550460
일부 정리 교육 지역 오프라인 교육 인력 포털 온라인 교육 소개,https://blog.naver.com/mifaffgov/220776968678
거리 시골 마을 상기 해소 가능 수도 지역,https://blog.naver.com/islandhole/223420145158
지적 보고서 농협 차원 원주민 맞춤 교육 실시 소통 창구 운영 농한기 여성 문화 활동 지원 조합원 제도 홍보 활성 여성 인의,https://blog.naver.com/mrbean7/222976454089
임시 거주 시설 조성 사업 주거지 마련 희망자 주택 실습 농장 복합 공간 조성 사업 희망자 사항 거주 시설,https://esmcenter.tistory.com/18784
수입 앵무새 자체 계류장 회원 시설 완공 대기 여름철 공기 자연 앵무새 생활 사육 설비,https://blog.naver.com/morangoum/222829194897
시민 유치 지원 사업 시민 유치 지원 사업 농림 축산 식품 농어촌 지역 고령화 저출산 인구 감소 농어촌 지역 활력 증진 제고,https://930303.tistory.com/entry/2016-%EA%B7%80%EB%86%8D%EA%B7%80%EC%B4%8C-%EC%9D%BC%EC%9E%90%EB%A6%AC-%EC%B0%BD%EC%97%85%EB%B0%95%EB%9E%8C%ED%9A%8C%EB%A5%BC-%EA%B0%80%EB%8B%A4?category=573032
과정 프로그램 진행 부분 양해,https://blog.naver.com/parkwasdy/221110139612
조선 산업 불황 조선업 근로자 기업 지원 조선업 희망 센터 교육 실시 희망 신청 가능,https://blog.ulsan.go.kr/7492
가구 첫해 평균 소득 직전 수준 소득 가계 유지 농외 경제 활동 참여 한국,https://rem8949.tistory.com/entry/%EC%B5%9C%EA%B7%BC-%EA%B7%80%EB%86%8D%C2%B7%EA%B7%80%EC%B4%8C-%EC%8B%A4%ED%83%9C%EC%99%80-%EC%8B%9C%EC%82%AC%EC%A0%90
현장 실질 도움 법안 배경 설명 전국 수요 증가 추세,https://blog.naver.com/kdwon53/60196428405
작년 교육 그것 기반 봉평 태산 인생 시작,https://blog.naver.com/suboree34/222305127681
이웃 정보 필요 도전 용기 필요 각오 무언가,https://blog.naver.com/ccoccomam/222797131815
초대 이장우 광주 농장 토크 농장 전문 판매 이정우 경북 상주 극복 방법 시골 방법,https://blog.naver.com/krcpolicy/20159083641
도시 환경 주변 정부 지원 다양 희망 관련 정보 자체 나름,https://blog.naver.com/scandimini/223062348944
앵무새 장기 장점 발현 통상 초기 수익 창출 문제 일반 상황 품종 고양이 리딩 결합 복합 전략,https://blog.naver.com/morangoum/222458065168
진안군 종합 지원 센터 센터 김진주 관내 이후 창업 브랜드 사업 김진주 센터 장은진 브랜드 사업장 컨설팅,https://blog.naver.com/shleemis/223297064924
경험 저온 창고 엽채류 보관 필요 여유 마음 결정 중요 생계 유지,https://blog.naver.com/wanjugun/222052010854
농가 주택 수리비 해당 도중,https://blog.naver.com/rkdgudwn12/220907790790
신규 활동 수행 부분 기술 부족 희망 도움 경기도 기술원,https://blog.naver.com/gyeonggi_gov/221460949423
실감 사실 올해 정도 내년 극복,https://blog.naver.com/farm0317/223307431839
서귀포시 올해 기본 교육 마무리 서귀포 교육 과정 운영 귀귀 최선,https://blog.naver.com/kohj007/222485226219
농업기술센터 관계자 안정 농인 요건 기술 교육 참여 멘토 유무 중요 실습 교육 기술 부족 선도 현장,https://blog.naver.com/hiksanin/222668940681
현장 초기 신청자 상자 신지식 복합 사업자 맞춤 멘토 현장 방문 멘토링 품목 기술 경영 멘토링 최대,https://blog.naver.com/fame7777/223069853780
도시 생활 터전 인생 시작 이유 희망 평가,https://blog.naver.com/kimdddhhh/221655564392
원격 상담 옥답 영상 컨설팅 지역 공동체 농림 수산 식품 교육 문화 정보원 옥답 홈페이지 까페 시골 노인,https://blog.naver.com/kyoung37/110153737173
초반 생각 센터 방문 상담 계획 수립 실행 최대한 도움 생각 방문,https://blog.naver.com/minekooo/222533065557
밥벌이 경제 고민 코로나 부산 운영 학원 회전,https://blog.naver.com/mega4u/221855235324
교과서 박서연 멘토 그녀 한몫 전통 사회 대부분 집성촌 형성 다리 친척,https://blog.naver.com/ytm1300/223018435957
시련 귀향 이야기 소견 금전 필요 마을 주민,https://blog.naver.com/ksarangga/50185592670
기준 농림 식품 실태 파악 지원 준비 다양 실효,https://blog.naver.com/mifaffgov/221536483020
관계자 지역 활력 관련 다양 사업 추진 청주 홍성헌 기자 출처 국민 일보 원본 링크,https://blog.naver.com/kst3175/223071268166
장소 적응 농사법 적용 농인 숙제,https://blog.naver.com/nong-up/221335574778
가지 겁니다 경제 문화 관계,https://monzaq.tistory.com/864
수정 발정 스트레스 하루 만렙 농부 생각,https://blog.naver.com/greenjeonnam/222073922056
남원 이야기 남원 음악 이야기 문제점 음악 서울 김포,https://blog.naver.com/deniro0908/223010149737
부모 사과 아내 고민 동의 마음 청량 모습 경북 봉화군 청량,https://blog.naver.com/farmboykr/222610241007
사업 직장 은퇴 다양 이유 관심 홈페이지 궁금증 종합 센터 코로나 사태,https://blog.naver.com/kobong226/222115136736
계획 양봉 활용 기능 생산 일반 제품 차별 소득 기능 소득 창출 보장 초기 소득 창출,https://blog.naver.com/ekgh42/222881756418
예비 지역 지원 센터 적극 활용 경상북도 경북,https://blog.naver.com/gbfood119/223247333330
경제 부족 생활 가능 생각 보수 소득 정년 퇴직 은퇴 창업 부부,https://blog.naver.com/kjymmv77/222790577116
아버지 아들 감귤 농장 아들 제주 관공서 기관 설명 행정 제도 법규 지속,https://blog.naver.com/gallery0909/222887971425
리더스 퀄리티 앵무새 농창 최저 예산 최고 효율 시설 구성 방법 멘토링 제공 리더스 퀄리티,https://blog.naver.com/morangoum/222090319010
강원도 홍천군 용머리 유치리 홍천 유치리 농지 비닐하우스 선별 포장 작업 여름 겨울,https://blog.naver.com/korjcf/220628567219
서울 그곳 피난처 생각,https://blog.naver.com/coverdale202/20157001689
낭만 현실 현실 외면 가족 결행 무모,https://blog.naver.com/9jidr/20189401477
창업 주택 구입 지원 사업 극복 안정 정보 확인 창업 관심,https://bh0303.tistory.com/820
영화 혜원 도시 전원 생활 결심 생활 문제 농지 구매,https://blog.naver.com/krcpolicy/221486230810
초기 창업 자금 소득 부족 농지 기술 부족 문제 촌시 단계 고려 사항 농림 축산 식품 과거 지역 수도 인접 지역,https://blog.naver.com/redis12/220815594545
텃새 동네 집성촌 그분 거기 평생 벼농사 텃세,https://blog.naver.com/oneshat0215/222256269013
상황 관련 내용 언급 블로그 또래 이분 카톡 골집 무상 임대 연계,https://blog.naver.com/kinong24/223409390852
창업 자금 신청 마음 준비 가지 난관 봉착 문제,https://blog.naver.com/cumbarm/222425703304
처음 시행착오 프로그램 참여 참가자 경험 마음,https://blog.naver.com/eyeana/222333536328
인제군 홈페이지 인제군 현황 기준 제군 홍보 책자 농부 현황 면적 해소 기술 지도 지원 대상 농산물 가격 정보 상거래,https://blog.naver.com/nong-up/221003449231
내손 집짓기 석축 지리산 산골 이야기 흙집 지리산 산골 메쌓기 석축 자연석 조경석,https://blog.naver.com/rnwjfch6728/40192008453
강진군 부스 상담 코너 마련 정서 지역 정보 획득 이주 지역 선배 연계 신뢰 초기,https://blog.naver.com/gangjingun/220470653046
처세술 주목 사례 경제 이유 인간 관계 비중 차지,https://blog.naver.com/sackful/222785837735
