nouns,link
사람 인간 관계 관계 사람 발표 공동체 공동체 홍천 과정 고등 대학 통합 과정 초등 어린이집,https://n.news.naver.com/mnews/article/028/0002437894?sid=004
사람 인간 관계 관계 사람 발표 공동체 공동체 홍천 과정 고등 대학 통합 과정 초등 어린이집,https://n.news.naver.com/mnews/article/028/0002437893?sid=004
사람 인간 관계 관계 사람 발표 공동체 공동체 홍천 과정 고등 대학 통합 과정 초등 어린이집,https://n.news.naver.com/mnews/article/028/0002437764?sid=004
최근 연구 결과 휴먼 마이크 바이옴 질병 밀접 관계 인간 미생물 농장 시스템 광산 투자 가지 맥락 사업 목표,https://n.news.naver.com/mnews/article/262/0000011814?sid=101
경력 관리 재취업 유의 교육 인간 관계 중요 스님 말씀 인덕 인복,https://n.news.naver.com/mnews/article/298/0000264456?sid=123
한국 경제 연구원 지난해 발표 전국 실태 장기 추적 조사 응답자 복수 가운데 마을 사람 인간 관계 문제 마을 관행 마찰 생활 곤란,https://n.news.naver.com/mnews/article/001/0010520535?sid=102
교육 여행 개별 컨설팅 인생 준비 제이엠 커리어 연계 재취업 직무 스트레스 한국 수직 권위주의 가부장 문화 특성 직장 인간 관계 갈등,http://www.metroseoul.co.kr/news/newsview?newscd=2018121000009
제이엠 커리어 연계 재취업 심리 상담 위너스 제이엠 공동 재직 수직 가부장 한국 특성 유발 직장 인간 관계 갈등,http://www.newspim.com/news/view/20181207000522
도쿄 건물 이웃 만큼 인간 관계 잎사귀 비즈니스 시골 젊은이 촉진 코이시 대표 인턴,https://n.news.naver.com/mnews/article/469/0000344647?sid=104
마녀 농인 산골 세월 길이 인간 관계 적극 노력 남편 마을 초상집,http://bravo.etoday.co.kr/view/atc_view.php?varAtcId=9175
북한 간첩 의심 시선 편견 이날 발표 김남철 조선소 인간 관계 부분,https://www.dailynk.com/%eb%9d%bc%eb%94%94%ec%98%a4-%ed%98%84%ec%9e%a5-2018-%eb%b6%81%ed%95%9c%ec%9d%b4%ed%83%88%ec%a3%bc%eb%af%bc-%ec%a0%95%ec%b0%a9-%eb%b0%9c%ed%91%9c%eb%8c%80%ed%9a%8c
거주자 관계 핵가족 경험 인간 관계 협동심 세대 시골 마을 주택 협동 주택 개조 세대,http://www.ksilbo.co.kr/news/articleView.html?idxno=668604
한국 경제 연구원 지난해 발간 전국 실태 추적 조사 응답자 복수 응답 가운데 마을 사람 인간 관계 문제 마을 관행 마찰 생활 곤란,http://www.newsmaker.or.kr/news/articleView.html?idxno=67636
건강 경제 여력 은퇴 사람 취미 생활 사람 본인 전문 공자 인생삼락 인간 관계 수양 맹자 부모 형제,https://n.news.naver.com/mnews/article/088/0000559871?sid=004
통계청 농림 축산 식품 해양수산부 공동 발표 기준 통계 인간 관계 스트레스 가족 일본,http://www.kyeongin.com/main/view.php?key=20180920010007590
공무원 죽음 계획 범죄 폭염 부족 갈등 사건 발생 결과 지역 토박이 원주민 외부 유입 주민 사이 인간 관계 갈등 최소,http://www.agrinet.co.kr/news/articleView.html?idxno=163935
한국 경제 연구원 지난해 발표 장기 년차 추적 조사 인의 생활면 곤란 마을 사람 인간 관계,https://n.news.naver.com/mnews/article/005/0001130924?sid=102
인간 인간 인간 자연 관계 소통 가능 상당수 공존 가치 마을 외곽 터전 마련 경향 마을,http://www.kookje.co.kr/news2011/asp/newsbody.asp?code=0300&key=20180910.22011001288
충남 마곡사 근처 선배 이건 기후 변화 기후 복수 문자 메시지 인간 인간 인간 문명 인간 지구 관계 설정 릴케 불안,https://n.news.naver.com/mnews/article/032/0002892649?sid=110
귀소 본능 생각 자연 라이프 윤택 자연인 자연 대다수 사업 인간 관계 상처 산속 생의,https://m.entertain.naver.com/article/016/0001438745
한편 한국 경제 연구원 지난해 발간 전국 실태 추적 조사 응답자 복수 응답 가운데 마을 사람 인간 관계 문제 마을 관행 마찰,https://n.news.naver.com/mnews/article/081/0002940719?sid=102
한국 경제 연구원 지난해 발간 전국 실태 추적 조사 응답자 가운데 마을 사람 인간 관계 문제 마을 관행 적응 곤란,http://www.newswhoplus.com/bbs/board.php?bo_table=news&wr_id=916
한국 경제 연구원 지난해 연구 자료 가운데 원주민 인간 관계 문제 마을 관행 곤란 인과 원주민 갈등 가장,http://www.kyeongin.com/main/view.php?key=20180823010007437
한국 경제 연구원 지난해 발간 전국 실태 추적 조사 응답자 복수 응답 가운데 마을 사람 인간 관계 문제 마을 관행 마찰 생활,http://www.yeongnam.com/mnews/newsview.do?mode=newsView&newskey=20180827.010310830360001
시대 베이비 부머 세대 퇴직 한참 인간 관계 사회 문화 통합 마을 자연 발생 자연촌 자연 부락 행정,http://www.dynews.co.kr/news/articleView.html?idxno=420643
한국 경제 연구원 지난해 발간 전국 실태 장기 추적 조사 응답자 복수 응답 가운데 마을 사람 인간 관계 문제 마을 관행 갈등,http://www.kado.net/?mod=news&act=articleView&idxno=927069
실제 한국 경제 연구원 지난해 발간 전국 실태 장기 추적 조사 응답자 복수 응답 가운데 마을 사람 인간 관계 문제 마을 관행 마찰,https://n.news.naver.com/mnews/article/005/0001125208?sid=102
한국 경제 연구원 지난해 발간 전국 실태 장기 추적 조사 응답자 복수 응답 가운데 마을 사람 인간 관계 문제 마을 관행 마찰 생활,https://n.news.naver.com/mnews/article/087/0000722439?sid=102
한국 경제 연구원 지난해 발간 전국 실태 장기 추적 조사 응답자 복수 응답 가운데 마을 사람 인간 관계 문제 마을 관행 마찰,https://n.news.naver.com/mnews/article/021/0002363302?sid=102
실시 주요 교육 신규 필요 인간 관계 작물 재배 이해 기초 작물 생리학 영농 현장 방문 친환경 자재 제조 실습 품목 결정 점검 경영 지식,http://www.jjan.kr/news/articleView.html?idxno=2014643
안정 교육 신규 필요 인간 관계 작물 재배 이해 기초 작물 생리학 영농 현장 방문 친환경 자재 제조 실습 품목 결정 점검 경영 지식,http://www.jjn.co.kr/news/articleView.html?idxno=752181
안정 교육 신규 필요 인간 관계 작물 재배 이해 기초 작물 생리학 영농 현장 방문 친환경 자재 제조 실습 품목 결정 점검 경영 지식,http://www.jeollailbo.com/news/articleView.html?idxno=548492
안정 교육 신규 필요 인간 관계 작물 재배 이해 기초 작물 생리학 영농 현장 방문 친환경 자재 제조 실습 품목 결정 점검 경영 지식,http://www.newsmaker.or.kr/news/articleView.html?idxno=63729
안정 교육 신규 필요 인간 관계 작물 재배 이해 기초 작물 생리학 영농 현장 방문 친환경 자재 제조 실습 품목 결정 점검 경영,http://www.nspna.com/news/?mode=view&newsid=300620
안정 교육 신규 필요 인간 관계 작물 재배 이해 기초 작물 생리학 영농 현장 방문 친환경 자재 제조 실습 품목 결정 점검 경영 지식,http://www.ujeil.com/news/articleView.html?idxno=209375
안정 교육 신규 필요 인간 관계 작물 재배 이해 기초 작물 생리학 영농 현장 방문 친환경 자재 제조 실습 품목 결정 경영 지식,http://www.ksilbo.co.kr/news/articleView.html?idxno=653090
안정 교육 신규 필요 인간 관계 작물 재배 이해 기초 작물 생리학 영농 현장 방문 친환경 자재 제조 실습 품목 결정 점검 경영 지식,http://www.newsfarm.co.kr/news/articleView.html?idxno=35522
안정 교육 신규 필요 인간 관계 작물 재배 이해 기초 작물 생리학 영농 현장 방문 친환경 자재 제조 실습 품목 결정 점검 경영 지식,http://www.nbntv.co.kr/news/articleView.html?idxno=113992
완주군 초보 영농 지식 실습 교육 안정 교육 신규 필요 인간 관계 작물 재배 이해 기초,https://n.news.naver.com/mnews/article/421/0003539980?sid=102
선배 농인 역할 생각 경북 청송군 현동면 농장 운영 서류 작성법 인간 관계,http://www.nongmin.com/article/ar_detail.htm?ar_id=289561
버스 출퇴근 야근 동료 경쟁 도시 생활 나머지 위안 인간 관계 고민 동일본 대지진 이후 일본,https://n.news.naver.com/mnews/article/020/0003163215?sid=104
중학교 학년 가족 서울 시골 당시 시골 태우 인간 관계 갈등 목표 생각,https://n.news.naver.com/mnews/article/469/0000316451?sid=103
오늘 마무리 업무 인간 관계 눈치 노력 스트레스 결단 토키 박수,https://n.news.naver.com/mnews/article/009/0004186772?sid=102
에세이 엄마 시골 이야기 나무 바람 반영 해외 석사 저자 정작 강조 도시 차이 자연환경 인간 관계 농촌공동체,https://n.news.naver.com/mnews/article/015/0003980799?sid=103
저자 서울 정리 터전 희망 프로그램 물질문명 자립 지로 기본 인간 관계 자연,https://www.huffingtonpost.kr/entry/story_kr_5b3dae74e4b07b827cbd62fd?utm_id=naver
치열 경쟁의식 청년 인간 관계 사람 만남 연대 지역 분위기 이날 순창 지원 센터 지역 벼룩시장 촌시 상인,http://www.jjan.kr/news/articleView.html?idxno=2011252
미래학자 앨빈 토플러 미래 쇼크 저서 과거 현재 미래형 인간 관계 지속 시골 안정 사람 영화 리틀 포레스트 감독 임순례 서울,https://n.news.naver.com/mnews/article/022/0003285263?sid=110
여년 중앙 무대 인간 관계 네트워크 집권 여당 영동 군민 대표 세일즈맨 영동군 인구 영동 창업 여건,http://www.breaknews.com/sub_read.html?uid=583373&section=sc1
교육 비전 설정 마인드맵 설계 분야 농기계 안전 사용 교육 창업 자금 이해 생활 인간 관계 이론 정보 제공 궁금증 해결 마지막,http://www.gndomin.com/news/articleView.html?idxno=171549
교육 비전 설정 마인드맵 설계 분야 농기계 안전 사용 교육 창업 자금 이해 생활 인간 관계 이론 정보 제공 궁금증 해결,http://www.gnnews.co.kr/news/articleView.html?idxno=328519
교육 첫날 둘째 비전 설정 마인드맵 설계 분야 농기계 안전 사용 교육 창업 자금 이해 생활 인간 관계 이론 정보 제공 궁금증 해결 마지막,http://www.gukjenews.com/news/articleView.html?idxno=928661
교육 첫날 둘째 비전 설정 마인드맵 설계 분야 농기계 안전 사용 교육 창업 자금 이해 생활 인간 관계 이론 정보 제공 궁금증 해결 마지막,http://www.newsmaker.or.kr/news/articleView.html?idxno=60258
지역 중점 과제 구성 포괄 보조금 합리 백두대간 도시 중요 추억 보람 인간 관계 무병장수 도움 성취 여한,http://www.sisamagazine.co.kr/news/articleView.html?idxno=131236
지역 원주민 소통 화합 촉진 기회 마련 지역 사회 활동 적극 참여 지역 원주민 원활 인간 관계 구축 노력 필요 설명,http://www.jeollailbo.com/news/articleView.html?idxno=537435
인간 관계 관계 자산 중요 은퇴 이후 생각,http://news.bbsi.co.kr/news/articleView.html?idxno=871648
마음 의지 인간 관계 인간 정부 생활 지원금 보조 중요 미래 전망,http://www.kyeonggi.com/?mod=news&act=articleView&idxno=1456351
둘째 농업기술센터 담당 부서 분야 질문 답변 교육 궁금증 해결 연구회 김동재 회장 생활 이해 인간 관계 방법 강의 마지막,http://www.gndomin.com/news/articleView.html?idxno=165557
둘째 농업기술센터 담당 부서 분야 질문 답변 교육 궁금증 해결 연구회 김동재 회장 생활 이해 인간 관계 방법 강의 마지막,http://www.newsmaker.or.kr/news/articleView.html?idxno=57632
둘째 농업기술센터 담당 부서 분야 질문 답변 교육 궁금증 해결 연구회 김동재 회장 생활 이해 인간 관계 방법 강의,http://www.gukjenews.com/news/articleView.html?idxno=891643
둘째 농업기술센터 담당 부서 분야 질문 답변 교육 궁금증 해결 연구회 김동재 회장 생활 이해 인간 관계 방법 강의 마지막,https://n.news.naver.com/mnews/article/003/0008491221?sid=102
둘째 농업기술센터 담당 부서 분야 질문 답변 교육 궁금증 해결 연구회 김동재 회장 생활 이해 인간 관계 방법 강의 마지막,http://www.viva100.com/main/view.php?key=20180317010005964
둘째 농업기술센터 담당 부서 분야 질문 답변 교육 궁금증 해결 연구회 김동재 회장 생활 이해 인간 관계 방법 강의,http://www.kukinews.com/news/article.html?no=532294
자연 사회 인간 불가분 관계 기후 관련 문제 환경 문제 지역 언론 관심 사람 지역 언론 지역 자리,http://www.gnnews.co.kr/news/articleView.html?idxno=322077
기본 일본 사람 인간 관계 정적 한국 역동 원작 영화 호흡 이정민 임순례 감독,https://m.entertain.naver.com/article/047/0002180677
라이프 트렌드 본래 터전 서울 인간 관계 셰어 하우스 버그 아웃 티슈 인맥 대안 가족 출현 온라인 오프라인,https://n.news.naver.com/mnews/article/009/0004107690?sid=103
저자 파킨슨병 악화 병원 인간 관계 이무영 대표 소설 제장 사람 흙내 영감,https://n.news.naver.com/mnews/article/001/0009871798?sid=103
조기 유치 지원 센터 설립 농축 산인 상공 전담 지원 연구 구성 교직 생활 경험 능력 인간 관계 유지 프로필 정당 나이,http://www.daejonilbo.com/news/newsitem.asp?pk_no=1298162
교육 내용 초기 경험 신규 예비 작목 기초 재배 기술 교육 인간 관계 형성 농장 우수 농장 견학 필요 관련,http://www.m-i.kr/news/articleView.html?idxno=384214
교육 내용 초기 경험 신규 예비 작목 기초 재배 기술 교육 인간 관계 형성 농장 우수 농장 견학 필요 관련,http://www.queen.co.kr/news/articleView.html?idxno=218662
교육 내용 초기 경험 신규 예비 작목 기초 재배 기술 교육 인간 관계 형성 농장 우수 농장 견학 관련 정보 전달,https://n.news.naver.com/mnews/article/087/0000697183?sid=102
자책감 인간 관계 단절 고통 청년층 대상 채팅 서울시 예비 대상 학교 입학생 모집 희망 서울 시민 서울시,http://ilyo.co.kr/?ac=article_view&entry_id=288549
자연 인간 관계 도시 서울 자립 기술 공생 기술 제작자 박새 기술 필요 제작자 과정 참여,https://n.news.naver.com/mnews/article/028/0002396232?sid=102
결심 사람 걱정 주변 사람 제주 텃세 생각 이웃 친척 정도 인간 관계 제주 제사 친척,https://n.news.naver.com/mnews/article/020/0003122600?sid=110
사람 영업 직무 특성 인간 관계 스트레스 대표 여유 목가 가족 선택 생활,https://n.news.naver.com/mnews/article/030/0002675911?sid=105
국가 예산 확보 예산 필요 인간 관계 자부 테마 사업 스토리 마을 집중 육성 수석 동네 붓글씨 동네 동네,https://n.news.naver.com/mnews/article/421/0003152001?sid=102
인간 관계 성실 장점 근무 동료 직원 청송 전임 단체장 사업,http://www.kyongbuk.co.kr/?mod=news&act=articleView&idxno=1014120
순천 오이 재배 농가 집중 지도 부채 상환 소통 상대방 존중 상호 존경 인간 관계 필수 조직 사랑 마음,http://www.honam.co.kr/read.php3?aid=1513782000542974234
계발 인간 관계 여가 소일거리 건강 노후 안락 종목 연합 갖가지 활동 프리마 기획 판매 공연 연출,http://bravo.etoday.co.kr/view/atc_view.php?varAtcId=7865
건강 인간 관계 문제 해결 생각 과정 현실 마음 새터민 사회 미래,http://www.agrinet.co.kr/news/articleView.html?idxno=157034
계발 인간 관계 여가 소일거리 건강 노후 안락 종목 연합 갖가지 활동 프리마 기획 판매 공연 연출,http://bravo.etoday.co.kr/view/atc_view.php?varAtcId=7866
계발 인간 관계 여가 소일거리 건강 노후 안락 종목 연합 갖가지 활동 프리마 기획 판매 공연 연출,http://bravo.etoday.co.kr/view/atc_view.php?varAtcId=7867
준비 교육 과정 인간 관계 지역 이해 영농 인턴 보람 도움 포항 아카데미,http://www.kbsm.net/default/index_view_page.php?idx=188953
준비 교육 과정 인간 관계 지역 이해 영농 인턴 보람 도움 포항시 내년,http://www.nspna.com/news/?mode=view&newsid=246678
한국 경제 연구원 관계자 계획 준비 마을 주민 인간 관계 마을 외부 전문가 지방 자치 단체 행정 기관 원활 의사소통 필요 정부,https://n.news.naver.com/mnews/article/417/0000273348?sid=103
지역 특산물 농인 소백산 중턱 재배 표고버섯 그간 인간 관계 직원,https://n.news.naver.com/mnews/article/088/0000509568?sid=102
강원도 횡성 학교 운영 이동훈 신부 고민 반려 동물 장례 필요 이제 애완 동물 표현 정도 동물 인간 관계 예전,https://n.news.naver.com/mnews/article/028/0002381623?sid=103
신화 인간 관계 쇠퇴 가족 공동체 쇠퇴 가족 가족 공동체 분리 핵가족 활성 농산 촌의 자원 산과 활용,http://www.agrinet.co.kr/news/articleView.html?idxno=156118
인간 관계 생각 목표 여자 결혼 생활 작성 시대 부부 이야기 이야기 아내 도시 남편 임지수,https://n.news.naver.com/mnews/article/009/0004021116?sid=102
도시 경험 인간 관계 접목 사례 젊은이 감각 분야 창업 소장,http://www.nongmin.com/article/ar_detail.htm?ar_id=279876
장성 군립 도서관 가을 시작 시작 독자 선택 도움 인간 관계 고민 주제 에세이 실용 도서 추천 배경 호미 자루 농법,http://www.gukjenews.com/news/articleView.html?idxno=779688
장성 군립 도서관 가을 시작 시작 독자 선택 도움 인간 관계 고민 주제 에세이 실용 도서 추천 배경,http://www.newsway.co.kr/view.php?tp=1&ud=2017090711570374645
미래 연금 재테크 증여 건강 인간 관계 커리어 개발 은퇴 전문 노후 준비 시작 노후 준비 수준 부담 의료비,http://weekly.cnbnews.com/news/article.html?no=123009
회장 청년 영농 시작 청년 인간 관계 농지 임대 구입 기술 가지 부분 어려움 해결,http://www.agrinet.co.kr/news/articleView.html?idxno=155080
청년 부족 가지 사람 인간 관계 기술 기술 토지 구입 생활 정부 청년 불금 지불 정책 가지 충족,http://www.ikpnews.net/news/articleView.html?idxno=31189
인간 관계 중요 정도 정년퇴직 귀어 고민 현지 원주민 갈등 걱정 텃세 부분,http://www.ytnradio.kr/program/?f=2&id=50802&s_mcd=0201&s_hcd=09
먹거리 정도 자급 사람 처음 해결 문제 거처 확보 인간 관계 타산 동행 장소 도시,http://bravo.etoday.co.kr/view/atc_view.php?varAtcId=7300
개성 정체 인간 관계 리더 대변 생각 넥타이 이스트 출신 음악가 컴퓨터 프로그래머 스마트 기반 심화 사람,http://www.ktnews.com/sub/view.php?cd_news=103860
자연인 소개 사람 시절 사업 인간 관계 상처 남자 자연인 로망 그걸 실현,http://www.knnews.co.kr/news/articleView.php?idxno=1219421
공동체 인간 관계 제시 모임 자발 생태 마을 공동체 마을 모임 출범 한국 생태 마을 공동체 네트워크 회의 선언문 기초 유정 전국귀농운동본부,https://n.news.naver.com/mnews/article/028/0002369228?sid=004
공동체 인간 관계 제시 모임 자발 생태 마을 공동체 마을 모임 출범 한국 생태 마을 공동체 네트워크 회의 선언문 기초 유정 전국귀농운동본부,https://n.news.naver.com/mnews/article/028/0002369216?sid=103
농업기술센터 분야 담당 부서 교육 궁금증 해결 의령군 연구회 김동재 회장 생활 이해 인간 관계 방법 강의 마지막 교육 승마 체험,http://www.gndomin.com/news/articleView.html?idxno=143484
생활 이해 인간 관계 방법 강의 선배 사항 생활 조언 교육 호응 박수 기자,http://www.gnnews.co.kr/news/articleView.html?idxno=301185
의령군 연구회 김동재 회장 생활 이해 인간 관계 방법 강의 마지막 승마 체험 엿강정 체험 흥미 부여 과정,http://www.gukjenews.com/news/articleView.html?idxno=730868
학교 졸업 희망자 관심 인큐베이터 기능 농장 농민 조직 유리 인간 관계 필수,http://www.nongmin.com/article/ar_detail.htm?ar_id=276820&subMenu=articletotal
분기 퇴직자 인생 모작 교실 글씨 인간 관계 재무 관리 노년기 의미 논어 역사 지혜 풍수지리 공동체 소호 마을 사례 스마트폰 사용법,http://www.ksilbo.co.kr/news/articleView.html?idxno=598811
생각 노후 준비 금융 안내서 재테크 안내서 가정 은퇴 인간 관계 가족 관계 배우자 동거,http://www.readersnews.com/news/articleView.html?idxno=73246
은퇴 위기 대비 인간 관계 발생 교수 은행,http://www.ytnradio.kr/program/?f=2&id=49835&s_mcd=0330&s_hcd=01
강창희 대표 시대 자산관리 오후 박갑주 교수 건국대 경영 대학원 교수 산업 혁명 직업 오후 최창호 심리학 박사 중장 심리 인간 관계 오후 전북,http://ilyo.co.kr/?ac=article_view&entry_id=250924
강창희 대표 시대 자산관리 오후 박갑주 교수 건국대 경영 대학원 교수 산업 혁명 직업 오후 최창호 심리학 박사 중장 심리 인간 관계 오후 전북,https://n.news.naver.com/mnews/article/008/0003880149?sid=102
강창희 대표 시대 자산관리 오후 박갑주 교수 건국대 경영 대학원 교수 산업 혁명 직업 오후 최창호 심리학 박사 중장 심리 인간 관계 오후 전북 종합 센터,http://www.m-i.kr/news/articleView.html?idxno=314729
강창희 대표 시대 자산관리 오후 박갑주 교수 건국대 경영 대학원 교수 산업 혁명 직업 오후 최창호 심리학 박사 중장 심리 인간 관계 오후 전북,http://www.gukjenews.com/news/articleView.html?idxno=718490
캘리 그라피 강좌 노년 인간 관계 노년 재무관리 논어 풍수지리 스마트폰 사용법 내용 준비 교육 화요일 목요일 오전,http://www.ksilbo.co.kr/news/articleView.html?idxno=595433
캘리 그라피 강좌 노년 인간 관계 노년 재무관리 논어 풍수지리 스마트폰 사용법 내용 준비 교육 화요일 목요일 오전,http://www.iusm.co.kr/news/articleView.html?idxno=739152
캘리 그라피 강좌 노년 인간 관계 노년 재무관리 논어 풍수지리 스마트폰 사용법 내용 준비 교육 화요일 목요일 오전,https://n.news.naver.com/mnews/article/003/0007971791?sid=102
캘리 그래피 강좌 노년 인간 관계 노년 재무관리 논어 풍수지리 스마트폰 사용법 프로그램 마련 교육 화요일 목요일,https://n.news.naver.com/mnews/article/421/0002747671?sid=102
도심 중심 인간 관계 프랑스인 남편 울이 동갑내기 아들내미 유민이 선택 당시,http://www.catholicnews.co.kr/news/articleView.html?idxno=17905
관심 현지 직업 거주 인간 관계 불안 실천 사람 장벽 상대 조부모,https://n.news.naver.com/mnews/article/032/0002785014?sid=104
거주 주민 인간 관계 유지 생활 지원 종합 사업 도시 청년 캠프 도시 청년 초보 농부 플랫 조성 운영 청년,http://www.ggilbo.com/news/articleView.html?idxno=365931
낙원 농본사상 사랑 점철 서사 구조 농민 문학 정형 인간 관계 아픔 작품 제작,http://www.dynews.co.kr/news/articleView.html?idxno=351631
홍천군 주최 투어 참여 희망자 산마늘 농장 직장 시작 영농 기술 습득 인간 관계 형성 도움 홍천,http://www.nongmin.com/article/ar_detail.htm?ar_id=275164&subMenu=articletotal
기존 포기 인간 관계 추가 지난해 세대 청년 하우스 게스트 하우스 주택 정책 확대 사업 청년,http://www.jjan.kr/news/articleView.html?idxno=1125028
한겨레 요판 정희진 메모 박정헌 지음 열림원 연초 지인 재배 과일 인간 관계 필요 자존심 착각,https://n.news.naver.com/mnews/article/028/0002355645?sid=103
경제 효율 인간 관계 사회 관계 사회 발전 주요 동력 작동 자발 하방 마을 사람 마을,https://n.news.naver.com/mnews/article/047/0002142868?sid=102
중국 고사 솔개 이야기 사람 시사점 솔개 평균 피폐 도시 환경 도시 인간 관계 어려움 사람 공간 매력 터전,https://n.news.naver.com/mnews/article/005/0000974394?sid=110
관계 인간 인간 사이 관계 유지 사회 생산 체계 모습 기존 식품 체계 편입 자체 가족 생활 양식 훼손,http://www.kado.net/?mod=news&act=articleView&idxno=839997
북구 관계자 인간 관계 재무관리 사회 공헌 활동 퇴직자 주요 관심 분야 교육 지원 퇴직자 인생 설계 방향 제시 기대,http://www.ksilbo.co.kr/news/articleView.html?idxno=578108
사업 직장 문제 경제 이유 와중 마련 인간 관계 환멸 적극 선택 방식 선배 생활 터전,https://n.news.naver.com/mnews/article/469/0000187357?sid=110
진안군 협의회 장목 사이 학교 학생 수업 진행 예수교 장로회 인간 관계 실존 무대 후임 부부 노인 학교 박물관 개관 준비 시작,https://n.news.naver.com/mnews/article/028/0002352133?sid=102
과도 업무 의미 인간 관계 스트레스 도쿄 한국 감안 저자 프리랜서 블로그 운영,https://n.news.naver.com/mnews/article/018/0003706768?sid=103
독일 여행 팀장 사진 가운데 중학 생일 부모 환경 학교 생활 인간 관계 트라우마 한국 사랑 기억 사람,https://n.news.naver.com/mnews/article/030/0002563116?sid=105
