nouns,link
생활 토지 임장 생활 창업 자금 자격 요건 전입 기준 이하 오빠 나이 자격 요건 지자체 교육,https://blog.naver.com/hain0116/223314630208
정도 힐링 포인트 이제 경험 중심 도움 마음,https://blog.naver.com/nadalove123/223432265281
진드기 고라니 돼지 인류 시골 텃새 극복 실습,https://blog.naver.com/sanbbaram/223401397592
가지 난관 봉착 시작 나름 최선 방안 은퇴 현실 엄나무 조합원 노동 집안 소득 일자리 농한기 농번기,https://blog.naver.com/farm0317/223226369622
역귀 기반 지역 사회 외부 텃세 따돌림 배타 정서 이웃 생각 마음 배려,https://blog.naver.com/ytm1300/222982337669
자연인 생활 경제 이득 현실 직면 전쟁 대지 나무 작물,https://blog.naver.com/hglee209/223142489365
자연 환경 정보 보조금 수익 장점 간접 경험 여건 생각 나름 현실,https://blog.naver.com/syd5618/223015065928
친구 선언 강원도 재주 친구 만능 맥가이버 서울 생활,https://blog.naver.com/kumdongil/223452195514
농활 이해 농활 필요 문제 정도 계획 하루,https://blog.naver.com/sane_12/223473452378
생산 환경 인구 감소 주요 요인 기후 변화 자연재해 경작지 부족 다양 위험 세대 진출,https://blog.naver.com/leave-02/223300195499
산업 황경수 초기 곤란 요인 자금 부족 기술 부족 농지 확보 곤란 지역 선정 기준 상담 창구 전문 주택 마련 이사,https://blog.naver.com/tomato9247/223400410887
전국귀농운동본부 관심 애정 학교 운영 지원 정보 제공 홈페이지,https://blog.naver.com/daedongblog/223180170060
울주군 초기 부족 경험 기술 극복 역량 강화 교육 실시 생활 도움 필요 교육 참여,https://blog.naver.com/ulju_love/223479025958
대부분 농인 부부 고비 둘째 도전 복숭아 한파 나무 시작 복숭아,https://blog.naver.com/dusghktns/222797495670
기본 공통 과정 이수 교육 내용 초기 관련 정보 경험 부족 해소 입문 필수 정보 기초 소양 교육 지원 신청 가능 횟수 기수 신청 가능 유형 특화 과정,https://blog.naver.com/sulmeokja/223217158267
사진 대한민국 포털 대로 슬기 민들레 생활 건강 먹거리 환경 자연 농법 명의,https://blog.naver.com/ytm1300/223274451485
수작업 밭농사 추천 최소 상주 목표 지역 가을 동네 주변 만남 오랫동안,https://blog.naver.com/csmcaca/223420681204
체크 준비 지원 마지막 연합 회장 인사말,https://blog.naver.com/seogwipo-si/223239698786
선호 개념 국어사전 지자체 인구 고령화 일손 개인주의 심화 마을 공동체 퇴색,https://blog.naver.com/mrbean7/223465392429
경제 인구 통계 자료 도시 최후 피난처 밥벌이 현실 어딜 마찬가지 아래,https://blog.naver.com/bomnoru/223151446078
은퇴 현실 후기 은퇴 은퇴 시골 생활 전환 고려 시작점 은퇴 생각 사항,https://blog.naver.com/idmaker23/223470045253
마음속 비전 생각 준비 부족 상태 시작 미리 체험,https://blog.naver.com/uiseong-good/223254755111
국비 지원 촌교 개강 소식 교육 모집 준비 과정 모집 생활 제한 자원 대처 필요,https://blog.naver.com/pero27/223320506387
현장 달인 교육 모집 평창군 초보 인과 평창군 전입 예정 도시민 현장 달인,https://blog.naver.com/pc_happy700/223406780921
강원도 영월군 영월군 관광 협의회 대변 협의회 회장 활동 박철희 회장 실제 지혜,https://blog.naver.com/kooni/222859554916
바위 농원 유튜브 구독자 소통 농부 소통 바위 농원 바위 농원 유튜브 구독자 판로 농부,https://blog.naver.com/soso6504/223340475531
발생 청도군 종합 지원 센터 설명 참가 자분 소감 포부 인사말 퀴즈 타임,https://blog.naver.com/ahelpinghand/223489437223
이해 극복 방법 교육 컨설팅 창업 교육 활용 지역 선택 지역 선택,https://blog.naver.com/sulmeokja/223204970201
만큼 초기 관련 정보 경험 부족 해소 도움 겁니다 농부 인턴 수민 제작 총괄 농부 선임 디터 태윤 농부 참고,https://blog.naver.com/nong-up/223198878293
준비 준비 대구광역시 농업기술센터 신규 기초 기술 교육 실시,https://blog.naver.com/ecocitydaegu/223388681155
출처 결정 요인 분석 경제 제권 제호 환경 기대 고민 텐데요 정확 전문,https://blog.naver.com/kfilee235/222999170128
정원 도시 순천 마을 외지인 마을 낙안 유명 마을 갈전 마을,https://blog.naver.com/foodrist/223484638947
경기도 희망 도시민 초보 대상 멘토 관련 분야 전문가 상담 지원 초보,https://blog.naver.com/ggaf2007/223365383800
진입 확장 공사 생활 주위 경치 언덕 언덕 실수 차량 진입 주변 여건 고려,https://blog.naver.com/jenny8464/220667811017
꿀벌 애정 가족 도움 양봉 관심 관심 꿀벌 아카시아,https://blog.naver.com/indiecat/223390375858
자연 보상 도시 소음 스트레스 자연 속삭임 풍경,https://blog.naver.com/morthe40/223374385562
서울 전라북도 김제 직업 엔지니어 농부 비트 여주 돼지감자 재배 결심 이유 비전 지역 선택 이유 처가 장인어른,https://blog.naver.com/jbreturn/222590742614
한입 마트 딸기 차별 매력 농부 즐거움,https://blog.naver.com/pmh1110/223115674384
마을 도시 텃밭 수준 규모 마을 농인,https://blog.naver.com/srshabba1/221039017446
실제 현실 배추 회원 잡초 관리 회원 카페 은퇴 회원 소통,https://blog.naver.com/sulmeokja/223276584961
정년 직장 부부 인생 준비 시작 국산 체리 전기 지난해 소개 품종 과일 시험 재배 국산 체리 경쟁력,https://blog.naver.com/sinmunman/223481895974
마을 풍경 마을 풍경 마을 풍경 마을 풍경 마을 풍경 부부 부부 포도 시골 매매 토지 매매 매매 초보 농부 상주,https://blog.naver.com/chlssk/222313753008
자연 준비 자연 내일 정답,https://blog.naver.com/108baeg/220169437268
전라남도 혜택 초기 극복 과정 필요 이야기 니다 시작 현재 체험 카페 운영 농부 전남,https://blog.naver.com/greenjeonnam/222735718310
한국 농정 신문 해결 살림 살림 학교 운영 실질 도움 노력,https://blog.naver.com/whiteworld84/150067306046
기술력 경험 부족 현장 초기 농인 경기 멘토 자부담 연간 최대 회의 멘토링 지원,https://blog.naver.com/ggaf2007/223368160389
지방 토목 회사 모습 금년 구입 사용 토목 회사 현장 구두 계약 밤톨 자갈 공사비 시공 업자,https://blog.naver.com/uifarm/220064629232
한국 경제 연구원 실태 조사 농인 초기 창업 자금 소득 부족 농지 기술 부족 복합 창업 창업 아이템,https://blog.naver.com/sinsari265/220627623947
사례 발표 창원 극장 운영 부곡면 양상추 수박 재배 박용준 씨세 극복 사항 경험담 지역 주민 화합 바탕,https://blog.naver.com/cngblog/220351165702
비용 전라북도 전액 지원 신청 대상 전라북도 전입 이내 신청 기간 일월 예산 소진 조기 종료,https://blog.naver.com/jbreturn/222120911309
환경 건강 먹거리 부분 황상희 노지 물부추 진액,https://blog.naver.com/greenfa/222678331509
경험 전무 기본 생업 이해 기본 지식 필수,https://blog.naver.com/sulmeokja/223377473312
강의 이야기 작목 선택 중요 이야기 가지 이야기 농장,https://blog.naver.com/soso6504/220991968893
화천 현장 학교 화천 박기 교장 체험 화천 체험 장기 과정 단기,https://blog.naver.com/kreiaglook/221235516913
동물 식물 젬병 티타임 점심 약속 팔마 체육관 벚꽃 벚꽃 구경 로망 농부,https://blog.naver.com/taerang0217/222696373665
실질 준비 작물 선택 선택 걱정 멘토 경기도 지원 센터,https://blog.naver.com/gyeonggi_gov/222602751335
도시 생활 정도 여유 전원생활 즐거움 만끽 처음 처음 처음,https://blog.naver.com/ojk1664/222040682633
나이 현재 직거래 판매 판로 개척 욕심 만큼 지어 생산 농산물 품질 향상 최선 현재,https://blog.naver.com/rda2448/222288187220
이날 참석 농인 공유 지역민 화합 중요 마련 감사 김인수 신원 면장 새내기,https://blog.naver.com/pamoon/222712591806
영주시 해결 노력 결과 소백산 드림 타운 입교 소백산 드림 타운 입교식 과정,https://blog.naver.com/yeongju_city/220743628070
방송 딸기 현장 방송 댓글 공감 상임 종상 공감,https://blog.naver.com/ebsstory/220745065995
시대 시대 현실 언론인 가면 청치 술수 기업 권력 정부 타락 윤리 사회,https://blog.naver.com/cjstp2007/220177122652
지역 축제 소개 전국귀농운동본부 조직 활동 단체 남해군 가이드북 인턴 농부,https://blog.naver.com/nong-up/221034456273
진작 포기 그건 근본 시작 근본,https://blog.naver.com/gugji/220359784924
출산 이유 자발 이유로 경력 단절 결심 정도 생활 가능 생각,https://blog.naver.com/inquirytheself/222643418239
초보 동네 기계 면사무소 무료,https://blog.naver.com/9jidr/20207530056
종일 불안감 준비 여럿 관련 문제 국가 해결,https://blog.naver.com/kimhongjip/220945680030
교육 문제 첫해 방학 주말 사고 산청군,https://blog.naver.com/7439500/222626148855
마음 도시 비교 도시 여유 처음 부부,https://blog.naver.com/uiseong-good/222069788705
여성 주제 뜨락 양희 숙씨 성취감 사례 여성 희망자 메모 선배 사례 마음,https://blog.naver.com/youbkook/220984787796
오늘 시도 예정 시민 활성 이후 지역 주민 도움 사례 오미자 재배 방법 오미자,https://blog.naver.com/pcs275/220785579441
농지 구입 시기 구입 농지 구입 시기 현장 신중 결정 농지 거래 실태 정서 농지 거래 형태 인맥 친분 거래,https://blog.naver.com/tameones/220474524304
교사 생활 강원도 홍천 구입 지적도 건축 가능 생각 허가,https://blog.naver.com/bmnv1/220002172411
계기 현재 발자취 허심탄회 말씀 하나하나 마음,https://blog.naver.com/sansufarm/220070470830
수경 재배 설명 질문 이야기 희망 자분 관심 질문 태안 인구 작년,https://blog.naver.com/youbkook/220860719117
무연고 지역 거기 싱글 배가 여성 싱글 거기 대부분 친환경 대부분,https://blog.naver.com/thristan/132815982
생각 과정 인정 노력 네트워크,https://blog.naver.com/pys2093/220390779034
예산 기술 맥가이버 지민 오늘 농시 자금 문제 이야기 과거 현재 행정,https://blog.naver.com/bidrak/110099250962
시행착오 진솔 인상 연구 선배 농인 나머지 로하스 생명 밥상,https://blog.naver.com/maebit/220318017210
리얼스토리 방영 이웃 내용 일상 공감 부분,https://blog.naver.com/sbkim527/220986580751
남편 생활 즐거움 준비 마음가짐 공담 실패담 보약,https://blog.naver.com/sumi1789/159561994
충남 일보 김준기 기자 청양군 농업기술센터 예비 부족 부분 필요 제공 맞춤 센터 예비 인과 선도 농가,https://blog.naver.com/ccm-1222/222090904835
행사장 아들 모습 군수 생활 도움 면담 한번 비서관 약속,https://blog.naver.com/yanzip/221085747210
걱정 걱정 하늘 동업 그날 처방 위험 부분 비닐 비닐,https://blog.naver.com/kane41/177767823
생각 준비 경험 눈물 바람 타의 경험 농부 정성,https://blog.naver.com/yoyoyoyo1318/40210037557
제도 활성 농인 박람회 행사장 이벤트 행사 수박 사과 껍질,https://blog.naver.com/kreiaglook/221356591843
새벽 참외 수확 시작 방문객 가족 설명 부인,https://blog.naver.com/leeway1/50175837592
사방 농민 텃새 얘기 얘기 농민 대부분 가능 할아버지,https://blog.naver.com/2030yang/40202618245
오늘 전남 광양 손해 만큼 광양 홍보 일조 지역 발전 공헌 사례,https://blog.naver.com/greenjeonnam/221611514145
도시 스트레스 인간 관계 결심 부산 학교 제공 교육 프로그램 지식,https://blog.naver.com/hhj8535/223479845126
이유 여유 자금 부족 기술 습득 농지 구입 생활 여건 불편 지역 주민 갈등 직업,https://blog.naver.com/sskn5200/220343230542
초기 필요 협력 관계 발전 경쟁의식 주변,https://blog.naver.com/jbreturn/222599834334
시골 할머니 할아버지 작물 전문가 이야기 선배 충고 준비,https://blog.naver.com/hellopolicy/150140955413
종합 센터 전문 상담 인력 확충 종합 단계 실행 사업 추진 예비 해소 컨트롤 타워 역할 방문,https://blog.naver.com/rda2448/221059130426
창업 주택 마련 저리 융자금 지원 생활 안정 지자체 유치 중앙 정부 별도 조례 제정 지원 사업,https://blog.naver.com/hellopolicy/150150057868
제목 내용 유튜브 이야기 시골 사온 이웃 토박이 입장 토박 입장 마을,https://blog.naver.com/yms2455/222201754226
농인 경제 표현 춘궁기 자금 지원 초보,https://blog.naver.com/hhc7118/20123689045
과정 협의회 지원 센터 전문가 도움 요청 순창군 종합 센터 행정 팀장,https://blog.naver.com/jbreturn/222084900605
이해 자연 그림 진행 목포 대학교 평생 교육 도착 도시민,https://blog.naver.com/a630203/220473157403
임야 재배 임산물 수확 기간 조건 검토 박성종 더덕 두릅 재배 품목 수확 시기 고려 임산물,https://blog.naver.com/kofpi/140183167497
종합 센터 지원 지역 지원금 지역 정착금 지자체 교육 정보 관련 자료 상담 진행 정보 도움,https://blog.naver.com/kfilee235/222728501223
마을 마을 지도자 다양 봉사 활동 시행착오 초창기 교육 농장 펜션 운영 안정,https://blog.naver.com/hong273526/222856484516
가족 반대 주위,https://blog.naver.com/firemanp111/220214806435
현실 그것 여정 도움 부자 농부,https://blog.naver.com/80284/223331827602
덕분 생활 이웃 친목 모임 농인 다육 농장 지역민 노하우 마을 회관 어르신,https://blog.naver.com/uiseong-good/222158046493
경험 순위 자금 부족 생활 생각 도시 지역 주민 갈등,https://blog.naver.com/88skrmsp/220346973331
현장 초보 신청자 신지식 복합 사업자 맞춤 멘토 현장 방문 멘토링 품목 기술 경영 멘토링 최대 무료 전문 상담,https://blog.naver.com/juminjachi/223367473302
고민 자금 융자 용지 매입 생각 지역 안성 직장 직장,https://blog.naver.com/ysc2220/221718512197
타지 주민 노력 주민 생활 마을 행사,https://blog.naver.com/uiseong-good/222121498148
홀로서기 주목 경기도 멘토링 지원 개인 맞춤 멘토 조언 지역민 친분 안정,https://blog.naver.com/gyeonggi_gov/222347649009
사과 브런치 카페 판로 극복 경기 연천군 이예숙 이예숙 청정 자연 경기 연천군 재배 사과 요리 음료 개발 브런치 카페 운영,https://blog.naver.com/ytm1300/223232508154
시골 생활 불편 문화 생활 생활 문화 생활 도서관 영화관 공연장 문화 시설 부족 거리 접근,https://securitynewsteam.tistory.com/2421
준비 과정 가족 배우자 대화 합의 필요 가족 적극 지지 동의 준비,https://blog.naver.com/brand_power/223260152422
블루베리 가지 준비 답사 주변 여론 농업기술센터 교육 권장,https://blog.naver.com/agrostory/222858666294
무언가 시작 시작 차이 제주도 육지 나들이 코감기 조수리 수호 농원 초보 농부 키위 농장,https://blog.naver.com/kit6242/221214458473
예전 경험 생애 처음 도시 여유,https://blog.naver.com/bloglh/220920017884
생활 안정 지원금 경제 지원 금액 지원금 신청 인임 증명 서류 계획서 구비 지자체 신청,https://blog.naver.com/grt4321/223205567364
로마 로마법 그곳 전통 문화 이해 갈등 예상 극복 얘기 인문 교육 전북 역사 지형 문화 생태 기본 교육 전북,https://blog.naver.com/jbgokr/221107091621
수익 보장 제도 확정 시행착오 세대 수익 보장 제도 적용 가능 농산 업체 발굴 대상 세대수,https://blog.naver.com/farm-aid/223490318532
후반기 보좌관 행정사 도시 응원 사업 운영 노동 강도 자연 재해 위험 시장 변동성 다양,https://blog.naver.com/skkang21/223383132845
충남 당진 우강면 인근 화훼 농장 농약 친환경 특징 농부 소영,https://blog.naver.com/chungnamdojung/222993857071
임대 농장 하우스 매매 비닐 하우스 장기 교육 전북 익산 이산화 탄소 발생기 난방 대포 겨울철 환경 관리 관리,https://blog.naver.com/jsh7347/223488632995
지원 온라인 플랫 해소 수요자 정보 접근성 정보 제공 구축 경남 실제 수요자 필요,https://blog.naver.com/gnfeel/222680682492
일부 지역 주민 소통 문제 말씀 준비 사항 기본 교육 트랜드 농산물 유통 구조 이해,https://blog.naver.com/hup2014/221419262953
수입 월급 말씀 생각 농지 농기계 준비 소요,https://blog.naver.com/poll1003/110175467415
미디어 마늘 농작물 관리 재료 관리 신경,https://blog.naver.com/gangjingun/220520156670
내용 현장 인과 전문가 대화 정보 이주 메모 수록 주요 내용,https://blog.naver.com/sinmunman/223275537178
관심 교육 정보 교육 모집 기간 모집 대상 희망자,https://blog.naver.com/damyanggun/221775314154
직업 서울 서울 죽도 목표,https://blog.naver.com/ddolmani0/220155759311
이야기 줄타기 이야기 제주 마을,https://blog.naver.com/kit6242/220499392015
결정 지식 경험 부족 적응 생활 필요 비용 인프라 부족,https://blog.naver.com/idmaker23/223338314240
정도 생활 거리 경제 분발,https://blog.naver.com/9jidr/220590609843
식사 집안 살림 남편 생활 오도 농부 오재경 마늘 자두 고추 작목 선택,https://blog.naver.com/uiseong-good/221749389539
동물 방문 여긴 도시 산책 현실 환경 문제 부정 환경 문제 현지,https://blog.naver.com/sbkim527/221800103368
농부 대화 생활 즐거움 기준 참가자 농작물 수확 체험 보람,https://blog.naver.com/dictionry41727/223374468733
부분 농산물 판로 신규 고객 창출 수익 온라인 마케팅 진행 온라인 마케팅 선택 사항 필수 사항,https://blog.naver.com/mrinet1/223067576416
주거 문제 해결 농인 조성 주택 수리비 지원 사업 경제 해소 장려금 농지 차비 이사비 지원 사업 시행 증가 마을,https://blog.naver.com/hadongblog/223327188105
소방대 방범대 체육회 바이스 멘토 의견 얘기 방법,https://blog.naver.com/taeyonga/222144380177
유기농 식품 치유 효과 저변 확대 국민 건강 기여 생각 고민 평소 성격 백현기 마을 응에,https://blog.naver.com/agrostory/222648001017
적응 회사원 직업 과수 직업 전환 환경 평생 과수 아버지 덕분 오늘 문경시 산북면 지회,https://blog.naver.com/chanjo0905/221419336719
필요 현실 강의 이점 교육 도움 장점 차후 유대 관계,https://blog.naver.com/haharara27/222961552622
밴드 서로 정보 교류 네트워크 형성 기회 사업 계획 구상 실행 사례,https://blog.naver.com/kongirang02/221516524170
신랑 생각,https://blog.naver.com/sunldve0317/140058640965
활력 유정용 과장 초기 주거지 확보 희망자 주거 지원 확대 조성 자녀 전입 도움,https://blog.naver.com/thecm11/223485315278
면적 얼만큼의 소득 이웃 농사철 국한 얘기 하루 소득,https://blog.naver.com/dinopro/222849235974
절차 전남 담양군 주소 이전 농지 임대 계약 지대장 등록 확인 절차 최대 주가 소요,https://blog.naver.com/taesudo/223317018969
해소 수하 청소년 수련 중심 제회 영양 학교 개최 개최 영양 학교 모집 인원 대상 의미 전망 시작,https://blog.naver.com/sununion/100055322620
현지 사회 연결 지역 사회 소통 협력 능력 중요 노력 인내 노력 인내 필요 분야 대처 노력 준비 필요 국민 연금,https://blog.naver.com/dbstmddk818/223212601693
제대 군인 시골 생활 적응 모습 방송 억대 농부 성격 남편,https://blog.naver.com/pirirings/220391368710
설날 연당 거리 시내 입구 중개업 사무실 개설 옛날 기억 전원생활,https://blog.naver.com/cafo2/220299873608
오늘 경남 김해시 청모 아마존 갈라 코카투 앵무새 리딩 센터 준비 부분 컨설팅 프로그램 동반 김해 리딩 센터,https://blog.naver.com/morangoum/223346850028
햇살 교육 교육 장마철 진행 가지 교육 일차 농기계 실습 장맛비 실습 걱정,https://blog.naver.com/songc1247/221309975188
이병학 교수 충남 학교 온라인 마케팅 교육 진행 판로 생산 농산물 소비자 전달 관건,https://blog.naver.com/mrinet1/223464415063
극복 얘기 농부 건강 농원 비트 농부 건강 농원 정직 비트,https://blog.naver.com/kso6694/222301129182
노력 주변 마을 주민 이것저것 준비 해결 생각 성실,https://blog.naver.com/hspark553/140109030078
사회 전반 지원 확대 환경 생태 빈농가 활용 쓰레기 활용 학교 이야기 인구 유입 논의 문화 시설 화경 개선 편안,https://blog.naver.com/twoyu2001/223445183781
텃밭 프로그램 극복 열쇠 테라스 수확 농작물 테라스 수확,https://blog.naver.com/d28a7fky/223292130603
도시 거주지 농지 도시 경험 운전 매지,https://blog.naver.com/dys351/223241541341
한국 경제 연구원 대한민국 경제 보고서 여유 자금 주거 환경 조성,https://blog.naver.com/goodnamwon/223367946842
주요 키워드 지원 교육 창업 창업 스마트 농지 확보 대상 농지 선임 후매 사업 지원 대상 범위 확대,https://blog.naver.com/tiny_home/223479637066
다큐 참외 아지매 일목 저녁 방송 까막눈 도시 주부 후반 결심 친환경 농약 참외 재배기,https://blog.naver.com/ktv520/220040994153
상주 공동체 학교 학생 학교 강사 공동체 협동조합 협동 사회 경제 유기 필요 가치,https://blog.naver.com/welchon4u/10181846582
생육 과정 극복 과정 현장 체험 교육 거창 농업기술센터 지원 사과 오미자 약초 체리 특용 작물 교육 부각 간장 된장 효소 이외,https://blog.naver.com/jibisil/130167311484
개강식 총장 정일 신부 준비 생각 교육 나라 농산업 발전 기여 우수 인재,https://blog.naver.com/sophia_line/220568971656
기분 화가 제외 제주 극복 올레 할머니 차방 올레 할머니 차방 아침 젊은이 편안,https://blog.naver.com/honeyjeju1/223117671726
농인 토크 극복 사연 신청자 맞춤 공연 접수 홈페이지 사연 접수 추첨 특별 선물 참여,https://blog.naver.com/88skrmsp/90143235432
대한민국 박람회 전시 국제 박람회 보관 경제 학과 졸업 직장 사무직 근무 기술 사업,https://blog.naver.com/jnreturnfarm/223427634858
사전 준비 경험 초기 투자 비용 소득 창출,https://blog.naver.com/duckgon/222032476684
정년 퇴임 나이 생각 노력 필요 자연,https://blog.naver.com/lim7179/70101505652
산업 혁명 시대 필연 현상 정의 실태 조사 해석 산업 혁명 시작 보스 포럼 클라우스 회장 세계 경제 포럼,https://blog.naver.com/happynep/221937292099
현제 농장 소개 인사 다과 교육 질문 식품 공무원 연수원 성점 꽃차 치유 체험 농장 견학 식품 공무원 연수원,https://blog.naver.com/sjsuk0733/223284906293
신축 전원주택 주택 매매 정보 신축 전원주택 소개 풍요 오르막길 방향 지붕 색깔,https://blog.naver.com/khrgreen/223462256572
서울 전라북도 익산 직업 어린이집 교사 교육 그녀 도내 열대작물 관련 교육,https://blog.naver.com/jbreturn/222575131842
현실 해소 인구 방안 일환 젊은이 일정 기간 생활비 지원 시스템 경제,https://blog.naver.com/khj00675/220083982411
장남 직장 정리 차남 작년 준비 현장 적응 서울 살림살이,https://blog.naver.com/ogapi4889/223342416552
곤란 관계 공통 생활 동네 관계 이웃집 숟가락 숫자,https://blogilda.tistory.com/799
최근 도시 생활 스트레스 경제 선택 지원 제도 개선,https://blog.naver.com/aafgr/223360771460
지난해 고창군 코로나 서울 도시 관련 박람회 연기 취소 유치 복분자 수박 멜론 블루베리 인삼 다양 소득 작물,https://blog.naver.com/agrostory/222804337992
무주 군수 해당 부서 공무원 협의회 의견 경청 현장 요구사항 실질 입장 이해 노력 무주 군수,https://blog.naver.com/bo114114/223445479465
간과 초반 재정 무리 초기 수입 마련,https://blog.naver.com/uiseong-good/221663391959
사기 가격 중고 부담 가격 농부 한참 장비 렌탈 업체 해결 기억 포크 레인,https://blog.naver.com/joung3589/221816969013
대처 방안 첫째 경제 경영 필요 초기 투자 필요 둘째 지역,https://blog.naver.com/terryrosetteok/223073491264
해당 사업 이주 초기 자금 부족 창업 자금 마련 사업 대상자 선정 신용 담보 대출 저금리 이자,https://blog.naver.com/idmaker23/222922572740
이내 초기 대상 촌지 기술 상담 현장 지도 작목 선택 조언 선배 농인 현장 교육 활용 제공 작목 월별 방법 초기,https://blog.naver.com/khj_dangjin/221934071799
처음 만화 기획 일상 과정 초점 골살 일상 웹툰 소수 당시 작품,https://blog.naver.com/nvlge/221497344949
세상 한국 경제 연구원 조사 실제 희망자 이유 기술 습득 차지,https://blog.naver.com/uiseong-good/220990640380
충주 농가 기술 센터 담당자 인터뷰 현실 이야기 전반 시골 내음,https://blog.naver.com/dusghktns/192417023
보통 회사 심신 회피성 생각 단순 경제 도피성 증가,https://blog.naver.com/foryoumangohada/223467559191
