nouns,link
서울 출판업 지방 주인공 서울 출판업 수익 측면 고객 관계 계산 소셜 농부,https://www.m-economynews.com/news/article.html?no=44166
조언 교육 강조 말년 시골 마을 전원 생활 생각 전원생활,https://n.news.naver.com/mnews/article/020/0003572105?sid=103
옥천군 관계자 시민 생활 적응 기본 기술 교육 프로그램 다양 진행 예정 옥천군 원면,https://n.news.naver.com/mnews/article/001/0014762607?sid=102
인생 단맛 쓴맛 초기 궤도 사례 독특 불씨,https://bravo.etoday.co.kr/view/atc_view/15432
정환 젊음 공부 지식 도전 임대 논밭 자리 부모,https://www.polinews.co.kr/news/articleView.html?idxno=654457
판로 확보 시작 실망 확률 만큼 냉정 신중 두촌면 괘석리,https://n.news.naver.com/mnews/article/087/0001051364?sid=102
준비 초반 귀한 과다 잔대 사삼 초롱꽃과 다년생 초본 식물 사포닌 성분 인삼 연구 결과,https://n.news.naver.com/mnews/article/662/0000045981?sid=102
성도 교회 목사 지난해 시골 교회 은혜 서로 의견 기감 감독 회장 제목 말씀 천영태,https://n.news.naver.com/mnews/article/005/0001704203?sid=103
성도 교회 목사 지난해 시골 교회 은혜 서로 의견 기감 감독 회장 제목 말씀 천영태,https://n.news.naver.com/mnews/article/005/0001704134?sid=103
방향 설정 체류 학교 인구 감소 문제 해결 시민 촉진 폐교 리모 처음 기숙 공동 주택 강의실 실습실,http://www.newsmaker.or.kr/news/articleView.html?idxno=152690
방향 설정 체류 학교 인구 감소 문제 해결 시민 촉진 폐교 리모 처음 기숙 공동 주택 강의실,https://www.cnbnews.com/news/article.html?no=665255
정환 도전 임대 논밭 버섯 작목 자리 부모,https://www.lecturernews.com/news/articleView.html?idxno=154527
방향 설정 체류 학교 인구 감소 문제 해결 시민 촉진 폐교 리모 처음 기숙 공동 주택 강의실 실습실,http://www.koreareport.co.kr/news/articleView.html?idxno=22101
투어 농인 체험 선배 농인 경험 시민 고흥군 적극 홍보 기대 시민 대상 고흥군 설명 회차,https://www.nbntv.kr/news/articleView.html?idxno=330063
창업 디자인 교육 농장 방향 설정 재배 강진군 체류 학교 인구 감소 문제 해결 시민 촉진 폐교,http://www.betanews.net:8080/article/1468663.html
예비 투어 사진 고흥군 투어 농인 체험 선배 농인 경험 시민 고흥군 적극 홍보,https://www.newspim.com/news/view/20240614000502
투어 농인 체험 선배 농인 경험 시민 고흥군 적극 홍보 기대 관계자 고흥군 올해 개최,http://www.asiaa.co.kr/news/articleView.html?idxno=174962
방향 설정 체류 학교 인구 감소 문제 해결 시민 촉진 폐교 리모 처음 기숙 공동 주택 강의실,https://www.ajunews.com/view/20240614130357891
방향 설정 체류 학교 인구 감소 문제 해결 시민 촉진 폐교 리모 처음 기숙 공동 주택 강의실,https://www.siminilbo.co.kr/news/newsview.php?ncode=1160265028356734
방향 설정 체류 학교 인구 감소 문제 해결 시민 촉진 폐교 리모 처음 기숙 공동 주택 강의실,https://n.news.naver.com/mnews/article/003/0012606640?sid=102
방향 설정 체류 학교 인구 감소 문제 해결 시민 촉진 폐교 리모 처음 기숙 공동 주택 강의실,http://www.m-i.kr/news/articleView.html?idxno=1129973
방향 설정 체류 학교 인구 감소 문제 해결 시민 촉진 폐교 리모 처음 기숙 공동 주택 강의실,https://n.news.naver.com/mnews/article/468/0001068811?sid=102
방향 설정 체류 학교 인구 감소 문제 해결 시민 촉진 폐교 리모 처음 기숙 공동 주택 강의실 실습실,http://www.newsworker.co.kr/news/articleView.html?idxno=335545
이천 사진관 세대 아내 호강 고생길,http://www.topstarnews.net/news/articleView.html?idxno=15506210
명인 도전 대부분 도시 친환경 농법 미래 세대 안전 먹거리 제공 건강 먹거리,http://www.kjdaily.com/article.php?aid=1718191658632831074
올해 대학 졸업 아들 결혼 이듬해 아내 고등학교 학년 시골 좌절 좌절 감수,https://n.news.naver.com/mnews/article/047/0002436374?sid=103
자영업 농장 식물 품종 연구 규모 비닐하우스 체리 바나나 라임 재배 여개 열대작물 종자,https://n.news.naver.com/mnews/article/662/0000045501?sid=103
다은 서울 생활 부모 건강 생활 마음 빈손 부모 치즈,https://www.foodneconomy.com/news/articleView.html?idxno=359571
최소화 유도 전남 지난해 시민 참가 전남 전입 전남 어인 농산어촌 체류 지원 센터 조성 농지 주택 정보 종합,http://www.mdilbo.com/detail/GQFJv6/722288
오늘날 인구 감소 현시대 문제 실천 사례 내용 지역 경력 단절 여성 경험 공유 정보 공유 공유 지역 상생 창업 실천,https://www.ekn.kr/web/view.php?key=20240610023313501
심마니 심산유곡 마가목 연구 수백 연구 완성 마가목 에디션 증류,https://economychosun.com/site/data/html_dir/2024/05/31/2024053100027.html
농부 판단 시행착오 임대 농장 목표 노력 모습 감동 모범,https://www.farmnmarket.com/news/article.html?no=21334
청정 천리 소재 고범수 실천 우수 사례 사례 현재 청정 상황버섯 운영 사례 강의 안양 대학교 홍세영 교수,https://www.kmaeil.com/news/articleView.html?idxno=457807
이대호 주일 처음 하루 나중 이틀 사흘 나흘 가능 최민규 이대호 판매 방식 중요,https://n.news.naver.com/mnews/article/056/0011736771?sid=101
점동면 지역 농가 농가 참여 보람 지원금 선택 가능,https://www.farmnmarket.com/news/article.html?no=21319
공모전 계획 정보 조언 귀감 사례 발굴 취지 마련 영농 과정 어려움 경험 역경,https://www.chukkyung.co.kr/news/articleView.html?idxno=71894
준비 도시민 참여 만큼 생활 동경 실제 사례 창업 어려움 대비 방침 최훈식 군수 교육,http://www.domin.co.kr/news/articleView.html?idxno=1472057
준비 도시민 참여 만큼 생활 동경 실제 사례 창업 어려움 대비 방침 최훈식 군수,http://sjbnews.com/news/news.php?number=817780
준비 도시민 참여 만큼 생활 동경 실제 사례 창업 어려움 대비 방침 최훈식 군수,http://www.jeollailbo.com/news/articleView.html?idxno=733668
농장 식당 메기 양식장 도전 농장 요새 판매 강의 작약 슬기 인생,https://www.mhns.co.kr/news/articleView.html?idxno=599117
박영주 경기도 지원 센터 경기도 지원 센터 경기도 홍보 박람회 참가 결정 방문 상담,https://www.skyedaily.com/news/news_view.html?ID=234716
준비 도시민 참여 만큼 생활 동경 실제 사례 창업 어려움 대비 방침 최훈식 군수 교육,https://www.newscj.com/news/articleView.html?idxno=3146716
장수군 준비 도시민 참여 만큼 생활 동경 실제 사례 창업 어려움 대비 방침 최훈식 군수,https://n.news.naver.com/mnews/article/002/0002334911?sid=102
박영주 센터 경기도 지원 센터 경기도 홍보 박람회 참가 결정 방문 상담 최선,https://n.news.naver.com/mnews/article/005/0001701316?sid=102
준비 도시민 참여 만큼 생활 동경 실제 사례 창업 어려움 대비 방침 장수군 예비,https://www.newspim.com/news/view/20240605000591
박영주 경기도 지원 센터 경기도 지원 센터 경기도 홍보 박람회 참가 결정 방문 상담,https://www.viva100.com/main/view.php?key=20240605010001451
준비 도시민 참여 만큼 생활 동경 실제 사례 창업 어려움 대비 방침 최훈식 군수 교육,https://www.nspna.com/news/?mode=view&newsid=701855
공모전 계획 정보 조언 귀감 사례 발굴 취지 마련 영농 과정 어려움 경험 역경,http://www.wonyesanup.co.kr/news/articleView.html?idxno=58502
박영주 경기도 지원 센터 경기도 지원 센터 경기도 홍보 박람회 참가 결정 방문 상담,http://www.econonews.co.kr/news/articleView.html?idxno=341247
장수군 준비 도시민 참여 만큼 생활 동경 실제 사례 창업 어려움 대비 방침 최훈식 군수,http://www.newsmaker.or.kr/news/articleView.html?idxno=152285
박영주 경기도 지원 센터 경기도 지원 센터 경기도 홍보 박람회 참가 결정 방문 상담,https://www.ajunews.com/view/20240605102446883
공모전 계획 정보 조언 귀감 사례 발굴 취지 마련 농이 과거 영농 과정 사례 공유 미래,https://n.news.naver.com/mnews/article/662/0000045119?sid=101
박영주 경기도 지원 센터 경기도 지원 센터 경기도 홍보 박람회 참가 결정 방문 상담,https://gg.newdaily.co.kr/site/data/html/2024/06/05/2024060500056.html
박영주 지원 센터 경기도 지원 센터 경기도 홍보 박람회 참가 결정 방문 상담 최선,https://daily.hankooki.com/news/articleView.html?idxno=1091569
박영주 경기도 지원 센터 경기도 지원 센터 경기도 홍보 박람회 참가 결정 방문 상담,https://n.news.naver.com/mnews/article/002/0002334837?sid=102
박영주 경기도 지원 센터 경기도 지원 센터 경기도 홍보 박람회 참가 결정 방문 맞춤 상담,https://n.news.naver.com/mnews/article/003/0012588410?sid=102
박영주 센터 기간 방문 상담 최선 경기도 지원 센터 구상 단계 과정,https://n.news.naver.com/mnews/article/468/0001066310?sid=102
박영주 경기도 지원 센터 경기도 지원 센터 경기도 홍보 박람회 참가 결정 방문 상담,https://n.news.naver.com/mnews/article/629/0000293665?sid=102
작목 반원 자부심 친환경 생태 개구리 메뚜기 이게 작목,https://n.news.naver.com/mnews/article/662/0000045092?sid=110
공모전 계획 정보 조언 귀감 사례 발굴 취지 마련 영농 과정 어려움 경험 역경,http://www.amnews.co.kr/news/articleView.html?idxno=59492
공모전 계획 정보 조언 귀감 사례 발굴 취지 마련 영농 과정 어려움 경험 역경,http://www.gnnews.co.kr/news/articleView.html?idxno=554583
공모전 계획 정보 조언 귀감 사례 발굴 취지 영농 과정 어려움 경험 역경 과정 사례,http://www.dynews.co.kr/news/articleView.html?idxno=755011
가수 배우 김현중 근황 공개 김현중 유튜브 채널 옥수수 구독자 투자 옥수수,https://m.entertain.naver.com/article/382/0001129837
그룹 출신 가수 탤런트 김현중 옥수수 매진 근황 최근 김현중 유튜브 채널 제목 영상,https://m.entertain.naver.com/article/117/0003837822
공모전 계획 정보 조언 귀감 사례 발굴 취지 마련 영농 과정 어려움 경험 역경,http://www.bokuennews.com/news/article.html?no=244935
근황 공개 김현중 지난달 유튜브 채널 제목 영상 투자 이천,https://n.news.naver.com/mnews/article/016/0002317460?sid=103
근황 공개 눈길 김현중 지난달 유튜브 채널 제목 영상 투자 옥수수,https://n.news.naver.com/mnews/article/009/0005313579?sid=102
흥청 미만 영농 수기 월일 접수 영농 단계 극복 경험담 공모 대상 진흥 청장 상금 수여 선정 흥청 청장 조재호,http://www.newsam.co.kr/news/article.html?no=37804
사생활 논란 이후 연예계 활동 그룹 출신 가수 탤런트 김현중 근황 김현중 최근 유튜브 채널 코너 일상,https://n.news.naver.com/mnews/article/005/0001700873?sid=103
공모전 계획 정보 조언 귀감 사례 발굴 취지 마련 영농 과정 어려움 경험 역경,http://sjbnews.com/news/news.php?number=817598
공모전 계획 정보 조언 귀감 사례 발굴 취지 마련 영농 과정 어려움 경험 역경,http://www.queen.co.kr/news/articleView.html?idxno=412705
공모전 계획 정보 조언 귀감 사례 발굴 취지 마련 영농 과정 어려움 경험 역경,http://www.jeonmin.co.kr/news/articleView.html?idxno=398731
극복 사례 수기 공모전 포스터 사진 흥청 공모전 계획 정보 조언 귀감 사례 발굴 취지 마련,https://www.mediapen.com/news/view/924912
공모전 계획 정보 조언 귀감 사례 발굴 취지 마련 영농 과정 어려움 경험 역경,https://n.news.naver.com/mnews/article/003/0012583424?sid=102
농장 식당 메기 양식장 도전 농장 요새 판매 강의 작약,https://www.polinews.co.kr/news/articleView.html?idxno=651406
농장 식당 메기 양식장 도전 농장 요새 판매 강의 작약,http://www.queen.co.kr/news/articleView.html?idxno=412633
농장 식당 메기 양식장 도전 농장 요새 판매 강의 작약 슬기 인생,https://www.mhns.co.kr/news/articleView.html?idxno=597687
인구 유출 귀향 활성 전제 방식 방식 정치 총체 방향 전환 모색,http://www.ikpnews.net/news/articleView.html?idxno=63980
재능 로망 실현 머릿속 수확 기쁨 옥수수 주차 풋내기 고르기 천리 걸음 중순,https://n.news.naver.com/mnews/article/654/0000076419?sid=102
이투데이 세종 기자 인구 감소 인구 감소 세역 통계 지난해 농가 인구 역대 최저 기록 고령 농가 인구 비율 처음,https://www.etoday.co.kr/news/view/2363643
생활 환경 시장 상황 결합 구조 문제 경제 분야 지원 문제 해결 지적 포기 도시 역귀,https://www.etoday.co.kr/news/view/2363644
버킷 리스트 이유 정도 창업 자격증 보람 재능기부 봉사 단체,https://www.esgeconomy.com/news/articleView.html?idxno=6668
인과 계농 필요 농지 선정 사업 계획 작성 컨설팅 노력 부자 스쿨 사회 기업 전환 숙박 장기 교육 실습장 성장,https://www.farminsight.net/news/articleView.html?idxno=12698
농부 박재민 부부 밀가루 반죽 숙성 마을 농산물 첫발 좌절 포기,https://n.news.naver.com/mnews/article/056/0011730944?sid=101
통계 중요 귀어 도전 통계 중요 이유 정부 귀어 통계 반영 귀어 대책 실효,https://www.etoday.co.kr/news/view/2364008
김학용 사태 사업 지와 사회 분위기 이제 노후 준비 생각 이후 도시,https://n.news.naver.com/mnews/article/055/0001158879?sid=102
사진 긴급 육묘 지원 본격 모내기 육묘 교육 장기 재직 퇴직 인생 설계 실질 도움 산업 창업 사례 노후,https://www.psnews.co.kr/news/articleView.html?idxno=2056307
경험 당초 목적 청년층 지방 자리 결혼 가정 순환 가능 농산업 부흥 목표 인구 조언,http://www.1conomynews.co.kr/news/articleView.html?idxno=29253
올해 주제 이야기 영농 사례 역경 일화 즐거움 공동체 성취 공모전 일반 부문 거주,https://www.gosiweek.com/article/1065584157916768
충북 옥천 청산면 교평리 년차 강호봉 월간 충북 옥천군 청산면 교평리 줄당기기 수리,https://n.news.naver.com/mnews/article/047/0002434566?sid=103
제도 변화 지방 소멸 현실 당시 노인 복지 주택 사업 관리 문제 노인 주택 의료 주거 복지,https://www.womaneconomy.co.kr/news/articleView.html?idxno=223489
심마니 심산유곡 마가목 연구 수백 연구 완성 마가목 에디션 증류,https://n.news.naver.com/mnews/article/366/0000994228?sid=101
시작 선배 귀창 농인 준비 조언 장밋빛 미래 농림 축산 식품,http://www.aflnews.co.kr/news/articleView.html?idxno=271994
어머니 농장 운영 참여 누벨 농부 본인 남해 한국,https://n.news.naver.com/mnews/article/308/0000034891?sid=102
역경 일화 즐거움 공동체 성취 결혼 이민 여성 한국 사회 과정 수기 주제 공모 분야 일반 부문 거주,https://n.news.naver.com/mnews/article/662/0000043910?sid=103
스마트 농산 업체 참여 지원 방식 안정 수익 구조 제공 국내 활성 예정 수익 보장 스마트 고정 수익,http://www.segyebiz.com/newsView/20240517506391?OutUrl=naver
스마트 농산 업체 참여 지원 방식 안정 수익 구조 제공 국내 활성 예정 수익 보장 스마트 고정 수익,https://www.ajunews.com/view/20240517100308050
대상 멘토 역할 범주 확장 성과 직후 경험 주민 진입로 분쟁 건축,https://bravo.etoday.co.kr/view/atc_view/15359
국내 유수 스마트 농산 업체 참여 지원 방식 안정 수익 구조 제공 국내 활성 예정 수익 보장 스마트,https://n.news.naver.com/mnews/article/022/0003933453?sid=101
스마트 농산 업체 참여 지원 방식 안정 수익 구조 제공 국내 활성 예정 수익 보장 스마트 고정 수익,https://n.news.naver.com/mnews/article/366/0000992989?sid=004
일상 사표 선언 가족 강화도 과실 시작 억대 마지막 심정 시작,https://www.wikitree.co.kr/articles/951727
인구 관련 인간 심리 파악 기인 수도권 공공 주택 사업 수익 일부 단독 주택 조성 지역 활력,http://www.aflnews.co.kr/news/articleView.html?idxno=271611
마을 공모 사업 주민 갈등 야기 마을 공동체 붕괴 직전 농업기술센터 지원 센터 업무 담당자 발령,http://www.aflnews.co.kr/news/articleView.html?idxno=271608
일상 사표 선언 가족 강화도 과실 시작 억대 마지막 심정 시작,https://www.foodneconomy.com/news/articleView.html?idxno=358859
올해 농인 도시 스포츠 의류 대리점 운영 초반 척수염 친환경 유기농 누룩 변수 훈증 처리 농가,http://www.ktsketch.co.kr/news/articleView.html?idxno=8011
대파 농장 관리 저가 수입 대파 시작 가격 형성 대파,http://www.hortitimes.com/news/articleView.html?idxno=31874
작물 작물 지역 품종 선택 틸라 수지 품종 재배,http://www.hortitimes.com/news/articleView.html?idxno=31872
마을 운영 사업 산휴 가공유 주택 사업 장기 학교 능력 부족 분란,https://www.eroun.net/news/articleView.html?idxno=43128
마음 작물 재배 준비 주문 재배 작물 선정 작물 산지 직접,https://n.news.naver.com/mnews/article/022/0003932047?sid=102
연계 창업 기반 조성 사업 창업 학교 건립 창업 적극 지원 계획 지역 주민 교류 지원 유출 방지 계획 재능 활동 사회봉사,http://www.agrinet.co.kr/news/articleView.html?idxno=327380
강진군 농업기술센터 최영아 소장 창업 디자인 교육 중요 작목 선택 역할 향후 역량 강화 교육 바탕 농산물 생산 유통,https://www.pinpointnews.co.kr/news/articleView.html?idxno=264749
김주수 군수 사전 준비 선행 프로그램 확대 운영 관심 지원,https://www.idaegu.co.kr/news/articleView.html?idxno=460433
농업기술센터 최영아 소장 창업 디자인 교육 중요 작목 선택 역할 향후 역량 강화 교육 바탕 농산물 생산 유통 포함,https://www.polinews.co.kr/news/articleView.html?idxno=647345
강화 기초 교육 지원 강화군 제공 생활 지역 적응 생활 시작 생각,https://n.news.naver.com/mnews/article/382/0001125026?sid=102
오이 도전 본지 현창 준비 치열 주만 정식 작년 일조량 부족 정식 오이 재배,https://www.farmnmarket.com/news/article.html?no=21139
최영아 강진군 농업기술센터 소장 창업 디자인 교육 중요 작목 선택 역할 향후 역량 강화 교육 바탕 농산물 생산,https://www.skyedaily.com/news/news_view.html?ID=231341
강진군 농업기술센터 최영아 소장 창업 디자인 교육 중요 작목 선택 역할 향후 역량 강화 교육 바탕 농산물 생산 유통,http://www.siminsori.com/news/articleView.html?idxno=264370
최영아 강진군 농업기술센터 소장 창업 디자인 교육 중요 작목 선택 역할 향후 역량 강화 교육 바탕 농산물 생산 유통,https://www.siminilbo.co.kr/news/newsview.php?ncode=1160291262702663
가지 의사 결정 가족 상의 전문가 공무원 적극 협력,http://www.jeollailbo.com/news/articleView.html?idxno=730678
김주수 군수 사전 준비 선행 프로그램 확대 운영 관심 지원,https://www.joongdo.co.kr/web/view.php?key=20240509010002340
농업기술센터 최영아 소장 창업 디자인 교육 중요 작목 선택 역할 향후 역량 강화 교육 바탕 농산물 생산 유통 포함,https://n.news.naver.com/mnews/article/277/0005415985?sid=102
연계 창업 기반 조성 사업 창업 학교 건립 창업 적극 지원 계획 지역 주민 교류 지원 유출 방지 계획 재능 활동,http://www.amnews.co.kr/news/articleView.html?idxno=58959
김주수 군수 사전 준비 선행 프로그램 확대 운영 관심 지원,http://www.kyongbuk.co.kr/news/articleView.html?idxno=4008448
한편 김주수 군수 사전 준비 선행 프로그램 확대 운영 관심 지원,https://www.nspna.com/news/?mode=view&newsid=697496
의성군 군수 김주수 성군 기술 센터 예비 대상 진행 의성 수료식 희망 도시민,https://n.news.naver.com/mnews/article/088/0000876818?sid=102
한편 김주수 군수 사전 준비 선행 프로그램 확대 운영 관심 지원,https://www.dkilbo.com/news/articleView.html?idxno=441574
연계 창업 기반 조성 사업 창업 학교 건립 창업 적극 지원 계획 지역 주민 교류 지원 유출 방지 계획 재능 활동,https://www.ggilbo.com/news/articleView.html?idxno=1028268
지역 주민 교류 지원 적극 유출 방지 계획 충북 수요 지원 시대 정부 연계,https://n.news.naver.com/mnews/article/586/0000078183?sid=102
연계 창업 기반 조성 사업 창업 학교 건립 창업 적극 지원 계획 지역 주민 교류 지원 유출 방지 계획 재능 활동,https://www.viva100.com/main/view.php?key=20240508010002086
창업 기반 조성 사업 창업 학교 건립 창업 적극 지원 계획 지역 주민 교류 지원,http://www.breaknews.com/1031071
보금자리 주거 지원 도시 농부 연계 추진 유출 방지 재능 활동 사회봉사 연계 영농 멘토 교육 문화 프로그램 운영,http://www.cctimes.kr/news/articleView.html?idxno=796884
연계 창업 기반 조성 사업 창업 학교 건립 창업 적극 지원 계획 마지막 지역 주민 교류 지원 유출 방지 계획,https://cc.newdaily.co.kr/site/data/html/2024/05/07/2024050700423.html
충북 특화 사업 도시 농부 활용 초기 일자리 연계 창업 기반 조성 사업 창업 학교 건립 창업 적극 지원 계획 지역 주민 교류 지원,https://www.thepublic.kr/news/articleView.html?idxno=223230
충북 특화 사업 도시 농부 활용 초기 일자리 연계 창업 기반 조성 사업 창업 학교 건립 창업 적극 지원 지역 주민 교류 지원,https://www.ccreview.co.kr/news/articleView.html?idxno=317975
정보 제공 스마트 기술 소개 국내 여름 겨울철 날씨 포기 부지,http://www.yonhapmidas.com/article/240507150134_660914
은퇴자 중심 지역 보금자리 주거 지원 도시 농부 연계 추진 지역 주민 교류 지원 유출 방지 계획 재능 활동 사회봉사,https://www.inews365.com/news/article.html?no=813327
연계 창업 기반 조성 사업 창업 학교 건립 창업 적극 지원 계획 지역 주민 교류 지원 유출 방지 계획 재능,http://www.bzeronews.com/news/articleView.html?idxno=659004
도시 농부 초기 대상 이해 일정 수입 보장 지역 주민 교류 지원 유출 방지 재능 활동 사회봉사,https://n.news.naver.com/mnews/article/656/0000089342?sid=102
일자리 연계 창업 지원 강화 희망자 청장년 은퇴자 그룹 대상 수요 분야 연계 집중 지원 지역 주민 교류 지원,https://www.newspim.com/news/view/20240507000954
재능 활동 사회봉사 연계 영농 멘토 교육 문화 프로그램 운영 지역 주민 교류 지원 유출 방지 방책 김영환 지사 수요 맞춤 지원,https://n.news.naver.com/mnews/article/031/0000834472?sid=102
보금자리 주거 지원 도시 농부 연계 추진 유출 방지 재능 활동 사회봉사 연계 영농 멘토 교육 문화 프로그램 운영,https://n.news.naver.com/mnews/article/001/0014672808?sid=102
단계 유출 방지 목표 민간 거버넌스 협력체 구축 교육 문화 프로그램 지원 활성 사업 투입 예산,http://www.jbnews.com/news/articleView.html?idxno=1435406
희망자 청장년 은퇴자 그룹 대상 수요 분야 연계 계획 유출 방지 재능 교육 영농 토제 프로그램 지원 김영환 지사,https://n.news.naver.com/mnews/article/421/0007524942?sid=102
연계 창업 기반 조성 사업 창업 학교 건립 창업 적극 지원 계획 지역 주민 교류 지원 유출 방지 계획 재능 활동 사회봉사,https://www.gukjenews.com/news/articleView.html?idxno=2987494
내일 오늘 순항 스쿨링 형제 셋째 진이 아버지 경상북도,http://enter.etoday.co.kr/news/view/258644
사례 철저 준비 필요 소장 기술 경영 공부 문화 이해 자세 상당수,https://n.news.naver.com/mnews/article/011/0004336557?sid=102
며느리 조금자 씨세 농사일 며느리 시어머니 김보순 사이 우여곡절 아무것 시작 며느리,https://www.polinews.co.kr/news/articleView.html?idxno=645975
며느리 조금자 씨세 농사일 며느리 시어머니 김보순 사이 우여곡절 아무것 시작 며느리,https://www.gukjenews.com/news/articleView.html?idxno=2984854
관계자 체험 마을 선배 멘토 주변 관광지 지난해 인구 천가 가구,https://n.news.naver.com/mnews/article/001/0014665034?sid=102
며느리 조금자 씨세 농사일 며느리 시어머니 김보순 사이 우여곡절 아무것 시작 며느리,https://www.lecturernews.com/news/articleView.html?idxno=151557
완주군 완주군 지원 센터 일간 관심 도시민 대상 교육 진행 호응 완주군 완주군 지원 센터 일간,http://www.domin.co.kr/news/articleView.html?idxno=1467342
완주군 완주군 지원 센터 일간 관심 도시민 대상 교육 진행 호응 교육 관심 도시민 대상 완주 군의,http://sjbnews.com/news/news.php?number=814217
상상 편안 여유 생활 가능 아무것 실행 가능 포털 정보 검색,https://www.joongboo.com/news/articleView.html?idxno=363650028
