nouns,link
사람 인간 관계 마련 예외 실제 필자 현장 목격 민원 사항 대부분 촌인 토착민 감정 대립 도시,https://n.news.naver.com/mnews/article/654/0000078719?sid=110
사람 농인 어업 선택 어촌 마을 이주 어인 신문 마지막 칼럼 자연 인간 동물 인간 인간 인간 관계 성장,http://www.interview365.com/news/articleView.html?idxno=108039
다양 최고 령자 이웃 마을 연천 인간 관계 평화 화목 관계 얘기 국경 선평 학교 남북 평화,https://n.news.naver.com/mnews/article/079/0003896252?sid=102
마을 인간 관계 중요 천연염 전문가 옥희 성주면 천연 염색 공방 아련 나래 농업기술센터 지원 센터 업무 담당자 발령,http://www.aflnews.co.kr/news/articleView.html?idxno=271608
인간 관계 수면제 신용 시작 거창 시작 사진 방송 화면,https://m.entertain.naver.com/article/311/0001725224
청년 자영업 지역 발령 텐데 인간 관계 의미 텐데 사람 의미,https://n.news.naver.com/mnews/article/277/0005414234?sid=102
정년퇴직 남편 교직 인간 관계 스트레스 퇴직 주인공 엄마 지소 선언 김나영,https://www.cbci.co.kr/news/articleView.html?idxno=465637
정년퇴직 남편 교직 인간 관계 스트레스 퇴직 주인공 엄마 지소 선언 김나영,https://www.wikitree.co.kr/articles/945232
정년퇴직 남편 교직 인간 관계 스트레스 퇴직 주인공 엄마 지소 선언 김나영,https://www.foodneconomy.com/news/articleView.html?idxno=358208
농축 산업 종사 경험 기반 지역 문제 관심 농가 캠페인 자립 준비 청년 편견 경제 사회 자립 건강 인간 관계 형성 지원,https://www.bntnews.co.kr/article/view/bnt202404130068
공방 마을 카페 도서관 희망 청년 공용 숙소 생태 자본주의 사슬 전환 시작 자연 인간 관계 설정,https://www.eroun.net/news/articleView.html?idxno=42237
계획 젊은이 참고 도시 생활 시골 생활 넷째 주변 친구 동료 인간 관계 노년 정리 상책,http://www.joongang.tv/news/articleView.html?idxno=71443
의대 정원 문제 충북 브랜드 문제 충북 대학 위상 문제 지역 이해관계 인간 생명 보편 가치 실현 차원 충북 정리,https://www.ccdn.co.kr/news/articleView.html?idxno=968584
활동가 동네 작가 활동 부부 활동 경제 어려움 해결 시작 종잣돈 지역 인간 관계 출발점 오늘 딸기 농장 최신,http://www.domin.co.kr/news/articleView.html?idxno=1463868
농축 산업 종사 경험 기반 지역 문제 관심 농가 캠페인 자립 준비 청년 편견 경제 사회 자립 건강 인간 관계 형성 지원,https://www.bntnews.co.kr/article/view/bnt202403300042
농축 산업 종사 경험 기반 지역 문제 관심 농가 캠페인 자립 준비 청년 편견 경제 사회 자립 건강 인간 관계 형성 지원,https://www.bntnews.co.kr/article/view/bnt202403160044
가능 귀어 어선 구입 정부 정책 자금 최대 평등 인간 관계 인식 발전 분석 베트남 여성 권리 중요 실현 목표,https://n.news.naver.com/mnews/article/047/0002425909?sid=100
의성군 장애인협회 연모 성군 한국 지도자 연합 회장 태수 성군 연합 회장 박형수 후보 인간 관계 사진 촬영 김재원 예비 후보 지지 철회 박형수 예비 후보,https://n.news.naver.com/mnews/article/003/0012405874?sid=102
물류 회사 관리직 인간 관계 어려움 성대 결절 아버지 건강 악화 결심 만평 시금치,https://n.news.naver.com/mnews/article/662/0000037461?sid=103
인생 후반전 건강 인간 관계 노환 육체 쇠락 입안 전략 사회봉사 일자리 정보 체득 현금 흐름 설계 연금 보험 설계 투자,https://www.kmaeil.com/news/articleView.html?idxno=438955
농축 산업 종사 경험 기반 지역 문제 관심 농가 캠페인 자립 준비 청년 편견 경제 사회 자립 건강 인간 관계 형성 지원,https://www.bntnews.co.kr/article/view/bnt202402030046
이원진 전국 사무 국장 인간 관계 이야기 한정 대전 노인 복지 센터 생활 지원사 대연 상사 대표 주제 경험담,https://gj.newdaily.co.kr/site/data/html/2024/02/03/2024020300025.html
제주도 부부 주문 못난이 상품 생명 인간 인간 관계 세상 세상,https://n.news.naver.com/mnews/article/028/0002674714?sid=110
병원 만큼 건강 악화 안산 안산 박보 인간 관계 구성 고통 보상금 액수 사람 관계,https://n.news.naver.com/mnews/article/047/0002419194?sid=102
무한 경쟁 단절 인간 관계 고립 도시 고충 생산 농산물 가공품 판매 고장 함양,http://www.dailytw.kr/news/articleView.html?idxno=30427
도시 지역 이동 인구 가구 통계청 조사 가구 절반 가량 인간 관계 만족 집안일 부탁 사람,https://n.news.naver.com/mnews/article/243/0000054066?sid=110
필자 칼럼 강의 소득 사정 도시 마찬가지 공동체 옛말 철저 이해 작위 인간 관계,https://n.news.naver.com/mnews/article/016/0002239418?sid=110
필자 칼럼 강의 소득 사정 도시 마찬가지 공동체 옛말 철저 이해 작위 인간 관계,https://n.news.naver.com/mnews/article/016/0002239300?sid=110
가구 가구 서울 경기도 거주 자연인 귀어 가구 가구 인간 관계 만족 응답 차이 집안일 부탁 도움 사람,https://n.news.naver.com/mnews/article/057/0001786619?sid=102
가구 가구 서울 경기도 거주 자연인 귀어 가구 가구 인간 관계 만족 응답 차이 집안일 부탁 도움 사람,https://n.news.naver.com/mnews/article/057/0001786544?sid=102
전체 가구 증가 이하 가구 가구 전반 인간 관계 만족 가구 전체 가구 포인트,https://n.news.naver.com/mnews/article/029/0002842788?sid=101
귀어 가구 가구 가구 가구 비중 귀어 가구 가구 가구 전반 인간 관계 만족 전체 인구 만족 비중,https://www.asiatime.co.kr/article/20231212500249
귀어 가구 가구 가구 가구 비중 귀어 가구 전반 인간 관계 만족 응답 비중 전체 인구 만족 비중,http://www.newspim.com/news/view/20231212000223
건강 일상 루틴 중요 변화 인간 관계 태도 인간 관계 심신 도시인 특효약 대부분 시골 하루 대화,http://www.popcornnews.net/news/articleView.html?idxno=48582
본지 제주 농협 청년 아카데미 두각 청년 교육 내용 교육 교류 인간 관계,http://www.jejuilbo.net/news/articleView.html?idxno=217846
제주 시작 서울 도시 생활 선택 대표 인간 관계 스트레스 일한 정직 직업 체질,http://www.jejuilbo.net/news/articleView.html?idxno=217686
가부장 지배 질서 자연 인간 관계 인간 우위 설정 생태 순환 공포감 생애 처음 기후 피해 사례 발표 유화영 충남 논산 채소 농가 호우 피해,http://www.ikpnews.net/news/articleView.html?idxno=62114
인간 관계 배려 이지영 신념 반영 이지영 낭만 전원생활 동경 시골 냉정 현장,https://bravo.etoday.co.kr/view/atc_view/14917
경기 양평 이듬해 우프 코리아 활동 늦가을 선의 연결 관계 인간 관계 놀라움 나라,https://n.news.naver.com/mnews/article/662/0000031394?sid=110
도시 은퇴 전원생활 생각 자녀 커뮤니티 인간 관계 지속 유리 계속,http://www.esgeconomy.com/news/articleView.html?idxno=4973
직장 업무 인간 관계 스트레스 과음 과로 절제 생활 건강 위기 병원 아내 골살 제안 준비 대반 극복,https://n.news.naver.com/mnews/article/016/0002215024?sid=110
마을 약속 도시 지역 마을 자발 하방 선택 도시민 마을 자치 규약 지향 대로 마을 공동체 구성 운영 인간 관계 집단 안정 지속,https://n.news.naver.com/mnews/article/047/0002408989?sid=102
새벽녘 도착 친절 청년 시오 마중 생활 즐거움 공감대 주제 하야오 감독 탐구 자연 인간 관계 이전 작품 잔혹,http://www.ggilbo.com/news/articleView.html?idxno=995017
시골 인간 관계 고민 도시 도시 정서 표현 방식 갈등 해소 여정 인내 필요 양수정 과도 관심 처음,https://n.news.naver.com/mnews/article/001/0014229536?sid=102
청년 창업 지역 대표 조직체 손영철 대표 창녕 생태 학교 수료생 시대 청년 인간 관계 경험 공유 농장 미래 청년 모임,http://www.aflnews.co.kr/news/articleView.html?idxno=255927
그동안 인구 통계 공백 문제 마스터 도제 인간 관계 독립 필요 상담 협력,https://n.news.naver.com/mnews/article/002/0002299182?sid=101
지역 사람 인간 관계 중요 동네 사람 큰일 큰일 주변 사람 눈치 중요,http://www.sisaweek.com/news/articleView.html?idxno=207621
디지털 독소 인간 관계 필요 소통 파민 시작 자동 라이트 차단 기능 진화 루틴 목표 중학생,https://magazine.hankyung.com/job-joy/article/202308228712d
에버 스튜디오 환상 도시 생활 사람 일종 안락 인간 관계 굴레 사람 시작 그곳,https://m.entertain.naver.com/article/047/0002402926
그건 요양 낙향 출발점 인생 시골 이건 인간 관계 선물 사람 토대,https://bravo.etoday.co.kr/view/atc_view/14707
기사 농산물 생활 스마트폰 인간 관계 사회 영향 시절 회귀,https://www.allurekorea.com/2023/08/01/%ec%9b%b0%eb%8b%88%ec%8a%a4-%ec%97%b0%eb%8c%80%ea%b8%b0/?utm_source=naver&utm_medium=partnership
연애결혼 출산 마련 인간 관계 희망 포기 세대 임수민 소장 돌이 전략 탈바꿈 도약 전환 마을 전략 전략,https://n.news.naver.com/mnews/article/002/0002294088?sid=102
홈스테이 과정 터득 지식 자연 형성 사회 인간 관계 리스크 지난해 인구 감소 코로나 이후 증가 기저 효과,https://www.inews365.com/news/article.html?no=773051
이전 인간 관계 이게 판매 루트 역할 소극 방식 한계 마케팅 강화 부분 아내 전담 생산량 절반 온라인,https://bravo.etoday.co.kr/view/atc_view/14628
한자 라면 예전 공기 소음 인간 관계 가지 가지 산업 자연환경 훼손,http://www.kukinews.com/newsView/kuk202307100038
인간 관계 세상사 즐거움 표현 생각 교실 교직 학생 즐거움,https://n.news.naver.com/mnews/article/021/0002580871?sid=102
회사 생활 인간 관계 도시 마음가짐 카페 펜션 운영 낭패 십상 옛날 부모 세대 학업 이농,http://www.esquirekorea.co.kr/article/78502
실제 정확 이해 배나무 모차르트 음악 철영 인간 관계 형성 정성 그걸 리스크 사전 방비,https://bravo.etoday.co.kr/view/atc_view/14581
홈스테이 지식 인간 관계 리스크 생각 김민기 하날 농장 대표 김민기 하날 농장 대표 주간 함양 지원 정책,https://n.news.naver.com/mnews/article/047/0002396125?sid=102
젊은이 참고 마음 전원 주변 친구 동료 인간 관계 느낌 자동차,http://www.joongang.tv/news/articleView.html?idxno=64139
여건 생각 응답 인간 관계 스트레스 마음 자연,http://www.ggilbo.com/news/articleView.html?idxno=977332
도시 양봉 매력 꿀벌 인간 독특 관계 가축 울타리 벌통 초보 적합 기후 위기 어려움 가중 지난해,https://n.news.naver.com/mnews/article/028/0002640570?sid=103
생활 성실 영문 혼선 무주군 설천면 산기슭 인간 관계 생각 시골 풍속 기본,https://bravo.etoday.co.kr/view/atc_view/14514
포스코 입사 현장 근무 퇴직 향후 진로 고민 체험 농장 밀접 인간 관계 계속 분야 공부,https://n.news.naver.com/mnews/article/658/0000039267?sid=102
서윤 언니 정정 혜인 회복 당시 서윤 친언니 지윤 커리어 결혼 임신 인간 관계 보편 고민 인물 주인공 공감,https://m.entertain.naver.com/article/140/0000050068
편집자 서울 생활 방식 수익 분배 이외 인간 관계 공동체 얘기 감자 개인,https://n.news.naver.com/mnews/article/007/0000007345?sid=102
도시 시골 도시 복귀 정원 인간 관계 사람 생각 성향 사람,http://www.gndomin.com/news/articleView.html?idxno=348177
목가 수입 창출 인간 관계 형성 바탕 생활 마음가짐 필요 전국,https://n.news.naver.com/mnews/article/662/0000017011?sid=103
지역 활력 타운 사업 문화 복지 기능 도시 경쟁 인간 관계 마음 부대,https://n.news.naver.com/mnews/article/081/0003348469?sid=102
사연 이장은 인심 풍경 이장은 마을 주민 인간 관계 외지인 마을 영농 자재 신청 대신,https://n.news.naver.com/mnews/article/421/0006691456?sid=102
리스크 대응 전략 건강 경력 재무 관리 인간 관계 창업 봉사 여가 생활 다양 분야 생애 설계 노하우 저자 산업 사회 교육 전문가 활동,https://n.news.naver.com/mnews/article/654/0000035022?sid=100
원주민 갈등 문제 사람 사이 갈등 마련 지연 학연 이사 연도 인간 관계 상대 방과,http://www.lcnews.co.kr/news/articleView.html?idxno=46714
유기농 농산물 꾸러미 년차 농부 마음 인간 관계 건강,https://n.news.naver.com/mnews/article/047/0002384299?sid=103
경험 육지 김양식 최소 평이 재배 수지 분석 인간 관계 불화 갈등 호소 마음,https://www.gukjenews.com/news/articleView.html?idxno=2668028
베이비 부머 세대 은퇴 관심 상황 상황 케어 파밍 농장 성취감 그곳 평등 인간 관계 경험 사회 대부분 실내,http://www.lifein.news/news/articleView.html?idxno=15282
도시 사업 남편 승기 인간 관계 아내 제안 아내 보라 남편 모습 찰나 만큼 여생,https://www.foodneconomy.com/news/articleView.html?idxno=344295
도시 사업 남편 승기 인간 관계 아내 제안 아내 보라 남편 모습 찰나 만큼 여생,http://www.queen.co.kr/news/articleView.html?idxno=385297
무료 터전 인문 학당 자영업 농민 퇴직 공무원 현직 인간 서로 관계 인간 본질 관계 인생,https://n.news.naver.com/mnews/article/003/0011699697?sid=102
인생 시작 변화 표현 복지 인간 관계 생활 만족도 관련 부분 이야기,https://www.womaneconomy.co.kr/news/articleView.html?idxno=215569
의령군 설계 서류 작성 지원 의령군 군수 오태완 맞춤 인간 관계 회복 우울증 스트레스 척도 정신 건강 선별 검사 자살 예방 정신 건강 관련 홍보,http://www.kukinews.com/newsView/kuk202302170005
윤재호 평창군 봉평면 주민 풍력 발전 이슈 인간 관계 동네 전체 김병건 평창군 봉평면 주민 풍력 발전 사회 문제,https://science.ytn.co.kr/program/view.php?mcd=0082&hcd=&key=202302141640436426
윤재호 평창군 봉평면 주민 풍력 발전 이슈 인간 관계 동네 전체 김병건 평창군 봉평면 주민 풍력 발전 사회 문제,https://n.news.naver.com/mnews/article/052/0001849333?sid=102
유형 인간 관계 억압 이야기 화두 라포 형성 상담 진행 부모 세대 인생 재취업 창업 가맹 창업 퍼스널 랜딩 관련 상담 교육,https://www.kmaeil.com/news/articleView.html?idxno=385991
담양 과일 재배 고재규 영호남 갈등 정치 유산 성토 인간 자연 탐험 담양 풍류 기행 인간 관계 이해 역사 여행 담양 자연,http://www.mdilbo.com/detail/1XC3Ew/688391
외지인 현지 갈등 마음 친구 자연 인간 관계 도시 관계 사람 사이 관계 생태 전환 교육 핵심,https://n.news.naver.com/mnews/article/032/0003202915?sid=110
전국 최초 도시 박람회 주도 부산시 농업기술센터 정년 퇴임 컨설팅 재능 봉사 전문 열정 재력 인간 관계 요인 시대 트렌드,https://n.news.naver.com/mnews/article/658/0000031171?sid=102
행로 이유 도시 사람 결심 이유 우리나라 또래 인간 관계 뿌리 통째 대격 변이,https://n.news.naver.com/mnews/article/047/0002377907?sid=102
외부 인간 관계 신경 다짐 군민 기대 부응 단계 맞춤 지원 전입자 임대 아파트 조성 기업 유치,https://n.news.naver.com/mnews/article/001/0013671820?sid=102
미혼 대부분 수십 농가 주택 잠금장치 여성 농민 농사일 주거 환경 인간 관계 적극 정책 소통 해결,https://n.news.naver.com/mnews/article/662/0000011206?sid=110
세컨드 라이프 생각 구체 준비 필요 가정 인간 관계 인생 정년퇴직 창업 생활 가지 생각 가족 협조 실현,https://www.ccdailynews.com/news/articleView.html?idxno=2168667
청년 인간 관계 바탕 토박이 친구 가족 함양 신경 외지 사람 청년 청년,https://n.news.naver.com/mnews/article/047/0002373365?sid=102
촌인 농사일 소득 창업 운영난 인간 관계 갈등 스트레스 주변 골든 타임,https://n.news.naver.com/mnews/article/016/0002065771?sid=110
인구 적응 역귀 비율 홍성 주한 인간 관계 축소 주변 또래 도시 친구 교류 기회,https://n.news.naver.com/mnews/article/662/0000009680?sid=102
본인 적성 재취업 창업 사전 정보 습득 준비 위험관리 풍요 인간 관계 문제 식습관 개선,http://www.insnews.co.kr/design_php/news_view.php?num=71922&firstsec=5&secondsec=53
김정화 경북 기술원 지원 국장 코로나 이후 모임 주요 대화 화제 멘토 인간 관계 유지 사업 풍요 셋째 정부,http://www.kyongbuk.co.kr/news/articleView.html?idxno=2116545
인간 관계 생각 고민 필요 영화 낭만 치유 공간 전업 농부 일터 만큼 순간 낭만,http://www.readersnews.com/news/articleView.html?idxno=107315
작가 사례 가운데 경제 문제 인간 관계 도시 설명 주민 인사 군청 체육 대회 행사 활용 인맥,https://n.news.naver.com/mnews/article/662/0000009412?sid=103
지자체 사람 운영 지역 정서 인간 관계 요인 환경 사람,http://www.breaknews.com/930911
고참 경험 견해 견해 요점 단언 인간 관계 도시 생활 유일 탈출구 시골 정신,https://bravo.etoday.co.kr/view/atc_view.php?varAtcId=14003
인간 관계 모욕 인내 희생 상대 배려 성정 이듬해 사례 평생 요구 검사 사람,http://www.gnnews.co.kr/news/articleView.html?idxno=512413
소셜 네트워크 다양 인간 관계 노력 마음 후반 여성 전화 결혼 생활 사연 딸아이 이혼 할머니,https://www.idaegu.co.kr/news/articleView.html?idxno=396199
먹거리 의식 실천 아버지 종수 동물 인간 관계 기후 정의 실현 생각 거리 행동,https://n.news.naver.com/mnews/article/659/0000005917?sid=102
인간 관계 직장 생활 생각 아내 질색 낚시,https://n.news.naver.com/mnews/article/009/0005018347?sid=101
장수 사과 여명 정도 추산 재배 중요 주민 인간 관계 요인 배전 이웃 교류 귀띔 대표 사과,http://www.mdilbo.com/detail/cYhjdj/678215
브라보 마이라 이프 박원식 객원 기자 박원식 사람 충북 영동군 산골 김명옥 외지인 시선 시골 시골 인간 관계 충돌,https://bravo.etoday.co.kr/view/atc_view.php?varAtcId=13906
개인 기후 위기 극복 만큼 인간 관계 인터뷰 말씀,https://news.bbsi.co.kr/news/articleView.html?idxno=3079029
주민 인간 관계 소개 주민 열정 삼베 작업장 수의 서울 부산 치목 마을 마을 삼베 관심,http://www.jeollailbo.com/news/articleView.html?idxno=664569
생각 영상 편지 친구 텃밭 텃밭 성장 잡초 잡초 멀칭 기법 고양이 자연 인간 관계 그것 전윤 환의,https://vop.co.kr/A00001617502.html
문제 어려움 인간 관계 발생 갈등 원시인 외계인 만남 주민 촌인 만남 방식 주민 소통 고민,https://www.womaneconomy.co.kr/news/articleView.html?idxno=212451
무의식중 자리 생각 인간 관계 사회생활 영향 요즘 시대 지수 세계 최고,http://www.newsprime.co.kr/news/article.html?no=573068
조지환 지인 천안 제안 이야기 고백 박혜민 박혜민 공감 남편 인간 관계 상처 관련 부분 포기,https://m.entertain.naver.com/article/047/0002356594
조지환 직업 생각 모습 박혜민 남편 배우 자리 상황 파악 오은영 박사 조지환 노력 대신 인간 관계 마음가짐,https://m.entertain.naver.com/article/415/0000011100
박혜민 방향 인간 관계 갈등 아픔 그걸 분노,https://m.entertain.naver.com/article/109/0004636573
안정 수입 조지환 천안 생각 박혜민 농사일 배우 노력 인간 관계 지적 조지환 정확,https://m.entertain.naver.com/article/076/0003880396
학과 개인 인상 관리 이미지 트레이닝 방법 조직 행동 인간 관계 개인 이미지 컨설팅 기업 조직 관리 분야 전공 마지막 웰빙 조경학,https://n.news.naver.com/mnews/article/028/0002594541?sid=102
박혜민 최근 관심 직업 조지환 실망 박혜민 인간 관계 갈등 아픔 분노 사람 배신 뒤통수,https://m.entertain.naver.com/article/408/0000158303
안정 수입 조지환 천안 생각 박혜민 농사일 배우 노력 인간 관계 지적 박혜민 호스트,https://m.entertain.naver.com/article/076/0003880366
공동체 사람 생활 필수 요소 인간 관계 사람 집단 정주 확률 여명 예술인 충남 모처 집단 추진,http://www.naeil.com/news_view/?id_art=426013
대부분 도시 생활 회의 선택 사람 작가 인간 관계 일상 생활,https://www.artinsight.co.kr/news/view.php?no=60040
군수 유치 의지 인간 관계 후보 보육 정책 일반 이용우 군수 축소 지적 정주 인구 인구 반박 후보,http://www.dtnews24.com/news/articleView.html?idxno=725635
종합 병원 지적 서울대 연계 교육 프로그램 대화 초중 후보 추진력 인간 관계 강조 김진표 의원,http://www.enewstoday.co.kr/news/articleView.html?idxno=1572404
성북구 센터 협업 체험 활동 실시 중구 음식 지역 개인 자율 인간 관계 정서 안정 보완 주거 환경 마련 스톡홀름 시가,https://n.news.naver.com/mnews/article/008/0004749046?sid=101
방황 공군 복무 시절 부대 개설 야학 신우 학교 생각 사업 키포인트 인간 관계 엔지니어링 회사 기술 전문 회사,https://n.news.naver.com/mnews/article/020/0003429769?sid=103
대학 시절 방황 공부 포기 고민 백령도 공군 복무 부대 생각 사업 키포인트 인간 관계 엔지니어링 회사 기술 전문 회사,https://n.news.naver.com/mnews/article/020/0003429519?sid=110
할머니 인간 관계 경험 인생 김미자 시골 서점 사람,https://bravo.etoday.co.kr/view/atc_view.php?varAtcId=13298
금창 전국귀농운동본부 상임 대표 그동안 농정 당국 기후 위기 응방 근본 자연 인간 조화 관계 인식 추구 운동 여성 농민 수천 먹거리,http://www.ikpnews.net/news/articleView.html?idxno=47061
기계 안전 사용 교육 기계 보급 확산 기계 사용 고령 아카데미 지역 여성 사회 참여 확대 능력 개발 리더십 인간 관계 커뮤니케이션 강좌,http://www.queen.co.kr/news/articleView.html?idxno=373837
신규 기초 영농 교육 개강 평창군 신규 인과 대상 신규 아카데미 지역 여성 사회 참여 확대 능력 개발 리더십 인간 관계 커뮤니케이션,http://www.weeklytoday.com/news/articleView.html?idxno=468276
직업 처음 이해 자재 절차 도시 인간 관계 중요 사회,http://www.thekpm.com/news/articleView.html?idxno=112477
교량 사회 자본 상대 친밀감 인간 관계 형성 폐쇄성 외부 폐쇄성 인간,http://www.namdonews.com/news/articleView.html?idxno=675245
교통수단 군사 농경 생산 수단 이용 인간 유대 관계 준비 창업 계획 청년 지원 제도 활용 방법,http://www.mdilbo.com/detail/tk5nTi/663500
참가 자의 마을 사업 유익 평가 참가자 지역 정보 습득 지역 이해 인간 관계 형성 도움 응답 마을 지역 활력 회복 인구 유입,https://n.news.naver.com/mnews/article/658/0000002751?sid=101
배수 물꼬 설치 빈집 경관 정비 농경 례문 전승 공동 활동 참여 김문한 이장은 주민 인간 유대 관계 형성 청개구리 제비 생물 다양 회복 성과,http://www.nongmin.com/article/ar_detail.htm?ar_id=612994
증가 교육 열정 수요 현실 공부 교육 교류 자연 도움 인간 관계,http://www.thekpm.com/view.php?ud=2022020310534932919de8cebab_17
인간 관계 시작 순간 의인 동양 풍수 서구인 순창 군청 농민 순창군 슬로건 유혹 군수 공무원 그것,http://www.domin.co.kr/news/articleView.html?idxno=1370426
적응 작물 지역민 인간 관계 형성 대표 특유 친화력 지역 주민 멘토 지역,http://www.thekpm.com/view.php?ud=202201131756283723124506bdf1_17
편집자 기업 환경 안전 분야 근무 장택순 대표 직장 인간 관계 진급 문제 가지 문제 발생 방향,http://www.thekpm.com/view.php?ud=202201111046438837124506bdf1_17
직장 인간 관계 스트레스 상당 농사일 노동 강도 판로 생각 노력 만큼 수익 정성,http://www.thekpm.com/view.php?ud=202201100906233657124506bdf1_17
이유 물질 준비 정신 준비 도시 농어촌 특유 인간 관계 자연 순리 겸허 농어촌 특유 사회 구조,http://www.bzeronews.com/news/articleView.html?idxno=499130
능력 나이 인간 관계 사람 인연 내년 얼굴 부모 직업 한숨,https://www.insight.co.kr/news/374290
가치 사전 풀이 사물 쓸모 대상 인간 관계 관계 인구 적극 소통 주기 거주 인구 귀향 낙향 등의,https://www.jnilbo.com/view/media/view?code=2021120910301742676
부부 목가 불편 직면 도시 생각 대부분 영광 생활 만족도 물건 온라인 주문 인간 관계,http://www.mdilbo.com/detail/ijwuyD/658501
연애 결혼 출산 포기 인간 관계 마련 포기 거기 희망 청년 홍성 청년 공동체 고민 청년 지역,http://news.lghellovision.net/news/newsView.do?soCode=SC91000000&idx=324496
실제 인간 관계 사람 공통점 공감 능력 수년 다양 분야 우수 마을 공동체 선정 쾌거 마을,http://www.jbnews.com/news/articleView.html?idxno=1350148
