nouns,link
교육 농경지 선택 막내 전학 초등 학교 적응 시작 대학 입학 전학 창녕,http://www.agrinet.co.kr/news/articleView.html?idxno=321808
보성군 투어 농인 체험 선배 농인 경험 토대 시민 보성군 적극 홍보 기대 참가자 득량면 다래 농장,http://www.weeklytoday.com/news/articleView.html?idxno=593385
보성군 투어 농인 체험 선배 농인 경험 토대 시민 보성군 적극 홍보 기대 참가자 득량면 다래 농장,http://www.jnilbo.com/71725542142
보성군 투어 농인 체험 선배 농인 경험 토대 시민 보성군 적극 홍보 기대 참가자 득량면 다래 농장,http://www.metroseoul.co.kr/article/20231017500503
보성군 투어 농인 체험 선배 농인 경험 토대 시민 보성군 적극 홍보 기대 참가자 득량면 다래 농장,http://www.m-i.kr/news/articleView.html?idxno=1057486
그건 생각 세금 부담 도피 농진청 창업 프로그램 시작 처음 고구마,https://n.news.naver.com/mnews/article/056/0011582924?sid=101
필요 노하우 전수 로망 낭패 일쑤 일정 기간 지역 공부 결정 준비 조언 핵심 엄씨 실패담,https://n.news.naver.com/mnews/article/001/0014263843?sid=102
친환경 알프 스오토메 시작 경험 실력 부족 시나노 골드 후지 식재 올해 처음 유기농 시나노 골드 소량 수확,http://www.ikpnews.net/news/articleView.html?idxno=61732
이후 물음 한미 협상 타결 시기 나라 미래 마음 정병 스마트 온실,http://www.agrinet.co.kr/news/articleView.html?idxno=321701
은퇴 희망 나이 대인 인구 지난해 올해 지역 유입 지역 유출,https://n.news.naver.com/mnews/article/047/0002409239?sid=102
규정 윗돌 아랫돌 형식 탈피 목소리 예비 창업 연계 복안 청양군 최대,http://www.dtnews24.com/news/articleView.html?idxno=755976
고창 벤처 발행 촌기 역병 새우 양식 새내기,https://n.news.naver.com/mnews/article/001/0014256599?sid=102
직장 사회생활 현실 무리 휴일 도시 탈출 오도 이촌 오도이 제작 가이드북 무료 공개 상태 결심,https://ilyo.co.kr/?ac=article_view&entry_id=460440
하우스 자연 농사일 성장 어려움 이호명 현장 경험,http://www.agrinet.co.kr/news/articleView.html?idxno=321537
노하우 정보 제주 농부 박람회 제주도 주최 제주도 연합회 회장 고희 주관 제주,http://www.jejumaeil.net/news/articleView.html?idxno=330381
보리 이용 동충하초 재배 이사 흥청 식량 학원 농과 동충하초 재배 기술 전수 목표 제시 이사,http://www.naeil.com/news_view/?id_art=475510
최소화 유도 전남 지난해 시민 참가 전남 전입 전남 어촌 체류 지원 센터 조성 농지 주택 정보 종합 정보,http://www.ilyoseoul.co.kr/news/articleView.html?idxno=479201
최소화 유도 전남 지난해 시민 참가 전남 전입 전남 어인 농산어촌 체류 지원 센터 조성 농지 주택 정보 종합 정보,https://n.news.naver.com/mnews/article/382/0001078675?sid=102
최소화 유도 전남 지난해 시민 참가 전남 전입 전남 어인 농산어촌 체류 지원 센터 조성 농지 주택 정보 종합 정보,http://www.aflnews.co.kr/news/articleView.html?idxno=256306
비참 인정 아버지 의논 아버진 최고 후원자 멘토 초심 결심 첨단 기술자,https://n.news.naver.com/mnews/article/658/0000054167?sid=102
최소화 유도 전남 지난해 시민 참가 전남 전입 전남 어인 농산어촌 체류 지원 센터 조성 농지 주택 정보 종합 정보,http://www.newsworker.co.kr/news/articleView.html?idxno=222999
최소화 유도 전남 지난해 시민 참가 전남 전입 전남 어인 농산어촌 체류 지원 센터 조성 농지 주택 정보 종합 정보,http://www.sentv.co.kr/news/view/669705
최소화 유도 전남 지난해 시민 참가 전남 전입 전남 어인 농산어촌,http://www.breaknews.com/990378
최소화 유도 전남 지난해 시민 참가 전남 전입 전남 어인 농산어촌 체류 지원 센터 조성 농지 주택 정보 종합 정보,http://www.siminsori.com/news/articleView.html?idxno=247918
최소화 유도 전남 지난해 시민 참가 전남 전입 전남 어인 농산어촌 체류 지원 센터 조성 농지 주택 정보 종합 정보,https://n.news.naver.com/mnews/article/468/0000985559?sid=102
최소화 유도 결과 지난해 전남 시민 참가 전남 전입 전남 어인 농산어촌 체류 지원 센터 조성 장기간 체류 임시,https://n.news.naver.com/mnews/article/031/0000776509?sid=102
최소화 유도 전남 지난해 시민 참가 전남 전입 전남 어인 농산어촌 체류 지원 센터 조성 농지 주택 정보 종합 정보,http://www.newspim.com/news/view/20231002000037
최소화 유도 전남 지난해 시민 참가 전남 전입 지난해 인구 소멸 기금 활용 전남 우수 창업 활성 창업 자금 천만,http://www.betanews.net:8080/article/1443450.html
최소화 유도 전남 지난해 시민 참가 전남 전입 전남 어인 농산어촌 체류 지원 센터 조성 농지 주택 정보 종합 정보,http://www.jnilbo.com/71606911152
최소화 유도 전남 지난해 시민 참가 전남 전입 전남 어인 농산어촌 체류 지원 센터 조성 농지 주택 정보 종합 정보,http://www.gjdream.com/news/articleView.html?idxno=634069
최소화 유도 전남 지난해 시민 참가 전남 전입 전남 어인 농산어촌 체류 지원 센터 조성 농지 주택 정보 종합 정보,http://www.getnews.co.kr/news/articleView.html?idxno=643341
최소화 유도 전남 지난해 시민 참가 전남 전입 전남 어인 농산어촌 체류 지원 센터 조성 농지 주택 정보 종합 정보,https://n.news.naver.com/mnews/article/002/0002302500?sid=102
최소화 유도 전남 지난해 시민 참가 전남 전입 전남 어인 농산어촌 체류 지원 센터 조성 농지 주택 정보 종합,https://n.news.naver.com/mnews/article/660/0000045999?sid=102
최소화 유도 전남 지난해 시민 참가 전남 전입 전남 어인 농산어촌 체류 지원 센터 조성 농지 주택 정보 종합 정보,https://www.ekn.kr/web/view.php?key=20231002010000047
새벽녘 도착 친절 시오 마중 생활 즐거움 공감대 묘사 너구리 계획 자연 인간 개발 너구리,http://www.ggilbo.com/news/articleView.html?idxno=995017
최소화 유도 전남 지난해 시민 참가 전남 전입 전남 어인 농산어촌 체류 지원 센터 조성 농지 주택 정보 종합 정보,https://n.news.naver.com/mnews/article/014/0005080138?sid=102
최소화 유도 전남 지난해 시민 참가 전남 전입 전남 어인 농산어촌 체류 지원 센터 조성 농지 주택 정보 종합 정보 습득,https://n.news.naver.com/mnews/article/421/0007083653?sid=102
최소화 유도 전남 지난해 시민 참가 전남 전입 전남 어인 농산어촌 체류 지원 센터 조성 농지 주택 정보 종합 정보,http://www.namdonews.com/news/articleView.html?idxno=742102
최소화 유도 전남 지난해 시민 참가 전남 전입 전남 어인 농산어촌 체류 지원 센터 조성 농지 주택 정보 종합 정보,https://n.news.naver.com/mnews/article/079/0003818522?sid=102
기존 공담 구별 연재 등장 서울 수도 지방 일본 기술 고흥 박준호 서울 지방,https://n.news.naver.com/mnews/article/001/0014229536?sid=102
현재 입장 도시 순수 지역 연고 순수 귀어 교육 상담 권리 제공 결단,http://ch1.skbroadband.com/content/view?parent_no=24&content_no=58&p_no=162121
거리 통학 사항 농약 못난이 단감 고객 포기 교육 농경지 선택 술회 여성,http://www.agrinet.co.kr/news/articleView.html?idxno=321440
배미 운영 학원 자신감 상실 남편 버킷 리스트 호로 준비 극복 과정 진솔 평가 심사 위원 참여 오승희,http://www.agrinet.co.kr/news/articleView.html?idxno=321439
지피 이용 경남 밀양 병아리 마리 병아리 고생,https://n.news.naver.com/mnews/article/036/0000048784?sid=102
발달 장애 가족 가구 시설 장애 사회 복지 공장 작업 공정 제품 불량 손해 장애 당사자 패배감,http://www.ikpnews.net/news/articleView.html?idxno=61618
도입 초기 전문가 도움 현지 물고기 가재 시기 과거 생산량 증가 소득 증대 현실 외지 젊은이 현재,https://n.news.naver.com/mnews/article/056/0011571666?sid=104
도입 초기 전문가 도움 현지 물고기 가재 시기 과거 생산량 증가 소득 증대 현실 외지 젊은이 현재,https://n.news.naver.com/mnews/article/056/0011571521?sid=104
도입 초기 전문가 도움 현지 물고기 가재 시기 과거 생산량 증가 소득 증대 현실 외지 젊은이 현재,https://n.news.naver.com/mnews/article/056/0011571289?sid=104
농기계 임대 사업소 서부 분소 설치 주요 군정 주요 문화축제 일정 안내 김영이 회장 지속 참석자 실패담 공유,http://www.chungnamilbo.co.kr/news/articleView.html?idxno=735007
문재인 정부 기후 평등 정치 운동 출발점 제공 세계 노동 운동 패러다임 전환 세계관 가능 쟁의,https://n.news.naver.com/mnews/article/002/0002300882?sid=102
관련 지원 수익 활동 개선 부정 지방 유입 확대 지역 발전 효과,http://www.sisaweek.com/news/articleView.html?idxno=208075
상대 서울 지방 패배 세상 편견 임업 단체 센터 중앙 부처 공무원 다양 내친김 임업 관련 교육 서비스 제공,https://n.news.naver.com/mnews/article/469/0000760468?sid=102
상추 선물 관리 최우선 순모 인근 초보 이유 관리 지적 처음 거름,http://www.hortitimes.com/news/articleView.html?idxno=21707
황정 흙장난 시작 처음 고생 마을 어르신 공부 고추 농법 터득,https://n.news.naver.com/mnews/article/023/0003787285?sid=004
이주민 원주민 배려 존중 대화 타협 정신 필요 결심 도시민 생활 도시 지역 국가 손실,http://www.jnilbo.com/71461058033
이외 안정 경제 활동 확률 소득 안정 집중 제어 컨트롤 타워 구축 강조 정연태,https://n.news.naver.com/mnews/article/087/0000994427?sid=102
시작 결과 시도 정부 귀산 귀어 관련 교육 신청 참여 일반 전문,https://www.lcnews.co.kr/news/articleView.html?idxno=59743
