nouns,link
도시민 대상 일간 투어 진행 호응 완주군 사전 체험 전북 특별 자치 완주군 완주군 지원 센터,https://n.news.naver.com/mnews/article/002/0002329682?sid=102
완주군 완주군 지원 센터 일간 관심 도시민 대상 교육 진행 호응 교육 관심 도시민 대상 완주 군의,http://www.jeollailbo.com/news/articleView.html?idxno=729463
주택 과잉 공급 복합 작용 주장 아베 총리 서울 수도 보유 주택 보유 지방,https://realty.chosun.com/site/data/html_dir/2024/04/27/2024042700397.html
하동군 관내 향인 대상 경험 성장 업적 이야기 주제 자서전 공모전 개최 공모 귀향 도시민 이해,https://www.newsgn.com/news/articleView.html?idxno=414519
향인 창작 자서전 접수 하동군 관내 향인 대상 경험 성장 업적 이야기 주제 자서전 공모전 개최,http://www.bzeronews.com/news/articleView.html?idxno=657147
하동군 귀향 자서전 공모전 개최 향인 창작 자서전 접수 경남 하동군 관내 향인 대상 경험 성장 업적 이야기 주제,http://www.kukinews.com/newsView/kuk202404250160
하동군 관내 향인 대상 경험 성장 업적 이야기 주제 자서전 공모전 개최 공모 귀향 도시민 이해 안정,http://www.newsprime.co.kr/news/article.html?no=637388
하동군 지역 향인 대상 경험 성장 업적 이야기 주제 자서전 공모전 개최 공모 귀향 도시민 이해,https://www.newsfreezone.co.kr/news/articleView.html?idxno=564403
하동군 관내 향인 대상 경험 성장 업적 이야기 주제 자서전 공모전 개최 공모 귀향 도시민 이해 안정,http://www.enewstoday.co.kr/news/articleView.html?idxno=2119555
하동군 귀향 자서전 공모전 개최 하동군 지역 향인 대상 경험 성장 업적 이야기 주제 자서전 공모전 개최 공모,https://www.viva100.com/main/view.php?key=20240425010008259
베이비 부머 세대 은퇴 본격 한때 유행 도시 생활 편리 트렌드 촌의 장점,http://www.kyeongin.com/main/view.php?key=20240425010002883
곡성군 관계자 지역 곡성군 사전 정보 체계 교육 제공 곡성군 지원 센터 운영 활동 지원 시민,http://www.namdonews.com/news/articleView.html?idxno=768185
곡성군 관계자 지역 곡성군 사전 정보 체계 교육 제공 지원 센터 운영 활동 지원 시민 안정,https://www.newscj.com/news/articleView.html?idxno=3132720
관계자 지역 곡성군 사전 정보 체계 교육 제공 곡성군 지원 센터 운영 활동 지원 시민,https://n.news.naver.com/mnews/article/277/0005409535?sid=165
관계자 지역 사전 정보 체계 교육 제공 곡성군 지원 센터 운영 활동 지원 시민 안정,https://www.nspna.com/news/?mode=view&newsid=694829
관계자 지역 곡성군 사전 정보 체계 교육 제공 곡성군 지원 센터 운영 활동 지원 시민,https://n.news.naver.com/mnews/article/031/0000830961?sid=102
관계자 지역 곡성군 사전 정보 체계 교육 제공 곡성군 지원 센터 운영 활동 지원 시민,http://www.newsworker.co.kr/news/articleView.html?idxno=328726
곡성군 관계자 지역 곡성군 사전 정보 체계 교육 제공 곡성군 지원 센터 운영 활동 지원 시민,http://www.enewstoday.co.kr/news/articleView.html?idxno=2118714
서울 경남 냉동 김밥 개발 세계 수출 과정 공개 창원 북면 젖소 사육 이동학 자연 목장 기업 협력 업체 축산업,http://www.knnews.co.kr/news/articleView.php?idxno=1430663
만족도 농림 축산 식품 실시 실태 조사 짐작 생활 환경 시장 상황 결합 구조 문제 경제 분야 지원,https://n.news.naver.com/mnews/article/056/0011706038?sid=102
생활 경험 체류 창업 지원 센터 인기 이날 입교식 입교 가족 선배 수료생 참여 가운데,http://www.cctimes.kr/news/articleView.html?idxno=794785
생활 경험 체류 창업 지원 센터 인기 이날 입교식 입교 가족 선배 수료생 참석 교생,https://www.inews365.com/news/article.html?no=810934
센터 관계자 최근 세대 열풍 취업 이유 가세 관심 센터 경험,https://www.ccdailynews.com/news/articleView.html?idxno=2269478
베이비 부머 은퇴 본격 도시 생활 전원 한때 유행 도시 생활 편리,https://n.news.naver.com/mnews/article/057/0001813396?sid=101
생활 경험 체류 창업 지원 센터 인기 김창규 시장 환영 인사 인구 유입 촉진,http://www.chungnamilbo.co.kr/news/articleView.html?idxno=767270
세계 핵심 산업 식량 안보 연결 동시 지역 인구 유입 당시 유성구 임대 농지 계약 연장 과정,https://www.ggilbo.com/news/articleView.html?idxno=1025449
생활 경험 체류 창업 지원 센터 인기 이날 입교식 입교 가족 선배 수료생 참여 가운데,http://www.bzeronews.com/news/articleView.html?idxno=656402
생활 경험 체류 창업 지원 센터 인기 이날 입교식 입교 가족 선배 수료생 참여 가운데,https://www.gukjenews.com/news/articleView.html?idxno=2973985
김덕환 증평군 농정 기획 팀장 체험 영농 활동 체험 체험 활용 빈집 폐교 위기 학교 활용,https://n.news.naver.com/mnews/article/056/0011705488?sid=102
나무 생각 생각 나무 추천 나무,https://www.sisaweek.com/news/articleView.html?idxno=213857
대한민국 여름 겨울철 날씨 유럽 포기 상추 농부 학교 졸업 준비 대상 경험담 전달,https://n.news.naver.com/mnews/article/001/0014640215?sid=101
주요 요인 영농 홍보 역귀 통계 실태 파악 실효 대책 마련,https://n.news.naver.com/mnews/article/056/0011703976?sid=102
농인 초기 영농 기술 부족 재배 수익 창출 확률 농인 기술 부족 소득 안정 가지 수요 충족 형태 일자리,https://n.news.naver.com/mnews/article/087/0001038932?sid=102
경주시 농인 초기 영농 부담 지역 우수 인과 선도 농가 주한 농장 방문 영농 기술 시설 관리법 컨설팅 제공 관심 분야 작목 재배 기술,https://n.news.naver.com/mnews/article/079/0003885726?sid=102
광화문 수년 유랑 생활 최근 에어컨 관련 기술 설치 기사 세월 탑승자 구조 기소 인원 대부분 구조 해양경찰,https://n.news.naver.com/mnews/article/022/0003924544?sid=102
지역 우수 선도 농가 주한 농인 초기 영농 부담 농장 방문 영농 기술 시설 관리법 컨설팅 제공 사업 초기 관심 분야 작목 재배 기술,http://www.ksmnews.co.kr/news/view.php?idx=477507
졸업 김현권 의원 결혼해 성군 의성군 여성 선거 윤석열 정부 국정 운영 심판 선거 이야기,https://www.pn.or.kr/news/articleView.html?idxno=30372
경주시 농인 초기 영농 부담 지역 우수 인과 선도 농가 주한 농장 방문 영농 기술 시설 관리법 컨설팅 제공 관심 분야 작목 재배 기술 습득,https://n.news.naver.com/mnews/article/088/0000872893?sid=102
중반 로라 기업 연고 충남 의미 누가 시작 처음 연속 주인,http://www.hortitimes.com/news/articleView.html?idxno=31680
지역 우수 선도 농가 주한 농인 초기 영농 부담 농장 방문 영농 기술 시설 관리법 컨설팅 제공 사업 초기 관심 분야 작목 재배 기술,http://www.weeklytoday.com/news/articleView.html?idxno=619390
창업 첫해 고추 아쿠 아포 닉스 농법 도입 덕분 친환경 상추 생산 지역 마트 납품 규모 아쿠 아포 닉스,https://n.news.naver.com/mnews/article/662/0000041377?sid=103
농협 농부 학교 이하 희망자 대상 개월 과정 창업 환영 인내 담대 당부 대한민국 최고 정예,http://www.newsfarm.co.kr/news/articleView.html?idxno=95217
뿌리 민정 피해자 용서 구조 자법 구원,https://n.news.naver.com/mnews/article/469/0000795945?sid=102
지역 우수 선도 농가 주한 농인 초기 영농 부담 농장 방문 영농 기술 시설 관리법 컨설팅 제공 제공 경주시 지난해 산내면 우라리,https://www.gukjenews.com/news/articleView.html?idxno=2968592
지역 우수 선도 농가 주한 농인 초기 영농 부담 농장 방문 영농 기술 시설 관리법 컨설팅 제공 사업 초기 관심 분야 작목 재배 기술,http://www.bzeronews.com/news/articleView.html?idxno=655235
지역 우수 선도 농가 주한 농인 초기 영농 부담 농장 방문 영농 기술 시설 관리법 컨설팅 제공 사업 초기 관심 분야 작목 재배 기술,http://www.hidomin.com/news/articleView.html?idxno=545349
지역 우수 선도 농가 이주한 농인 초기 영농 부담 농장 방문 영농 기술 시설 관리법 컨설팅 제공 다주 낙영 경주시장,https://www.viva100.com/main/view.php?key=20240414010004281
지역 우수 선도 농가 주한 농인 초기 영농 부담 농장 방문 영농 기술 시설 관리법 컨설팅 제공 사업 초기 관심 분야 작목 재배 기술,http://www.m-i.kr/news/articleView.html?idxno=1110841
지역 우수 선도 농가 주한 농인 초기 영농 부담 농장 방문 영농 기술 시설 관리법 컨설팅 제공 사업 초기 관심 분야 작목 재배 기술,http://www.kbsm.net/news/view.php?idx=429774
농인 초기 영농 부담 지역 우수 인과 선도 농가 주한 농장 방문 영농 기술 시설 관리법 컨설팅 제공 관심 분야 작목 재배 기술 습득 과정 상담,https://n.news.naver.com/mnews/article/005/0001688409?sid=102
지역 우수 선도 농가 주한 농인 초기 영농 부담 농장 방문 영농 기술 시설 관리법 컨설팅 제공 사업 초기 관심 분야 작목 재배 기술,https://n.news.naver.com/mnews/article/031/0000828251?sid=102
지역 우수 선도 농가 주한 농인 초기 영농 부담 농장 방문 영농 기술 시설 관리법 컨설팅 제공 사업 초기 관심 분야 작목 재배 기술,http://www.metroseoul.co.kr/article/20240414500077
지역 우수 선도 농가 주한 농인 초기 영농 부담 농장 방문 영농 기술 시설 관리법 컨설팅 제공 사업 초기 관심 분야 작목 재배 기술,https://www.asiatoday.co.kr/view.php?key=20240414010007304
지역 우수 선도 농가 주한 농인 초기 영농 부담 농장 방문 영농 기술 시설 관리법 컨설팅 제공 사업 초기 관심 분야 작목 재배 기술,https://www.ekn.kr/web/view.php?key=20240414021224851
농인 초기 영농 부담 영농 기술 시설 관리법 컨설팅 제공 현장 실습 교육 개월 참여 연수생 최대 선도 농가 최대 지원,http://www.kukinews.com/newsView/kuk202404140012
농협 농부 학교 이하 희망자 대상 개월 과정 창업 장기 교육 과정 인내 담대 당부 대한민국 최고 정예,http://www.agrinet.co.kr/news/articleView.html?idxno=326602
농협 농부 학교 이하 희망자 대상 개월 과정 창업 환영 인내 담대 당부 대한민국 최고 정예,https://www.chukkyung.co.kr/news/articleView.html?idxno=71208
영동 골살 체험 프로그램 운영 전입 대상 주택 수리비 신축 설계 지원,https://n.news.naver.com/mnews/article/001/0014624630?sid=101
농협 농부 학교 이하 희망자 대상 개월 과정 창업 환영 인내 담대 당부 대한민국 최고 정예,https://www.thefairnews.co.kr/news/articleView.html?idxno=25482
농협 농부 학교 이하 희망자 대상 개월 과정 창업 환영 인내 담대 당부 대한민국 최고 정예,http://www.fntimes.com/html/view.php?ud=202404092303014853dd55077bc2_18
농협 농부 학교 이하 희망자 대상 개월 과정 창업 강호동 회장 활력 열정 인재 입교 환영,http://www.kihoilbo.co.kr/news/articleView.html?idxno=1082802
농협 농부 학교 이하 희망자 대상 개월 과정 창업 환영 인내 담대 당부 대한민국 최고 정예,https://n.news.naver.com/mnews/article/018/0005710981?sid=100
농협 농부 학교 이하 희망자 대상 개월 과정 창업 환영 인내 담대 당부 대한민국 최고 정예,https://n.news.naver.com/mnews/article/018/0005710978?sid=100
농협 농부 학교 이하 희망자 대상 개월 과정 창업 장기 교육 환영 인내 담대 당부 회장 대한민국,https://n.news.naver.com/mnews/article/666/0000038723?sid=101
농협 농부 학교 이하 희망자 대상 개월 과정 창업 입교식 참석 강호동 농협 중앙 회장 인내 담대 대한민국 고의,https://www.joongboo.com/news/articleView.html?idxno=363646447
농협 농부 학교 이하 희망자 대상 개월 과정 창업 환영 인내 담대 당부 대한민국 최고 정예,https://weekly.hankooki.com/news/articleView.html?idxno=7087171
농협 농부 학교 이하 희망자 대상 개월 과정 창업 환영 인내 담대 당부 대한민국 최고 정예,http://www.newsworker.co.kr/news/articleView.html?idxno=326885
농협 농부 학교 이하 희망자 대상 개월 과정 창업 환영 인내 담대 당부 대한민국 최고 정예,http://www.lkp.news/news/articleView.html?idxno=46866
농협 농부 학교 이하 희망자 대상 개월 과정 창업 환영 인내 담대 당부 대한민국 최고 정예,https://n.news.naver.com/mnews/article/022/0003922574?sid=101
농협 농부 학교 이하 희망자 대상 개월 과정 창업 환영 인내 담대 당부 대한민국 최고 정예,http://www.worktoday.co.kr/news/articleView.html?idxno=51176
농협 농부 학교 이하 희망자 대상 개월 과정 창업 환영 인내 담대 당부 대한민국 최고 정예,http://www.startuptoday.co.kr/news/articleView.html?idxno=190874
농협 농부 학교 이하 희망자 대상 개월 과정 창업 환영 인내 담대 당부 대한민국 최고 정예,http://www.smedaily.co.kr/news/articleView.html?idxno=287088
농협 농부 학교 이하 희망자 대상 개월 과정 창업 강호동 회장 대한민국 활력 열정 인재 인내,http://www.metroseoul.co.kr/article/20240409500039
중국 첨밀밀 유명세 헤라 이웃집 찰스 사연 이웃집 찰스 코로나 무대 헤라 남편 사업 경남 하동 주한 헤라 버섯,https://m.entertain.naver.com/article/415/0000027250
중국 첨밀밀 스타덤 헤라 한국 가수 이유 오후 코로나 무대 남편 사업 위기 경남,https://m.entertain.naver.com/article/609/0000841671
농협 농부 학교 이하 희망자 대상 개월 과정 창업 환영 인내 담대 당부 대한민국 최고 정예,https://n.news.naver.com/mnews/article/119/0002818631?sid=101
수강 작물 재배 기초 이론 현장 실습 보금자리 주택 농지 사례 선도 농가 벤치마킹 농기계 안전 사용법 조작 실습 사업 계획서 작성법 관련 기초,http://www.domin.co.kr/news/articleView.html?idxno=1464912
이하 희망자 대상 개월 과정 창업 장기 교육 프로그램 시작 졸업 배출 강호동 회장 입교식 인내,https://n.news.naver.com/mnews/article/079/0003883340?sid=101
농협 농부 학교 이하 희망자 대상 개월 과정 창업 환영 인내 담대 당부 대한민국 최고 정예,https://www.cnbnews.com/news/article.html?no=653235
농협 농부 학교 이하 희망자 대상 개월 과정 창업 환영 인내 담대 당부 대한민국 최고 정예,https://www.lcnews.co.kr/news/articleView.html?idxno=72966
농협 농부 학교 이하 희망자 대상 개월 과정 창업 환영 인내 담대 대한민국 최고 정예 성장,http://www.wsobi.com/news/articleView.html?idxno=236747
수강 작물 재배 기초 이론 현장 실습 보금자리 주택 농지 사례 선도 농가 벤치마킹 농기계 안전 사용법 조작 실습 사업 계획서 작성법 관련 기초,http://www.domin.co.kr/news/articleView.html?idxno=1464832
지자체 사례 경험 괴산군 퇴자 마을 인프라 관건 최근 퇴자 임대 분양 타운 하우스 가구 단독 주택 가구 필지,https://realty.chosun.com/site/data/html_dir/2024/04/08/2024040800618.html
신중 선택 노년 생활비 수입원 마련 가능 도시 생활,http://www.joongang.tv/news/articleView.html?idxno=71443
기반 미래 비전 인우 학생 지역 농인 멘토 역할 자금,http://www.agrinet.co.kr/news/articleView.html?idxno=326394
주거 보육 부담 완화 생활 여건 개선 보금자리 조성 사업 시장 가능 계농 창업 운동장 경쟁 문제,http://www.agrinet.co.kr/news/articleView.html?idxno=326395
인구 감소 시점 관심 연령 기준 연령 상향 조정 지원 대상 확대 영농 하차 사례,https://www.chukkyung.co.kr/news/articleView.html?idxno=71074
제주 기존 주택 리모 가격 임대 주택 협동조합 조합원 준비 부족 정부 변화 모델,https://www.lifein.news/news/articleView.html?idxno=16958
요인 공부 시절 서울 문구점 운영 배경 지식 전무 농약 비료 작물,https://n.news.naver.com/mnews/article/662/0000040822?sid=101
도시민 자금 탕진 시민 일정 기간 경험 최대,http://www.gnnews.co.kr/news/articleView.html?idxno=549724
김해 둥지 황새 자연 부화 김해시 화포 습지 인근 방사장 황새 희망 참가자 최장 숙소 일자리 체험 기술 교육 지원,https://n.news.naver.com/mnews/article/056/0011693772?sid=101
지원 사업 기업 인턴 거름망 필요 확률 상황 목표 노력 박정 한국 계농 업경 영연 무안군 연합 회장,http://www.agrinet.co.kr/news/articleView.html?idxno=326323
작용 영향 인구 유입 호재 작용 제동 잼버리 파행 정부 안일 대응 초기 대응 정부,https://n.news.naver.com/mnews/article/659/0000020216?sid=100
거기 생태 교육 필요 절감 무주 고등학교 설립 대중 지도자 대중 미래 이해 영양가,http://kor.theasian.asia/archives/333826
이듬해 호두 호두나무 보상 묘목 문제 재배 관리 잘못 판단 묘목,https://n.news.naver.com/mnews/article/022/0003919496?sid=102
충북 도시 농부 단시간 일자리 제공 안정 유도 생활 사전 경험 충북 체류 창업 지원 센터 운영 뒷받침,https://n.news.naver.com/mnews/article/662/0000040299?sid=100
주영 부모 양육 사업 아빠 허리 부상 엄마 사망 슬픔 경제 심리 어려움 지인 소개 주거지,https://www.ksilbo.co.kr/news/articleView.html?idxno=995567
유입 연계 농지 이양 안정 진행 둘째 지방 소멸 대응 기금 탄력 활용 숨통 임시방편 국가,http://www.domin.co.kr/news/articleView.html?idxno=1463471
수익 계산 무모 도전 사례 분야 적성 확인 화분 결심,https://www.incheonilbo.com/news/articleView.html?idxno=1241756
순종 여호수아 백성 전투 현장 청송 교회 부임 동시 지역 활력 사역,https://n.news.naver.com/mnews/article/005/0001684280?sid=103
순창 프로그램 도농 문화 격차 적응 시민 과정 발생 신청 방법 순창군 풍산면 위치 순창군 지원 센터 방문 팩스 이메일,http://www.newsmaker.or.kr/news/articleView.html?idxno=150278
적응 시민 과정 발생 시행착오 최소 지역 주민 교류 기회 신청 방법 순창군 풍산면 위치 순창군 지원 센터 방문 팩스 이메일,http://www.ttlnews.com/article/KOREA/15703
순창 프로그램 도농 문화 격차 적응 시민 과정 신청 방법 순창군 풍산면 위치 순창군 지원 센터 방문 팩스 이메일 가능,https://www.skyedaily.com/news/news_view.html?ID=226065
순창 시민 현실 순창군 인구 유입 순창 프로그램 도농 문화 격차 적응 시민 과정 발생,https://www.viva100.com/main/view.php?key=20240327010008833
프로그램 도농 문화 격차 적응 시민 과정 발생 제공 현실 걸음 프로그램 자연,http://www.domin.co.kr/news/articleView.html?idxno=1463165
교장 기회 활용 관내 학부모 명회 귀자 교장 학교 시작 계획,https://n.news.naver.com/mnews/article/047/0002427535?sid=102
프로그램 도농 문화 격차 적응 시민 과정 발생 시행착오 신청 순창군 풍산면 순창군 지원 센터 방문 팩스 이메일,https://n.news.naver.com/mnews/article/003/0012451681?sid=102
순창 프로그램 도농 문화 격차 적응 시민 과정 발생 신청 방법 순창군 풍산면 위치 순창군 지원 센터 방문 팩스 이메일,http://www.weeklytoday.com/news/articleView.html?idxno=616044
순창 프로그램 도농 문화 격차 적응 시민 과정 발생 신청 방법 순창군 풍산면 위치 순창군 지원 센터 방문 팩스 이메일,https://www.psnews.co.kr/news/articleView.html?idxno=2050589
순창 프로그램 도농 문화 격차 적응 시민 과정 제공 현실 걸음 자연 가치,https://n.news.naver.com/mnews/article/382/0001115516?sid=102
순창 프로그램 도농 문화 격차 적응 시민 과정 신청 방법 순창군 풍산면 위치 순창군 지원 센터 방문 팩스 이메일,https://www.jeonmae.co.kr/news/articleView.html?idxno=1024283
순창 프로그램 도농 문화 격차 적응 시민 과정 신청 방법 순창군 풍산면 위치 순창군 지원 센터 방문 팩스 이메일,http://www.jeollailbo.com/news/articleView.html?idxno=725549
순창 프로그램 도농 문화 격차 적응 신청 방법 순창군 풍산면 위치 순창군 지원 센터 방문 팩스 이메일 가능,https://www.ajunews.com/view/20240326140153180
순창 프로그램 도농 문화 격차 적응 시민 제공 현실 걸음 프로그램 자연,https://www.jjan.kr/article/20240326580127
순창군 순창 프로그램 도농 문화 격차 적응 시민 제공 현실 걸음 프로그램 자연,https://www.joongdo.co.kr/web/view.php?key=20240326010008200
순창 프로그램 도농 문화 격차 적응 시민 과정 신청 방법 순창군 풍산면 위치 순창군 지원 센터 방문 팩스 이메일 가능,http://www.shinailbo.co.kr/news/articleView.html?idxno=1848666
사진 순창군 순창 프로그램 도농 문화 격차 적응 시민 신청 방법 순창군 풍산면 위치 순창군 지원 센터 방문 팩스 이메일 가능,https://www.gukjenews.com/news/articleView.html?idxno=2953378
천혜 자연환경 자랑 전북 순창 주간 현실 순창군 도농 문화 격차 적응 시민,http://www.breaknews.com/1023125
순창 프로그램 도농 문화 격차 적응 시민 과정 신청 방법 순창군 풍산면 위치 순창군 지원 센터 방문 팩스 이메일 가능,https://n.news.naver.com/mnews/article/629/0000276297?sid=102
준비 부족 자금 부족 소득 확보 주민 불화 정확 정보 기술 습득 현지 인과 융화 관건 현지,http://www.domin.co.kr/news/articleView.html?idxno=1463027
감한 생각 환영 걱정 대구 적응 주전 경쟁 리우 올림픽 최종 선정,https://m.sports.naver.com/kfootball/article/436/0000084128
두릅 재배 소득 결과물 회사 법인 고향 전남 장성 농산물 유통 관련 회사 근무,https://n.news.naver.com/mnews/article/022/0003917116?sid=102
치열 이태호 사례 무모 심사숙고 결정 도전 보수 접근 부족 지자체,https://bravo.etoday.co.kr/view/atc_view/15214
생활 준비 어머니 고향 인연 청주시 문의면 자리 처음 마음 상태 관리,https://www.ccdn.co.kr/news/articleView.html?idxno=965631
이창열 의원 올해 연구 활동 사례 분석 지역 균형발전 경제 활성 도움 한편 의회 의원 연구 단체 위원회,https://n.news.naver.com/mnews/article/654/0000068575?sid=102
올해 산업 사무관리 시설 관리 창업 분야 멘토 위촉 박현숙 대구 지방 보훈 청장 후배 제대 군인 사회,https://www.dkilbo.com/news/articleView.html?idxno=434509
올해 산업 사무관리 시설 관리 창업 분야 멘토 위촉 박현숙 대구 지방 보훈 청장 후배 제대 군인 사회,https://news.bbsi.co.kr/news/articleView.html?idxno=3148181
올해 산업 사무관리 시설 관리 창업 분야 멘토 위촉 박현숙 대구 보훈 청장 후배 제대 군인 사회,http://www.kbsm.net/news/view.php?idx=425921
주민 토론회 우수 지역 벤치마킹 마무리 최종 결과물 도출 반영 구상 이창열 의원 사례 분석,https://n.news.naver.com/mnews/article/087/0001031595?sid=102
이창열 의원 평창 보석 사례 분석 지역 균형발전 지역 경제 활성 도움 한편 평창군 의회,https://n.news.naver.com/mnews/article/468/0001038793?sid=102
배후 지역 인구 지역 지역 어려움 기본 생활 환경 부족 시장 구조 문제 일자리,https://www.farminsight.net/news/articleView.html?idxno=12132
가능 전원 생활 직장인 유입 전망 학연 더블 유엔 홀딩스 이전 스마트 사업 마구잡이 진행 중단 사례,https://www.enetnews.co.kr/news/articleView.html?idxno=21541
조사 결과 그동안 지역 주민 화합 도시 회귀 폐단 정도 해소 풀이 긍정 평가,http://www.aflnews.co.kr/news/articleView.html?idxno=266471
운동 마을 목회 사역 목회 주민 사역 지역 주변인 마을 지적,https://n.news.naver.com/mnews/article/005/0001678524?sid=103
완주 용인 완주군 고산 김경한 정유진 부부 이전 지주 고추 대실패 작물 요령,http://www.domin.co.kr/news/articleView.html?idxno=1460265
경찰 공무원 생활 사업 아내 유로 고향 성주 만평 규모 비닐하우스 참외 부부 고민,https://n.news.naver.com/mnews/article/662/0000038543?sid=103
예정 올해 마늘 시행착오 공유 생활 김해시 진영읍 양지 마을 오늘 아마추어 농부 시행착오,https://n.news.naver.com/mnews/article/047/0002424149?sid=103
지속 소득 창출 대부분 현실 무료 임대 농인 지원 기간 주거,https://www.yeongnam.com/web/view.php?key=20240228010003475
민주당 위원회 이날 자료 윤석열 정부 경제 운용 고물가 간주 소멸 지역 임대 주택 건설 지원 예산 복원 확대 내용 발표 민주당,https://www.newspim.com/news/view/20240228001063
부여 국비 보금자리 조성 충남 농림 축산 식품 주관 지난해 강우 폭염 기상 악화 병해충 확산 품종 육묘 농가 홍희 주력 품종,http://www.kukinews.com/newsView/kuk202402280222
