nouns,link
부분 시청자 관심 생각 공간 도시 생활 갈등 인간 관계 풍광 먹거리 혼재 선택,http://tvdaily.co.kr/read.php3?aid=1405583840732469002
지역민 일자리 창출 한편 고령 마을 유도 발전 기반 마을 기업 인간 관계 중시 경제 문제 관계 훼손 장애물,http://www.kookje.co.kr/news2011/asp/newsbody.asp?code=0300&key=20140703.22006191928
창업 영성 프로그램 참여 심리학 문학 공부 변화 사람 유형 인간 관계 발생 갈등 자율 욕구 관계 욕구 충돌 발생 상대 방의,https://n.news.naver.com/mnews/article/032/0002483614?sid=103
웰빙 관심 가운데 전원주택 주의 도심 지방 생업 인간 관계 문제 유발 우려 평생,https://n.news.naver.com/mnews/article/215/0000102806?sid=101
인간 관계 스트레스 전남 구례 피아골 장인 김미선 사람 재배 기술 유통,https://n.news.naver.com/mnews/article/366/0000193167?sid=101
서울 머니 금융 증권 보험 부동산 창업 은퇴 정보 인간 관계 변화 실감 소득 연착륙 강조 소장,https://n.news.naver.com/mnews/article/009/0003197947?sid=101
도시 근교 전원생활 비중 한때 유행 지방 전년 대비 은행 정기 서드 에이지 이징 건강 취미 인간 관계 재무 주제,https://n.news.naver.com/mnews/article/009/0003171916?sid=101
사람 인간 관계 동화 순창 의지 관계자 교육 가정 유치 체계 효율 교육,http://www.sjbnews.com/news/articleView.html?idxno=457600
순창군 이달 예비 장기 교육 마련 올해 인구 유치 사람 인간 관계 동화 순창 순창 우기홍 기자,http://www.domin.co.kr/news/articleView.html?idxno=1019182
자식 출가 계획 모씨 자손 인간 관계 노후 설계 상담 정보 제공 노년 플래너 주택 가격,https://n.news.naver.com/mnews/article/079/0002574535?sid=102
인간 관계 당내 장악력 평가 노광열 민주당 문광 면장 도전장 괴산 건설 정성 괴산 최선,http://www.cctoday.co.kr/news/articleView.html?idxno=823269
한국 강신주 현상 사람 일부 강신주 인간 관계 매개 단절 측면 단절 극복,http://www.mediaus.co.kr/news/articleView.html?idxno=39930
프로젝트 인간 자연 관계 조명 작업 한편 자연 선물 영감 가족 모습 자연 사람 심성 표현 사람,https://n.news.naver.com/mnews/article/032/0002430622?sid=103
젊은이 대상 강연 최근 탈북자 대상 강연 사람 이해타산 영리 인간 관계,http://ch.yes24.com/Article/View/24142
골든 라이프 아카데미 은퇴 재취업 창업 노후 생활 실질 도움 연령 맞춤 목돈 마련 방법 자산 증식 프로그램 건강 인간 관계 상담,http://www.econovill.com/archives/146140
주목 단순 생활 일기 생명 인간 인간 관계 생각 계업 고마움 바탕 생명,https://n.news.naver.com/mnews/article/008/0003169168?sid=103
추세 대안 중심 강원도 강원 인간 관계 건조 자연 건강 여유,http://www.kado.net/news/articleView.html?idxno=655683
평생 농부 자칭 고구마 농부 그녀 남편 사업 인간 관계 가정 외조,https://n.news.naver.com/mnews/article/375/0000103350?sid=103
평생 농부 자칭 고구마 농부 그녀 남편 사업 인간 관계 가정 외조,https://n.news.naver.com/mnews/article/374/0000043870?sid=103
인간 관계 소유물 동네 일상생활 관심 실천 개월 프로젝트 페이스북 장사 김철환 로터 미디어 직거래 달성 소셜 농부,https://n.news.naver.com/mnews/article/018/0002876250?sid=103
농약 범벅 들판 방치 비닐 쓰레기 냇물 거기 이름 간섭 도움 인간 관계 빌미 노동 착취 현실 젊은이,https://n.news.naver.com/mnews/article/032/0002400497?sid=004
경제 살림 인간 관계 건강 문제 응답 은퇴 준비 지인 소식 도시 응답,https://n.news.naver.com/mnews/article/417/0000017391?sid=101
신영철 강북 삼성병원 교수 대부분 스트레스 인간 관계 나타 은퇴 이후 이날 행사 농협 생명 농협 증권 농협 금융 계열사 노후 자산 관리 재취업,http://www.newstomato.com/ReadNews.aspx?no=409935
시골 영지 관리 일상 바냐 전남 구례 실제 생활 연출 세계관 인간 관계 제안 연출 가의,https://n.news.naver.com/mnews/article/003/0005440315?sid=103
치매 어머니 자연 기록 전국 협회 전희 선생 노인 악담 저주 인간 존엄 인간 관계 경험 공동체 경험 고통 사람,https://n.news.naver.com/mnews/article/028/0002205255?sid=103
인간 인간 관계 인간 자연 관계 회복 조화 욕망 가능 전도사 이병철 슬로푸드 운동가 김종덕 녹색평론 발행인 김종철 청도 학교 교장,http://www.kookje.co.kr/news2011/asp/newsbody.asp?code=0500&key=20130907.22012192650
사람 인간 관계 공간 갈등 신경전 상담 의외,https://n.news.naver.com/mnews/article/028/0002198988?sid=101
방송 기분 이원종 생활 소개 이원종 강원도 원주 과수원 사람 상처 가슴앓이 인간 관계 배신 기분 밤새,https://m.entertain.naver.com/article/213/0000359600
도시 농부 학교 생태 학교 기예 자랑 과정 소통 상생 기운 인간 관계 원활,https://n.news.naver.com/mnews/article/028/0002196645?sid=101
농부 의도 상태 인간 관계 뭔가 성립 펀드,https://n.news.naver.com/mnews/article/002/0001993652?sid=102
재직 임직원 퇴직 임직원 재무 설계 건강 관리 인간 관계 안정 노후 포스코 관심 반영 포스코 에코 실습 농장 친환경 농법,https://n.news.naver.com/mnews/article/262/0000006522?sid=102
재무 설계 건강 관리 인간 관계 노후 준비 생애 설계 교육 퇴직 창업 컨설팅 전문 교육 단계 재취업 창업 실무 교육 부부 노후 필요 구체,http://www.etoday.co.kr/news/section/newsview.php?idxno=750488
장본 색지 미디어 연재 스토리 설정 왕년 명랑 만화 분방 상상력 상황 필살기 인간 관계 변칙 리듬 시도 그물,https://n.news.naver.com/mnews/article/140/0000022355?sid=004
인간관 계란 퇴색 부작용 속출 도시 마을 농어촌 관계 사람 처방 바람 사정,http://www.jemin.com/news/articleView.html?idxno=310837
대신 소음 매연 소통 빙자 소란 인간 관계 다양 스트레스 노출 도시 골살이 진실 고민 어른,https://n.news.naver.com/mnews/article/081/0002335607?sid=103
올해 부동산 관리 강좌 체험 노후 프로그램 확대 계획 여행 인간 관계 리디 자인 강조 접근 실버 여행 산업의,https://n.news.naver.com/mnews/article/050/0000028953?sid=101
석양 창가 시작 생활 오랜만 여유 문화 혜택 정작 가족 친지 인간 관계 소원 사람 사이 거리,https://n.news.naver.com/mnews/article/298/0000104353?sid=117
요즘 트렌드 지방 전원생활 약국 관심 인간 관계 역지사지 관점 생각,http://www.yakup.com/pharmplus/index.html?mode=view&cat=23&cat2=460&nid=3000131104
한편 기숙 대안 학교 샨티 학교 내면 인간 관계 둘째 수업 회의 모습 지역민 사랑 역할 문수 지역,https://n.news.naver.com/mnews/article/047/0002022781?sid=103
직업 담사 창업 컨설턴트 전문가 임직원 재무 설계 건강 관리 인간 관계 노후 준비 포스코 직원 은퇴 이후 희망자 포스코 에코 운영 경북 포항 위치,https://n.news.naver.com/mnews/article/003/0005097829?sid=101
기존 대량 품종 생산 농가 중심 소량 품종 생산 영소 여성 가족 농민 인간 관계 긍정 기여 생산물 소비자 애정 보람 책임,http://www.kyeongin.com/news/articleView.html?idxno=728247
감물 생태학 습관 천주교 부산교구 준비 생태 체험 학교 생태 교육 생태학 습관 자연 인간 생태 관계 중시 활용 현대,https://n.news.naver.com/mnews/article/082/0000384133?sid=103
생활 실질 도움 선배 지역민 만남 인간 관계 철학 실습 현장 견학 위주 교육 실시 예정 교육 농기계,http://www.sjbnews.com/news/articleView.html?idxno=429159
생활 실질 도움 선배 지역민 만남 인간 관계 철학 실습 현장 견학 위주 교육 실시 예정 교육 농기계 친환경 농법,https://n.news.naver.com/mnews/article/003/0005064721?sid=102
교육 선배 지역민 만남 인간 관계 철학 실습 현장 견학 위주 진행 농기계 친환경 농법 실습 실습 농장 운영 빈집 농지 등의,https://n.news.naver.com/mnews/article/421/0000230415?sid=102
전국귀농운동본부 텃밭 보급소 안철환 소장 도시 관련 사업 현실 지자체 소장 회색 시멘트 건물 생활 감정 인간 관계,https://n.news.naver.com/mnews/article/028/0002179992?sid=102
선호 지원 정보 제공 상담 활동 희망 일자리 정보 제공 지원 선호 프로그램 지역 주민 인간 관계 형성,http://www.ccdailynews.com/sub_read.html?uid=319582&section=sc6
지역 주민 인간 관계 형성 지원 비중 조사 전입 주민 생활상 파악 맞춤식 복지 서비스 제공 계획 도시민 유치 홍보 관련 정책 수립 반영,http://www.inews365.com/news/article.html?no=274860
과정 지역 주민 갈등 응답 지역 주민 인간 관계 형성 지원 요구 관계자 설문 조사 전입 민의,https://n.news.naver.com/mnews/article/003/0004996467?sid=102
지역 주민 인간 관계 형성 지원 비중 지난해 조사 전입 주민 생활상 파악 맞춤식 복지 서비스 제공 계획 도시민 유치 홍보 관련 정책 수립,https://n.news.naver.com/mnews/article/001/0006112501?sid=102
소득 투자 결정 지역 선도 농가 노하우 인간 관계 지혜 필요 마을 주민 텃세 경계심,https://n.news.naver.com/mnews/article/088/0000278997?sid=102
인간 관계 만족도 현재 정상철 양양 군수 양양 추진 사업 여명 외지인 이주,https://n.news.naver.com/mnews/article/087/0000424642?sid=102
공동 사회 도덕 인간 관계 중시 관습 여론 지역 사회 통제 사람 배타 불만 토로 특유 문화 준비 부족,http://www.nongmin.com/article/ar_detail.htm?ar_id=211978
요즘 인간 관계 국한 매정 내용 수감자 학교 교육 힙합 앨범 내기 다양,https://n.news.naver.com/mnews/article/005/0000538337?sid=102
인터넷 학교 노하우 공개 예정 지속 가능 친환경 작물 유통망 기반 폐쇄 인간 관계 구축 개방 관계 구축,https://n.news.naver.com/mnews/article/022/0002472594?sid=103
열정 헌신 인간 관계 정도 극단 운영 도움 황송 교사 역할 모델,https://n.news.naver.com/mnews/article/007/0000004233?sid=004
고향 은퇴 고향 결심 퇴직 동시 준비 자녀 거주 인간 관계 유지 목적 거주지 근처 소형 아파트 마련,https://n.news.naver.com/mnews/article/009/0002849639?sid=101
인구 최고 기록 상반기 인구 가구 변화 머리 가슴 공감 인간 자연 관계,https://n.news.naver.com/mnews/article/047/0002013821?sid=103
직장 인간 관계 단절 그동안 패턴 사업 아이템 창업 사회 기여 활동 봉사 활동 프랜차이즈,https://n.news.naver.com/mnews/article/022/0002464850?sid=102
생각 주변 모임 격려 정보 공유 은퇴 전문가 은퇴 인간 관계 시기 조지 베일 하버드대 교수 복의,http://www.nongmin.com/article/ar_detail.htm?ar_id=210411&subMenu=articletotal
직장 인간 관계 단절 그동안 패턴 사업 아이템 창업 사회 기여 활동 봉사 활동 프랜차이즈,https://n.news.naver.com/mnews/article/018/0002691263?sid=102
소속 직장 인간 관계 사업 아이템 창업 사회 기여 활동 봉사 활동 프랜차이즈,http://www.newshankuk.com/news/content.asp?fs=1&ss=3&news_idx=201211230914451267
직장 인간 관계 단절 그동안 패턴 사업 아이템 창업 사회 기여 활동 봉사 활동 프랜차이즈,http://www.ebuzz.co.kr/news/shoop/2681228_3025.html
직장 인간 관계 단절 그동안 패턴 사업 아이템 창업 사회 기여 활동 봉사 활동 프랜차이즈,http://www.etoday.co.kr/news/section/newsview.php?idxno=657842
직장 인간 관계 단절 그동안 패턴 사업 아이템 창업 사회 기여 활동 봉사 활동 프랜차이즈,https://n.news.naver.com/mnews/article/015/0002789158?sid=103
직장 인간 관계 단절 그동안 패턴 사업 아이템 창업 사회 기여 활동 봉사 활동 프랜차이즈,http://www.newsen.com/news_view.php?uid=201211230900508310
직장 인간 관계 단절 패턴 사업 아이템 창업 사회 기여 활동 봉사 활동 프랜차이즈,https://n.news.naver.com/mnews/article/079/0002416874?sid=101
이날 교육 박철규 기술 보급 과장 인간 관계 시작 최승 지도 오미자 재배 기술 교육 이수현 지도 웰빙 채소 생산 텃밭 기술 교육 다양 진행 한편,http://www.ccdailynews.com/sub_read.html?uid=303578&section=sc6
제주 올레 최근 트렌드 도시 방증 인간 관계 동물 조건 중요 비중 차지 관계,https://n.news.naver.com/mnews/article/145/0000010133?sid=103
인구 외환 위기 직후 베이비 부머 세대 은퇴 본격 시골 생활 도시 생활 인간 관계 요구 문화 존중 눈높이 시골 생활,https://n.news.naver.com/mnews/article/005/0000527728?sid=110
편집자 산촌 유학 유형 함양 지리산 자락 햇살 처음 시작 산촌 유학 현재 인간 관계 중요 의미 지역 길지,https://n.news.naver.com/mnews/article/002/0001986536?sid=102
인간 관계 사회 발달 학생 모습 꽃집 운영 학생 원예 테라 인기,http://news.itimes.co.kr/news/articleView.html?idxno=468515
경제 준비 인간 관계 건강 주변 환경 고려 가지 은퇴 활용 사항 노후 병기 거주 전략 가지 제시 노후 주거 계획 부부,https://n.news.naver.com/mnews/article/008/0002887279?sid=101
노하우 인간 관계 인맥 관리 홍명식 주무관 홍보 특산물 판로 개척 직판 행사 지원 재경 향우회 출향 인사 네트워크 구축 활동,http://www.yeongnam.com/mnews/newsview.do?mode=newsView&newskey=20120718.010290722420001
나라 과거 태도 서양 인간 관계 가치관 개고기 대량 개고기 사료 이야기 친구,https://n.news.naver.com/mnews/article/028/0002149758?sid=102
작년 근처 오랜만 목돈 성인 인간 관계 어려움 미리,https://n.news.naver.com/mnews/article/007/0000004101?sid=102
은퇴 이후 재테크 창업 봉사 인생 후반 계획 병행 조언 경제 요건 여가 인간 관계 건강 중요,https://n.news.naver.com/mnews/article/018/0002617433?sid=103
회사 사람 사이 인간 관계 군데 현재 강연 방송,http://ch.yes24.com/Article/View/19973
대안 단계 정도 취미 여가 생활 일환 방해 도시 꽃식물 의미 거리 공급 공장 인간 식물 관계,https://n.news.naver.com/mnews/article/020/0002339185?sid=110
청중 면면 토박이 도시 주한 농인 강연 페이스북 이야기 무대 세팅 인간 관계 중요 청중 강사 사이 찬바람 정도,https://n.news.naver.com/mnews/article/032/0002213078?sid=110
생활 실질 도움 선배 인과 지역민 만남 인간 관계 토론 실습 현장 견학 위주 교육 실시 예정 실습 농장 운영 교육 농기계,http://www.sjbnews.com/news/articleView.html?idxno=396816
생활 실질 도움 선배 인과 지역민 만남 인간 관계 토론 실습 현장 견학 위주 교육 실시 예정 실습 농장 운영 교육 농기계,https://n.news.naver.com/mnews/article/003/0004395563?sid=102
교육 실질 도움 선배 인과 지역민 만남 인간 관계 토론 실습 현장 견학 위주 교육 실시 실습 농장 운영 교육 농기계 친환경 농법,https://n.news.naver.com/mnews/article/001/0005559483?sid=102
지자체 지역 사회 활력 다양 인재 유치 전문 발휘 지원 용간 정보 활용 도시 생활 인간 관계 자양분,http://www.nongmin.com/article/ar_detail.htm?ar_id=199348&subMenu=articletotal
가족 일손 자연 이웃 평소 인간 관계 마곡사 소식 입소문 참여 방법 조건,https://n.news.naver.com/mnews/article/036/0000026165?sid=102
안정 직장 인간 관계 정치 참여 가능 분배 정도 건강 인간 진정 번역자 현직 농부 전국귀농운동본부 통문 편집 위원 들녘 저자,https://n.news.naver.com/mnews/article/262/0000004873?sid=103
이후 전국귀농운동본부 도시 위원회 서울 인천 수도 거주자 대상 상자 텃밭 사업 수확물 이웃 과정 인간 관계 형성 도시 빈민 노숙 장애,http://er.asiae.co.kr/erview.htm?idxno=2011111808360299660
생태 학교 도시 농부 학교 체험 행사 도시 부산시 농업기술센터 도시 관심 고취 활동 공동체 형성 인간 관계 회복 자아실현 건전 도시 소비자,http://er.asiae.co.kr/erview.htm?idxno=2011111816283755813
자연 인간 관계 환경 문제 오늘 특별 의미 사람 계속,https://n.news.naver.com/mnews/article/032/0002177625?sid=110
사람 인간 관계 환경 사고 방식 차이 표현 미숙 마을 가족 가족 도시 무소유,https://n.news.naver.com/mnews/article/028/0002113456?sid=102
농민 운동 친구 자연 현대 문명 자연 교감 도시 문명 인간 사회 인간 관계,https://n.news.naver.com/mnews/article/047/0001984496?sid=103
절반 가정 개인 사용 은퇴 희망 기업인 조건 리더십 경영 능력 기업가 정신 인간 관계 배경,http://www.kado.net/news/articleView.html?idxno=518080
인간 관계 배경 경영인 하루 업무 하가 중소기업 은퇴 생활 명중 정도 전원생활 희망,https://n.news.naver.com/mnews/article/112/0002202579?sid=101
인간 관계 배경 경영인 하루 업무 하가 중소기업 은퇴 생활 명중 정도 전원생활 희망,https://n.news.naver.com/mnews/article/112/0002202558?sid=101
사람 배신 인간 관계 결심 도시 생활 염증 선택 생활,http://www2.enewstoday.co.kr/sub_read.html?uid=244632&section=sc1
출하 인간 관계 형성 역점 동청 합자회사 도매 시장 지역 생산 농민 구체 도움 현실 젊은이 일부,https://n.news.naver.com/mnews/article/003/0003787847?sid=102
주제 시인 생각 다양 시골 인간 관계 도시 사람 시골 사람 일반 재고,https://n.news.naver.com/mnews/article/006/0000049780?sid=101
두통 해방 우울증 가능 작물 인간 관계 영향 작물,https://n.news.naver.com/mnews/article/081/0002169110?sid=102
평소 주변 사람 배려 인간 관계 평판 도움 미래 대비 인간 심신 평안 생태 은퇴자,https://n.news.naver.com/mnews/article/021/0002066201?sid=103
산업 시기 이농 이후 마을 인구 이동 토박이 평생 흑인 인권 운동 노벨 평화상 남아공 대주교 인간 관계 인간,https://n.news.naver.com/mnews/article/032/0002105830?sid=110
아빠 직장 지점 공장 마을 관련 남편 원활 인간 관계 엄마 최소한 지역 행사 얼굴 도장 시늉,https://n.news.naver.com/mnews/article/047/0001976284?sid=103
도시 생활 사람 배신 인간 관계 결심 이유 인터넷 최근 버섯 재미 재배,http://www.newscj.com/news/articleView.html?idxno=59440
인물 교체 가족 교체 어려움 계속 공동체 관계 문제 크다 인간 직장 하루,https://n.news.naver.com/mnews/article/028/0002067188?sid=103
인물 교체 가족 교체 어려움 계속 공동체 관계 문제 크다 인간 직장 하루,https://n.news.naver.com/mnews/article/028/0002399955?sid=103
마을 전통 체험 프로그램 운영 백종 서울 직장 작년 공생 관계 인간 자연 일부 자부 마을 자리,http://www.kyeongin.com/news/articleView.html?idxno=547774
작품 총각 결혼 과정 농가 일기 나중 언니 불편 그동안 인간 관계,https://n.news.naver.com/mnews/article/081/0002113703?sid=103
한때 종단 포기 생각 고백 자리 인간 관계 방망 징계 경향 종헌 종법,http://www.newscj.com/news/articleView.html?idxno=47438
한반도 탄생 지구 온난화 미래 자연 인간 관계 생각 이야기 생활협동조합 유기 공동체 기업 대안 학교 건강 세상 가슴,https://n.news.naver.com/mnews/article/028/0002043534?sid=102
인간 관계 시작 도시 준비 사항 지압 수지침 요가 선택 필수 살림 조직 가입,https://n.news.naver.com/mnews/article/002/0001961101?sid=103
자우 회원 현지 주민 어려움 이해 마음가짐 도시 탈출 사람 중심 인간 관계 이웃 친척 마을,https://n.news.naver.com/mnews/article/001/0003230874?sid=102
자우 회원 현지 주민 어려움 이해 마음가짐 지방 기사 참조 도시 탈출 사람 중심 인간 관계,https://n.news.naver.com/mnews/article/001/0003229549?sid=102
실제 주변 탐험 외국 명문 진학 경험 다큐 사례 목격 인간 관계 상품 미국 공동 관심 주거 형태,https://n.news.naver.com/mnews/article/005/0000398834?sid=110
고향 치매 어머니 대안 학교 생태 자연 농법 집중 전희 행동 요령 인간 관계 조직 생활 참고 주변 인물,https://n.news.naver.com/mnews/article/016/0000334455?sid=103
고향 치매 어머니 대안 학교 생태 자연 농법 집중 전희 행동 요령 인간 관계 조직 생활 참고 주변 인물,https://n.news.naver.com/mnews/article/112/0002073161?sid=103
요시카 협의 정보망 활용 전국 농인 학생 확보 주력 예정 요시카 정의 인간 관계 구축 핵심 과정 커뮤니티 코디네이터,https://n.news.naver.com/mnews/article/310/0000003937?sid=102
인간 관계 형성 정서 함양 중요 역할 수행 향토음식 연계 틈새 관광 시장 의견 고령화 문화 가족 사회 인구 구성 변화,https://n.news.naver.com/mnews/article/020/0002094683?sid=110
산골 차실 무화 생각 공동체 차손 인간 탐욕 사유 재산 인간 관계 기초 파악 아내 공동 소유,https://n.news.naver.com/mnews/article/047/0001961409?sid=103
촌시 장애 요인 생활 편의 시설 문제 자녀 교육 주시 소득 기존 인간 관계 단절 응답 희망 지역 고향 연고,https://n.news.naver.com/mnews/article/086/0001984714?sid=101
장덕진 서울대 사회학 교수 사회 안전망 외연 확장 나라 상대 부족 만큼 인간 관계 보충 현상 적용,https://n.news.naver.com/mnews/article/081/0002037129?sid=102
농인 자연 가치 출간 인간 자연 관계 인간 위주 일방통행 자연 파괴 시작 저자,https://n.news.naver.com/mnews/article/001/0002741839?sid=102
펜션 창업 명심 컨설팅 출판 대행 번역 전공 인간 관계 장점 부각 반면 체력 한계 디지털 문화 단점,https://n.news.naver.com/mnews/article/081/0002012289?sid=102
도시민 원활 영농 표준 모델 개발 보급 복지 연구 인간 관계 유지 열정 진흥 사업 전반 경험,http://www.dailian.co.kr/news/n_view.html?id=146853&sc=naver&kind=menu_code&keys=25
도시민 원활 영농 표준 모델 개발 보급 복지 연구 인간 관계 유지 열정 진흥 사업 전반 경험,https://n.news.naver.com/mnews/article/298/0000012167?sid=137
필자 농자 국제통화기금 시절 해당 지역 사람 수준 신규 농자 자본 확보 전문 증대 시장 관련 주요 인사 원활 인간 관계,http://www.nongmin.com/article/ar_detail.htm?ar_id=157604
확대 인간 관계 서로 얼굴 관계 물건 관계 단순 생산자 생명 운동 중심 유기 생태학,https://n.news.naver.com/mnews/article/002/0001943973?sid=103
관계 인간 자연 관계 평화 학교 대안 학교 탁발 순례,https://n.news.naver.com/mnews/article/032/0001958469?sid=100
직장 학교 가정 인간 관계 유지 대화 은퇴 계획 수준 낭만 현실,https://n.news.naver.com/mnews/article/008/0001982292?sid=103
지역 학교 구성원 교육 문제 도시 젊은이 자녀 교육 인성 교육 인간 관계 필요 기술 태도 소양 목표 교과,https://n.news.naver.com/mnews/article/028/0001945668?sid=102
병원 가본 소년 농부 철학 교수 농부 귀환 윤구병 인간 관계 문제 그동안 공동체 사람,https://n.news.naver.com/mnews/article/047/0001938662?sid=102
인간 관계 심리 싸움 사람 마음 심리 서적 인기 남편 교통사고 선택 주부 오리 수십 매출,https://n.news.naver.com/mnews/article/214/0000060545?sid=103
마을 사람 신뢰 바탕 인간 관계 중요 요즘 일부 사람 정도 재력 뒷받침 상태 전원생활 공간 생각 소위 귀족,https://n.news.naver.com/mnews/article/021/0000221331?sid=102
현지 주민 인간 관계 중요 문제 과정 우려 현지 농민 인간 관계 문제 일부 직장 퇴직 정도 재력 뒷받침 상태 노년,https://n.news.naver.com/mnews/article/078/0000038354?sid=117
과정 우려 현지 인간 관계 일부 정도 재력 뒷받침 상태 노년 전원생활 소위 귀족 생활,https://n.news.naver.com/mnews/article/021/0000214704?sid=102
나이 도시 생활 시도 도시 생활 인간 관계 시골 정도 편안,https://n.news.naver.com/mnews/article/021/0000212804?sid=103
건지 형태 가족 건가요 통제 자연 관계 인간 인간 관계 의식주 문제,https://n.news.naver.com/mnews/article/079/0000197777?sid=102
김규동 도시 생활 인간 관계 자연 사회 논의 가능 도시 연결 고리 시기 예전 번역가,https://n.news.naver.com/mnews/article/036/0000015362?sid=102
강대구 순천 교수 교육 부모 부모 지속 인간 관계 생활 자산 아무것 아이디어 확률,https://n.news.naver.com/mnews/article/036/0000015379?sid=102
연고 지역 이환의 도시 사람 나름 노하우 귀띔 부모 도시 생활 인간 관계 활용 농산물 판로 조언 홍성,https://n.news.naver.com/mnews/article/081/0000125037?sid=102
선택 저자 치열 응기 필치 씨앗 출간 중요 시대 인간관 계의,https://n.news.naver.com/mnews/article/214/0000006518?sid=115
도시 인간 관계 배후 착취 도시 자원 한정 대리 만족,https://n.news.naver.com/mnews/article/036/0000011758?sid=110
