nouns,link
지난해 윤석열 정부 경제 운영 세금 조원 법인세 소득세 소멸 지역 임대 주택 건설 지원 예산 복원 확대 민주당,http://www.laborplus.co.kr/news/articleView.html?idxno=33374
경기도 멘토 상시 모집 경기도 경기도 농수 산진 흥원 운영 경기도 지원 센터 멘토 초보 상시 모집 농수 산진 흥원,https://www.asiatoday.co.kr/view.php?key=20240228010014630
경기도 경기도 농수 산진 흥원 운영 경기도 지원 센터 멘토 초보 상시 모집 경기도 멘토 사업,https://n.news.naver.com/mnews/article/119/0002804189?sid=102
말씀 지속 가능 옥천 목표 착공 창업 학교 체류 조성 사업 추진 예비,http://www.ilyoseoul.co.kr/news/articleView.html?idxno=484836
처음 시작 인증 생각 처음 인증 기준 정도 이해도,https://www.sisaweek.com/news/articleView.html?idxno=212310
허버트 집필 즈음 운동 헬렌 스콧 니어링 조화 비트 세대 훗날 감독 영화 완성 포기 인정 정도 역사 대작,https://www.harpersbazaar.co.kr/article/1861280
염소 소득 작목 부각 산업 규모 증가 염소 산업 규모 증가 효율 국가 예산 운용 기관 고유 과제 재편 용인 정성 평가 확대,http://www.foodnews.co.kr/news/articleView.html?idxno=106909
민주당 국민 역사 해남 완도 진도 귀어 정착지 원금 확대 주거비 지원 문화 복지 카드 파격 지원 전남 마을 조성,https://n.news.naver.com/mnews/article/629/0000268722?sid=102
초기 감나무 해전 겨울 날씨 곰팡이 곶감 건조 상주 명물 곶감 옛말 냉성 작물 인삼 그간 남부 지역 충남 금산 경북,https://n.news.naver.com/mnews/article/018/0005675697?sid=101
실제 인구 만큼 도시 인구수 준비 이유 작목 선택 재배,https://www.ccdn.co.kr/news/articleView.html?idxno=960826
경북 도청 당시 단독 주택 한옥 주택 조성 추진 경험 보통 단독 주택 입주자 은퇴자 대부분 도시 주민 평균 연령 세로,https://n.news.naver.com/mnews/article/022/0003904681?sid=102
인구 궁여지책 평가 과거 경험 임시방편 비판 교류 협의회 보은 홍보 전입자 유치 도움 창원시,https://n.news.naver.com/mnews/article/025/0003341535?sid=102
투자 최소 안정 영농 도모 농창 투자 심층 컨설팅 사업 단계 친화 단계 실행,http://www.namdonews.com/news/articleView.html?idxno=758436
전남 곡성군 협동조합 조합원 연어 동명 관점 자본 포획 상황 강조 생태 전환 실천 공간 해방,http://www.ikpnews.net/news/articleView.html?idxno=62882
성주 사연 대구 요식업 동업자 친구 속아 재산 대구 생각 성주 상주,http://www.seongjuro.co.kr/news/view.php?idx=53438
도농 복합 시인 김제시 김제 생활 경험 기회 제공 단계 체계 지원 지원,http://www.domin.co.kr/news/articleView.html?idxno=1457138
지역 지역민 문화 원주민 기름 분리 농인 농철 퇴비 거름 시골 냄새 이걸 문제 농사철,https://n.news.naver.com/mnews/article/022/0003901253?sid=102
결과 도약 기반 당시 세로 후보 나이 선전 모델 개발 참여 유인 중앙 회가,https://www.thebell.co.kr/free/content/ArticleView.asp?key=202401251729216960105164
본지 취재 올해 정년 퇴임 인생 선배 걱정 여기저기 장성군 관리 교육 스톱,https://www.newsfreezone.co.kr/news/articleView.html?idxno=543860
무모 도전 가능 도전 용기 도전,http://www.sisaweek.com/news/articleView.html?idxno=211477
사업 반야월 깻잎 시작 년차 농협 농민 수상 정도 기술 박사 논문 학위 과정 취득 주위 조합장,https://n.news.naver.com/mnews/article/662/0000036219?sid=102
인천 대형 여객선 공모 손가락 군수 지난해 성과 농어 업인 육성 귀어 유치 활성 도시 장기간 체류,http://www.kyeongin.com/main/view.php?key=20240123010002717
첫해 노지 묘목 홍수 정호 재배 방법 시도 방법 개발 후배 비법 처음 후배,https://n.news.naver.com/mnews/article/056/0011647131?sid=101
시도 시행착오 방법 부동산 매입 시작 강박 관념 해당 지자체 주최,https://n.news.naver.com/mnews/article/421/0007304638?sid=110
부분 미흡 소득 창출 구조 시행착오 창업 철저 준비 필요 조언 정석,https://mbcgn.kr/article/u7bYlD4Lztq-7
베이커리 젊은이 취향 저격 절대 조합 손님 마음 도시 생활 부부 코로나 영향 오이 농장 전념 농부 생활,https://www.mhns.co.kr/news/articleView.html?idxno=571821
하영주 무주군 농업기술센터 활력 팀장 지역 선도 멘토 현실 유도 게스트 하우스 최소 도움 공간 운영 계획 지역,https://www.skyedaily.com/news/news_view.html?ID=218399
활력 하영주 팀장 지역 선도 멘토 현실 유도 게스트 하우스 최소 도움 공간 자리매김 최선 노력,http://sjbnews.com/news/news.php?number=804094
무주군 농업기술센터 활력 하영주 팀장 지역 선도 멘토 현실 유도 게스트 하우스 최소 도움 공간 운영 계획 지역 주민,http://www.domin.co.kr/news/articleView.html?idxno=1454436
투병 친구 강원도 횡성 도시 자연 결심 대장암 완치 판정 결심 가지 작물,https://www.mhns.co.kr/news/articleView.html?idxno=571495
무주군 농업기술센터 활력 하영주 팀장 지역 선도 멘토 현실 유도 게스트 하우스 최소 도움 공간 운영 계획 지역,https://www.jjan.kr/article/20240115580049
무주군 농업기술센터 활력 하영주 팀장 지역 선도 멘토 현실 유도 게스트 하우스 최소 도움 공간 운영 계획 지역,http://www.jjn.co.kr/news/articleView.html?idxno=960028
하영주 무주군 농업기술센터 활력 팀장 무주군 게스트 하우스 지역 선도 멘토 현실 유도 최소 도움 공간 운영,https://n.news.naver.com/mnews/article/002/0002315632?sid=102
무주군 농업기술센터 활력 하영주 팀장 지역 선도 멘토 현실 유도 게스트 하우스 최소 도움 공간 운영 계획 지역 주민,http://www.amnews.co.kr/news/articleView.html?idxno=56696
기존 농공 협동조합 도시 젊은이 입사 자연 생태 목표 경제성장 판명 계속 성장 경제성장,http://www.m-economynews.com/news/article.html?no=41498
차기 여성 조합장 후배 경험 전수 청남 농협 관내 가덕 조합원 숫자 정도,https://cc.newdaily.co.kr/site/data/html/2024/01/11/2024011100150.html
성남 섬유 관련 사업 고향 호법 영농 조합 법인 대선 첫해 양파 양파 육묘 전문가 초빙 교육,http://www.hortitimes.com/news/articleView.html?idxno=31437
도시 고민 부부 옥천군 농업기술센터 전국 처음 시도 방법 우려 주변 시선 지난해 무게 당도,https://n.news.naver.com/mnews/article/662/0000035263?sid=102
단추 공부 성실 채소 샐러드 제공 평택시 통복 전통 시장 시련 오뚝이 자리 최린 농가 엠지 마켓,https://www.farmnmarket.com/news/article.html?no=20541
유입 거점 마련 마을 활동가 양성 우수 외국인 장기 모듈러 주택 조성 상주 도전 응전 역사 도전 발전,http://www.ksmnews.co.kr/news/view.php?idx=462580
정도 감소 대통령 출마 출마 추구 가치,https://n.news.naver.com/mnews/article/437/0000373574?sid=100
알로에 정체 알로에 사포 처음 시작 부부 생활 위기 달성 매출 천연 영양제 비법,https://www.mhns.co.kr/news/articleView.html?idxno=570395
실제 운동 출신 정치인 선생 나름 비판 정치 부분 쓰레기,https://n.news.naver.com/mnews/article/214/0001321943?sid=100
매스컴 이미지 해녀 바다 힐링 환상 지적 인맥,https://n.news.naver.com/mnews/article/421/0007264006?sid=102
활력 농인 환경 적응 농토 정성 노력 자리 겁니다,https://n.news.naver.com/mnews/article/662/0000034879?sid=103
창업 농지 확보 어려움 영체 농지 자원 이동 고민 사례 부분 결핍 초등 학교 실과 교과,http://www.agrinet.co.kr/news/articleView.html?idxno=323733
네트워크 구축 사항 공동 대응 선배 경험 후배 반복 취지 이강삼 회장 시행착오 수산 대학 졸업 정도,http://www.agrinet.co.kr/news/articleView.html?idxno=323672
인터넷 정보 시골 소문 주민 정성 우호 관계 부부 동반 필수 초래 첩경,https://bravo.etoday.co.kr/view/atc_view/14991
성과 극복 농림 축산 식품 공모 선정 협약 공익 수당 향상 장려금 지원 사기 임산물 생산 기반 확충,https://www.gukjenews.com/news/articleView.html?idxno=2888132
장기 관점 유학생 가족 형태 궁극 목표지 시행 초기 학생 학교장 교직원 공감 지역 협력 좌우 학교,https://n.news.naver.com/mnews/article/079/0003846307?sid=102
시절 부모 시골 생활 일기 교통사고 사업 빈털터리 중반 아버지 평생 어머니 도시 직장 생활 난청,https://n.news.naver.com/mnews/article/469/0000776605?sid=103
생각 관광농원 계획 생각 관광농원 취지 영농 숙박 식당 핑장 체육 시설 운영 제도 악용 사례 출발점,https://www.womaneconomy.co.kr/news/articleView.html?idxno=220346
지역 촉진 프로그램 공공 민간 주체 운영 대상 여자 요구 홍보 채널 실험 보완 과정,http://www.bizwnews.com/news/articleView.html?idxno=73147
지역 현안 해결 지방 소멸 대응 유치 계농 정주 기반 확충 효과 조원 예산 낭비 사례,https://n.news.naver.com/mnews/article/662/0000034295?sid=110
참가자 연고 인맥 멘토링 회사 운영 지원 운영 자금 수익 창출 비즈니스 모델 컨설팅 사업 미래 계획 도움,http://www.newsworker.co.kr/news/articleView.html?idxno=311845
부산 엑스포 유치 이불 애초 외교 정보력 부족 김기현 오롯 모임 문화 모임 프로젝트 진행 시작,https://n.news.naver.com/mnews/article/047/0002416262?sid=100
부산 엑스포 유치 이불 애초 외교 정보력 부족 김기현 오롯 모임 문화 모임 프로젝트 진행 시작,https://slownews.kr/101061
모종 품종 모종 상태 점검 파종 시기 중요 포기 제초 포기 방법 가성,https://www.lcnews.co.kr/news/articleView.html?idxno=65882
아내 한국 생활 이야기 고민 체계 준비 필요 조언 사진,http://www.kwangju.co.kr/article.php?aid=1702809000761938028
이대로 부부 지원군 등장 아들 호주 이민 준비 찬수 아버지 제안 고군분투 열무 합류,https://www.mhns.co.kr/news/articleView.html?idxno=568997
추위 칼국수 김밥 올겨울 추위 겨울 부부 거리 가게 운영 장사 운명,https://www.mhns.co.kr/news/articleView.html?idxno=568857
가능 업계 전문가 디지털 데이터 토지 구입 환경 작물 선정 참고 정보,https://www.newsway.co.kr/news/view?ud=2023121316504354786
정주 인구 요인 교육 기관 의료 기관 포함 교육 문화 인프라 모종린 교수 나라 이후 현상 제주 이민 동네 지향 장소 지향 고향 지향,http://www.bosa.co.kr/news/articleView.html?idxno=2212455
수습 실업 부동산 붕괴 경제 예상 궁지 시작 수습 운동 실업 유도 효과,http://www.iminju.net/news/articleView.html?idxno=95156
이후 농약 유기 재배 방식 재배 밀과 이웃 농가 배합 경험 다짐 경기도 양평 천연 발효 유기농,https://www.cbci.co.kr/news/articleView.html?idxno=454775
이유 실행 소극 대응 베이비붐 세대 종사 비율,https://n.news.naver.com/mnews/article/009/0005226178?sid=101
그동안 한시 마을 경험 시행착오 생각 농인 마을 소득 사업,https://n.news.naver.com/mnews/article/009/0005226174?sid=101
사례 아이디어 일정 기간 마을 판단 기회 방안 죽리 마을 인의,https://n.news.naver.com/mnews/article/009/0005226173?sid=101
눈앞 친척 굼벵이 사육 경험 사료 사용 톱밥 교체 전량 폐사 복구 성충 구입 산란,http://www.idaegu.com/newsView/idg202312040110
코오롱 온라인 사업 박재현 상무 도전 스타일 자원 활용 체험 동시 실천 차별 공간 유도,http://www.lawissue.co.kr/view.php?ud=202312051830334613204ead0791_12
강소 극복 과정 진솔 시작 기대 한편 기술원,http://www.aflnews.co.kr/news/articleView.html?idxno=260366
지속 가능 하동 힐링 체험 관광 도시 조성 미래 산업 기반 군수 일반 파도 파괴력 사각 파도 지역 소멸 위기 경제자유구역 개발,http://www.gnnews.co.kr/news/articleView.html?idxno=540427
경상남도 하동 농인 운영 시골 집장가 브랜드 된장 대봉 김부각 딸기 팝업 팝업 변수 브랜드 상업 공간 지루함 죽음,https://n.news.naver.com/mnews/article/024/0000086067?sid=101
지속 가능 하동 힐링 체험 관광 도시 조성 미래 산업 기반 군수 일반 파도 파괴력 사각 파도 지역 소멸 위기 경제자유구역 개발,http://www.shinailbo.co.kr/news/articleView.html?idxno=1795253
지속 가능 하동 힐링 체험 관광 도시 조성 미래 산업 기반 구축 방안 군수 일반 파도 파괴력 사각 파도 지역 소멸 위기 경제자유구역 개발,https://www.viva100.com/main/view.php?key=20231202010000317
지속 가능 하동 힐링 체험 관광 도시 조성 미래 산업 기반 구축 방안 군수 일반 파도 파괴력 사각 파도 지역 소멸 위기 경제자유구역 개발,https://www.polinews.co.kr/news/articleView.html?idxno=626623
지속 가능 하동 힐링 체험 관광 도시 조성 미래 산업 기반 구축 방안 군수 일반 파도 파괴력 사각 파도 지역 소멸 위기 경제자유구역 개발,https://n.news.naver.com/mnews/article/002/0002310238?sid=102
공감 기본 복지 확대 활력 도시 조성 패러다임 군수 파도 지역 소멸 위기 파도 경제자유구역 개발,http://www.newspim.com/news/view/20231201000980
지속 가능 하동 힐링 체험 관광 도시 조성 미래 산업 기반 군수 일반 파도 파괴력 사각 파도 지역 소멸 위기 경제자유구역 개발,http://www.bzeronews.com/news/articleView.html?idxno=637008
개발 재정 위기 군민 좌절감 교육 주거 의료 지역상 침체 총체 정주 기능 상실 지속 가능 하동 힐링 체험 관광 도시 조성 미래 산업 기반,https://n.news.naver.com/mnews/article/629/0000252418?sid=102
지속 가능 하동 힐링 체험 관광 도시 조성 미래 산업 기반 군수 일반 파도 파괴력 사각 파도 지역 소멸 위기 경제자유구역 개발,http://www.kukinews.com/newsView/kuk202312010149
지속 가능 하동 힐링 체험 관광 도시 조성 미래 산업 기반 군수 일반 파도 파괴력 사각 파도 지역 소멸 위기 경제자유구역 개발,https://www.gukjenews.com/news/articleView.html?idxno=2868195
취업 거동 불편 회장 수발 고액 아르바이트 모습 결심 물질 인간 가치 중요시 모습 작가,https://n.news.naver.com/mnews/article/024/0000086026?sid=102
지속 가능 하동 힐링 체험 관광 도시 조성 미래 산업 기반 군수 일반 파도 파괴력 사각 파도 지역 소멸 위기 경제자유구역 개발,https://www.newsfreezone.co.kr/news/articleView.html?idxno=531599
지속 가능 하동 힐링 체험 관광 도시 조성 미래 산업 기반 군수 일반 파도 파괴력 사각 파도 지역 소멸 위기 경제자유구역 개발,http://www.enewstoday.co.kr/news/articleView.html?idxno=2063665
지속 가능 하동 힐링 체험 관광 도시 조성 미래 산업 기반 구축 방안 하승철 군수 지역 소멸 위기 경제자유구역 개발 재정 위기 군민 좌절감,http://www.newsprime.co.kr/news/article.html?no=620745
지속 가능 하동 힐링 체험 관광 도시 조성 미래 산업 기반 군수 일반 파도 파괴력 사각 파도 지역 소멸 위기 경제자유구역 개발,https://www.dnews.co.kr/uhtml/view.jsp?idxno=202312011304098180869
대대 제천 산수 다양 마을 힐링 고민 어려움 보람 희열 길라잡이,https://n.news.naver.com/mnews/article/028/0002666904?sid=102
이사장 함안 농부 협동조합 지역 공동체 기존 편견 지속 성과 시골 생활 매력 이사장 협동조합 이야기 박재민,http://www.knnews.co.kr/news/articleView.php?idxno=1419713
궁극 원주민 갈등 농인 사회 응의 요인 지속 지적 사회 갈등 요인 극복 지자체 정부 차원 다각도 대책 마련 실정,http://www.goodmorningcc.com/news/articleView.html?idxno=300403
강소 극복 과정 진솔 시작 기대 한편 기술원,http://www.ksmnews.co.kr/news/view.php?idx=456262
기술원 강소 극복 과정 조영숙 기술 원장 시작 인과 도움 한편,http://www.kbmaeil.com/news/articleView.html?idxno=976409
경북 기술원 시작 초보 강소 공기 강소 극복 과정 진솔,http://www.kbsm.net/news/view.php?idx=413730
강소 극복 과정 시작 기대 한편 강소 민간 전문가,https://www.onews.tv/news/articleView.html?idxno=189344
강소 극복 과정 진솔 시작 기대 기술원,http://www.metroseoul.co.kr/article/20231128500283
경주 노곡 산방 김영도 경주 농업기술센터 권유 체리 와인 경주 지역 강소 현장 강소 농부 극복 과정,http://www.idaegu.com/newsView/idg202311260124
강소 극복 과정 진솔 시작 기대 한편 기술원,https://n.news.naver.com/mnews/article/031/0000791733?sid=102
발간 책자 강소 극복 과정 진솔 조영숙 원장 시작,http://www.kukinews.com/newsView/kuk202311280024
극복 과정 진솔 조영숙 원장 발간 도움 강소 민간 전문가 강소 노고 진심 감사 시작,https://www.smartfn.co.kr/article/view/sfn202311280003
강소 극복 과정 진솔 시작 기대 노컷뉴스,https://n.news.naver.com/mnews/article/079/0003837836?sid=102
강소 극복 과정 진솔 시작 기대 한편 기술원,https://www.ekn.kr/web/view.php?key=20231128010008172
소설 운동 출신 변호사 이태하 정치 환멸 한지섭 종교 강조,https://www.kpinews.kr/newsView/1065596328314172
본지 제주 농협 아카데미 두각 하차 사례 제주 문제 생산량,http://www.jejuilbo.net/news/articleView.html?idxno=217735
올해 사업 과정 제주 귀어 프로그램 희망 인원 최근 사이 제주 이주 사례 일부 언론 노출,http://www.jejumaeil.net/news/articleView.html?idxno=331719
행정 지원 마음 마을 생각 한편 진안군 종합 지원 센터,http://www.jeollailbo.com/news/articleView.html?idxno=712166
박상춘 상무 이사 시설 원예 온실 경영 농가 실시 공과 내부 기자재 운영 필요 서비스 공급 파트너,http://www.agrinet.co.kr/news/articleView.html?idxno=322746
한때 운동 초심 권력 야합 세태 환멸 선택 과학 종교 강조,https://n.news.naver.com/mnews/article/056/0011606561?sid=103
한지섭 정치 환멸 인물 작가 운동 출신 인물 최소한 소설 한편 현실 고발 생각,https://n.news.naver.com/mnews/article/469/0000771221?sid=103
실망 결심 조정래 작가 인물 위력 인간 존엄 사이 작품,https://m.entertain.naver.com/article/396/0000660850
종교 효과 민주 운동 정계 입문 권력 야합 운동 모습 한지섭,https://n.news.naver.com/mnews/article/001/0014342648?sid=103
사례 거주지 생활 고민 포기 이제 메타 버스 시대 메타 버스 가상,https://n.news.naver.com/mnews/article/662/0000032394?sid=110
대다수 생각 아카데미 농부 교육,http://www.jejuilbo.net/news/articleView.html?idxno=217404
문제 인구 유입 공모 사업 추진 미흡 소득 하락 농작물 재해 보험 가입 저조 감소 예상 가운데 생산 콩재 전환 결과 농민 시름,http://www.agrinet.co.kr/news/articleView.html?idxno=322606
영암 관광 교육 농장 창업 실제 창업 사업 세종 조경 영암 전라남도,https://n.news.naver.com/mnews/article/047/0002413045?sid=102
언급 발전 종합 계획 수립 사전 농민 소통 부족 지적 강성중 의원 국민 통영 빈집 농인 운영 비율 사업 효과,http://www.gnmaeil.com/news/articleView.html?idxno=529753
교육 선배 사례 공유 동경 준비 사항 주의 내용 자리 마련 예정 최훈식 군수 교육,http://www.domin.co.kr/news/articleView.html?idxno=1446799
교육 선배 사례 공유 동경 준비 사항 주의 내용 자리 마련 예정 최훈식 군수 교육,http://sjbnews.com/news/news.php?number=798079
교육 선배 사례 공유 동경 준비 사항 주의 내용 자리 마련 예정 최훈식 장수 군수,https://www.newscj.com/news/articleView.html?idxno=3081367
올해 차인 김상 미세 조형찬 부부 막내딸 상미 최근 야구 경기 온라인 예매 전석 매진 바람 현장 구매 노인 발길,https://www.mhns.co.kr/news/articleView.html?idxno=566199
교육 선배 사례 공유 동경 준비 사항 주의 내용 자리 마련 예정 최훈식 군수,https://n.news.naver.com/mnews/article/003/0012205828?sid=102
교육 선배 사례 공유 동경 준비 사항 주의 내용 자리 마련 예정 최훈식 군수 교육,http://www.jeonmin.co.kr/news/articleView.html?idxno=387512
교육 선배 사례 공유 동경 준비 사항 주의 내용 자리 마련 예정 최훈식 군수 교육 지역,http://www.jeollailbo.com/news/articleView.html?idxno=711034
교육 선배 사례 공유 동경 준비 사항 주의 내용 자리 마련 예정 최훈식 군수 교육,https://www.nspna.com/news/?mode=view&newsid=667528
교육 선배 사례 공유 동경 준비 사항 주의 내용 자리 마련 예정 한편 장수군,https://n.news.naver.com/mnews/article/002/0002307581?sid=102
이윤경 전략 주제 토크 진행 작물 선정 유통 판로 개척 조언 예비 호응 행사 운영 러닝,https://www.thekpm.com/news/articleView.html?idxno=180319
재배 식재 가능 생산 농협 유통 안정 소득 장점 초보 인기 작목 과장 금산 지역 농축산물 소비자 국민,http://www.dynews.co.kr/news/articleView.html?idxno=727816
정부 관여 문제 해결 영역 기업 수익 창출 시장 영역 제도 개선 필요 부분 관광 벤처 교육 방식 우회 콘텐츠 개발,https://n.news.naver.com/mnews/article/028/0002664089?sid=101
하미 와인 밸리 인물 시설 채소 장수 식품 머루 시장 관심 가공 시작 산머루,https://n.news.naver.com/mnews/article/021/0002604350?sid=102
진심 대추 어려움 안성시 농업기술센터 농기계 교육 도움 성장 발전 계기 현재,https://www.farmnmarket.com/news/article.html?no=20227
어머니 속도 어머니 남편 중장비 사업 고향 가난,https://www.mhns.co.kr/news/articleView.html?idxno=565720
뚝심 직진 바람 강선영 남편 사과 설도 사과나무,https://n.news.naver.com/mnews/article/047/0002411744?sid=102
경험 확률 운전 가능 공기 은퇴 러시 전원주택 반면 베이비붐 이후 세대 대부분 도시,https://n.news.naver.com/mnews/article/023/0003797319?sid=101
사업 냉동 김밥 개발 유럽 나물 수출 아마존 입점 지역 먹거리 활용 소득 증대 경남 하동 위치 냉동 김밥 생산 업체 복만 최근 눈코,https://n.news.naver.com/mnews/article/022/0003871083?sid=101
일부 증가 속도 지자체 역량 지역 실무 지자체 관리 역량 제각각 상황 대부분 전담 조직,https://n.news.naver.com/mnews/article/016/0002218231?sid=101
예비 현실 조언 곤충 산업 단백질 대체 식품 유망 성장 사업 사업 판로,http://www.domin.co.kr/news/articleView.html?idxno=1445143
과거 창업 과정 경험 교훈 만족 사업 지자체 공공 기관 기업 임야 제공 인과 소작농 나물,http://www.sisajournal-e.com/news/articleView.html?idxno=304668
비교 건강 농사일 생각 사과 생산 누가 목표,http://www.ikpnews.net/news/articleView.html?idxno=61889
역귀 비율 정부 통계 생활 생각 최근 도시 시골 셔틀,http://www.esgeconomy.com/news/articleView.html?idxno=4973
김영조 튜버 평생 지역민 부분,http://news.lghellovision.net/news/articleView.html?idxno=441858
지역 사회 기여 소질 부수 소득 정부 계농 창업 사회 활성 지원 사업,http://topclass.chosun.com/news/articleView.html?idxno=32420
광역 지원 계정 충북 도와 시군 출산 관광 관련 분야 사업 보건 의료 도립 단양군 의료 운영 북부 의료 공백,http://www.ccreview.co.kr/news/articleView.html?idxno=316182
명인 선배 도움 기억 경험 경험 후배 농민,https://n.news.naver.com/mnews/article/662/0000030683?sid=101
농대 입학 본격 실제 상황 필요 기술 농작물 다양 소비자 선호 일시 유행 농민 십상,https://n.news.naver.com/mnews/article/662/0000030596?sid=110
박준호 기자 서울 생활 청산 먹거리 장류 장고 추장 식혜 도전,http://www.namdonews.com/news/articleView.html?idxno=745082
가족 코너 낭만 현실 사이 선인장 농부 일기 소개 옆집 부자 비밀 노트 경험 작물 선인장 시절 부모,https://www.mhns.co.kr/news/articleView.html?idxno=564411
지역 사회 기여 소질 부수 소득 정부 계농 창업 사회 활성 지원 사업 지역 사회,https://n.news.naver.com/mnews/article/009/0005203559?sid=110
낭만 현실 사이 선인장 농부 일기 장맛 손맛 매출 생선 구이 시장 반찬 출구 경험 작물 선인장 시절 부모,http://www.kjdaily.com/article.php?aid=1698046492613867227
부산 동미 시장 가을 황금 정체 낭만 현실 사이 선인장 농부 일기 처음 굼벵이 식용 달팽이 농가 가격,https://www.polinews.co.kr/news/articleView.html?idxno=623148
지역 신설 추진 시도 민주당 권기 창출 확대 효과 설명 목포 의대 대학 병원,https://n.news.naver.com/mnews/article/018/0005598989?sid=100
보성군 투어 농인 체험 선배 농인 경험 토대 시민 보성군 적극 홍보 기대 투어 참가자 득량면 다래 농장,http://www.jndn.com/article.php?aid=1697618168371789107
