nouns,link
거창 아카데미 방송인 삼형제 아빠 생활 일시 방송인 대동여지도 프로그램 전국 소개 전국,https://blog.naver.com/geochanggun/223476353318
남편 성화 정도 생활 적응 정신 주변 생활 도움,https://blog.naver.com/nemoa/223490530094
자금 연구 조사 결과 지원금 오늘 최대 대출 지원금 자격,https://blog.naver.com/pyi53/223411265341
안정 창업 주거 공간 마련 지원 신규 인력 육성 인력 구조 개선 지역 활성 추진 창업,https://blog.naver.com/happy-goseong/223484064808
본인 방문 접수 시군 추이 예산 범위 선발 서산시 농업기술센터 상반기 창업 주택 구입 지원 사업 대상자 공개 모집,https://blog.naver.com/coq/223467538719
해남 부동산 농가 주택 토지 매매 정보 해남 부동산 매물 농가 주택 부속 토지 소개 마당 과수나무 텃밭 매물 시골,https://blog.naver.com/kproland/223452104986
귀향 가지 공통점 나이 전원 고향 귀향 차이점 연고지,https://blog.naver.com/1jessica2/223454470938
남원시 산내면 예비 농어촌 워킹 홀리데이 사전 교육 기초 교육 현장 탐방 진행 농어촌 워킹 홀리데이 일자리 경험 예비,https://blog.naver.com/jbreturn/223463382965
전북 특별 자치 어업 농어촌 일자리 플러스 센터 센터 김명희 이하 센터 예비 관심 이해 확대 남원시 산내면 실상사 학교 시작,https://blog.naver.com/leebangheui/223462525428
계농 업인 지원금 출도 지원 지원금 창업 지원금 창업 지원,https://blog.naver.com/toresi/223419583890
여주 시민 기자단 정명선 기자 주시 아카데미 현장 농업기술센터 새내기,https://blog.naver.com/yeojuhangul/223434521616
보성 전남 보성군 노동면 농가 주택 촌집 토지 매매 계획 관리 지역 보성 계획 고려 요약 대지 토지 필지,https://blog.naver.com/jmlaa13/223488258591
양평군 계획 가요 자금 매입 농지 가요 양평군 촌시 주거 입지,https://blog.naver.com/patty54/223481150896
실현 걸음 선택 고려 도시 이주 생활 방식 직업,https://blog.naver.com/idmaker23/223470045253
센터 오른쪽 예정자 체험 숙소 펜션 전국 체류 지원 센터 유행,https://blog.naver.com/manjisong/223480614561
메카 홍천 기술력 승부 문명 홍천군 농업기술센터 소장 홍천 최근 현장 기술력 승부 홍천군 농업기술센터,https://blog.naver.com/agrostory/223449361812
동탄 어린이집 동탄 가정 어린이집 동탄 어린이집 어린이집 상추 놀자 재료 오감 놀이 태안 태안 먹거리 부모 태안 수혜 집사람,https://blog.naver.com/railroad7/223475534043
어촌 고흥 지구 인구 절벽 도심 도로 고흥 방문자 이야기 정리 내용 순천시,https://blog.naver.com/mega4u/223487556816
가치 경상남도 거창군 농부 사과 열매 사과 작업 사과 수원,https://blog.naver.com/geochanggun/223460352337
가평 학교 경기도 가평군 교육 지원 센터 지정 기쁨 가평 학교 고생 결과 결실 가평군,https://blog.naver.com/pero27/223452708329
서산시 농업기술센터 하반기 창업 주택 구입 지원 사업 대상자 모집 흥청 진행 사업 전업,https://blog.naver.com/seosan_city/223471648757
오늘 김제 수국 재배 이명희 늘봄 수국 농장 준비 고소득 작물 생각 수국 작목 경험,https://blog.naver.com/jbreturn/223469981406
가리 베리 농장 운영 경주 용담 베리 농원 노인 놀이터 정도 생각 생각 경주,https://blog.naver.com/chodb3/223487737748
마음 강의 쇼핑몰 공통점 정도 준비 가요 시골 시골,https://blog.naver.com/lonanj/223393023761
박람회 우수 단체 선정 연합 뉴스 농협 중앙 공동 주최 수원 컨벤션 센터 스마트 창업 박람회 참가 우수,https://blog.naver.com/gokory/223486458789
장기 교육 프로그램 신청 생각 국가 지원 최고 교육 과정 생각 추천 양평 수미 마을 체험 마을 숙식 가능,https://blog.naver.com/ypdurei/223478266944
안녕 경남 주말 체험 체험 장소 부모 텃밭 체험 체험 고기 캠핑,https://blog.naver.com/ej3428/223453704641
보리 찰보리 보리농사 닭발 닭발 석쇠 닭발 일상 제주 제주도 일기 일상 기록 일기 농부 일기 조수리 제주 조수리 초보 농부 키위 키위과 수원 골드 키위 레드 키위,https://blog.naver.com/kit6242/223455297228
안정 하반기 창업 주택 구입 지원 하반기 창업 주택 구입 지원 사업 대상자 모집 모집 기간,https://blog.naver.com/cleanhwasun/223484122145
태안 태안 마늘 밭두둑 비닐 멀칭 주문 감자 양파 마늘 택배 작업 마무리 반복 새벽 관리기 아버지,https://blog.naver.com/railroad7/223485383526
통영 산양읍 맛집 일기 드라이브 위치 통영 살기 통영 산양읍 맛집 일기 경남 통영시 산양읍 산양 중앙,https://blog.naver.com/mintchoco724/223463892784
은퇴자 청년층 지방 지역 활성 기여 지역 활력 타운 영월 금산 구례 지역 도시 은퇴자 타운 하우스 공공 임대 주택 친환경 전원주택,https://blog.naver.com/valust/223442392995
여유 로컬 푸드 매장 납품 텃밭 수입 로컬 푸드 매장 홍천 춘천 방향,https://blog.naver.com/hcgnews/223484404034
봉화 전원생활 학교 교육 일간 문화 가지 촌의 보조금 수령 혜택,https://blog.naver.com/100cholove/223427779786
머리 활성 온몸 말초 감각 신경 세포 진안군 센터 꿀벌 도시 전주 진안 도시 전주 진안,https://blog.naver.com/hykkt/223447396326
국민 일보 주관 일금 서울 센터 전시장 창업 취업 관련 정보 제공 박람회 개최 스마트 시대,https://blog.naver.com/j93231209/223449744746
모비 체험 선장 식물 나라 세계 여행 농장 농산물 체험 예정자 퇴자 출발 인생 오디 벌꿀 꿀벌 체험 채밀 체험,https://blog.naver.com/capitanc/223456355780
개요 희망 도시민 생활 체험 프로그램 개월 거주 농사일 지역 문화 체험 생활 경험,https://blog.naver.com/lysig3887/223487134274
제주 농협 제주 아카데미 농작업 생력화 현장 견학 스마트 농기계 발명 범포 아카데미 교육 관계자 참석 가운데 농작업 생력화,https://blog.naver.com/nh-jeju/223473943871
서귀포시 창업 주택 구입 고민 특별 지원 사업 실시 사업 안정 생활 시작 대출 금리 저금 리의,https://blog.naver.com/seogwipo-si/223477233407
제주 제주도 일기 일상 기록 일기 농부 일기 조수리 제주 조수리 초보 농부 키위 키위과 수원 골드 키위 레드 키위 키위 키위 농원 체험 농원 제주 농원 제주 체험 농원,https://blog.naver.com/kit6242/223475200410
태안 태안 마늘 쪽마늘 감자 수확 책상 탁상 달력 맏이 부모 집사람 어린이집 운영 시작 블로그 세월 흔적,https://blog.naver.com/railroad7/223484285939
안녕 가림 농산 완주군 흰민들레 엉겅퀴 헛개나무 흰민들레 엉겅퀴 열매즙 제조 판매 년차 올해 유럽 텃밭,https://blog.naver.com/tksdichtkfkd/223467834585
가운데 가운데 촌부자 밭최뚝 땅버들 버들개지 바람,https://blog.naver.com/bellaluna0115/223483161539
자급자족 인생 밭농사 논농사 마스터 제부 처형,https://blog.naver.com/parkmirakko/223487909379
준비 생각 목표 설정 과정 도시 목표 설정 과정 필요 목표 설정,https://blog.naver.com/dys351/223476522862
단양군 하반기 창업 주택 구입 지원 사업 신청자 접수 충북 단양군 내달 하반기 창업 주택 구입 지원 사업 신청자 접수 사업,https://blog.naver.com/dong630510/223490433240
박람회 오늘 양재 센터 박람회 참여 후기 작성 양재 센터 박람회 포스터,https://blog.naver.com/sara-farm/223475488260
유기농 당근 경제 공동체 생활 체험 이야기 말씀 제주도 송당리 유기농 당근 교육 국세청 교육 국세 공무원 교육,https://blog.naver.com/ydk825/223452416262
상주시 시장 강영석 일금 일일 일간 서울시 양재동 에이티 센터 개최 박람회 참가 상주시 다양 소개 출처 주시,https://blog.naver.com/greatsangju/223476708672
날씨 자연 투어 소개 시작 홍성 기준 도시 지역 주민 등록 주소 희망 시민 대상 투어 진행,https://blog.naver.com/happytourshare/223442638167
선택 생활 자연 선택 언년 세월 일상 자연 작목 작물 반려 아침 소리,https://blog.naver.com/mcsb5098/223426044818
노즐 패킹 고무 패킹 노즐 텃밭 토마토 가지가지 지식 이야기 제주 제주도 일기 일상 기록 일기 농부 일기 조수리 제주 조수리 초보 농부 키위,https://blog.naver.com/kit6242/223489938874
전북 특별 자치도 임실 사단 장병 대상 전북 안내 상담 전북 학교 명회 개최 전북 학교 운영 사업,https://blog.naver.com/leebangheui/223484186508
태안 경사면 축대 흙벽돌 벽돌 축대 세월 주변 전년 경사면,https://blog.naver.com/railroad7/223469682649
경주 정보 회원 경주 실천 현실 생산 생산 품목 소비자 직거래 지난해 경주 수도산 벚꽃 모임 회원,https://blog.naver.com/chodb3/223377927641
처음 바람 언덕 방문 바람 경상 거창군 농부 바람 언덕 사과 수원 사과 작업 기후,https://blog.naver.com/geochanggun/223487962997
시군 마을 입주자 모집 최장 개월 숙소 연수 프로그램 제공 경상 도지사 박완수 희망 도시민 대상,https://blog.naver.com/gnfeel/223405325661
보리 찰보리 콤바인 추수 보리 추수 제주 제주도 일기 일상 기록 일기 농부 일기 조수리 제주 조수리 초보 농부 키위 키위과 수원 골드 키위 레드 키위 키위 키위 농원,https://blog.naver.com/kit6242/223471237325
태안 양파 수확 양파 양파 고령 시골 품앗이 일손 아버지 금요일 저녁 태안 퇴근,https://blog.naver.com/railroad7/223474358286
제주 동쪽 당근 주스 당근 맛집 팥죽 제주 제주도 일기 일상 기록 일기 농부 일기 조수리 제주 조수리 초보 농부 키위 키위과 수원 골드 키위 레드 키위 키위 키위 농원,https://blog.naver.com/kit6242/223486187140
트랙터 서부 농업기술센터 방제 제주 제주도 일기 일상 기록 일기 농부 일기 조수리 제주 조수리 초보 농부 키위 키위과 수원 골드 키위 레드 키위 키위 키위 농원 체험 농원,https://blog.naver.com/kit6242/223483720355
농부 보릿고개 곡물 신토불이 제주 제주도 일기 일상 기록 일기 농부 일기 조수리 제주 조수리 초보 농부 키위 키위과 수원 골드 키위 레드 키위 키위 키위 농원,https://blog.naver.com/kit6242/223477477117
막내 놀이 제주 제주도 일기 일상 기록 일기 농부 일기 조수리 제주 조수리 초보 농부 키위 키위과 수원 골드 키위 레드 키위 키위 키위 농원 체험 농원 제주 농원,https://blog.naver.com/kit6242/223439464313
얼기미 곡물 채반 보리 채반 찰보리 탄광 삼겹살 제주 제주도 일기 일상 기록 일기 농부 일기 조수리 제주 조수리 초보 농부 키위 키위과 수원,https://blog.naver.com/kit6242/223473906331
동탄 어린이집 동탄 가정 어린이집 동탄 어린이집 태안 완두콩 수확 완두콩 완두콩 집사람 운영 이지 어린이집 부모 태안 상상,https://blog.naver.com/railroad7/223486567067
밀면 제주 밀면 토토 카페 트랙터 제주 제주도 일기 일상 기록 일기 농부 일기 조수리 제주 조수리 초보 농부 키위 키위과 수원 골드 키위 레드 키위 키위 키위 농원,https://blog.naver.com/kit6242/223428462930
텃밭 토마토 텃밭 오늘 일상 제주 제주도 일기 일상 기록 일기 농부 일기 조수리 제주 조수리 초보 농부 키위 키위과 수원 골드 키위 레드 키위 키위 키위 농원 체험 농원,https://blog.naver.com/kit6242/223473166141
비파 비파주 파담 금주 금술 제주 제주도 일기 일상 기록 일기 농부 일기 조수리 제주 조수리 초보 농부 키위 키위과 수원 골드 키위 레드 키위 키위 키위 농원 체험 농원,https://blog.naver.com/kit6242/223465035002
보리 추수 보리 찰보리 보리 개역 제주 제주도 일기 일상 기록 일기 농부 일기 조수리 제주 조수리 초보 농부 키위 키위과 수원 골드 키위 레드 키위 키위 키위 농원,https://blog.naver.com/kit6242/223472357751
타이어 끈끈이 환상 박피 참개구리 개구리 수원 제주 제주도 일기 일상 기록 일기 농부 일기 조수리 제주 조수리 초보 농부 키위 키위과 수원 골드 키위,https://blog.naver.com/kit6242/223447775090
제주 제주도 일기 일상 기록 일기 농부 일기 조수리 제주 조수리 초보 농부 키위 키위과 수원 골드 키위 레드 키위 키위 키위 농원 체험 농원 제주 농원 제주 체험 농원,https://blog.naver.com/kit6242/223456394865
모기 덤덤 여름 모기 모기 제주 제주도 일기 일상 기록 일기 농부 일기 조수리 제주 조수리 초보 농부 키위 키위과 수원 골드 키위 레드 키위 키위 키위 농원 체험 농원,https://blog.naver.com/kit6242/223480599088
지붕 누수 천정 누수 야자수 야자나무 까치 제주 제주도 일기 일상 기록 일기 농부 일기 조수리 제주 조수리 초보 농부 키위 키위과 수원 골드 키위 레드 키위 키위 키위 농원,https://blog.naver.com/kit6242/223487125462
제주 제주도 일기 일상 기록 일기 농부 일기 조수리 제주 조수리 초보 농부 키위 키위과 수원 골드 키위 레드 키위 키위 키위 농원 체험 농원 제주 농원 제주 체험 농원,https://blog.naver.com/kit6242/223482666173
태안 생활 파이어 피트 시멘트 피트 오랜만 블로그 블로그 주인장 재미,https://blog.naver.com/railroad7/223468559926
얼굴 제주 제주도 일기 일상 기록 일기 농부 일기 조수리 제주 조수리 초보 농부 키위 키위과 수원 골드 키위 레드 키위 키위 키위 농원,https://blog.naver.com/kit6242/223463837834
감귤 수원 방제 인용 매실 제주 제주도 일기 일상 기록 일기 농부 일기 조수리 제주 조수리 초보 농부 키위 키위과 수원 골드 키위 레드 키위 키위 키위 농원,https://blog.naver.com/kit6242/223434495954
제주 제주도 일기 일상 기록 일기 농부 일기 조수리 제주 조수리 초보 농부 키위 키위과 수원 골드 키위 레드 키위 키위 키위 농원 체험 농원 제주 농원 제주 체험 농원,https://blog.naver.com/kit6242/223449004757
제주 제주도 일기 일상 기록 일기 농부 일기 조수리 제주 조수리 초보 농부 키위 키위과 수원 골드 키위 레드 키위 키위 키위 농원 체험 농원 제주 농원 제주 체험 농원,https://blog.naver.com/kit6242/223478685216
토양 수분 토양 토양 온도 제주 제주도 일기 일상 기록 일기 농부 일기 조수리 제주 조수리 초보 농부 키위 키위과 수원 골드 키위 레드 키위 키위 키위 농원,https://blog.naver.com/kit6242/223458288428
제주 바람 제주 제주도 일기 일상 기록 일기 농부 일기 조수리 제주 조수리 초보 농부 키위 키위과 수원 골드 키위 레드 키위 키위 키위 농원 체험 농원 제주 농원,https://blog.naver.com/kit6242/223440675653
에어컨 수리 에어컨 에어컨 에러 내기 배관 센서 제주 제주도 일기 일상 기록 일기 농부 일기 조수리 제주 조수리 초보 농부 키위 키위과 수원 골드 키위,https://blog.naver.com/kit6242/223488908185
날씨 농부 모자 직장인 양복 출근 머리 농부 모자 바버 제주 제주도 일기 일상 기록 일기 농부 일기 조수리,https://blog.naver.com/kit6242/223460525372
주차 시골 주차 대문 주차 제주 제주도 일기 일상 기록 일기 농부 일기 조수리 제주 조수리 초보 농부 키위 키위과 수원 골드 키위 레드 키위 키위 키위 농원 체험 농원,https://blog.naver.com/kit6242/223484928954
제주 제주도 일기 일상 기록 일기 농부 일기 조수리 제주 조수리 초보 농부 키위 키위과 수원 골드 키위 레드 키위 키위 키위 농원 체험 농원 제주 농원 제주 체험 농원,https://blog.naver.com/kit6242/223461650129
광어 액비 액비 해초 액비 제주 제주도 일기 일상 기록 일기 농부 일기 조수리 제주 조수리 초보 농부 키위 키위과 수원 골드 키위 레드 키위 키위 키위 농원 체험 농원,https://blog.naver.com/kit6242/223457575276
제주 제주도 일기 일상 기록 일기 농부 일기 조수리 제주 조수리 초보 농부 키위 키위과 수원 골드 키위 레드 키위 키위 키위 농원 체험 농원 제주 농원 제주 체험 농원,https://blog.naver.com/kit6242/223454203313
제주 제주도 일기 일상 기록 일기 농부 일기 조수리 제주 조수리 초보 농부 키위 키위과 수원 골드 키위 레드 키위 키위 키위 농원 체험 농원 제주 농원 제주 체험 농원,https://blog.naver.com/kit6242/223462822503
예초 일상 기록 제주 제주도 일기 일상 기록 일기 농부 일기 조수리 제주 조수리 초보 농부 키위 키위과 수원 골드 키위 레드 키위 키위 키위 농원 체험 농원,https://blog.naver.com/kit6242/223441828978
도전 이름 국수 비빔국수 잔치국수 비오 제주 제주도 일기 일상 기록 일기 농부 일기 조수리 제주 조수리 초보 농부 키위 키위과 수원 골드 키위,https://blog.naver.com/kit6242/223487952762
제주 제주도 일기 일상 기록 일기 농부 일기 조수리 제주 조수리 초보 농부 키위 키위과 수원 골드 키위 레드 키위 키위 키위 농원 체험 농원 제주 농원 제주 체험 농원,https://blog.naver.com/kit6242/223479801049
서산시 협회 회장 박형식 관내 홀몸 노인 이주노 동자 다문화가정 막장 전달 지역 사회 사진 서산시 협회 협회 회원,https://blog.naver.com/coq/223468785532
치과 농부 이야기 농부 일상 제주 제주도 일기 일상 기록 일기 농부 일기 조수리 제주 조수리 초보 농부 키위 키위과 수원 골드 키위 레드 키위 키위 키위 농원 체험 농원,https://blog.naver.com/kit6242/223481407927
카페인 음료 체력 나라 제주 제주도 일기 일상 기록 일기 농부 일기 조수리 제주 조수리 초보 농부 키위 키위과 수원 골드 키위 레드 키위 키위 키위 농원 체험 농원,https://blog.naver.com/kit6242/223452961855
라이더 제주 라이더 취미 일상 오늘 일상 제주 제주도 일기 일상 기록 일기 농부 일기 조수리 제주 조수리 초보 농부 키위 키위과 수원 골드 키위 레드 키위 키위 키위 농원,https://blog.naver.com/kit6242/223443774418
사과 모티브 조각 조각가 감탄 예산 성임제 장집 수덕사 당호 예산 어죽 예산 시장 예산 국수 사고,https://blog.naver.com/womant30/223485069539
박람회 오늘 일산 킨텍스 박람회 참여 후기 출처 일산 킨텍스 박람회 포스터,https://blog.naver.com/sara-farm/223481715034
고창군 다양 강의 예비 뉴스 블럭 옥천군 교육 교육 모집 뉴스 블럭 인천 뿌리 기업 채용 박람회,https://blog.naver.com/serioso27/223486683106
지점 위치 주말 별장 주택 가족 휴양 주택 하우스 강태공 숙소 주택 포항시 남구 장기면 동해 바다 권역 우수 주택 추천,https://blog.naver.com/p4179/223490698750
