nouns,link
지난해 가구 가구 전년 가구 가구 증가 가구 증가 도시 지역 인간 관계 어려움 페미니즘 록지,https://n.news.naver.com/mnews/article/032/0003108964?sid=102
지난해 가구 가구 전년 가구 가구 증가 가구 증가 도시 지역 인간 관계 어려움 페미니즘 록지,https://n.news.naver.com/mnews/article/032/0003107509?sid=102
고기 축제 문화 축제 확장 인간 관계 심층 고민 축제 프로그램 공급 기획 운영 주체 예술가 청년 확대 회다지소리 지역 대표,http://www.kado.net/news/articleView.html?idxno=1094462
튜버 귀어 산촌 방식 모작 사람 이야기 주특기 건강 운동 습관 인간 관계 관리,https://n.news.naver.com/mnews/article/586/0000029651?sid=103
아내 의견 중요 사진 뉴시스 초원 그림 자연 인간 관계 걸림돌 작용 공산 친구 친지 사람 사람,http://www.thescoop.co.kr/news/articleView.html?idxno=52061
가족 친구 부부 사제 인간 관계 소리 잔소리 호의 관계 추비 농작물 성장 도움 유기 농산물 수확 중요,http://www.dynews.co.kr/news/articleView.html?idxno=642609
흐름 평생 직장 개념 현상 위기 인간 관계 스트레스,http://www.mdilbo.com/detail/WYXZ2h/654288
인간 관계 주장 교육 위탁 기관 성과급 지급 위탁 기관 경쟁 유도 필요,http://www.breaknews.com/831986
충남 홍성군 사례 교육 교육 기관 지역 단체 지원 지역 교육 인간 관계 주장 교육 위탁 기관,http://www.kmaeil.com/news/articleView.html?idxno=302802
충남 홍성군 사례 교육 교육 기관 지역 단체 지원 지역 교육 인간 관계 주장 교육 위탁 기관,http://www.weeklytoday.com/news/articleView.html?idxno=401654
기계 고장 정도 기간 인간 사이 관계 기계 이사 내천 마을 후반 상경 노동 노동 노동 결혼 노동 육아 노동 노동,https://n.news.naver.com/mnews/article/047/0002324879?sid=103
발효 과정 인간 관계 교육 기술 교육 갈등 해결 모색 필요,https://n.news.naver.com/mnews/article/025/0003126636?sid=101
한국 경제 연구원 실시 촌인 실태 장기 추적 조사 복수 응답 지역 사회 생활 노동 마을 사람 인간 관계,http://www.nongmin.com/article/ar_detail.htm?ar_id=608558
인구 증가 활성 필요 조건 역귀 지속 발생 사회 기업 구성원 친소 이해 배려 인간 관계 마을 활성,http://www.seoulwire.com/news/articleView.html?idxno=447812
평소 인간 관계 제약 돼지 전염병 명절 가족 방문 자제 정책 고립 동네 유지 기여 원주민,http://www.laborplus.co.kr/news/articleView.html?idxno=27451
경로 일자리 인간 관계 건강 행복감 한국 일부 지자체 시니어 타운 고소득 시니어 타운 사업,http://www.insnews.co.kr/design_php/news_view.php?num=66111&firstsec=2&secondsec=21
광주 자동차 이내 위치 지리 특성 지난해 가구 주민 유대 마을 인간 관계 고려 철거 관리 요구,http://www.mdilbo.com/detail/jA1Ziw/649364
부장 생각 인간 관계 스트레스 마음 경제 부분,http://www.kukinews.com/newsView/kuk202105280063
교육 프로그램 홍성 인간 관계 네트워크 도움 멘토 센터 사람 고민 과정 가공 식품 누룽지,http://www.thekpm.com/view.php?ud=20210601093733334342ef4e12e4_17
덕분 상질 버섯 생산 페이지 분량 계획서 작성 아내 설득 작물 사람 인간 관계 사회생활 관계,http://www.thekpm.com/view.php?ud=20210601093359263142ef4e12e4_17
한국 농수산 대학교 수석 졸업 고향 부안 작목 육묘 어린잎 채소 김민석 스마트 도입 대학원 진학 견문 활동 인간 관계,http://www.jjn.co.kr/news/articleView.html?idxno=826969
한양대 학교 인간 관계 산업 조직 심리 강의 기업 지인 업종 사람 택배 관련 아르바이트 창업,http://www.lecturernews.com/news/articleView.html?idxno=67750
연구 개발 지원 제출 미암면 지역 사회 보장 협의 위기 가구 내부 환경 정비 도배 경직 인간 관계 회복 정신 거리 계기,http://www.newsmaker.or.kr/news/articleView.html?idxno=114424
이동신 강사 특강 지역 주민 관계 유지 인간 관계 기술 인문학 설명 신규 농법 수익 이웃 관계,http://www.lecturernews.com/news/articleView.html?idxno=64985
연애 고집 아내 설득 포기 결혼 인간 관계 집안 경제,http://www.ikpnews.net/news/articleView.html?idxno=43815
운영 활성 대책 수립 생활 체육 카로 육성 스포츠 테마파크 정비 전통문화 발굴 학교 운영 위원회 교육 체육 분야 인간 관계 령인 정체,https://n.news.naver.com/mnews/article/002/0002181800?sid=102
상대 장점 단점 인정 인간 관계 자리 충고 퇴직 시골 사업,http://www.kmaeil.com/news/articleView.html?idxno=273241
비닐 논리 이유 나중 생태 학교 자연 인간 관계 이해 타산 접근 서로 믿음 바가지 그것,http://www.ccdn.co.kr/news/articleView.html?idxno=696200
한국 농수산 대학교 수석 졸업 고향 부안 작목 육묘 어린잎 채소 김민석 스마트 도입 대학원 진학 견문 활동 인간 관계,http://sjbnews.com/news/news.php?number=709182
골살 은퇴자 일정 기간 골살이 경험 문제 생활 환경 경제 여건 시골 인간 관계 현장,http://www.thescoop.co.kr/news/articleView.html?idxno=50139
경쟁 사회 소음 먼지 신분 차별 시선 피곤 인간 관계 자유 자유 개념 강조 자급자족 생계 지역 생산 소비 동시,https://n.news.naver.com/mnews/article/028/0002536368?sid=110
주민 화합 인간 관계 생활비 부족 인구 감소 농어민 수당 확대 연금 확대 국민 연금 현실 소득 안정,http://www.goodmorningcc.com/news/articleView.html?idxno=247803
언니 텃밭 경북 상주 봉강 공동체 언니 텃밭 지역재단 경제 자립 봉강 공동체 생태 인간 자연 관계 자연 다양,https://n.news.naver.com/mnews/article/047/0002302977?sid=102
코로나 계기 관심 증가 포기 논농사 매력 시골 성패 경제 인간 관계 중요 시골 비용,https://n.news.naver.com/mnews/article/262/0000014206?sid=103
협의회 업무 농인 전화 신과 관계 인간 대면 관계 사회 소외 극복 관건,http://www.joongdo.co.kr/web/view.php?key=20210113010004226
정점 권력자 사람 지배 관계 인간 자연 남성 여성 지배 정토회 에코 붓다 이사 운동 본부 정책 연구소 소장 국민농업포럼 공동 대표 환경운동연합 한살림,http://www.bulkwang.co.kr/news/articleView.html?idxno=35857
트렌드 진행형 라이프 스타일 도시민 인구 수용 인간 관계 사람 사람 모양,http://www.gndomin.com/news/articleView.html?idxno=263980
진안군 부귀면 임진 최선희 카페 개업 운영 과정 배경 인간 관계 뒷말 서로 오롯 어른 친구,http://www.domin.co.kr/news/articleView.html?idxno=1322935
인간 관계 형성 미디어 이용 감소 은퇴자 공동체 마을 은퇴자 공동체 마을 입주 동기 환경 휴식 정착지 탐색,http://www.cstimes.com/news/articleView.html?idxno=444255
인간 관계 형성 미디어 이용 감소 조사 은퇴자 공동체 마을 퇴자 공동체 마을 입주 동기 환경 휴식 정착지,https://n.news.naver.com/mnews/article/014/0004551744?sid=102
인간 관계 형성 미디어 이용 감소 은퇴자 공동체 마을 은퇴자 공동체 마을 입주 동기 환경 휴식 정착지,https://www.wikitree.co.kr/articles/603614
동생 도시 머릿속 개인주의 전체 협력 과정 인간 관계 경제 시스템 교육,http://www.ikpnews.net/news/articleView.html?idxno=42764
인간 자연 관계 소로 생각 시작 월든 수백 동창 재하 혜원 생활 그동안 도시 생활,https://www.artinsight.co.kr/news/view.php?no=51080
셀프 유배 생활 필요 인간 관계 정리 중도 전국 지자체 관광 활성 개발 귀어 인구 유입 프로그램,https://n.news.naver.com/mnews/article/023/0003579508?sid=103
인구 제안 반대 운동 처음 마음 인간 관계 욕심 마련,http://bravo.etoday.co.kr/view/atc_view.php?varAtcId=11754
장년층 이야기 의외 청년 인구 도시 직장 생활 인간 관계 피로감 공기,https://n.news.naver.com/mnews/article/028/0002518950?sid=103
시골 대안 인구 유입 인간 관계 전원생활 거기 사람 사회 존재 존재,http://www.knnews.co.kr/news/articleView.php?idxno=1336381
디지털 비즈니스 센터 앤드루 맥아피 교수 컴퓨터 로봇 상징 기계 인간 관계 설정 지구 행사 소비 활용 제약 전략,https://n.news.naver.com/mnews/article/009/0004680927?sid=103
인간 관계 좌우 마을 이웃 관계 중요 원칙 마을 주민 리더 중심 문제 해결 모습 지속 마을,https://n.news.naver.com/mnews/article/002/0002155924?sid=102
규모 확대 유일 경영 전략 대뇌 전두엽 기입 금수 대농 승계 청장년 인과 자본 경험 인간 관계 시골 좌충우돌 수저 삼무 청년,http://www.agrinet.co.kr/news/articleView.html?idxno=180065
작가 굴곡 도시 자연 치유 마음 극복 자연 인간 관계 추구,http://sjbnews.com/news/news.php?number=695212
굴곡 도시 화백 자연 마음 자연 인간 관계 추구 구상 작품 자연,http://www.jjan.kr/news/articleView.html?idxno=2093015
도시 자연 마음 치유 경험 김우철 화백 자연 인간 관계 추구 자연,http://www.jjn.co.kr/news/articleView.html?idxno=809900
와의 소통 농장 운영 스타 벨리 사이버 힐링 스타 밸리 캐릭터 대화 이벤트 인간 관계 차별 사랑 게임 인디 게임,http://www.kukinews.com/newsView/kuk202009290278
어려움 정관용 유현준 그게 상대 계속 카운터 파트 국가 자연 인간 관계,https://n.news.naver.com/mnews/article/079/0003405305?sid=103
세대 전략 사회 경제 기반 취약 비승 계농 자금 정보력 부족 인간 관계 포기 지역 사회 부족 기반 생산 주력 낭패 십상 아이디어 강점 필요,http://www.nongmin.com/article/ar_detail.htm?ar_id=312380
인간 관계 규정 시대 건강 인간 관계 계발 태도 다각 동네 가운데 골목길,http://www.netongs.com/news/articleView.html?idxno=205560
인간 관계 규정 시대 건강 인간 관계 계발 태도 다각 동네 가운데 골목길,https://n.news.naver.com/mnews/article/047/0002277301?sid=103
직장 퇴직 예전 아내 결심 시설 경험 현실 어려움 마을 주민 원활 인간 관계 최우선 과젭니다 소득,http://www.mpmbc.co.kr/bbs/board.php?bo_table=news&wr_id=190432&sca=%EB%89%B4%EC%8A%A4%ED%88%AC%EB%8D%B0%EC%9D%B4
전형석 집사람 산골 마을 시설 경험 현실 어려움 마을 주민 원활 인간 관계 최우선,https://chmbc.co.kr/article/BXlMyGhWedxjF2
전형석 집사람 산골 마을 시설 경험 현실 어려움 마을 주민 원활 인간 관계 최우선,http://www.mbceg.co.kr/post/79243
귀어 번지 전남 가다 우수 사례 청춘 영농 조합 법인 청년 의기투합 품목 평소 도시 인간 관계 틈새시장 완도 전복,http://www.nongmin.com/article/ar_detail.htm?ar_id=309967
사도 세자 정약용 선생 아명 미용 인간 관계 인생 문제 국민,http://www.kyeonggi.com/news/articleView.html?idxno=2289803
환산 인간 관계 소규모 공동체 사람 실망 현실 인습 편견 속박 공동체 압력,https://n.news.naver.com/mnews/article/023/0003533255?sid=103
중요 자연 풍광 사람 인간 관계 이웃 박인호 전원 칼럼니스트,http://www.nongmin.com/article/ar_detail.htm?ar_id=309537
시골 인간 관계 파종 작물 수확 기쁨 감동 보람 한편,http://www.jbnews.com/news/articleView.html?idxno=1290864
유년 시절 아들 도시 생활 경험 결심 김한국 인간 관계 소원 가치관 아버지,http://www.domin.co.kr/news/articleView.html?idxno=1290997
생각 편의 시설 도시 투자 인간 관계 사회 활동 핵심 별개 연결 은퇴 사회 활동,https://n.news.naver.com/mnews/article/015/0004322414?sid=101
경남 기술원 원장 달연 최근 증가 유도 지난해 영농 반면 부모 형제간 갈등 마을 주민 인간 관계 어려움 기준 보통,http://www.nongmin.com/article/ar_detail.htm?ar_id=308331
경상남도 기술원 원장 달연 최근 증가 유도 영농 반면 부모 형제간 갈등 마을 사람 인간 관계 어려움 리커트,http://www.aflnews.co.kr/news/articleView.html?idxno=168872
마을 사람 인간 관계 어려움 리커트 보통 단계 구성 측정 방법 척도 기준 보통 하로 조사,http://www.gnnews.co.kr/news/articleView.html?idxno=441013
경상남도 기술원 최근 증가 유도 영농 창업 반면 부모 형제간 갈등 마을 사람 인간 관계 어려움 리커트 척도,http://www.thekpm.com/view.php?ud=202004020855258598931afa4cb1_17
경상남도 기술원 원장 달연 최근 증가 유도 영농 반면 부모 형제간 갈등 마을 사람 인간 관계 어려움 리커트 척도,http://www.newsfarm.co.kr/news/articleView.html?idxno=54691
경남 기술원 최근 증가 영농 반면 부모 형제간 갈등 마을 사람 인간 관계 어려움 리커트 척도,http://www.knnews.co.kr/news/articleView.php?idxno=1322511
경남 기술원 최근 증가 유도 영농 창업 반면 부모 형제간 갈등 마을 사람 인간 관계 어려움 리커트 척도,http://www.gndomin.com/news/articleView.html?idxno=237645
경상남도 기술원 최근 증가 유도 창업 반면 부모 형제간 갈등 마을 사람 인간 관계 어려움 리커트 척도,http://www.idomin.com/news/articleView.html?idxno=725712
경상남도 기술원 최근 증가 유도 영농 창업 반면 부모 형제간 갈등 마을 사람 인간 관계 어려움 리커트 척도 기준 보통 하로,http://www.weeklytoday.com/news/articleView.html?idxno=164167
경남 도농 기원 창업 만족 조사 결과 발표 경남 도농 기원 최근 증가 반면 부모 형제간 갈등 마을 사람 인간 관계 어려움 리커트 척도,http://www.viva100.com/main/view.php?key=20200331010012655
경남 기술원 원장 달연 최근 증가 유도 영농 반면 부모 형제간 갈등 마을 사람 인간 관계 어려움 리커트 척도,http://www.kukinews.com/news/article.html?no=769934
경상남도 기술원 최근 증가 유도 영농 창업 반면 부모 형제간 갈등 마을 사람 인간 관계 어려움 리커트 척도,http://www.ilyoseoul.co.kr/news/articleView.html?idxno=379419
경남 기술원 최근 증가 유도 영농 창업 반면 부모 형제 갈등 마을 사람 인간 관계 어려움 리커트 척도,https://n.news.naver.com/mnews/article/003/0009786568?sid=102
제과 회사 승진 보장 양씨 인간 관계 스트레스 아내 원씨 적극 권유 결심 년차 초보 농부 병충해 기술 부족 패의,http://www.nongmin.com/article/ar_detail.htm?ar_id=307790
포세 대연 결혼 출산 마련 인간 관계 포함 세대 시대 청년 관내 경로당 개소 여성 아동 안심 지킴 운영 세대 다양 여성 안전,http://sjbnews.com/news/news.php?number=678818
인간 관계 읍사무소 직원 농협 농자 센터 직원 교류 세월 병원 고향 연고 사람,http://www.smartfn.co.kr/view.php?ud=202001100955497861b45d942afb_46
창군 출산 번지 자리매김 배경 센터 농어촌 놀이터 포세 대연 결혼 출산 마련 인간 관계 포함 세대 시대 청년,https://n.news.naver.com/mnews/article/014/0004387760?sid=102
물건 인간 관계 자연 정리 제주 자연 가족 분리 독립 현실 제주 혜택 육지 소도시 생활 추천,http://topclass.chosun.com/board/view.asp?catecode=R&tnu=202003100006
버그 현실 충격 과정 심폐 작품 인간 관계 행운 가족,http://www.viva100.com/main/view.php?key=20200126010008448
시골 해결 어려움 시골 마을 베이비붐 세대 인간 관계 도시 배경 형성 퇴직,https://n.news.naver.com/mnews/article/028/0002480999?sid=101
인간 관계 필요 소로 소로 고독 상담 시골,https://n.news.naver.com/mnews/article/032/0002984193?sid=102
이제 마을 문제 발굴 해결 웃간 인간 관계 회복 마을 청년 공동체 청년 네트워크 연합 발전 세미나 개최 청년 토크,http://www.incheonilbo.com/news/articleView.html?idxno=1014208
경제 요인 기존 토착민 교류 인간 관계 형성 문제 한국 경제 연구원 발표 자료 인구 기존 마을 주민 갈등 경험,http://www.namdonews.com/news/articleView.html?idxno=549928
로망 가차 질주 산골 만사 착오 장애 점철 감회 인간 관계 시골 생활 애환,http://bravo.etoday.co.kr/view/atc_view.php?varAtcId=9990
경제 요인 기존 주민 교류 인간 관계 형성 문제 한국 경제 연구원 발표 자료 인구 기존 마을 주민 갈등 경험 선입 견과,https://n.news.naver.com/mnews/article/022/0003412445?sid=110
행정 혁신 소득 증대 사회 복지 분야 망라 위기 극복 과제 선정 강좌 주제 관리 변화 재테크 인간 관계 내용 구성 변화,http://www.yeongnam.com/mnews/newsview.do?mode=newsView&newskey=20191107.010300815140001
평화재단 기획 실장 대통령 자문 지속 가능 발전 위원회 전문 위원 전국귀농운동본부 부본 부장 아프가니스탄 생산력 생산 관계 인간 관계 방법,http://www.hyunbulnews.com/news/articleView.html?idxno=301595
한편 연고 어려움 인간 관계 누가 지역 사회 정서 규칙 외지인,http://www.mhns.co.kr/news/articleView.html?idxno=319420
인간 관계 진다 개인 주변 이웃 갈등 심화 이웃 마을 자치,https://n.news.naver.com/mnews/article/002/0002108471?sid=102
반복 일상 인간 관계 주인공 현실 주인공 고향 사진 키미 엄마 호박잎쌈 수제 쌈장 영상 캡처 키미,http://www.dailypop.kr/news/articleView.html?idxno=41682
무스 부시 토끼 사찰 속세 유혹 범상 이름 메뉴 식물 대표 미국 공부 음식 인간 관계 고민 시작 공부 동물 고통,https://n.news.naver.com/mnews/article/011/0003618018?sid=102
완주군 여성 청년 가능 완주군 서면 최첨단 준비 미소 인간 관계 경영 능력 현재 미래 사용,http://www.domin.co.kr/news/articleView.html?idxno=1261737
년차 지난해 소셜 네트워크 서비스 카카오 플러스 부부 판매 표고버섯 인간 관계 도시 마을 공동체 진정 이웃 도움,https://n.news.naver.com/mnews/article/011/0003615522?sid=101
교육 식구 주변 여성 정보 교환 인간 관계 남편 시골 최근,https://n.news.naver.com/mnews/article/005/0001236858?sid=110
나무 인간 생각 올해 복숭아 수확 복숭아나무 요즘 공생 관계 인간 식물 이용 식물 착취 생각,https://n.news.naver.com/mnews/article/020/0003238850?sid=110
사람 상대 유통 회사 종사 양성 대표 인간 관계 결심 창원 마창 국화 수출 농단 일원 전국 작목 기본 하우스,http://www.hortitimes.com/news/articleView.html?idxno=21709
캠프 참가 서울 완주군 사례 자연 매력 시골 불편 그것 매력 인간 관계,https://n.news.naver.com/mnews/article/298/0000284853?sid=004
대학원 생명 그림 소재 자연 인간 유대 관계 도시 산골 사람 시골 도시 사람,http://www.bzeronews.com/news/articleView.html?idxno=409701
대표 공동체 운영 농협 조합장 간담회 참석 청년 농민 인간 관계 도시 신경 여자,http://www.nongmin.com/article/ar_detail.htm?ar_id=300581
뿌리 필요 영양 성분 도시 시골 인간 관계 발생 명암 요철 부처 가운데 토막 사람,http://bravo.etoday.co.kr/view/atc_view.php?varAtcId=9853
연애결혼 출산 경력 취미 인간 관계 기성 세대 포기 세대 농창 관련 정보 플랫 제공 의원 정부,http://www.nongmin.com/article/ar_detail.htm?ar_id=299992
부모 마찬가지 인간 관계 대부분 동네 가구 마을 주민 지려 갈등,http://www.ikpnews.net/news/articleView.html?idxno=38127
교사 생활 저자 일상 집중 마음 치유 텃밭 영화 작업 인간 관계 흔적 본인 내면 성찰 성장 마음 산책,https://n.news.naver.com/mnews/article/469/0000404826?sid=103
김석봉 별생각 시골 성좌 오밤중 도시 인간 관계 생태계 민박 구현 기쁨,http://bravo.etoday.co.kr/view/atc_view.php?varAtcId=9796
청년 취업 고용 불안 연애 결혼 출산 마련 인간 관계 방안 리턴 청년 유입 방안 청년 유출 방지 정주형 사업 모델 강릉 앵커 사업 발굴,https://n.news.naver.com/mnews/article/081/0003011149?sid=102
인간 관계 중요 관계 주문 아들 현직 얘기 그게 생각 영월군,http://woman.chosun.com/client/news/viw.asp?cate=C04&mcate=M1005&nNewsNumb=20190661448
김동재 연구 회장 생활 이해 인간 관계 방법 강의 둘째 깃털 공예 전래 놀이 체험 치즈 체험 흥미 부여 딸기 송이버섯 농장 방문,http://www.gndomin.com/news/articleView.html?idxno=207127
부모 함양 정은진 위성 합창단 활동 언니 오빠 동생 지역 사회 사이 합창단 부모 신뢰 인간 관계 확장,http://www.ibulgyo.com/news/articleView.html?idxno=173762
지원 정책 소개 기계 임대 사업소 미생물 배양 시설 영농 이용 시설 견학 생활 이해 인간 관계 방법 교육 첫날 진행 둘째 흥미,https://n.news.naver.com/mnews/article/002/0002090854?sid=102
교육 과정 첫째 지원 정책 소개 기계 임대 사업소 미생물 배양 시설 영농 이용 시설 견학 김동재 연구 회장 생활 이해 인간 관계 방법 강의,http://www.betanews.net:8080/article/1008749.html
교육 첫날 지원 정책 소개 기계 임대 사업소 미생물 배양 시설 영농 이용 시설 견학 김동재 연구 회장 생활 이해 인간 관계 방법 강의 둘째,http://www.gukjenews.com/news/articleView.html?idxno=1117135
인간 관계 경쟁 칼럼니스트 켈시 머먼 건설 회사 운영 아버지 철학 성장 죽는다 금융 위기 오자 사업,http://www.skyedaily.com/news/news_view.html?ID=84398
지난해 한국 경제 연구원 전국 실태 장기 추적 조사 응답자 복수 가운데 마을 사람 인간 관계 문제 마을 관행 마찰 생활 곤란 남도,https://n.news.naver.com/mnews/article/001/0010773107?sid=102
열풍 정년 퇴임 인구 세대 사회 자연주의 세상 가지 심리 실험 인간 관계 유지 지음 수지 사람 나무 사이,https://n.news.naver.com/mnews/article/094/0000006874?sid=004
인간 관계 수입 규모 출퇴근 패턴 부분 시골 출신 농사일 가난 충만,https://n.news.naver.com/mnews/article/028/0002450141?sid=103
정리 인간 관계 정리 우연 만남 지원 센터 후배 사람 나이 중반 도시 사업 정부 정책 변화,http://www.nongmin.com/article/ar_detail.htm?ar_id=296563
아침마당 가수 김정연 어려움 이야기 오전 방송 교양 프로그램 아침마당 시골 그게 인간 관계 준비,http://tvdaily.co.kr/read.php3?aid=15537326321445707002
첫째 지원 정책 소개 기계 임대 사업소 시설 영농 이용 시설 견학 김동재 연구 회장 생활 이해 인간 관계 방법 강의,http://www.gnmaeil.com/news/articleView.html?idxno=409497
첫째 지원 정책 소개 기계 임대 사업소 시설 영농 이용 시설 견학 김동재 연구 회장 생활 이해 인간 관계 방법 강의 둘째,http://www.gukjenews.com/news/articleView.html?idxno=1086274
교육 과정 첫째 지원 정책 소개 기계 임대 사업소 시설 영농 이용 시설 견학 김동재 연구 회장 생활 이해 인간 관계 방법 강의 둘째,http://www.kukinews.com/news/article.html?no=642863
교육 과정 첫째 지원 정책 소개 기계 임대 사업소 시설 영농 이용 시설 견학 김동재 연구 회장 생활 이해 인간 관계 방법 강의 둘째,http://www.viva100.com/main/view.php?key=20190319010006307
사회 이민 환경 인간 관계 관습 문화 직업 만큼 어려움,http://www.shinailbo.co.kr/news/articleView.html?idxno=1150286
유투 인공지능 강의 준비 농기구 사용법 애플 스마트폰 인간 기계 관계 변화 인공지능 탑재 음성,http://www.redian.org/archive/130810
위원 장애 청년 일자리 제공 지역 사회 인간 관계 외로움 기본,https://n.news.naver.com/mnews/article/047/0002219331?sid=102
기술자 활용 관심 사람 외지 고생 마음고생 낭비 인간 관계 원수 십상 위험 주인,http://www.ikld.kr/news/articleView.html?idxno=200981
은퇴 고령 증가 추정 전문가 현상 앵커 최근 자발 아웃사이더 자처 즉흥 연속 밀도 인간 관계 티슈,https://n.news.naver.com/mnews/article/214/0000924343?sid=102
경북 상주 시설 오이 농장 곽기 첫해 농사일 허탕 지역 선도 농가 김인남 작물 생리 제법 인간 관계 생활 가격 출하량,http://www.nongmin.com/article/ar_detail.htm?ar_id=295055
사람 인간 관계 문제 마을 관행 마찰 생활 곤란 남도 인과 원주민 갈등 체계 관리 지역 공동체 일원,https://jnilbo.com/?p=792590
재취업 창업 봉사 활동 도전 두려움 직무 스트레스 한국 수직 권위주의 가부장 문화 특성 직장 인간 관계 갈등,http://www.metroseoul.co.kr/news/newsview?newscd=2019012100194
관계 처음 인간 관계 스트레스 나름 인생 회사 생각 이유 동경,http://www.marieclairekorea.com/2019/01/lifestyle/%eb%8b%a4%eb%a5%b4%ea%b2%8c-%ec%82%b4%ec%95%84%eb%b3%b4%eb%a0%a4%ea%b3%a0%ec%9a%94/?_N_=01
동귀 연세대 학교 심리학 교수 최근 인구 증가 직장 생활 도시 생활 인간 관계 정신,http://science.ytn.co.kr/program/program_view.php?s_mcd=0082&s_hcd=0020&key=201901091630499647
와중 용기 부자 농부가 사람 소개 리치 남자 대화 인간 관계 생활 방식 태도 주변 정돈 방법 생각,http://www.readersnews.com/news/articleView.html?idxno=91488
지역 영화 리틀 포레스트 인정 유턴 인간 관계 고백,https://n.news.naver.com/mnews/article/088/0000570241?sid=004
