nouns,link
농사터 영농 경영 영농 창업 정리 충남 영농 창업 사업단 졸업,https://blog.naver.com/cnu_fstt/223198824153
계획 어려움 분석 새싹 인삼 수경 재배 농산업 고소득 창출 모델 제시 열정 사연,https://blog.naver.com/ytm1300/223073301402
이유 시골 텃세 특용 작물 카페 음식점 공방 애견 카페 정원 카페 방법,https://blog.naver.com/nicole9262/223361365870
준비 도시,https://blog.naver.com/ysd_62/223354170309
준비 요인 책상 인터넷 검색 준비 자연,https://blog.naver.com/hellopolicy/150140955413
해결 이웃 소통 부재 친화력 손부 작목 선택 성과 재능 시장 가격 판로 작목 선택 연관 묘목 구입 식재 계획 수량,https://blog.naver.com/djwjs190/220562648482
생활 환경 시장 상황 결합 구조 문제 경제 분야 역귀 조사 예방 대책 수립 실정 김호 단국 환경 자원 경제학 교수,https://blog.naver.com/mrbean7/223474354353
도시 시골 낭만 시골 사회 왕따 철저 준비,https://blog.naver.com/fars1/221040235875
순위 선배 노하우 도시 인생 시작 생각,https://blog.naver.com/g8836/120163470492
철저 준비 미래 연구소 임광순 소장 감사 출처 절차,https://blog.naver.com/sangmuk74/221217244585
관심 실제 준비 겁니다 초보 입장,https://blog.naver.com/elcampo/222279911011
텃세 이야기 원주민 도움 간섭 입장 차이,https://blog.naver.com/planamedia1/221442620600
중요 월일 코엑스 박람회 사례 강의 쥔장 자리 부족 불편 가운데 경청 예비,https://blog.naver.com/jkh116/220452108401
,https://blog.naver.com/kirby128/222879176757
이유 일반 불편 교통 의료 시설 문화 생활 겨울 추위 이웃 텃세 축사 냄새 피곤 육체 노동,https://blog.naver.com/sbkim527/221588791474
계획 생각 이주 현실 육하원칙 의거 단계 계획 철저 준비 환경,https://blog.naver.com/hjy0201hi/221193797938
지름길 셋째 승부 지름길 최신식 영농기 구입 토지 경장 주요 영농 기본 경험,https://blog.naver.com/grandpaslove/220969263358
증가 비전 발전 가능 도시 이유,https://blog.naver.com/nongbooygs/221712502470
제반 특성 공부 선택 실제 필자 현장 목격 민원 사항 대부분 토착민 감정 대립,https://blog.naver.com/mrbean7/223465392429
자료 준비 검색 농어촌 뉴타운 사업 실시 생각 필요,https://blog.naver.com/jeju-farm/222717293386
자연 환경 돈벌이 가지 장점 생각 생활 수입 생각,https://blog.naver.com/psw6650/220710673018
전문가 한탕주의 무리 투자 지역 사회 부적응 지적 낭만 철저 준비 의지 시인 십상,https://peaceharmony.tistory.com/entry/%ED%9D%AC%EB%A7%9D%EC%9D%98-%EC%94%A8-%EB%BF%8C%EB%A6%AC%EA%B8%B0-%EA%B7%80%EB%86%8D-5-%EC%8B%A4%ED%8C%A8%EC%97%90%EC%84%9C-%EB%B0%B0%EC%9A%B4%EB%8B%A4
누군가 확정 수매 잎새 생산 잎새 산삼 확정 수매 판로,https://blog.naver.com/smartfarm777/222280344806
동영상 교육,https://blog.naver.com/kyu151515/222320550426
승부 최신식 영농기 구입 토지 경작 주요 경험 기술 동반 모래 목가 생활,https://blog.naver.com/hjseasang2016/221079125436
보따리 이유 최악 사례 미남 얼굴,https://blog.naver.com/kyusil07/221732627593
연고 경북 영양 둥지 경치 생각 집사람 생활 대화 상대,https://blog.naver.com/ksdamss/30112121156
유형 결심 요인 요인 필요 정보 내용 계획 분석 본인 계획 천섬 아침 전원주택 여주 효석 타운 타운 하우스,https://blog.naver.com/dsa3467/220738055608
직장 퇴직 명퇴 사업 노후 준비 건강 문제 다양 엘리트 직장 이유 직업,https://blog.naver.com/jungbub2013/220505322576
지역민 소통 노력 문화 이해 부족 지역민 불화 연결 지적 시골 생활 성패 좌우 도시 시골 문화 간극,https://blog.naver.com/201media/220096255326
영농 준비 세부 자금 구체 판매 계획 수립 건설업 종사 결심 김철민 가명 당시 축산업 시작 축사,https://blog.naver.com/mrbean7/222983970023
준비 부족 분석 한국 흥원 조사 결과 준비 부족,https://blog.naver.com/happysongpa/221049016175
준비 부족 자금 부족 소득 확보 주민 갈등 준비 부족 사전 준비,https://blog.naver.com/jakepark3/220459547211
함평군 농업기술센터 교육 백향 체험 이리네 농장 선진 견학 이리 농장 고집 만큼 신념,https://blog.naver.com/podo01/223105048287
경험담 복합 지식 부족 마음 이야기 스승,https://blog.naver.com/tofhsk691217/222580851985
비율 세대 추월 미래 경제 불안감 요인 재배 품목 농작물 생산,https://blog.naver.com/lk17won/221168940985
농편 목차 의미 사회 경제 영향 의미 농림 수산 식품 지난해 가구 가구 이후,https://blog.naver.com/ipet1002/220475474841
시도 경험 준비 결정 지식 부족 자본 부족,https://blog.naver.com/fallstar17/223367890871
이야기 지리산 백운 농장 수확 저장 올해 작년 산밭 재작년 최소한 작물 보호제 생각,https://blog.naver.com/kumyong68/222976466442
준비 경험 단언 준비 중요 생각 그것,https://blog.naver.com/ranine_/222769844995
지방 소멸 피부 문제 다양 지역 콘텐츠 증가 기여 연습 정리 도전 규모,https://blog.naver.com/merryyear09/222943150863
예상 언급 청창 거대 태풍 계획 의지 계농,https://blog.naver.com/elcampo/223278106552
인구 극소수 극소수 인구 노동 마을 기업 포스팅 감사,https://blog.naver.com/woonynetwork/220645719861
영농 생활 문화 여건 불편 상실감 촌지 병원 대형 슈퍼 불편 그걸,https://blog.naver.com/toj0825/221224824467
휴양 치열 사전 준비 생활 유유자적 여유 생각 반복 반복 시골 인심,https://blog.naver.com/88skrmsp/90112984487
소득 부족 생활 불편 이웃 갈등 고립 자녀 교육 농림 축산 식품 자료 외지인 변혁,https://blog.naver.com/zenbuddhism/221138812710
스타트 환상 투자 기회 공학 학번 사업 풀로 연비누,https://blog.naver.com/phyto-soap/223274845055
실패담 경과 이야기 오늘 준비 과정 확률 태도 필요 정보 생각 대로 첫째 최대한,https://blog.naver.com/baramgr/222880125664
원주민 사전 준비 부족 문제 중요 평가 응답 자의 준비 부족 자금 부족,https://blog.naver.com/phanks/50108380768
가지 최소 준비 단추 오늘 이야기 지난달,https://blog.naver.com/bidrak/220148220575
과정 시골 전원 주택 농막 이동식 주택 컨테이너 하우스 세컨드 하우스 주말농장 경험 사례,https://blog.naver.com/dsgagu2/221615999133
소득 실상 정확 중요 희망 소득 달성 작목,https://blog.naver.com/khj00675/222202493347
전북 김제 사례 청우 민우 지지 열정 화수분 희망 현재 사업 완전 극복,https://blog.naver.com/ytm1300/223141692359
요인 현황 첫째 분석 요인 해결 대안 직접 소득 창출 도움,https://blog.naver.com/grandpaslove/220929391635
부부 기후 기후 변화 유념 재래식 농법 확률 자연,https://blog.naver.com/pilsaga123/220550276182
재배 시작 계획 포부 피력 포인트 농지 좌절 교훈 도전 한우 가격 약세 시작 이득,https://blog.naver.com/taegeon21/110148895446
지역민 소통 노력 문화 이해 부족 지역민 불화 연결 지적 시골 생활 성패 좌우 도시 시골 문화 간극,https://blog.naver.com/khh5700/220538101830
그이 지름길 직후 대형 농기계 구입 트랙터 콤바인 대형 농기계 고가 조작 고장 사고 인적,https://blog.naver.com/imkikyo/90165285076
이유 사례 정리 가족 공감 사례,https://blog.naver.com/culppy/221280776103
실패담 근무 초등 대안 벼리 학교 안식년 허락 속초 이사 현상 오늘 경과보고 포스팅,https://blog.naver.com/baramgr/222876112015
문제 핵심 겁니다 세상 의지 기본 준비물,https://blog.naver.com/uue53/221523901121
소득 부족 커뮤니티 문화 농림 축산 식품 발표 사례 시골 텃세 마을 커뮤니티 불협화음 시골 문화 부적응 역귀 이야기 등장,https://blog.naver.com/lafen77/223459065585
승부 최신식 영농기 구입 토지 경작 주요 경험 기술 동반 모래 목가 전원생활,https://blog.naver.com/ydpodoblog/220047870173
자금력 경쟁력 정보 도시 생각 여유,https://blog.naver.com/leej1199/220054670997
현실 농가 경영 계획 판로 개척 상태 영농 투자 비용 고품질 생산 기본 판로 개척 중점 농가 경영 실속,https://blog.naver.com/djwjs190/220786417974
올해 그것 지난번 결론 이곳저곳 모임 고사 회원 수도,https://blog.naver.com/bonggani/221546726674
올해 교육 전북 전주시 위치 체험 마을 원색 명화 마을 현장 학습 장소 창업 경험 분석 극복 과정 이야기 영농 목표,https://blog.naver.com/nkrf_blog/223388333293
가정 불화 위치 최적 농장 구입 최고 시설 정보 확인 경험 현명 판단 필요,https://blog.naver.com/pamoon/60198000299
대부분 가족 적응 가족 목적 가지 선택 필수 요소,https://blog.naver.com/khj00675/220374468091
첫해 유기농 농약 화학 비료 고집 고추 사과 유기농 동네 부모 지인 말씀,https://blog.naver.com/hojuwh74/20166125133
실패담 직접 교통 사고 아침 태풍 이삭 집사 양계장 하우스 오후 철거 작업 피곤,https://blog.naver.com/baramgr/222877567070
관련 참여 지역 특성 정보 고려 아래 제도 개선 행하 여여 지역,https://nanse.tistory.com/entry/2020-%EA%B7%80%EB%86%8D%EA%B7%80%EC%B4%8C-%EC%B2%AD%EB%85%84%EC%B0%BD%EC%97%85-%EB%B0%95%EB%9E%8C%ED%9A%8C%EC%9E%A5%EC%97%90%EC%84%9C?category=322523
교통사고 월동 표면 가지 요인 작용 첫째 태도 문제 안정 연금 자금,https://blog.naver.com/baramgr/222879285720
처음 오징어 먹물 사용 결과 발효 미숙 제주도 조수리 수호 농원 초보 농부 식당 조심 요즘 일상 오징어 먹물 바게트,https://blog.naver.com/kit6242/222164233370
실제 지역민 불화 마을 주민 문제 사실 문제,https://blog.naver.com/jdyi8589/70143591563
농부 이유 지역 이야기 소개 파프리카 피망 생육 온도 결과,https://blog.naver.com/nong-up/221100213253
농가 부채 중요 연구 모임 적극,https://blog.naver.com/softman_777/221641981003
집계 한국 경제 연구원 도시 농림부 영농 경험 부족 청년층 장기 교육 농인,https://blog.naver.com/hansungnews/221367199130
악화 부부 관계 시골 인심 이웃 관계 생각 시골 인심,https://blog.naver.com/ilivingsense/70138306499
인구 지원 부족 이유 가구 지역민 불화 가구 자녀 교육 영농 본인 사망 가구,https://blog.naver.com/proone2/20140684356
지자체 자금 지원 대다수 찬성 반면 일부 농인 자금 지원 주목 관계자,https://blog.naver.com/l0235l/50124449396
성패 기술 자본 이유 정리 관심 방식 위기 절박감 자리,https://blog.naver.com/baubo/150045239706
우량 농지 한계 농지 구입 우량 농지 지역 사정 주민 거래,https://blog.naver.com/shin5964/220105911797
탈농 환경 부적응 다양 얘기 주제 환경 적응 필요,https://blog.naver.com/containsky/220556015150
그동안 흉내 결과 코로나 시국 회복 회복,https://blog.naver.com/bonggani/222722365502
고립 적응 김귀영 종합 센터 상황 원주민 관심 참견 유학,https://blog.naver.com/wind0631/221043681988
올해 고민 시내 농자 재상 관수 방법 설계 필요 자재 구입 비용 가능,https://blog.naver.com/bonggani/221536024950
자연 위기 기후 동식물 감소 아이엠에프 시절 가구 참고 자료 욕망,https://blog.naver.com/hanj999/120158957085
그이 지름길 직후 대형 농기계 구입 트랙터 콤바인 대형 농기계 고가 조작 고장 사고 인적,https://blog.naver.com/khh5700/220538076162
산촌 선배 작물 재배 의사소통 중요 자리 귀산 판매,https://blog.naver.com/mosh6739/221255860068
생각 초기 이유 소득 부족 일본 신규 농자 소득 경영 어려움,https://blog.naver.com/lawperf/220143489308
준비 농인 지역 주민 갈등 해소 고립 도시 준비,https://blog.naver.com/welcomeyangyang/220705294750
그이 지름길 직후 대형 농기계 구입 트랙터 콤바인 대형 농기계 고가 조작 고장 사고 인적,https://blog.naver.com/idean/70035319571
시련 경제 안정 소득 보장 중요 요인 영농기 마련 사업 자금 조달 부족 소득 일자리 부족 경제 요인,https://blog.naver.com/hwarang35/220312988069
조건 여유 관계 관계 도시 자산 정리 퇴직금 연금 텃밭 생각,https://blog.naver.com/93goldstar/220975673303
연산면 정태현 농가 개화 초기 초세 확보 대신 날씨 일조량 부족 꽃받침 마름,https://blog.naver.com/jcyrion/220842744533
토명 아카데미 배움터 영농 기술 한정 약점 간파 일부,https://blog.naver.com/gagutalktalk/221298106500
갈등 조장 중요 결정 노력 성실 성격 좌우 사실 중요 정부 지원,https://blog.naver.com/jcyrion/220766249835
진행 결과 국내 사례 답습 걱정 필요,https://blog.naver.com/morangoum/222528279812
호박 피자 해남 호박 요리 안녕 해남 만렙 농부 요리 분석 호박 사용 피자 도우,https://blog.naver.com/9951016/221036321721
