nouns,link
영도 해운대구 어린이 보호구역 스쿨 발생 사고 경각심 재발 방지 대책 마련 교내 인력 적극 활용 통학 안전 시스템 구축 답변 집중 모니터링,https://www.newscj.com/news/articleView.html?idxno=3029074
어린이 보호 구역 발생 사고 경각심 재발 방지 안전 통학 확보 마련 교내 인력 적극 활용 통학 안전 시스템 구축 답변 집중 모니터링,https://www.gukjenews.com/news/articleView.html?idxno=2723019
원장 어린이 인사 어린이 프로그램 오랫동안 종이접기 서점 종이접기 공부 사업,https://n.news.naver.com/mnews/article/001/0013952916?sid=102
교내 안전사고 코로나 초기 수학여행 저체온 등교 사고 서울 경기 수원시 어린이 보호구역 스쿨 초등학생 사망 사고 하굣길 안전,https://n.news.naver.com/mnews/article/021/0002572763?sid=102
동래구 동래 교육 지원 과밀 학급 학습 환경 개선 상호 협의 교내 체육 시설 운동장 개방 요청 동래 교육 지원 최근 통학 어린이 안전사고 발생 안전사고 예방,https://www.gukjenews.com/news/articleView.html?idxno=2721648
교육청 지난달 도구 초등 학교 이보호 구역 등교 어린이 비탈길 화물 사망 사고 발생 통학 안전 확보 방법 사업 추진,https://n.news.naver.com/mnews/article/081/0003361379?sid=102
학교 어린이날 하루 교내 운동회 체육복 양쪽 중대 사고 발생 납입 보장 보험료 면제 입면,http://www.insnews.co.kr/design_php/news_view.php?num=74188&firstsec=2&secondsec=26
장재성 교장 축제 미래 과학 기술 경험 사각지대 문화 어린이 경험 선물 과학자 중요 과학 경험 과학 사고,http://www.incheonilbo.com/news/articleView.html?idxno=1193745
재난 사고 사회 환경 변화 제도 보호 국민 체계 서비스 제공 유아 특수 보육 재학 창원시 유니 시티 어린이집 유아 교육 기관 방문 유아,http://www.kukinews.com/newsView/kuk202305120057
동아일보 사설 어린이 눈높이 눈높이 사설 사설 배경 지식 동아일보 자료 사진 교육부 학교 력학 교내 범죄 사고 예방 인공지능 활용 관제,http://kids.donga.com/news/vv.php?type=news&id=20230511123958956578
어린이 추억 선물 노컷뉴스 제보 세상 비리 부당 대우 사건 사고 미담 얘깃거리 이메일 카카오톡 노컷뉴스 사이트,https://n.news.naver.com/mnews/article/079/0003768631?sid=102
이날 전날 성북 소방서 학생 교직원 대상 규모 합동 소방 훈련 실시 코로나 위주 수업 학생 캠퍼스 교내 화재 안전사고,https://www.ekn.kr/web/view.php?key=20230509010002230
어린이날 전날 성북 소방서 학생 교직원 대상 규모 합동 소방 훈련 실시 코로나 위주 수업 학생 캠퍼스 교내 화재 안전사고,http://www.veritas-a.com/news/articleView.html?idxno=456088
어린이날 전날 성북 소방서 학생 교직원 대상 규모 합동 소방 훈련 실시 코로나 위주 수업 학생 캠퍼스 교내 화재 안전사고 발생,https://www.dailysmart.co.kr/news/articleView.html?idxno=72564
지난해 제주 시내 초교 정문 승용차 후진 교내 학생 현장 사고 장소 어린이 보호구역 이유 가중 처벌 사례,https://www.hangyo.com/news/article.html?no=98817
지난해 제주 시내 초등 학교 정문 승용차 후진 교내 학생 현장 사고 장소 어린이 보호구역 이유 가중 처벌 사례,http://www.hidomin.com/news/articleView.html?idxno=514766
어린이 희생 경찰 용의자 미국 텍사스주 야외 대형 쇼핑몰 현지 최근 수년 총기 규제 시중 총기 물량 급증 교내 총기 사고 빈발,https://n.news.naver.com/mnews/article/023/0003762158?sid=104
지난해 제주 시내 초등 학교 정문 승용차 후진 교내 학생 현장 사고 장소 어린이 보호구역 이유 가중 처벌 사례,https://n.news.naver.com/mnews/article/003/0011843619?sid=100
작년 제주 시내 초등 학교 정문 승용차 후진 교내 학생 현장 사고 장소 어린이 보호구역 이유 가중 처벌 충북 충주,http://www.newspim.com/news/view/20230507000026
지난해 제주 시내 초등 학교 정문 승용차 후진 교내 학생 현장 사고 장소 어린이 보호구역 이유 가중 처벌 사례,http://www.shinailbo.co.kr/news/articleView.html?idxno=1698908
국민 김병욱 국회의원 교통사고 처리 특례법 일부 개정 법률안 발의 현행법 스쿨 어린이 중상 합의 관계 형사 처벌 대상 학교 운동장 교내 통학,https://n.news.naver.com/mnews/article/657/0000014589?sid=102
학교 운동장 교내 학로 학교 교통사고 발생 도로 이유 어린이 중상 처벌 김병욱 의원 개정안,https://n.news.naver.com/mnews/article/079/0003766779?sid=102
지난해 제주 시내 초등 학교 정문 승용차 후진 교내 학생 현장 사고 장소 어린이 보호구역 이유 가중 처벌 사례,http://www.seoulwire.com/news/articleView.html?idxno=501353
교내 교통사고 어린이 보호구역 스쿨 동일 처벌 기준 적용 학생 안전 확보 교통사고 예방 기대 국민 김병욱 사진 포항 울릉 국회 교육 위원회 의원 학교 유치원 내부 시설 운동장,https://n.news.naver.com/mnews/article/022/0003809612?sid=102
지난해 제주 시내 초등 학교 정문 승용차 후진 교내 학생 현장 사고 장소 어린이 보호구역 이유 가중 처벌 사례,https://www.cnbnews.com/news/article.html?no=600151
지난해 제주 시내 초등 학교 정문 승용차 후진 교내 학생 현장 사고 장소 어린이 보호구역,http://www.breaknews.com/963367
지난해 제주 시내 초등 학교 정문 승용차 후진 교내 학생 현장 사고 장소 어린이 보호구역 이유 가중 처벌 사례,https://www.ibabynews.com/news/articleView.html?idxno=110971
지난해 제주 시내 초등 학교 정문 승용차 후진 교내 학생 현장 사고 장소 어린이 보호구역 이유 가중 처벌 사례,https://n.news.naver.com/mnews/article/088/0000812427?sid=004
지난해 제주 시내 초등 학교 정문 승용차 후진 교내 학생 현장 사고 장소 어린이 보호구역 이유 가중 처벌 사례,https://www.gokorea.kr/news/articleView.html?idxno=741114
방초 학교 교장 민원 일수 전교 참여 가운데 어린이 교내 체험 학습 어린이 주변 학교 폭력 디지털 폭력 등굣길 교통사고 학생 위협,http://www.bzeronews.com/news/articleView.html?idxno=605109
교내 공식 구성원 재학 졸업 배출 대로 학교 산악회 구성 어린이 청소년 광경,https://n.news.naver.com/mnews/article/047/0002390988?sid=102
마련 어린이 통학 차량 시민 배려 보호 인식 캠페인 실시 건의 교내 교통사고 발생 위험 학교 공간 학교 시설 부지 활용 학교의,http://www.ujeil.com/news/articleView.html?idxno=326337
교내 교통사고 발생 위험 학교 공간 학교 시설 부지 활용 학교 상황 고려 방안 검토 김종섭 의원 어린이 보호구역 학생,https://www.iusm.co.kr/news/articleView.html?idxno=1014298
노래 어린이 창시 소파 방정환 선생 잡지 개벽 소리 사고력 올림피아드 인공지능 융합 콘서트 전국 초중 학생 사고력 평가 대회,https://n.news.naver.com/mnews/article/030/0003095892?sid=105
활용 모니터링 강화 설비 수시 점검 안전사고 발생 대비 오승록 여름철 어린이 더위 해소 바닥 분수 정기 수질 검사 시설 검사,https://n.news.naver.com/mnews/article/277/0005253230?sid=102
교내 영문 잡지 인수 공통 감염병 영문 기사 당시 백신 접종 권고 어린이 역사 고민 환경 생각,http://www.naeil.com/news_view/?id_art=459253
봉사자 김정욱 지도 교사 교내 교통안전 주제 기획 도안 안전 안전사고 나기 어른 잘못 인식 개선 교육 예방 중요 어린이,https://idsn.co.kr/news/view/1065596435994801
봉사자 김정욱 지도 교사 교내 교통안전 주제 기획 도안 안전 안전사고 나기 어른 잘못 인식 개선 교육 예방 중요 어린이,http://www.welfarenews.net/news/articleView.html?idxno=91378
법안 목적 사후 구제 피해 회복 치중 예방 사고 조사 비중 상대 사회 동반 어린이 보호 형벌 강화 지자체 정부 책임 회피 일환,http://www.joongdo.co.kr/web/view.php?key=20230424010007111
어린이 장애 친구 보람 강사 이론 강의 장애 사고,https://n.news.naver.com/mnews/article/032/0003218669?sid=102
어린이 장애 친구 보람 강사 체험 이론 강의 장애 사고,https://m.sports.naver.com/general/article/144/0000881769
임영규 폭행 사건 기물 파손 사기 혐의 사건 사고 서울 대학교 어린이 병원 기부 소식 동시 이전 이다인 경제 공동,https://www.ilyosisa.co.kr/news/article.html?no=239102
주요 사건 사고 승재 한국 형사 법무 연구원 선임 연구 위원 어린이 젊은이 학생 부분 적극 트라우마 치료,https://n.news.naver.com/mnews/article/052/0001874557?sid=102
사고 발생 예방 메모지 전교 리본 학생 자치회 교내 추모 행사 내용 영상 온라인 탑재 공유,http://www.headlinejeju.co.kr/news/articleView.html?idxno=512455
적십자사 대전 세종 지사 이하 대전 세종 적십자 최근 대전 둔산동 스쿨 어린이 보호구역 한편 재난 심리 회복 지원 센터 친구 사고 간접 경험 교내 학생 대상 학교 협의 재난 심리,https://n.news.naver.com/mnews/article/421/0006748687?sid=102
교육청 캠페인 대전 발생 어린이 보호구역 음주운전 사망 사고 학생 교통안전 교육 교통 안전 지킴 확대 운영 내외 분리 하굣길 노선,https://daily.hankooki.com/news/articleView.html?idxno=946075
발생 어린이 보호구역 음주운전 사망 사고 예방 진행 이정선 학생 교통안전 교육 교통 안전 지킴 확대 운영 내외 분리 하굣길 노선 위험 요소,http://www.newsworker.co.kr/news/articleView.html?idxno=200883
발생 어린이 보호구역 음주운전 사망 사고 예방 진행 학생 교통안전 교육 교통 안전 지킴 확대 운영 내외 분리 하굣길 노선 위험 요소 점검,https://www.kpinews.kr/newsView/179555459851130
트럭 교내 돌진 건물 충돌 사고 발생 산청 학교 학부모회 대형트럭 가드레일 사고 대책 마련 호소 학부모회 학교 인근 도로 어린이 보호구역,https://n.news.naver.com/mnews/article/047/0002388512?sid=102
자동차 사고 총기 사건 하루 평균 아동 사망 코로나 대유행 기간 어린이 총기 사망 교내 총격사건 언론 사회 이목,https://news.koreadaily.com/2023/04/11/society/generalsociety/20230411173032098.html
미국 보호 교내 총기 난사 사건 발생 봉쇄 훈련 현지 언론 관련 보도 어린이 총기 사고 사망 최근 총상,https://n.news.naver.com/mnews/article/277/0005239609?sid=110
덕진구 어린이 급식 관리 지원 센터 특별 분양 분양 텃밭 규모 구역 텃밭 분양 신청 신청서 전북 홈페이지 교내 공지 이메일 신청,https://n.news.naver.com/mnews/article/079/0003754135?sid=102
분간 난사 어린이 명과 교직원 치명 총상 경찰 도착 당국 가방 총기 사고 사용 무기 당일,https://www.bbc.com/korean/articles/cx9xq22rwvyo?xtor=AL-73-%5Bpartner%5D-%5Bnaver%5D-%5Bheadline%5D-%5Bkorean%5D-%5Bbizdev%5D-%5Bisapi%5D
교내 총기 난사 어린이 목숨 소식 미국 사회 총기 규제 필요 학부모 교내 총기 사고 근절 근본 대책 입장 이날 내슈빌,https://n.news.naver.com/mnews/article/421/0006712904?sid=104
이후 미국 학생 교내 총기 폭력 노출 조사 영국 가디언 미국 총기류 어린이 청소년 주요 사망 지목 자동차 사고 추월,https://n.news.naver.com/mnews/article/025/0003268990?sid=104
범행 당시 총격 교내 폐쇄 회로 출입구 위치 지도 소지 정황 확인 경찰 어린이 살해 비판 바이든 대통령 부인 여사,https://n.news.naver.com/mnews/article/421/0006710041?sid=104
헤일 돌격 소총 권총 최소 소지 건물 출입문 교내 기도 당부 한편 총기 사고 현재 미국 발생 사건 기록,https://n.news.naver.com/mnews/article/015/0004825642?sid=104
길안 초등 학교 교내 강당 재학 대상 과학 발명 아이디어 발표 대회 이영록 교장 길안 어린이 과학 발명 아이디어 발표 대회 나라 미래 학생 창의 사고력,http://www.kyongbuk.co.kr/news/articleView.html?idxno=2127067
점검 캠페인 어린이 보호구역 안전 운전 사회 관심 참여 유도 안전사고 예방 실시 교내 차도 분리 현황 학교 인접 보도 보행 안전 시설물 보도 방호 울타리 무단 횡단 금지 시설,https://daily.hankooki.com/news/articleView.html?idxno=934625
점검 캠페인 어린이 보호구역 안전 운전 사회 관심 참여 유도 안전사고 예방 실시 교내 차도 분리 현황 학교 인접 보도 보행 안전 시설물 보도 방호 울타리 무단 횡단 금지 시설,http://www.bzeronews.com/news/articleView.html?idxno=549574
통학 교내 놀이 시설 안전 점검 위험 요소 제거 학교 전북 교통 방송 안전 전북 어린이 교통안전 사고 예방 업무 협약 체결 휘빈 기자,http://www.domin.co.kr/news/articleView.html?idxno=1417604
교통사고 안전 학로 취지 진행 교육감 이날 차량 운전자 대상 어린이 보호구역 안전 운전 당부 적치 안전 통학 방해 요소 점검 학기,http://www.jjn.co.kr/news/articleView.html?idxno=933188
학기 등교 출발 응원 교내 시설물 안전 전북 교통 방송 안전 전북 어린이 교통안전 사고 예방 업무 협약 체결 경근 기자,https://www.jjan.kr/article/20230315580250
교육감 학기 등교 출발 응원 교내 시설물 안전 전북 어린이 교통안전 사고 예방 업무 협약 체결 전북 교육청 협약 기관 교육 환경,https://www.ajunews.com/view/20230315170646317
논제 어린이 성장 논제 생각 장애 이동권 보장 지원 방법 주제 반응 기억 이분법 사고,https://n.news.naver.com/mnews/article/007/0000007327?sid=102
점검 캠페인 어린이 보호구역 안전 운전 사회 관심 참여 유도 안전사고 예방 실시 교내 차도 분리 현황 학교 인접 보도 보행 안전 시설물 보도 방호 울타리 무단 횡단 금지 시설,http://www.joongdo.co.kr/web/view.php?key=20230315010004555
캠페인 어린이 보호구역 안전 운전 사회 관심 참여 유도 안전사고 예방 홍보 실시 교내 차도 분리 현황 학교 인접 보도 보행 안전 시설물 설치 현황 학교 출입문 인접 지역,http://www.ccnnews.co.kr/news/articleView.html?idxno=288252
응원 교내 시설물 안전 교육청 전날 전라북도 전북 지방 경찰청 전북 자치 경찰 위원회 한국 교통안전공단 전북 지부 도로교통공단 전북 본부 안전 전북 어린이 교통안전 사고 예방,http://www.jeollailbo.com/news/articleView.html?idxno=686305
교육감 학기 등교 출발 응원 교내 시설물 안전 전북 어린이 교통안전 사고 예방 업무 협약 체결 전북 교육청 협약 기관 교육 환경,http://www.jeonmin.co.kr/news/articleView.html?idxno=374712
통학 교내 놀이 시설 안전 점검 위험 요소 제거 학교 전북 교통 방송 안전 전북 어린이 교통안전 사고 예방 업무 협약 체결,https://n.news.naver.com/mnews/article/421/0006686314?sid=102
학기 등교 출발 응원 교내 시설물 안전 전북 어린이 교통안전 사고 예방 업무 협약 체결 전북 교육청 협약 기관 교육 환경,https://n.news.naver.com/mnews/article/003/0011744017?sid=102
캠페인 어린이 보호구역 안전 운전 사회 관심 참여 유도 안전사고 예방 홍보 실시 교내 차도 분리 현황 학교 인접 보도 보행 안전 시설물 보도 방호 울타리 무단 횡단 금지 시설,http://www.chungnamilbo.co.kr/news/articleView.html?idxno=706550
어린이 보호구역 안전 운전 사회 관심 참여 유도 안전사고 예방 홍보 실시 교내 차도 분리 현황 학교 인접 보도 보행 안전 시설물 보도 방호 울타리 무단 횡단 금지 시설 설치,http://www.newstnt.com/news/articleView.html?idxno=260182
점검 캠페인 어린이 보호구역 안전 운전 사회 관심 참여 유도 안전사고 예방 실시 교내 차도 분리 현황 학교 인접 보도 보행 안전 시설물 보도 방호 울타리 무단 횡단 금지 시설,http://www.dynews.co.kr/news/articleView.html?idxno=696214
교통사고 안전 학로 진행 교육감 이날 차량 운전자 대상 어린이 보호구역 안전 운전 당부 학기 등교 학생 출발 응원 교내 시설물,http://www.kukinews.com/newsView/kuk202303150078
점검 캠페인 어린이 보호구역 안전 운전 사회 관심 참여 유도 안전사고 예방 실시 교내 차도 분리 현황 학교 인접 보도 보행 안전 시설물 보도 방호 울타리 무단 횡단 금지 시설,https://www.ccdailynews.com/news/articleView.html?idxno=2191908
교육감 학기 등교 출발 응원 교내 시설물 안전 전북 어린이 교통안전 사고 예방 업무 협약 체결 전북 교육청 협약 기관 교육 환경,https://n.news.naver.com/mnews/article/002/0002279109?sid=102
교육감 학기 등교 출발 응원 교내 시설물 안전 전북 어린이 교통안전 사고 예방 업무 협약 체결 전북 교육청 협약 기관,http://www.nspna.com/news/?mode=view&newsid=625588
점검 캠페인 어린이 보호구역 안전 운전 사회 관심 참여 유도 안전사고 예방 실시 교내 차도 분리 현황 학교 인접 보도 보행 안전 시설물 보도 방호 울타리 무단 횡단 금지 시설 설치,http://www.sisanews24.co.kr/10265
캠페인 어린이 보호구역 안전 운전 사회 관심 참여 유도 안전사고 예방 홍보 실시 교내 차도 분리 현황 학교 인접 보도 보행 안전 시설물 보도 방호 울타리 무단 횡단 금지 시설,http://www.newsfreezone.co.kr/news/articleView.html?idxno=451893
점검 캠페인 어린이 보호구역 안전 운전 사회 관심 참여 유도 안전사고 예방 실시 교내 차도 분리 현황 학교 인접 보도 보행 안전 시설물 보도 방호 울타리 무단 횡단 금지 시설,https://www.dnews.co.kr/uhtml/view.jsp?idxno=202303151031260480651
학교 교육 목표 창의 사고 감성 어린이 품격 실력 교내 놀이 공간 구축 학생 학교 조성 흥초 학교 학생 승마 교육,https://n.news.naver.com/mnews/article/088/0000802933?sid=004
교통사고 예방 홍보 활동 교육감 청장 이날 내동 교문 등교 학생 격려 교통 안전 홍보 교내 어린이 보행 안전 원칙 퀴즈,http://www.goodmorningcc.com/news/articleView.html?idxno=285479
녹취 정순신 당시 인천 지검 특수 부장 세월 침몰 사고 생명 고인 어린이 상태 기자 이재민 캠프 생각,https://n.news.naver.com/mnews/article/056/0011441818?sid=102
사고 질문 토대 강조 교수 열심 왼손 그림 맥락 내외 차례 검증 수업 탁자 왼손 그림,https://n.news.naver.com/mnews/article/001/0013783294?sid=102
하굣길 어린이 교통사고 예방 통학 안전 확보 개교 당부 성훈 천시 교육감 내달 개교 중학교 아람 초등 학교 유치원 방문 교내 시설 급식,https://www.viva100.com/main/view.php?key=20230224010007373
총장 교내 거위 전용 횡단 보도 거위 이용 차량 어린이 시민 맨발 바닷물 물놀 더위 오전,https://n.news.naver.com/mnews/article/025/0003261890?sid=102
교육 활동 침해 행위 학생 교내 봉사 전학 퇴학 조치 어린이 보호구역 하굣길 어린이 교통사고 예방 방안 포함 교육부 행안 경찰청 지자체 교육 지원,https://n.news.naver.com/mnews/article/009/0005092514?sid=102
지난해 서울 어린이 보호 구역 사고 언급 사고 강화 교내 불법 촬영 근절 사고 학교 해빙기 재해 취약 시설,http://www.goodmorningcc.com/news/articleView.html?idxno=284756
부총리 지난해 서울 어린이 보호 구역 사고 발생 사고 부총리 폭력 학교 학교 경찰서 유관 기관 공동 대응 체계 강화 교내 불법,https://n.news.naver.com/mnews/article/421/0006646474?sid=102
화재 지진 발생 대형 명사고 발생 우려 기숙사 야간 대피 모의 훈련 실시 특수 학교 초중 학교 기숙사 스프링클러 설치 계획 추진 점검 어린이 통학,https://www.asiatoday.co.kr/view.php?key=20230222010012848
하굣길 어린이 보호구역 스쿨 사고 계기 정부 보도 초등 학교 도로 학교 교내 부지 활용 학교 관할 시도 교육청 부지 교환,https://n.news.naver.com/mnews/article/003/0011706055?sid=102
프롬프트 질문 소재 어린이 이야기 순식간 지난달 미국 뉴욕 공립 학교 교내 무선 와이파이 기기 학생 교사 접근,https://n.news.naver.com/mnews/article/028/0002627963?sid=105
사회 흐름 중학교 개교 대상 교내 악기 연주 수업 정규 수업 방과 학교 조성 어린이 청소년 성장 교육 번지 강남 최선,https://n.news.naver.com/mnews/article/277/0005217539?sid=102
촉망 어린이 나중 어른 분식집 주인장 떡볶이 성적표 초등 학교 학년 교내 백일장 교장 선생 족자 글자,http://monthly.chosun.com/client/news/viw.asp?ctcd=F&nNewsNumb=202302100056
레드카 어린이날 경품 행사 포토 부스 산타 각리 올림픽 온라인 컨셉 교내 보물 상품 교환 보물찾기 행사 전교 호응,http://www.jbnews.com/news/articleView.html?idxno=1384326
골든 큐브 워즈 세계 우수 어린이 프로그램 선정 시상 성찰 교내 단계 공간 학습 생활 가능 지도,https://n.news.naver.com/mnews/article/079/0003736329?sid=102
마지막 사고 교내 규정 어린이 보호 구역 사고 상황 어린이 보호 구역 기준 어린이 보호 구역 해제 해당,http://enter.etoday.co.kr/news/view/237037
확인 어린이 보호 구역 사고 물음표 마지막 사고 교내 규정 어린이 보호 구역 사고 상황 어린이 보호 구역 기준,https://daily.hankooki.com/news/articleView.html?idxno=922372
마지막 사고 교내 규정 어린이 보호 구역 사고 상황 어린이 보호 구역 기준 궁금증 유발 어린이 보호 구역 해제 해당,https://m.entertain.naver.com/article/119/0002682131
마지막 사고 교내 규정 어린이 보호구역 사고 상황 어린이 보호구역 기준 어린이 보호구역 해제 해당 구역,https://m.entertain.naver.com/article/003/0011682606
마지막 사고 교내 규정 어린이 보호 구역 사고 상황 어린이 보호 구역 기준 어린이 보호 구역 해제 해당,https://www.bntnews.co.kr/article/view/bnt202302080009
마지막 사고 교내 규정 어린이 보호 구역 사고 상황 어린이 보호 구역 기준 어린이 보호 구역 해제 해당,http://www.stardailynews.co.kr/news/articleView.html?idxno=407752
교내 텃밭 활용 이론 실습 진행 교육 과정 학급 과정 흥청 조영덕 인천시 농업기술센터 소장 어린이 식물 체험 식물 관심,https://www.lecturernews.com/news/articleView.html?idxno=118525
마지막 사고 교내 규정 어린이 보호 구역 사고 상황 어린이 보호 구역 기준 어린이 보호 구역 해제 해당,https://m.entertain.naver.com/article/076/0003968730
마지막 사고 교내 규정 어린이 보호 구역 사고 상황 어린이 보호 구역 기준 어린이 보호 구역 해제 해당,https://m.entertain.naver.com/article/408/0000179749
마지막 사고 교내 규정 어린이 보호 구역 사고 상황 어린이 보호 구역 기준 어린이 보호 구역 해제 해당,https://m.entertain.naver.com/article/609/0000686421
교내 텃밭 활용 이론 실습 진행 교육 과정 학급 과정 흥청 조영덕 인천시 농업기술센터 소장 어린이 식물 체험 식물 관심,http://www.discoverynews.kr/news/articleView.html?idxno=950108
교내 텃밭 활용 이론 실습 진행 교육 과정 학급 과정 흥청 조영덕 인천시 농업기술센터 소장 어린이 식물 체험 식물 관심,https://www.dnews.co.kr/uhtml/view.jsp?idxno=202302060926226050495
이성 사고 분석 능력 상승 과학 실과 국어 미술 학업 성취 향상 생명 환경 문제 생태 학습 도움 조영덕 인천시 농업기술센터 소장 어린이 식물,https://www.kmaeil.com/news/articleView.html?idxno=384971
교내 텃밭 활용 이론 실습 진행 교육 과정 학급 과정 흥청 조영덕 인천시 농업기술센터 소장 어린이 식물 체험 식물 관심,https://n.news.naver.com/mnews/article/119/0002680940?sid=102
어린이 식물 체험 식물 관심 친밀감 창의 감성 학습 연계 현장 교육 마련 지난해 교육 설문 조사 실시 결과 영역 이성 사고,https://www.viva100.com/main/view.php?key=20230205010001046
합천 초등 학교 교내 학생 물림 사고 피해 학부모 제공 친구 주말 오후 학교 학교 건물 중앙 현관 주변 손목,http://www.kukinews.com/newsView/kuk202302020142
통학 버스 정류장 교내 학교 정문 좌회전 신호등 신설 경찰 관계자 가변 속도 시스템 어린이 교통사고 발생 예방 만큼 변화 제한 속도 규정,https://n.news.naver.com/mnews/article/421/0006606613?sid=102
어린이 사고 집중 분석 어린이 사각지대 안전 박미선 보호자 교내 진입 교내 스쿨 나라,https://www.bntnews.co.kr/article/view/bnt202302010017
어린이 사고 집중 분석 어린이 사각지대 안전 박미선 보호자 교내 진입 교내 스쿨 나라,https://m.entertain.naver.com/article/437/0000330706
