nouns,link
광주광역시 교육청 초등 학교 이하 현장 체험학습 실시 어린이 통학 버스 차량 이용 문제 교육청 현장 체험학습 일반 전세 버스 이용 사고 발생 민형사 책임,https://n.news.naver.com/mnews/article/382/0001074875?sid=102
과정 어린이 통학 버스 차량 이용 사고 교육청 민형사 책임 외부 기관 학교 체험학습 프로그램 다양 교내 체험 학습 실행 가능,https://n.news.naver.com/mnews/article/417/0000948154?sid=102
광주시 교육청 초등 학교 이하 현장 체험 학습 어린이 통학 버스 차량 이용 문제 해결 교육청 향후 현장 체험학습 일반 전세 버스 이용 사고 발생 민형사 책임,http://www.kjdaily.com/article.php?aid=1694432156611079005
교내 체험 학습 실행 가능 설명 법제처 현장 체험 사용 전세 버스 관광버스 어린이 규정 도색 운행 해석 버스 논란,https://n.news.naver.com/mnews/article/056/0011563708?sid=102
어린이 통학 버스 차량 이용 문제 해결 실질 민형사 책임 지원 교육청 현장 체험학습 일반 전세 버스 이용 사고 발생 민형사 책임,https://www.cnbnews.com/news/article.html?no=619351
외부 기관 학교 체험학습 프로그램 다양 교내 체험 학습 실행 가능 노컷뉴스 제보 세상 비리 부당 대우 사건 사고 미담,https://n.news.naver.com/mnews/article/079/0003811517?sid=102
광주시 교육청 현장 체험학습 일반 전세 버스 이용 사고 발생 민형사 책임 교내 체험학습 권장 지난해 법제처 도로 교통 제조 제호 관련 어린이 통학,http://www.bigtanews.co.kr/article/view/big202309110026
광주광역시 교육청 초등 학교 이하 현장 체험학습 실시 어린이 통학 버스 차량 이용 문제 교육청 현장 체험학습 일반 전세 버스 이용 사고 발생 민형사 책임,http://www.joongdo.co.kr/web/view.php?key=20230911010003180
이용 사고 발생 민형사 책임 지원 보상 범위 대신 변제 초등 학교 이하 현장 체험학습 어린이 통학 차량 신고 버스 이용 법제 처의,https://n.news.naver.com/mnews/article/277/0005312563?sid=102
광주시 교육청 초등 학교 이하 현장 체험학습 실시 어린이 통학 버스 차량 이용 문제 교육청 현장 체험학습 일반 전세 버스 이용 사고 발생 민형사 책임,https://n.news.naver.com/mnews/article/081/0003392203?sid=102
광주시 교육청 초등 학교 이하 현장 체험학습 실시 어린이 통학 버스 차량 이용 문제 해결 교육청 현장 체험학습 일반 전세 버스 이용 사고 발생 민형사 책임,https://www.newscj.com/news/articleView.html?idxno=3062366
광주시 교육청 교육감 이정선 초등 학교 이하 현장 체험학습 실시 어린이 통학 버스 차량 광주시 교육청 현장 체험학습 일반 전세 버스 이용 사고 발생 민형사 책임,http://www.jeollailbo.com/news/articleView.html?idxno=704795
광주시 교육청 초등 학교 이하 현장 체험학습 실시 어린이 통학 버스 차량 이용 문제 해결 교육청 현장 체험학습 일반 전세 버스 이용 사고 발생 민형사 책임,http://www.newsworker.co.kr/news/articleView.html?idxno=220321
사고 교육청 대신 광주시 교육청 초등 학교 이하 현장 체험학습 어린이 외부 기관 학교 체험학습 프로그램 다양 교내 체험 학습 실행 가능 이정선,https://n.news.naver.com/mnews/article/001/0014185256?sid=102
광주시 교육청 초등 학교 이하 현장 체험 학습 실시 어린이 통학 버스 차량 이용 문제 광주시 교육청 현장 체험학습 일반 전세 버스 이용 사고 발생 민형사 책임,https://www.kpinews.kr/newsView/1065592197412797
경제 광주시 교육청 초등 학교 이하 현장 체험학습 실시 어린이 통학 버스 차량 이용 광주시 교육청 교육청 현장 체험학습 일반 전세 버스 이용 사고 발생,http://www.startuptoday.co.kr/news/articleView.html?idxno=138501
교내 의견 혼란 한국 교총 회장 정성국 전국 초등 교원 설문 조사 결과 최근 조사 결과 현장 체험 학습 불의 사고,https://www.hangyo.com/news/article.html?no=99872
어린이 통학 버스 차량 이용 문제 해결 실질 민형사 책임 지원 교육청 현장 체험학습 일반 전세 버스 이용 사고 발생 민형사 책임,https://www.cstimes.com/news/articleView.html?idxno=559873
광주시 교육청 전경 광주시 교육청 초등 학교 이하 현장 체험학습 실시 어린이 통학 버스 차량 교육청 현장 체험학습 일반 전세 버스 이용 사고 발생 민형사 책임,https://daily.hankooki.com/news/articleView.html?idxno=998222
광주시 교육청 초등 학교 이하 현장 체험학습 실시 어린이 통학 버스 차량 이용 문제 광주시 교육청 현장 체험학습 일반 전세 버스 이용 사고 발생 민형사 책임,http://www.enewstoday.co.kr/news/articleView.html?idxno=2037339
참여 교내 지정 구간 어린이 승하차 지점 드롭 설치 안전 등굣길 조성 홍보 전개 북부 관계자 북구 교통 행정과 참여 교통사고 예방 효율 교통 관리,http://www.jndn.com/article.php?aid=1694279464369172011
뉴스 김우수 교통사고 소식 시대 예수 생각 조명 고아 중국집 배달원 불우 어린이 김우수,https://n.news.naver.com/mnews/article/005/0001636333?sid=103
김홍태 세종 남부 경찰 서장 교내 설치 어린이 승하차 허용 구간 자녀 등하 학부모 차량 안전사고 위험 학부모 학교 관계자 관심 주의 요구 당부,http://www.ccnnews.co.kr/news/articleView.html?idxno=307065
김홍태 세종 남부 경찰 서장 교내 설치 어린이 승하차 허용 구간 자녀 등하 학부모 차량 안전 사고 위험 학부모 학교 관계자 관심 주의 요구 당부,http://www.aflnews.co.kr/news/articleView.html?idxno=254351
김홍태 세종 남부 경찰 서장 교내 설치 어린이 승하차 허용 구간 자녀 등하 학부모 차량 안전 사고 위험 학부모 학교 관계자 관심 주의 요구 당부,http://www.jbnews.com/news/articleView.html?idxno=1406663
세종 남부 경찰 서장 교내 설치 어린이 승하차 허용 구간 자녀 등하 학부모 차량 안전사고 위험 학부모 학교 관계자 관심 주의 요구 당부,https://www.gukjenews.com/news/articleView.html?idxno=2802797
관리 어린이 놀이 시설 관리 예방 방화 구획 피난 시설 관리 교내 냉난방 조경 수목 관리 사고 발생 안전 관리 최선 학교 외벽 균열 누수,https://www.kgnews.co.kr/news/article.html?no=761721
교내 총기 사고 직업 안전 위협 이유 팬데 이후 직업 피로도 내슈빌 커버 초등 학교 총기 난사 사건 발생 어린이 명과 교직,https://n.news.naver.com/mnews/article/047/0002404998?sid=104
광진구 어린이 대공원 인근 길거리 흉기 거리 상점 업주 손님 위협 사고 서울 경찰청 소속 경정 동료 모텔 동의 관계,https://n.news.naver.com/mnews/article/020/0003518412?sid=102
어린이 포함 집계 이전 확인 사망자 명이 증가 부산 목욕탕 화재 폭발 사고 합동 감식 유증 추정 부산 동구 좌천동 소재 목욕탕,https://www.ajunews.com/view/20230902215319511
올해 어린이 초등 학교 교실 담임 교사 사건 버지니아주 비리 부당 대우 사건 사고 미담 얘깃거리 이메일 카카오톡 노컷뉴스 사이트,https://n.news.naver.com/mnews/article/079/0003806799?sid=104
홍범 장군 흉상 육사 교내 독립운동 업적 선양 독립운동 사고 운전자 가중 처벌 식이 악용 추정 식이 시행 이후 어린이,https://n.news.naver.com/mnews/article/052/0001928984?sid=100
홍범 장군 흉상 육사 교내 독립운동 업적 선양 독립운동 사고 운전자 가중 처벌 식이 악용 추정 식이 시행 이후 어린이,https://radio.ytn.co.kr/program/?f=2&id=91279&s_mcd=0452&s_hcd=01
슬기 어린이 교훈 학생 화양 국민학교 융합 사고력 학교 완성 목표 설정 진로 교육 활동 강화 디지털 시민 역량,https://n.news.naver.com/mnews/article/666/0000019632?sid=102
창원시 어린이 급식 관리 지원 센터 사업 연속 위탁 운영 기관 선정 산학 협력 데이터 센터 사업 사고 글쓰기 언어 사고 기초 수리 능력 기초 학습 능력 향상 교육 프로그램 학습 향상,http://www.knnews.co.kr/news/articleView.php?idxno=1412040
교내 자료 바탕 답변 추천 학생 출처 확인 신뢰도 판단 학생 응답 토론 촉진 창의 비판 사고력 소통 협업 능력 향상 주도 학습,https://it.chosun.com/site/data/html_dir/2023/08/11/2023081100955.html
명예 회장 어린이 안전 재단 고석 사장 재난 안전 기술원 정상 원장 국내 재난 안전 분야 조사 연구 교육 시설 안전사고 피해 학생 교직원 가족 심리 안정 사회 상담,http://amenews.kr/news/view.php?idx=54536
한국 어린이 안전 재단 사장 정상 한국 재난 안전 기술원 원장 국내 재난 안전 분야 관계자 소개 교내 범죄 예방 설계 기술 활용 디지털 보안 전환 중요 강조 김진욱,http://www.ikld.kr/news/articleView.html?idxno=278975
마사이족 어린이 장터 사제 동행 옹달샘 교내 학생 김서영 학년 학생 회장 학교 인성 프로그램 학업 강요 학생 사고,https://www.catholictimes.org/article/article_view.php?aid=387505
학교 관계자 요원 아침 출근 어린이 교통 봉사 활동 참여 교통사고 예방 활동 기여 지역 어르신 교내 정화 활동 참여 안전 교육 환경,http://www.bzeronews.com/news/articleView.html?idxno=619818
교내 출입 규제 문제 수면 교직원 문제 부분 반응 외부 학교 침입 사건 사고,https://www.cctoday.co.kr/news/articleView.html?idxno=2182513
사고 학생 인근 주민 온종일 불안 과거 해당 고교 행정 근무 어린이집 심장 기분 한숨 피습 사건 현장,https://n.news.naver.com/mnews/article/656/0000059215?sid=100
초록 우산 어린이재단 부산 지역 본부 희헌 후원 후원 교통사고 예방 전주 교내 공기 정화 벽면 녹화 저소득 아동 소원 성취 산타 원정대,https://n.news.naver.com/mnews/article/082/0001225542?sid=102
학교장 입장 교내 발생 사건 사고 책임 학교 시설물 적극 개방 여성 가족 평생 교육 위원회 어린이 안전 보행 환경 조성 교통 안전시설 개선 보도,https://www.thereport.co.kr/news/articleView.html?idxno=39060
여교사 교내 극단 선택 사망 사건 교육 사회 관심 어린이 시소게임 간주 시소게임 한쪽,http://www.g-enews.com/ko-kr/news/article/news_all/20230801100134264e8b8a793f7_1/article.html
공분 교권 침해 문제 학생 인권 조례 찬반 논란 모습 이주호 아동 어린이 청소년 기본 보호 목적 국제 법인 유엔 아동 권리 협약 서명 논문,https://n.news.naver.com/mnews/article/001/0014105357?sid=102
국립 어린이 청소년 도서관 책벌레 도서관 령기 프로그램 학교 도서관 활성 계획 청소년 주도 독서 습관 형성 교내 독서 문화 확산,http://www.kihoilbo.co.kr/news/articleView.html?idxno=1042720
어린이 발달 악영향 지표 교육청 소셜 미디어 교내 질서 위험천만 챌린지 도전 영상 유행 청소년 사고사 사례,https://n.news.naver.com/mnews/article/023/0003777684?sid=105
교사 학부모 민원 교내 마감 여럿 동병상련 아픔 사정 어린이집 유치원 교사 댓글 유치원 어린이,https://www.wikitree.co.kr/articles/872532
응급실 뺑뺑이 사망 사고 최근 지난달 대전 초등 학교 학년 여학생 교내 의식 구급차 대전 시내 어린이 응급 환자,https://www.polinews.co.kr/news/articleView.html?idxno=615244
어린이 응급 환자 병원 조치 목숨 사고 대전 리포트 교내 엘리베이터 여학생 바닥 머리 고통 지난달,https://n.news.naver.com/mnews/article/056/0011530523?sid=102
앵커 어린이 응급 환자 병원 조치 목숨 사고 리포트 교내 엘리베이터 여학생 바닥 머리 고통 지난달,https://n.news.naver.com/mnews/article/056/0011530342?sid=102
앵커 어린이 응급 환자 병원 조치 목숨 사고 리포트 교내 엘리베이터 여학생 바닥 머리 고통 지난달,https://n.news.naver.com/mnews/article/056/0011530246?sid=102
어린이 응급 환자 병원 조치 목숨 사고 대전 리포트 교내 엘리베이터 여학생 바닥 머리 고통 지난달,https://n.news.naver.com/mnews/article/056/0011530244?sid=102
학생 교과 성취 내신 성적 이수한 과목 내용 교내 수상 내역 학생 발췌 의미 봉우리 서도 어른 의자 형태 섬인 동도 어린이,http://www.veritas-a.com/news/articleView.html?idxno=465899
어린이 생활 공간 서울 초등 학교 교실 여교사 극단 선택 사건 충격 가운데 학부모 트라우마 사고 후유 장애 이유 화환 꽃다발,https://n.news.naver.com/mnews/article/081/0003378613?sid=102
트라우마 사고 후유 장애 화환 꽃다발 뭇매 오전 어린이 생활 공간 강조 어른,https://n.news.naver.com/mnews/article/421/0006940605?sid=102
타위 실시간 음성 인식 기술 활용 청각 처리 장애 어린이 의사소통 솔루션 사고 개발 필수 경험 제공 테크 프로그램 교내,https://n.news.naver.com/mnews/article/053/0000037346?sid=105
경찰 아파트 구슬 관련 수사 착수 가운데 인근 초등학교 교내 사건 사고 발생 미국 여자 어린이 남동생 사망,https://n.news.naver.com/mnews/article/421/0006928845?sid=102
입장료 성인 이하 어린이 단체 단체 성인 별도 예약 당일 현장 카드 결제 가능 국내 유일 교내 설치,http://www.joongdo.co.kr/web/view.php?key=20230712010003367
산초 어린이 주도 재난 대피 훈련 서산 오산 초등 학교 교장 유월 학생 계획 협약 목적 학교 체육 시설 개방 교내 안전 사고 민원 최소 학교 교육 과정 운영,http://www.joongdo.co.kr/web/view.php?key=20230703010000349
최근 어린이 보호 구역 사고 결과 그간 지자체 인도 전북 전주 교내 식당 학생 아침밥 키오스 메뉴 대학생,https://n.news.naver.com/mnews/article/022/0003828955?sid=102
윤건영 유보 통합 유치원 어린이집 교육 중심 단일 기관 통합 양질 보육 교육 초등 담사 본인 책무 바탕 관련 행정 업무 교내 전문가 역할,https://n.news.naver.com/mnews/article/079/0003784854?sid=102
파닉스 프로그램 어린이 스피킹 수업 과정 구성 안전 교육 안전 이해 안전 사고 대응 능력 안전 중요,https://n.news.naver.com/mnews/article/656/0000055098?sid=102
전라북도 교육청 어린이 보호구역 어린이 승하차 조성 학생 안전 보장 통학 불편 안전사고 예방 승하차 전국 최초 학교 담장 조성 일부 학교 교내 혼잡도,http://sjbnews.com/news/news.php?number=784412
교내 혼잡 차량 안전사고 우려 제거 설명 서거석 전북 교육감 어린이 보호구역 어린이 승하차 설치 안전 교육 환경 조성 학부모 운전자,http://www.jjn.co.kr/news/articleView.html?idxno=941074
교육청 전국 최초 학교 담장 어린이 승하차 조성 일부 학교 드라이브 스루 방식 교내 혼잡 차량 안전사고 우려 서거석 교육감 어린이 보호구역,http://www.jeollailbo.com/news/articleView.html?idxno=696716
전북 교육청 전국 최초 학교 담장 어린이 승하차 조성 일부 학교 드라이브 스루 방식 교내 혼잡 차량 안전사고 우려 서거석 교육감 어린이 보호구역,https://www.ajunews.com/view/20230625130442523
교육청 전국 최초 학교 담장 어린이 승하차 조성 일부 학교 드라이브 스루 방식 교내 혼잡 차량 안전사고 사전 차단 계획 서거석 교육감 어린이 보호구역,http://www.domin.co.kr/news/articleView.html?idxno=1429782
부산 시설 공단 수변 어린이 공원 공영주 차장 보수 보강 공사 완료 월말 운영 재개 지난해 학부모 수상 안전사고 예방 인식 학부모 안전교육 연수 강화 교내,http://www.lawissue.co.kr/view.php?ud=202306231800048904204ead0791_12
전북 교육청 전국 최초 학교 담장 어린이 승하차 조성 일부 학교 드라이브 스루 방식 교내 혼잡 차량 안전사고 우려 서거석 교육감 어린이 보호구역,https://n.news.naver.com/mnews/article/002/0002290498?sid=102
전북 교육청 전국 최초 학교 담장 일부 학교 드라이브 스루 방식 어린이 안심 승하차 조성 교내 혼잡 차량 안전사고 우려 차단 계획 교육청 올해,https://www.jjan.kr/article/20230623580030
전북 교육청 전국 최초 학교 담장 어린이 승하차 조성 일부 학교 드라이브 스루 방식 교내 혼잡 차량 안전사고 우려 서거석 전북 교육감 어린이 보호구역,https://n.news.naver.com/mnews/article/629/0000223614?sid=102
학부모 수상 안전사고 예방 인식 학부모 안전교육 연수 강화 교내 물놀이 어린이 놀이 시설 분수 시설 교육청 울산시 울산 해경 소방서 수상 안전 관리,https://n.news.naver.com/mnews/article/001/0014022274?sid=102
교내 수상 안전 교육 활성 중고 대상 울산 해경 물놀이 어린이 놀이 시설 개소 분수 시설 개소 울산시 교육청 효과 수상 안전사고,https://n.news.naver.com/mnews/article/003/0011931762?sid=102
전북 교육청 전국 최초 학교 담장 어린이 승하차 조성 일부 학교 드라이브 스루 방식 교내 혼잡 차량 안전사고 우려 서거석 교육감 어린이 보호구역,https://n.news.naver.com/mnews/article/031/0000754035?sid=102
전북 교육청 전국 최초 학교 담장 어린이 승하차 조성 일부 학교 드라이브 스루 방식 교내 혼잡 차량 안전사고 우려 서거석 교육감 어린이 보호구역,https://www.gukjenews.com/news/articleView.html?idxno=2748623
전북 교육청 전국 최초 학교 담장 어린이 승하차 조성 일부 학교 드라이브 스루 방식 교내 혼잡 차량 안전사고 우려 서거석 교육감 어린이 보호구역,https://www.nspna.com/news/?mode=view&newsid=644380
교육청 전국 처음 학교 담장 어린이 승하차 조성 교내 혼잡 차량 안전사고 우려 방침 서거석 교육감 어린이 승하차 편도 도로,https://n.news.naver.com/mnews/article/003/0011931476?sid=102
전북 교육청 전국 최초 학교 담장 일부 학교 드라이브 스루 방식 어린이 안심 승하차 조성 교내 혼잡 차량 안전사고,http://www.breaknews.com/972153
전북 교육청 전국 최초 학교 담장 어린이 승하차 조성 일부 학교 드라이브 스루 방식 교내 혼잡 차량 안전사고 우려 서거석 교육감 어린이 보호구역,https://n.news.naver.com/mnews/article/079/0003783532?sid=102
전국 최초 학교 담장 어린이 승하차 설치 교내 혼잡 차량 안전사고 예방 예정 서거석 교육감 현행법 어린이 승하차 편도 도로 설치 편도,https://n.news.naver.com/mnews/article/001/0014021260?sid=102
전북 교육청 전국 최초 학교 담장 어린이 승하차 조성 일부 학교 드라이브 스루 방식 교내 혼잡 차량 안전사고 우려,http://www.newspim.com/news/view/20230623000286
이름 대신 특수 거리낌 동료 교사 수학여행 교내 연례행사 특수 어린이 청소년 기억 대목 장애 체험 고통,https://n.news.naver.com/mnews/article/047/0002396609?sid=103
음식점 배달원 학생 음식 배달 교내 오토바이 사고 누가 치료비 법령 어린이 통학 버스 기사 관광 통역 안내원 일반 화물 차주 산재 보험 적용 추가,http://www.gjdream.com/news/articleView.html?idxno=629545
부산 전국 스쿨 어린이 사고 심경 통학 안전 대책 관계 기관 학생 통학 안전 확보 체인지 체육 활동 기반 조성 교내 도서관,https://n.news.naver.com/mnews/article/003/0011921447?sid=102
초등 학교 어린이 사이 실제 모형 장난감 유행 흉기 상술 위험 장난감 안전 사고 예방 교내 생활지 역시,https://ccn.hcn.co.kr/user/news/BD_newsView.do?news_category=03&story_id=NS2023061300050&story_seq=0&soCode=114&socttSn=NS2023061300050&socttSeq=0
교내 영송 중앙 도서관 글로벌 강의실 대구 광역시 보육 교직원 보수 교육 과정 개강 과정 지역 어린이집 보육 교직원 대상,https://news.unn.net/news/articleView.html?idxno=548183
과정 진행 관내 어린이집 보육 교직 참여 세부 교육 보육 교사 건강 관리 다문화교육 이해 실제 안전사고 예방 아동학 성폭력 실종 예방,https://n.news.naver.com/mnews/article/008/0004898690?sid=102
어린이집 교사 미래 친구 등굣길 총장 사고 분석 향후 유사 사고 발생 교내 시설 긴급 점검 안전,https://n.news.naver.com/mnews/article/011/0004200970?sid=102
사랑 어린이집 교사 친구 사고 현장 요구 사고 진상 규명 예정 동덕 여대 교내 언덕 쓰레기 수거,https://n.news.naver.com/mnews/article/057/0001748676?sid=102
사랑 어린이집 교사 친구 학생 고인 추모 공간 등굣길 교내 언덕 쓰레기 수거차 병원 사고 오후,https://n.news.naver.com/mnews/article/011/0004200917?sid=102
언덕길 편의 문관 담장 아래쪽 성북구 어린이 급식 관리 지원 센터 북쪽 담장 일부 파손 사고 당시 학교 사고 현장 인근 교내 전체 차량 통행 금지 쓰레기 하장 위치 시일,https://n.news.naver.com/mnews/article/629/0000221217?sid=102
어린이 노약자 건강 비상사태 미국 뉴욕 유치원 초등 학교 야외 활동 정지 교내 학생 보건 마스크 배포 산불,https://n.news.naver.com/mnews/article/023/0003768638?sid=104
창의 사고 지혜 성장 단순 교과 과정 학생 자치 올해 어린이 예술 활동 정서 함양 지원 목표 경기 교육청 감성 예술 학교 사업,https://n.news.naver.com/mnews/article/666/0000013276?sid=102
교내 설치 안전 전동 제공 일상 안전 교육 실천 대전 동도 일상 안전 전동 제공 안전 강화 노력 최근 어린이 보호구역 교통사고 대전 동도,http://www.ggilbo.com/news/articleView.html?idxno=977877
어린이 노약자 건강 비상 사태 유치원 초등 학교 야외 활동 정지 교내 학생 보건 마스크,https://n.news.naver.com/mnews/article/023/0003768504?sid=104
차량 교내 삼거리 양모 상태 인근 병원 이송 양모 방학 어린이집 실습 예정 친언니 양모 양은 예견 사고,https://n.news.naver.com/mnews/article/449/0000251091?sid=102
안전시설 점검 간담회 최근 대전 수원 어린이 보호구역 사망 사고 발생 교내 대학 캠페인 최근 이슈 마약 이용 성범죄 디지털 성범죄 예방,https://n.news.naver.com/mnews/article/003/0011888439?sid=102
전교 임원 교내 등교 학생 스마트폰 양인숙 교장 교문 도로 어린이 교통사고 노출 환경,http://www.joongboo.com/news/articleView.html?idxno=363594487
지난해 교육부 등록금 수입 교직원 보수 교내 장학금 액수 사립 대학 사건 계기 어린이 보호구역 스쿨 안전 대책 실효 확보 어린이 사망 사고 발생,http://www.incheonilbo.com/news/articleView.html?idxno=1195818
박정연 초록 우산 어린이재단 본부 약국 가정 케어 교육 교내 과정 의무 필요 가정 양립 지원 아기 단축 근로,https://n.news.naver.com/mnews/article/079/0003774549?sid=102
사진 전라남도 교육청 제공 전라남도 교육청 어린이 통학 안전 환경 개선 목포 학로 지속 발생 교통사고 인지 학로,https://www.safetynews.co.kr/news/articleView.html?idxno=222035
전남 교육청 어린이 통학 안전 환경 개선 목포 학로 지속 발생 교통사고 인지,http://www.breaknews.com/966750
목포 교통 안전시설 현장 방문 사진 전라남도 교육청 어린이 통학 안전 환경 개선 목포 학로 지속 발생 교통사고 인지 학로,http://www.getnews.co.kr/news/articleView.html?idxno=627850
전남 교육청 어린이 교통안전 교육 우수 사례 현장 방문 학생 안전 최우선 목포 목포 학로 지속 발생 교통사고 인지 학로,https://www.psnews.co.kr/news/articleView.html?idxno=2025516
제공 전남 교육청 전라남도 교육청 어린이 통학 안전 환경 개선 목포 초등 학교 방문 우수 사례 확산 목포 학로 지속 발생 교통사고 인지,https://www.asiatime.co.kr/article/20230523500313
사진 전남 교육청 제공 전라남도 교육청 어린이 통학 안전 환경 개선 목포 학로 지속 발생 교통사고 인지 학로,https://daily.hankooki.com/news/articleView.html?idxno=960220
전라남도 교육청 일화 어린이 통학 안전 환경 개선 목포 초등 학교 방문 목포 학로 지속 발생 교통사고 인지 학로,http://www.newsworker.co.kr/news/articleView.html?idxno=205864
교통 안전시설 우수 사례 현장 방문 전남 교육청 제공 전라남도 교육청 어린이 통학 안전 환경 목포 학로 지속 발생 교통사고 인지 학로,https://n.news.naver.com/mnews/article/468/0000946279?sid=102
대산 교내 체육 대회 개최 체육 주간 운영 체육 주간 이날 학생 교통안전 영상 시청 실생활 발생 어린이 교통사고,http://www.joongdo.co.kr/web/view.php?key=20230523010006706
지난해 제주 시내 초등 학교 정문 승용차 후진 교내 학생 현장 사고 구역 어린이 보호구역 이유 가중 처벌 사례 개정안,https://n.news.naver.com/mnews/article/001/0013953426?sid=102
