nouns,link
올림픽 금메달 안세영 초등학생 배드민턴 동호인 아버지 라켓 대희 파리 올림픽 안세영 배드민턴 셔틀콕 여왕 금메달 성장기 여자 단식,https://n.news.naver.com/mnews/article/660/0000066303?sid=104
초등학생 우연 기회 중학교 엘리트 전문 선수 발탁 얼떨결 늦깎이 엘리트 선수 유소년 선수 필수 교육 코스 나무 성장기,https://m.sports.naver.com/kfootball/article/450/0000107522
수업 부상 방지 안전 교육 운동 편성 몸풀기 운동 달리기 이용 유아기 성장기 진입 초등학생 체육 활성 메카 자리매김 시동 모양새,https://n.news.naver.com/mnews/article/020/0003573021?sid=102
도심 체험 성장기 생태 감수 도움 놀이 개장식 이후 열흘 진행 체험 지역 유치원생 초등학생 참여,https://www.ulsanpress.net/news/articleView.html?idxno=529266
성장기 건강 문제 시력 저하 약시 고도 근시 질환 발생 성인 초등학생 안경 관리 안경 착용 과도 움직임 부상 걱정,https://www.dkilbo.com/news/articleView.html?idxno=444327
성장기 살림 당시 초등학생 동생 유환 평생 기억 동생,https://m.entertain.naver.com/article/416/0000305767
성장기 건강 문제 시력 저하 약시 고도 근시 질환 발생 성인 초등학생 안경 관리 안경 착용 과도 움직임 부상 걱정,http://www.knnews.co.kr/news/articleView.php?idxno=1430086
총선 최대 이슈 부상 출생 문제 해결 관련 공약 국민 출생 위기 해결 여성 가족 폐지 인구 신설 초등학생 방과 보육 담당 늘봄 학교,https://n.news.naver.com/mnews/article/002/0002326883?sid=102
신상호 인격 형성 중요 시기 초등학생 예의 존중 성장기 나무 선수 부상 관리 기량 향상 도움,https://m.sports.naver.com/general/article/009/0005259821
빈폴 키즈 초등학생 필수 아이템 가방 분야 독보 선두 가운데 상황 성장기 건강 센스 책가방,http://www.biztribune.co.kr/news/articleView.html?idxno=303073
연맹 유치 부나 초등 사이 롤러 스포츠 활성 초등학생 선수 양성 성장기 아동 하체 발달 도움 성인 경비 효율 운동,http://www.mygoyang.com/news/articleView.html?idxno=77530
놀이 성장기 학생 폭력 증가 이유 학교 폭력 우려 부상 당시 보도 화면 초등 학교 남학생 해당 학생,https://www.wikitree.co.kr/articles/904559
휴가 부상 개인 사정 참석 학생 날씨 농구 선수 열정 투지 대회 열기 체육관 중학교 학년 학년 초등학생,https://m.sports.naver.com/basketball/article/398/0000070504
유치원생 초등학생 대상 국악 나무 경연 대회 한음 국악 영재 성장기 하림 전시 참여 동물 복지 제품 우수 이해,http://www.biztribune.co.kr/news/articleView.html?idxno=288027
초등학생 근육질 체격 초미 이터 초딩 터미네이터 최명진 유망주 기대 동중 학교 진학 성장기 다리 근육 파열 골절 고생,https://m.sports.naver.com/general/article/450/0000094421
선수 기량 발전기 성장기 세까지 이후 노련미 장착 완성도 배구공 초등 학교 학생 계획 한국 배구,https://m.sports.naver.com/volleyball/article/472/0000027362
지역 초등학생 북교 김주석 요리사 재능기부 요리 아동 통합 사례 관리사 아동 가구 가정 방문 성장기 아동 필요 단백질 식품,https://www.asiatime.co.kr/article/20230512500254
초등학생 대회 입상 목적 무리 훈련 부상 위험 노출 성장기 부상 운동 중요 기본기 부상 위험,https://www.kgnews.co.kr/news/article.html?no=745796
이상준 김태주 초등학생 결혼 출산 육아 스로 가족 좌충우돌 성장기 드라마 방송,https://m.entertain.naver.com/article/408/0000183426
고도 성장기 노동조합 운동 임금 상승 생산직 노동자 중산 진입 현재 대의 세대 당시 대학 초등학생,http://www.ilemonde.com/news/articleView.html?idxno=16695
영역 콘텐츠 초등학생 체험 중고 학교 청소년 성장기 청소년 시기 자극 선별 콘텐츠 제작 보급,http://www.newsfreezone.co.kr/news/articleView.html?idxno=434672
차세대 국가 선수 전인 성장 스포츠 과학 지원 차세대 국가 선수 초등학생 중학생 고등학생 성인 연령 분포 비교 학교 성장기 선수 비율,https://www.korea.kr/news/contributePolicyView.do?newsId=148909297&call_from=naver_news
프로게이머 스포츠 급부상 스포츠 발전 가능 이해 주인공 강찬 성장기 프로게이머 역량 자세 초등학생 주인공 프로게이머,http://sjbnews.com/news/news.php?number=762507
스포츠 시리즈 초등학생 희망 직업 프로게이머 스포츠 급부상 스포츠 발전 가능 이해 주인공 강찬 성장기 프로게이머 역량 자세,http://www.jndn.com/article.php?aid=1668501784348770103
과학 영향 감정 건강 중요 키워드 부상 감정 조절 인성 학습 메타 차원 접근 사례 두뇌 코칭 기업 뇌교육 초등학생 대상,http://www.brainmedia.co.kr/BrainTraining/23031
이나 스튜디오 초등학생 성인 운동 진행 키즈 성장기 근력 향상 자세 교정 효과,http://www.sisunnews.co.kr/news/articleView.html?idxno=169887
기준 영유 아기 초등학생 세대 상품 활동 알파 세대 가입 고객 성장 단계 건강 관리 프로그램 안과 질환 예방 관리 성장기 영양 운동 관리 학업 능력,http://www.babytimes.co.kr/news/articleView.html?idxno=59363
업계 최초 의료 보험 보장 아기 자폐증 보장 성장기 자폐증 진단 출시 태아 미취학 초등학생 가입 건수 상품 출시 이후 전월 대비 이상의,http://www.fntimes.com/html/view.php?ud=202207091011535597dd55077bc2_18
올해 처음 시행 코웨이 청정 학교 교실 프로젝트 초등학생 대상 진행 환경 교육 소화 흡수 우유 단백질 사용 성장기 단백질 필요 성인 영양,http://www.greened.kr/news/articleView.html?idxno=295973
성장기 두피 고민 정수리 냄새 제거 효과 자연 유래 성분 자극 초등학생 샴푸 주목 성분 임산부 주목 임산부 샴푸 급부상,http://www.fashionbiz.co.kr/TN/?cate=2&recom=2&idx=192996
성장기 영양 균형 도내 재배 과일 구성 건강 식단 초등학생 교육감 지선 보편 교육 복지 무상급식 도입 공약 전국 이슈 급부상,http://www.joongboo.com/news/articleView.html?idxno=363542839
온라인 컴포트 브랜드 주니어 라인 확대 편안 속옷 트렌드 부상 인기 속옷 업계 주니어 속옷 주니어 속옷 보통 초등학생 학년 중학생 성장기 착용 업계 한때 주니어 라인,http://www.apparelnews.co.kr/news/news_view/?idx=196246
지역 역사 인물 고려 어벤져스 영상 제작 전국 초등학생 역사 교재 활용 서비스 성장기 데이터 기반 부모 후천 환경 예상 최종,https://n.news.naver.com/mnews/article/353/0000041817?sid=101
수족 구수 성장기 장판 손상 골절 기흉 임산부 후출혈 수혈 진단 담보 자동차 부상 치료비 보장 초등학생 학교 생활 플랜 학교 발생,http://www.meconomynews.com/news/articleView.html?idxno=63290
입시 경쟁 선택 학생 성장기 학교 해피 엔딩 종영 김요한 초등학생 태권도 발목 부상 학교,https://m.entertain.naver.com/article/415/0000007384
단계 예비기 준비기 기성 장기 분류 단계 맞춤 교육 제공 국장 인구 학자 조영태 서울대 보건 대학원 교수 초등학생 고등학교 진학 권유,https://n.news.naver.com/mnews/article/011/0003995704?sid=102
경계 청춘 성장기 이날 방송 부상 방송 말미 기준 지원 초등학생 뽀뽀 사건 언급 직구,http://www.celuvmedia.com/article.php?aid=1637829203402577006
이날 태권 대회 발목 부상 초등학생 태권도 포기 기준 모습 경계 청춘 성장기 작품 수요일 목요일,https://m.entertain.naver.com/article/438/0000041075
이날 태권 대회 발목 부상 초등학생 태권도 포기 기준 모습 경계 청춘 성장기 작품 수요일 목요일,https://m.entertain.naver.com/article/438/0000041074
이날 태권 대회 발목 부상 초등학생 태권도 포기 기준 모습 경계 청춘 성장기 작품 수요일 목요일,https://m.entertain.naver.com/article/438/0000041073
성장기 성인 무용 도움 발육 초등 저학년 학생 안짱다리 심해 정형외과 의사 수업 권유 무용,http://www.sisunnews.co.kr/news/articleView.html?idxno=145354
초등학생 평균 표준 초경 시기 장판 시기 조건 체중 감량 일반 성장기 성장기 감속기 성장 단계 성장,https://www.ibabynews.com/news/articleView.html?idxno=97427
이후 사업 경제 여유 초등학생 자녀 중국 고속 경제 성장기 양극 문제 상황,https://n.news.naver.com/mnews/article/001/0012471189?sid=104
해강 성장기 흥미 강의 성장 아버지 윤현 캐릭터 우려 초등학생 시절 충격 해강 지려 단체 경기,http://www.mediaus.co.kr/news/articleView.html?idxno=216086
젊음 한국 보도 사진 성장기 정립 전라남도 여천군 둔병도 흑백 초등학생 사이 파리,https://n.news.naver.com/mnews/article/020/0003362558?sid=103
초등학생 코로나 여파 물리 공간 요즘 하루 여가 대부분 신체 정서 사회 성장기 필요 콘텐츠 서비스 제공,https://www.geconomy.co.kr/news/article.html?no=74523
회장 성장기 회고담 에피소드 구성 충북 영동 출신 신앙 생활 최근 영재 초등학생 교육 기관 설립 제안 검토 한국인 창조 에너지 폭발,https://n.news.naver.com/mnews/article/009/0004797495?sid=102
취학 아동 세과 초등학생 부모 세대 구분 세대 주의 질병 부상 세부 분석 결과 포함 우리나라,http://www.whosaeng.com/126892
질병 부상 세부 분석 결과 포함 취학전 아동 장염 초등학생 호흡기 질환 이외 성장기 치과 안과 질환 피부 질환 장염 골절 손상,http://www.greenpostkorea.co.kr/news/articleView.html?idxno=128611
취학 아동 세과 초등학생 부모 세대 구분 세대 주의 질병 부상 세부 분석 결과 포함 우리나라,http://www.mdtoday.co.kr/mdtoday/index.html?no=419599
취학 아동 세과 초등학생 부모 세대 구분 세대 주의 질병 부상 세부 분석 결과 포함 우리나라,http://www.gvalley.co.kr/news/articleView.html?idxno=579600
취학 아동 세과 초등학생 부모 세대 구분 세대 주의 질병 부상 세부 분석 결과 포함 결과,http://www.kmedinfo.co.kr/news/articleView.html?idxno=67633
취학 아동 세과 초등학생 부모 세대 구분 세대 주의 질병 부상 세부 분석 결과 포함 지난해 우리나라,https://www.kpanews.co.kr/article/show.asp?idx=222205&category=C
질병 부상 세부 분석 실시 초등학생 이하 지난해 호흡기 질환 이외 성장기 치과 안과 질환 피부 질환 장염 골절 손상,http://www.dailypharm.com/Users/News/NewsView.html?ID=276002&REFERER=NP
취학 아동 세과 초등학생 부모 세대 구분 세대 주의 질병 부상 세부 분석 결과 포함 우리나라,http://www.bosa.co.kr/news/articleView.html?idxno=2149819
빙상 선수 초등학생 중학생 고등학생 대학생 전체 종목 평균 초등학생 중학 성장기 청소년 필요 확보 학습 침해 선수 정신,https://n.news.naver.com/mnews/article/028/0002540522?sid=102
정도 필요 신체 접촉 경험 응답 선수 초등학생 정상 학교 생활 성장기 청소년 필요 확보 학습,https://n.news.naver.com/mnews/article/079/0003492917?sid=102
학생 선수 장시간 훈련 정상 학교 생활 성장기 청소년 필요 확보 상황 학습 침해 선수 정신 육체 소진 부상,https://n.news.naver.com/mnews/article/032/0003069406?sid=102
비율 초등학생 중학생 고등학생 신체 폭력 이용한 구타 인권위 새벽 오후 저녁 훈련 장시간 훈련 정상 학교 생활 성장기,https://n.news.naver.com/mnews/article/277/0004885452?sid=102
성장기 자녀 시력 부모 걱정 시기 시력 발달 형성 보통 렌즈 적응 초등학생 착용 시작 렌즈 콘택트렌즈,http://www.ikunkang.com/news/articleView.html?idxno=33469
성장기 자녀 부모 키즈 콘텐츠 선택 기준 업계 관련 콘텐츠 강화 어린이집 초등 학교 임시 휴업 유아 초등학생 시청 직접,http://www.kukinews.com/newsView/kuk202103160212
김우식 성장기 시청자 감동 배우 이정하 별한 초등학생 시절 축구 부상 운동 사연 우식 부상,https://m.entertain.naver.com/article/396/0000573107
드라마 성장기 초점 용병제 객원 코치 이름 초빙 초등학생 점수 대패 일상 개월,https://m.entertain.naver.com/article/047/0002293276
초등학생 조카 선물 가족 선물 영양제 선택 가능 이벤트 눈길 종합 비타민 관계자 활동 성장기 남자 여자 선물 성장 발달 도움 아기,http://www.mhns.co.kr/news/articleView.html?idxno=410646
작품 박새 성장기 장르 요소 작품 박새 웃음 드라마 영화 축구 클라 초등학생 수준,http://www.esquirekorea.co.kr/article/46131
성장기 균형 전신 사용 운동 체력 팀워크 초등학생 아들 학교 하키 아들 운동 시작 아빠,http://www.outdoornews.co.kr/news/articleView.html?idxno=31514
변화구 성장기 유소년 어깨 팔꿈치 무리 선수 보호 차원 초등학생 슬라이더 커브 손목 팔꿈치 동작 투수 부상 체인지업,https://m.sports.naver.com/kbaseball/article/003/0009621208
미토 전제품 충격 부상 위험 조절 부분 안전 타원 밸브 업그레이드 높이 조절 성장기 초등 학교 저학년 무리 미토 초등학생,https://www.dailysecu.com/news/articleView.html?idxno=85335
뽀로로 통령초 학생 대통령 세대 직장인 대통령 올해 유튜브 채널 자이언트 주인공 스타 크리에이터 연습생 좌충우돌 성장기,https://n.news.naver.com/mnews/article/024/0000064041?sid=101
미토 전제품 충격 부상 위험 조절 부분 안전 타원 밸브 업그레이드 높이 조절 성장기 초등 학교 저학년 무리 미토 초등학생,https://www.dailysecu.com/news/articleView.html?idxno=82058
조절 성장기 초등 학교 저학년 무리 연령 최대 견고 일반 초등학생 보드 대형 바퀴 장착 방지 배수구,http://www.woodkorea.co.kr/news/articleView.html?idxno=36337
조절 성장기 초등 학교 저학년 무리 연령 최대 견고 일반 초등학생 보드 대형 바퀴 장착 방지 배수 구로,http://hobbyissue.co.kr/news/view/98061
초등학생 신분 국내 선수 대회 여자 싱글 우승 차지 김연아 소치 동계 올림픽 무대 당시 성적 종합 성장기 체형,https://n.news.naver.com/mnews/article/033/0000039906?sid=103
조절 성장기 초등 학교 저학년 무리 연령 최대 견고 일반 초등학생 보드 대형 바퀴 장착 방지 배수구,http://hobbyissue.co.kr/news/view/80275
부상 자세 교정 동반 운동 식단 관리 중요 추석 연휴 가족 행사 체중 초등학생 부모,https://www.ibabynews.com/news/articleView.html?idxno=78242
상장 부상 추첨 선물 증정 참가자 국내 치즈 선물 세트 전달 호응 김태환 축산 경제 우유 가족 퀴즈 대회 성장기 초등학생 부모 국내산,http://www.chukkyung.co.kr/news/articleView.html?idxno=55216
우유 사업 일환 가족 퀴즈 대회 우유 관련 퀴즈 성장기 초등학생 지도 초등 학교 김도영 가족 금상 차지 가족 입상 상장 부상 추첨,http://www.youngnong.co.kr/news/articleView.html?idxno=27516
우유 사업 일환 가족 퀴즈 대회 우유 관련 퀴즈 성장기 초등학생 지도 초등 학교 김도영 가족 금상 차지 가족 입상 상장 부상 추첨,http://www.thebigdata.co.kr/view.php?ud=201908230943195953d0a8833aad_23
우유 사업 일환 가족 퀴즈 대회 우유 관련 퀴즈 성장기 초등학생 지도 초등 학교 김도영 가족 금상 차지 가족 입상 상장 부상 추첨,http://www.newsworker.co.kr/news/articleView.html?idxno=37557
우유 사업 일환 가족 퀴즈 대회 우유 관련 퀴즈 성장기 초등학생 지도 초등 학교 김도영 가족 금상 차지 가족 입상 상장 부상 추첨,http://www.lawissue.co.kr/view.php?ud=201908230803498455204ead0791_12
초등학생 현재 팔꿈치 내측 인대 상태 통증 시마 의사 뉴스 요소 지적 고교 이하 발병 요인 성장기,https://m.sports.naver.com/wbaseball/article/264/0000000652
조절 성장기 초등 학교 저학년 무리 연령 초등학생 고학년 자녀 초등학생 선물 제격 부상 예방 무릎 보호,http://hobbyissue.co.kr/news/view/17930
전국 최초 성동구 초등학생 방과 지원 조례 제정 초등학생 성장기 폭염 한파 미세먼지 외부 환경 상관 실내 활동,https://n.news.naver.com/mnews/article/277/0004499326?sid=102
조절 성장기 초등 학교 저학년 무리 연령 초등학생 고학년 자녀 초등학생 선물 제격 부상 예방 무릎 보호,http://www.gokorea.kr/news/articleView.html?idxno=264642
초등학생 과도 긴장감 불안 장애 우울증 공격 초조감 정신 심리 성장기 밸런스 전체 소아 청소년 원형 탈모 성장,http://www.m-i.kr/news/articleView.html?idxno=617829
초등 학교 학년 학생 자녀 배웅 학부모 사망 부상 범인 경제 성장기 연금 부모 버블 붕괴 격타 무직 자식 의지,https://n.news.naver.com/mnews/article/586/0000007005?sid=104
사진 류현진 이호영 코치 제공 중학교 시절 투구 코치 초등학생 류현진 성장기 스승 투수 선정 제자 모습,https://m.sports.naver.com/kbaseball/article/380/0000001260
조절 성장기 초등 학교 저학년 무리 연령 초등학생 고학년 자녀 초등학생 선물 제격 부상 예방 무릎 보호,https://www.dailysecu.com/?mod=news&act=articleView&idxno=52537
성장기 건강 유지 운동 나라 국민 자전거 초등학생 인치 둘째 안전 자전거 유아기,http://www.sisunnews.co.kr/news/articleView.html?idxno=106568
가능 성장기 초등 학교 저학년 무리 미토 미토 미토 미토 초등학생 선물 관심 미토 초등학생 성인,http://www.tourtimes.net/95202
조절 성장기 초등 학교 저학년 무리 디자인 높이 초등학생 자녀 초등학생 선물 제격 부상 예방 무릎 보호,http://www.thekpm.com/view.php?ud=201905141628092825124506bdf1_17
조절 성장기 초등 학교 저학년 무리 디자인 높이 초등학생 자녀 초등학생 선물 제격 부상 예방 무릎 보호,http://www.polinews.co.kr/news/article.html?no=391674
조절 성장기 초등 학교 저학년 무리 디자인 보드 미토 미토 초등학생 선물 관심 미토 초등학생,http://www.tourtimes.net/87653
성장기 인터넷 사용 모바일 사회관 계망 서비스 정보 기술 세대 요즘 초등학생 일기 영상 하루 초의 일기 완성,https://n.news.naver.com/mnews/article/032/0002935720?sid=102
시작 초등학생 리그 미래 시즌 신인 열풍 전력 평가 성장기 만큼 선배 훈련 부상,https://m.sports.naver.com/kbaseball/article/468/0000469344
성장기 훈련 중요 은퇴 선수 이진영 임창용 최희준 원장 나이 부상 유형 초등학생 모양 후의,https://m.sports.naver.com/kbaseball/article/477/0000151481
시작 초등학생 남자 팔씨름 정도 그건 유전 성장기 체형 예전 근력 머릿속 각인 전달,https://m.sports.naver.com/golf/article/435/0000002168
소속 초등학생 중고 학생 구성 경기 이부 청소년 김선갑 구청장 농구 기초 체력 증진 성장기 청소년 운동 대회 그동안,http://www.siminilbo.co.kr/news/articleView.html?idxno=583400
소속 초등학생 고등학생 구성 경기 이부 청소년 김선갑 광진구 청장 농구 기초 체력 증진 성장기 청소년 운동 대회,http://www.sisamagazine.co.kr/news/articleView.html?idxno=149496
소속 초등학생 고등학생 구성 경기 이부 청소년 진행 김선갑 광진구 청장 농구 기초 체력 증진 성장기 청소년 운동 대회,https://n.news.naver.com/mnews/article/277/0004335477?sid=102
성장기 선수 오랫동안 진학 동계 훈련 훈련 중학생 진학 초등학생 자유 부모 관리 정도,https://m.sports.naver.com/kfootball/article/413/0000072774
성장 기업 김진오 부장 크리에이터 이야기 크리에이터 유튜브 유튜브 주력 소비 부상 초등학생 검색 유튜브 동영상,http://www.ajunews.com/view/20180828104136582
김진오 성장 기업 부장 개천 시대 사회관 계망 서비스 활용 유튜브 주력 소비 부상 초등학생 검색 유튜브 아침 스마트폰,http://www.ajunews.com/view/20180827093918684
선수 볼링 마니아 부모 초등학생 볼링 입문 이나영 체격 성장기 시작 두각 선수 인천 대회 기억,https://m.sports.naver.com/general/article/005/0001118359
조절 성장기 초등 학교 저학년 무리 디자인 보드 조절 초등학생 보드 씽씽이 성비 미토 보드 미토 헤드,http://www.polinews.co.kr/news/article.html?no=362661
초래 성장기 자세 체형 교정 나이 성호르몬 분비 성조숙증 성장 부진 초등학생 중학생 비만 대부분 뼈나이 실제 나이,http://www.it-b.co.kr/news/articleView.html?idxno=22498
초등학생 베란다 손가락 부상 사용 설명서 저자 이지현 약사 성장기 피부 재생 능력 어른 상처,http://www.metroseoul.co.kr/news/newsview?newscd=2018070400043
초등학생 베란다 손가락 부상 사용 설명서 저자 이지현 약사 성장기 피부 재생 능력 어른 상처,http://www.lawissue.co.kr/view.php?ud=201807041106226716204ead0791_12
조절 성장기 초등 학교 저학년 무리 디자인 보드 조절 초등학생 보드 씽씽이 성비 미토 보드 미토 헤드 장착,http://www.newsfarm.co.kr/news/articleView.html?idxno=26595
태동 단계 변화 국내 남성 화장품 시장 외환 위기 이후 성장기 색조 화장 처음 초등학생 화장품 방문 판매원 어머니 덕분 사회 편견,https://n.news.naver.com/mnews/article/008/0004068609?sid=101
청소년 교육 센터 초등학생 중학생 주안점 미래 사회 경쟁력 주역 성장 성장기 회로 작용 중간 상호 보완 가능 실버 의료 문화 환경,http://www.m-economynews.com/news/article.html?no=22448
오빠 시작 유도 예랑 학생 초등 학교 학년 고등학교 학년 오빠 당시 유도 선수 경기 체중 조절 성장기 예랑 학생 과제 지난해 제회,http://www.idomin.com/?mod=news&act=articleView&idxno=567040
신유 선수 초등학생 대한민국 여자 탁구 유망주 주목 치아 자연 치유 가능 성장기 턱뼈 부상 부위 회복 얼굴 비대칭,http://www.bosa.co.kr/news/articleView.html?idxno=2081712
테니스 근력 집중력 순발력 향상 초등학생 어른 남녀노소 밀도 성장기 증가 사춘기 강화 최대 밀도 도달,https://n.news.naver.com/mnews/article/076/0003237795?sid=101
테니스 근력 집중력 순발력 향상 초등학생 어른 남녀노소 밀도 성장기 증가 사춘기 강화 최대 밀도 도달,https://n.news.naver.com/mnews/article/076/0003237164?sid=101
학회 초등 학생 근시 발병률 이후 가량 세노 비스 키즈 오메가 성장기 중요 포함 오메가,https://n.news.naver.com/mnews/article/123/0002180367?sid=101
학회 초등 학생 근시 발병률 이후 가량 증가 세노 비스 키즈 오메가 성장기 중요 포함 오메가,http://www.metroseoul.co.kr/news/newsview?newscd=2018012900112
서울 강남 지역 학교 초등학생 고민 최근 개월 성장기 밸런스 전체 소아 원형 탈모 성장 장애,https://n.news.naver.com/mnews/article/003/0008407013?sid=110
학회 초등 학생 근시 발병률 이후 가량 정관 장군 성장기 탄생 제품 연령 단계 제품,http://daily.hankooki.com/lpage/economy/201801/dh20180120060023138090.htm
학회 초등 학생 근시 발병률 이후 가량 세노 비스 키즈 오메가 성장기 중요 포함 오메가,http://www.mdtoday.co.kr/mdtoday/index.html?no=308791
학회 초등 학생 근시 발병률 이후 가량 세노 비스 키즈 오메가 성장기 중요 포함 오메가,http://www.lawissue.co.kr/view.php?ud=201801190933039843204ead0791_12
일본 초등학생 중학 생의 급식 일본 급식 운영비 성장기 경험 상처 정치 무상급식 선별 보편 논쟁 쟁의,http://www.kihoilbo.co.kr/?mod=news&act=articleView&idxno=731044
신체 전체 밸런스 성장기 초등학생 정도 손가락 부상 장애 판정 그것 계기 직장,http://www.gnmaeil.com/news/articleView.html?idxno=360622
당시 대중 가요 영화 광고 등장 중국 본토 전파 중국 고도 성장기 이후 제주도 강원 국내 휴양지 쿠알라룸푸르 다낭 발리 해외 초등학생 상의,https://n.news.naver.com/mnews/article/009/0004062944?sid=004
초등학생 구성 리틀 고등학생 주니어 아빠 엄마 의기투합 파파 축구 협회 분과 위원 원장 아이스하키 신체 성장 기의,https://m.sports.naver.com/general/article/021/0002328960
초등학생 개학 오랜만 친구 통과 의례 장시간 자세 성장기 척추 균형 초래 앞뒤,https://n.news.naver.com/mnews/article/016/0001280169?sid=103
한샘 이케아 공략 대응 자녀 성장기 거실 가구 콘셉트 한샘 거실 공간 역할 신혼 자녀 영아 기유 아기 초등학생 기중 고등학생 부문,http://www.ebn.co.kr/news/view/905332
초등학생 성인 연령 연습 암벽 오픈 지난해 대부분 정관 클라이밍 입문 시기 성장기 난부 일부 기초 지자체,http://www.kookje.co.kr/news2011/asp/newsbody.asp?code=1600&key=20170810.22015003604
