nouns,link
부상 가능 근육 긴장 상태 경기 위험 초등학생 성장기 선수 동계 기간 부상 위험 게임 위주 체력 단련 기본기 강화,https://m.sports.naver.com/kbaseball/article/109/0003498008
최근 초등학생 사이 인기 안전 문제 성장기 걸음걸이 습관 영향 부상 사례 접수 운동 최고 시속 정도 안전 장비,http://www.dynews.co.kr/news/articleView.html?idxno=346949
유행 바퀴 신발 최근 초등학생 사이 인기 교육청 바퀴 신발 성장기 걸음걸이 습관 영향 안내 안전 장구,http://www.domin.co.kr/news/articleView.html?idxno=1144503
유행 힐리스 바퀴 운동화 최근 초등학생 사이 인기 신발 하이힐 모습 바퀴 뒤꿈치 성장기,http://www.jeollailbo.com/news/articleView.html?idxno=506651
여년 유행 시작 바퀴 운동 성장기 건강 주의 필요 어린아이 초등 학교 저학년 학생 연령층 사이 필수 유행 아이템 자리,https://n.news.naver.com/mnews/article/123/0002154681?sid=103
여년 유행 시작 바퀴 운동 성장기 건강 주의 필요 어린아이 초등 학교 저학년 학생 연령층 사이 필수 유행 아이템 자리,http://www.ajunews.com/view/20170306151727855
명가 성장기 사이 진료 인원 집중 강북 병원 병원장 신경외과 척추측만증 초등학생 정기 검사 의무 실시 권장 정도 조기 발견,https://n.news.naver.com/mnews/article/346/0000014237?sid=103
유행 시작 바퀴 운동 성장기 건강 주의 필요 어린아이 초등 학교 저학년 학생 연령층 사이 필수 유행 아이템 자리,http://www.gukjenews.com/news/articleView.html?idxno=663586
민간 전시 시설 바퀴 신발 초등학생 설득 의료 바퀴 신발 성장기 초등 걸음걸이 습관 영향 우려,http://www.kookje.co.kr/news2011/asp/newsbody.asp?code=0300&key=20170306.22006213727
관절 건강 성장 직접 연관 만큼 발생 부상 질환 예방 노력 필요 성장기 척추측만증 주의보 책상 학생,https://n.news.naver.com/mnews/article/032/0002768986?sid=103
명가 성장기 사이 진료 인원 집중 강북 병원 병원장 신경외과 척추측만증 초등학생 정기 검사 의무 실시 권장 정도 조기 발견,https://n.news.naver.com/mnews/article/144/0000478797?sid=103
명가 성장기 사이 진료 인원 집중 강북 병원 병원장 신경외과 척추측만증 초등학생 정기 검사 의무 실시 권장 정도 조기 발견,http://medipana.com/news/news_viewer.asp?NewsNum=195929&MainKind=A&NewsKind=5&vCount=12&vKind=1
초등학생 대학생 한국 프로 스포츠 젖줄 미래인 엘리트 선수 수확 돌입 성장기 만큼 목소리 학생 관계자 얼굴 미소,http://www.kyeonggi.com/?mod=news&act=articleView&idxno=1320019
초등학생 성인 어깨높이 차이 좌우 다리 차이 증상 검사 소견 성장기 치료 요구 공부 고등학생,http://news.bbsi.co.kr/news/articleView.html?idxno=808000
심사 위원회 전국 초등학생 학년 선수 대상 회의 기존 대상 우수 장려상 성장기 통증 골격 완성 성인 단계 대형 부상 예고,https://m.sports.naver.com/kfootball/article/139/0002069639
센터 출신 부친 여자 배구 청소년 출신 모친 수경 박지수 초등학생 처음 농구공 사진 점프 복주 기자 국가 성장기 점프 잡지 박지수 농구 자녀 처음 소개,https://m.sports.naver.com/basketball/article/430/0000000476
상체 부상 빈도 상대 성장기 골절 의심 장판 손상 동반 발생 초등학생 보통 성인 근육 소아 소년 시기,https://n.news.naver.com/mnews/article/016/0001104760?sid=103
상체 부상 빈도 상대 성장기 골절 의심 장판 손상 동반 발생 초등학생 보통 성인 근육 소아 소년 시기,http://news.heraldcorp.com/view.php?ud=20160822000579
상체 부상 빈도 상대 성장기 골절 의심 장판 손상 동반 발생 초등학생 보통 성인 근육 소아 소년 시기,https://n.news.naver.com/mnews/article/016/0001104217?sid=103
성장기 운동 습관 성인 유아기 스트레칭 유도 아동기 격려 초등 초등학생 가능 스포츠 경험 지역 스포츠 리그 등록 승부,http://www.koreadaily.com/news/read.asp?art_id=4423110
이웃집 초등학생 살해 머리 절단 범행 성명문 학교 교문 고도 성장기 베드타운 개발 현재 고령 빈집 증가 노인 거주지,http://jmagazine.joins.com/monthly/view/312023
박승준 부평 병원 병원장 소아 정형외과 전문의 척추측만증 선진국 초등학생 정기 남아 활동 팔꿈치 상체 부상 빈도 상대 성장기,https://n.news.naver.com/mnews/article/016/0001019782?sid=103
부평 병원 박승준 병원장 소아 정형외과 전문의 척추측만증 선진국 초등학생 남아 활동 팔꿈치 상지 부상 빈도 상대 성장기,https://n.news.naver.com/mnews/article/346/0000009493?sid=103
부평 병원 박승준 병원장 척추측만증 선진국 초등학생 정기 검사 의무 상지 부상 빈도 상대 성장기 골절 의심 장판 손상 동반 발생,http://news.kukinews.com/article/view.asp?arcid=0010472582&code=46111301&cp=nv
아이스하키 초등학생 부산 지역 초등학생 성장기 균형 신체 발달 최적 운동 부산 마리나,https://n.news.naver.com/mnews/article/016/0000997120?sid=004
겨울 방학 초등학생 스케이트장 최고 놀이터 빙판 운동 만큼 부상 위험 존재 주의 필요 무의식,https://n.news.naver.com/mnews/article/417/0000157230?sid=103
겨울 방학 초등학생 스케이트장 최고 놀이터 빙판 운동 만큼 부상 위험 존재 주의 필요,https://n.news.naver.com/mnews/article/016/0000978044?sid=103
겨울 방학 초등학생 스케이트장 최고 놀이터 빙판 운동 만큼 부상 위험 존재 주의 필요 스케이팅,http://news.kukinews.com/article/view.asp?arcid=0010269827&code=41171911&cp=nv
겨울 방학 초등학생 스케이트장 최고 놀이터 빙판 운동 만큼 부상 위험 존재 주의 필요 무의식,https://n.news.naver.com/mnews/article/123/0002126771?sid=103
겨울 방학 초등학생 스케이트장 최고 놀이터 빙판 운동 만큼 부상 위험 존재 주의 필요 무의식,https://n.news.naver.com/mnews/article/022/0002998127?sid=103
새해 벽두 초등학생 영문 원초 등장 민국 환호 소치 올림픽 성장기 영향 반면 국가 훈련,https://m.sports.naver.com/general/article/076/0002873783
초등학생 새해 다짐 고민 성장기 청소년 성장 장판 자극 점프 운동 부상 운동전 스트레칭 필수,https://n.news.naver.com/mnews/article/022/0002986657?sid=103
대구 동도 초등 학교 성장기 학생 축산물 섭취 체력 증진 축산물 인식 제고 장관 상장 부상 수상 동도 학생 한우 활용 불고기 수제 함박 스테이크,http://www.idaegu.co.kr/news.php?code=ch05&mode=view&num=184801
처음 케트 초등학생 시절 고난도 트리플 점프 마스터 폭풍 성장기 사이 가량 자라 스케이트 부츠 주니어 성인,http://kids.hankooki.com/lpage/news/201512/kd20151227162921125630.htm
초등학생 하루 일정 사용 주기 휴식 지도 렌즈 활동 렌즈 부상 강남 세상 김욱 원장,http://www.asiatoday.co.kr/view.php?key=20151029010016090
성장기 건강 문제 시력 저하 약시 고도 근시 질환 발생 성인 초등학생 관리 안경 착용 과도 움직임 부상 걱정 부모,https://n.news.naver.com/mnews/article/417/0000136431?sid=103
초등 학교 학생 날아라 버스 내용 설명 머릿속 버스 경북 영천 만석 집안 양반 자제 성장기 피난지 결혼 밑천 장만,https://n.news.naver.com/mnews/article/262/0000008659?sid=103
성장기 자녀 부모 또래 성장 부모 하루하루 초등학생 중학생 자녀 과도 학습 컴퓨터 이용 수면,http://www.starseoultv.com/news/articleView.html?idxno=345118
성장기 광주 광대 협률 지방 순회 광주 필자 광복 시골 필자 초등 학교 강당 초등학생 상대 임방울 쑥대머리 관람,http://www.honam.co.kr/read.php3?aid=1438786800473340169
약시 난시 초등학생 발생 지속 시력 저하 주의 성장기 척추측만증 성장 방해 허리 디스크 악화 조기,http://news.kukinews.com/article/view.asp?arcid=0009666297&code=41171911&cp=nv
본문 이미지 영역 성장기 각막 변형 난시 주의 약시 난시 초등학생 발생 지속 시력 저하 주의,https://n.news.naver.com/mnews/article/417/0000116458?sid=103
성장기 각막 변형 난시 주의 시력 약시 난시 초등학생 발생 지속 시력 저하 주의,https://n.news.naver.com/mnews/article/396/0000326755?sid=103
성장기 난시 시력 사이 완성 약시 난시 초등학생 발생 지속 시력 저하 주의,https://n.news.naver.com/mnews/article/032/0002613807?sid=103
성장기 각막 변형 난시 주의 시력 약시 난시 초등학생 발생 지속 시력 저하 주의,https://n.news.naver.com/mnews/article/468/0000019934?sid=103
시라소니 구마 신마 쌍칼 무옥 하야시 캐릭터 사랑 당시 초등학생 사이 전어 조영승 성장기 나라 격투기 황금기 최홍만,https://m.sports.naver.com/general/article/477/0000005205
초등학생 아들 평소 건강 아들 고열 병원 골절 화상 성장기 자녀 발생 위험 아토피 비염 천식 생활 질환 보장,https://n.news.naver.com/mnews/article/009/0003475614?sid=101
어른 성장기 척추 부담 박광식 의학 전문 기자 보도 리포트 초등학생 겨울 왕국 엘사 공주 구두 뒷굽 웨지힐 운동화,https://n.news.naver.com/mnews/article/056/0010158662?sid=105
성장기 신발 박광식 의학 전문 기자 보도 리포트 초등학생 겨울 왕국 엘사 공주 구두 뒷굽 웨지힐 운동화,https://n.news.naver.com/mnews/article/056/0010158185?sid=105
스타트 주민 센터 다목 강당 스타트 초등학생 대상 스포츠 치어리딩 관계자 프로그램 성장기 청소년 효과 운동 프로그램 건강 도움,http://www.siminilbo.co.kr/news/articleView.html?idxno=392910
스타트 주민 센터 다목 강당 스타트 초등학생 대상 스포츠 치어리딩 관계자 프로그램 성장기 청소년 효과 운동 프로그램 건강 도움,http://www.gukjenews.com/news/articleView.html?idxno=231090
인천시 동구 드림스 타트 주민 센터 다목 강당 스타트 초등학생 대상 스포츠 관계자 프로그램 성장기 청소년 효과 운동 프로그램 건강 도움,http://www.shinailbo.co.kr/news/articleView.html?idxno=437992
일반 학생 초등 학교 입학 학생 여학생 남학생 저학년 남자 호기심 신체 활동 부상,https://n.news.naver.com/mnews/article/214/0000471296?sid=102
올해 동계 훈련 그동안 성장기 체력 훈련 각오 초등학생 관중석 부상 대책 마련 시급 대회 마지막 관중석 난간,https://m.sports.naver.com/general/article/047/0002077146
개인 성장기 자전 에세이 독일 나치 열광 침묵 공멸 독일 초등학생 세대 거대 자극 매혹 게임,https://n.news.naver.com/mnews/article/001/0007171884?sid=103
의원 직각 트랙 급정거 급회전 학생 부상 위험 성장기 초등학생 직각 운동장 우려 만큼 일반,http://www.ksilbo.co.kr/news/articleView.html?idxno=463431
성징 초등학생 시기 영유 아기 제외 인간 성장 남학생 운동 부상 성장기 부상 입어 장판 손상 조기 유합,https://n.news.naver.com/mnews/article/018/0003042348?sid=102
초등학생 중학생 완전 애기 성적 혹사 무릎 통증 누나 병원 정밀 검사 성장기 혹사 연골 조직,http://www.newsen.com/news_view.php?uid=201407311808013033
초등학생 중학생 완전 애기 성적 혹사 무릎 통증 누나 병원 정밀 검사 성장기 혹사 연골 조직,https://m.sports.naver.com/general/article/065/0000091576
관절 질환 안전 지대 초등학생 대도 마찬가지 무릎 통증 성장기 장판,https://n.news.naver.com/mnews/article/417/0000041637?sid=103
학생 시력 검사 결과 일정 기준 하인 학생 비율 초등 학교 학년 학년 중학교 학년 성장기 습관 근시 어른 근시 확률,https://n.news.naver.com/mnews/article/014/0003154739?sid=101
시즌 급부상 네오 플랜 시즈 소재 사용 디자인 엄마 판매 시크 커플 연출 스타일 주장 초등학생 조카 이날,https://n.news.naver.com/mnews/article/145/0000012105?sid=103
피부 개선 디스크 성인병 질병 예방 치료 효과 수영 성장기 초등학생 정도 수영 체험 학습 단체 교육청 예산 타령,http://www.idaegu.com?c=10&uid=291098
초등학생 훈련 강도 성과 과도 연습량 부상 훗날 무용수 활동,https://n.news.naver.com/mnews/article/145/0000011858?sid=102
제주 제주 가정 여자 초등학생 성폭행 징역 중형 선고 재판부 성장기 기절 폭행 전치 부상 피고인 재판,https://n.news.naver.com/mnews/article/079/0002553763?sid=102
초등학생 책가방 시장 연간 규모 추산 빈폴 키즈 책가방 아동 책가방 수진 빈폴 키즈 디자인 실장 성장기 책가방 디자인 가방 크기 무게,http://www.asiatoday.co.kr/news/view.asp?seq=923145
초등학생 책가방 시장 최근 성장 업계 올해 시장 규모 지난해 가격 디자인 기능 성장기 만큼 착용 체형,https://n.news.naver.com/mnews/article/375/0000112125?sid=004
초등학생 책가방 시장 최근 성장 업계 올해 시장 규모 지난해 가격 디자인 기능 성장기 만큼 착용 체형,https://n.news.naver.com/mnews/article/374/0000045610?sid=115
한국교육개발원 초등학생 고교생 유학 출국 현황 자료 문제점 성장기 영향 교육 전문가 신중 입장 해외 영어 캠프 주목,https://n.news.naver.com/mnews/article/022/0002595922?sid=103
포항 스틸러스 유스 제철동 초등 학교 운동 소질 포항 시내 초등학생 성장기 고등학교,https://m.sports.naver.com/general/article/260/0000000793
문제 자세 습관 성장기 자녀 척추 관절 집중력 저하 초등학생 의자 선택 자세 교정 필요 시기 본격 학습 시기,https://n.news.naver.com/mnews/article/417/0000014560?sid=103
체력 증진 질병 체크 성장기 도움 부분 교정 여름 방학 확인 여름 방학 건강 초등학생 충치 체크 예방,https://n.news.naver.com/mnews/article/145/0000011184?sid=103
초등 학교 학년 학생 황호준 광주 기독 병원 호준 그해 월일 이후 병원 부상자 사망자 어머니 소설가 홍희담,http://www.sisapress.com/news/articleView.html?idxno=60972
나이 초등학생 처음 교정 고교 시절 교정 이후 커리 샬럿 커리어 절반 덕분 성장기 샬럿,https://m.sports.naver.com/general/article/430/0000000039
김연아 초등학생 딸아이 이야기 스포츠센터 진행 스케이팅 스포츠 성장기 건강 성장 건강 취미 생활 역할 수행,https://n.news.naver.com/mnews/article/076/0002332355?sid=103
초등학생 이야기 건강 마음 십자 대파 성장기 건강 위협 부상 발생 십자 인대 무릎,https://n.news.naver.com/mnews/article/143/0002113196?sid=103
초등학생 자녀 대부분 학부모 주니어 전용 골프클럽 대신 성인 여성 골프채 개조 사용 조사 이준석 피터스 피팅 센터 성장기 클럽,http://www.etoday.co.kr/news/section/newsview.php?idxno=721556
성장기 척추 건강 척추측만증 검사 실시 학생 교정 교실 운영 한편 구강 건강 이하 미취학 초등학생 대상 불소 도포 사업,http://www.kyeonggi.com/news/articleView.html?idxno=665413
도시 부상 금년 세계 한국 나무 연수구 성장기 학생 건강 심신 발달 개교 초등학생 대상 무상급식 실시,https://n.news.naver.com/mnews/article/421/0000112725?sid=102
간식 부상 계획 교장 학교 식단 성장기 일린 필요 구성 만큼 음식 중요 식사 감사 학생,http://www.ccdailynews.com/sub_read.html?uid=306334&section=sc8
부상 위험 체계 훈련 경기 운영 규칙 자연 개인기 팀워크 자양분 잠실 피닉스 체육 박지웅 원장 설명 초등 여학생,https://n.news.naver.com/mnews/article/086/0002128449?sid=102
휠라 키즈 초등학생 남자 책가방 유통 고향 가족 선물 성장기 아동 신체 발달 체중 기능 디자인 기능 고려 선물,https://n.news.naver.com/mnews/article/076/0002177770?sid=103
한국 초등 체육 학회 지제 스키 초등학생 장판 손상 골절상 학생 확인 전문가 스키 골절 부상,https://n.news.naver.com/mnews/article/005/0000492461?sid=103
한국 초등 체육 학회 지제 조사 결과 스키 초등학생 장판 손상 골절상 학생 스키 골절 부상 병원 내원,https://n.news.naver.com/mnews/article/004/0002110089?sid=103
초등학생 아들 생각 아빠 슈퍼맨 전직 구조 대원 아빠 부상 패밀리맨 성장기 반영 걸로 상상 기자 의아 표정 아버지,https://n.news.naver.com/mnews/article/020/0002270675?sid=103
레그 생체 역학 검사 치료 시스템 성장기 소아 청소년 잘못 자세 다리 문제 병원 초등학생 가슴 일자 자세,https://n.news.naver.com/mnews/article/005/0000458738?sid=103
초등 학교 입학 정도 성장기 컴퓨터 화면 얼굴 부상 위험 충격 건강 시력 검사 최소,https://n.news.naver.com/mnews/article/296/0000009006?sid=103
컨버전스 시대 임베디드 성장 기회 김기철 사무 국장 컨버전스 시대 수록 임베디드 지난해 주니어 부문 신설 초등학생 고등학생 참여 미래 전문 인력 양성,http://www.datanet.co.kr/news/articleView.html?idxno=53972
최근 성장기 걸음걸이 유도 자세 형성 도움 기능 아동 초등학생 가방 척추 장애 교과서 과제물,https://n.news.naver.com/mnews/article/020/0002201888?sid=103
성장기 영양 균형 식습관 조성 대상 체험 행사 초등학생 대상 굿바이 아토피 캠프 캠프 친환경 먹거리 인식,https://n.news.naver.com/mnews/article/112/0002115182?sid=101
경쟁사 가격 원일 당시 구몬 학습 중고 학생 과목 초등학생 책정 처음 교원그룹 성장기 서울 강남 지역 건물 건물,https://n.news.naver.com/mnews/article/024/0000030248?sid=102
초등학생 야구 학교 야구 그것 아무 안전 최우선 리틀 야구 가입 대상 초등 학교 학년 중학교 학년 성장기,https://n.news.naver.com/mnews/article/088/0000161335?sid=102
사업 성장기 건강 친환경 먹거리 지원 지원 유치원생 초등학생 친환경 급식 혜택 기대,https://n.news.naver.com/mnews/article/081/0002074204?sid=102
조해진 한나라당 대변인 정회 결과 브리핑 도시 저소득층 가정 초등학생 원내대표 성장기 아동 나라 백년대계 진보신 노회찬,http://polinews.co.kr/news/newsview.html?no=101684
초등학생 밴쿠버 올림픽 빙판 스피드 인방 모태범 이상화 이승훈 조명 부상 슬럼프 성과 훈련 속내,https://m.entertain.naver.com/article/022/0002119957
스피드 인방 모태범 이상화 이승훈 선수 초등학생 밴쿠버 올림픽 빙판 올림픽 부상 슬럼프 올림픽 성과,http://www.newsen.com/news_view.php?uid=201003120901331001
프로그램 초등학생 밴쿠버 올림픽 빙판 스피드 인방 모태범 이상화 이승훈 조명 올림픽 부상 슬럼프 성과,https://m.entertain.naver.com/article/001/0003164819
초등학생 밴쿠버 올림픽 빙판 스피드 인방 모태범 이상화 이승훈 선수 올림픽 부상 슬럼프 올림픽 성과 발휘,http://www.newsen.com/news_view.php?uid=201003101906231001
성장기 아동 무상급식 제공 시절 신분 차이 소득 그거 학생 전체 초등 학교 중학교 학생 무상급식,https://n.news.naver.com/mnews/article/214/0000135495?sid=100
무상급식 확대 심인 무교육 대상 급식비 농어촌 지역 초등학생 교육비 특별회계 중학생 무상급식 개년 계획 발표 기자 간담회 국가 성장기 학생 건강 발달,https://n.news.naver.com/mnews/article/001/0003102418?sid=102
부상 수영 관절 무리 심폐 기능 향상 근지구력 하체 균형 발달 집중력 향상 도움 전신 근육 사용 균형 초등학생,https://n.news.naver.com/mnews/article/088/0000151145?sid=102
이비인후과 관련 질환 예방 치료 성장기 방어 능력 환경 영향 예전 초경 연령 초등학생 시작 초경 시작 장판,https://n.news.naver.com/mnews/article/145/0000006281?sid=103
저출산 사회 고착 초등학생 이후 연평균 감소 소비자 물가 상승 이후 자릿수 안정 고도 성장기,https://n.news.naver.com/mnews/article/032/0002043292?sid=101
조재경 초등학생 학부모 남자 시기 장판 부상 주의 성장기 장판,https://n.news.naver.com/mnews/article/214/0000103044?sid=103
초등학생 이전 남녀 비율 초등학생 남학생 비율 진영수 성장기 필수 권장 식품 운동 표준 몸무게 어른,https://n.news.naver.com/mnews/article/028/0001979398?sid=103
황석영 자전 성장기 개밥바라기 별도 표준 초등학생 용인 사회 격화 경쟁 시스템 역설,https://n.news.naver.com/mnews/article/021/0001975154?sid=103
운동 학교 학생 아버지 가슴 성장기 체력 당시 부상 동생 그녀 고등학생 초등학생 동생,https://m.sports.naver.com/general/article/145/0000004457
성인 규격 야구장 무리 시합 성장기 인대 파열 부상 속출 대한야구협회 여년 성인 규격 사정 초등학생 중학교 입학 투수 누간 야구장,https://m.sports.naver.com/general/article/032/0001965363
서동진 수석 코치 성장기 영양 섭취 아래 중학교 학년 여동생 초등학생 남동생 일흔 할머니 식구,https://n.news.naver.com/mnews/article/144/0000051704
부상 택시 기사 세상 범죄 장소 해고 승용차 돌진 초등학생 중상 이수정,https://n.news.naver.com/mnews/article/033/0000010989?sid=102
요리 연구가 이혜정 출연 초등학생 요리 모습 재료 성장기 효과 운동 습관 제시 예정 음식,https://n.news.naver.com/mnews/article/082/0000101170
초등학생 성장기 치수 사이즈 선택 사이즈 부상 위험 주의 필요 바퀴 성도 충격 완화 바퀴 숫자 표기,https://n.news.naver.com/mnews/article/084/0000021100?sid=102
회사 초등학생 유치원생 접근 견학 경비 향수 브랜드 부활 격변 세기 역설 일부 미국인 성장기 물건,https://n.news.naver.com/mnews/article/021/0000093192?sid=104
국내 러닝 산업 시장 형성기 초기 성장기 도달 얘기 평생 교육 기업 실제 산업 규모 유아 초등학생 교육 시장 러닝 한동안 자율 학습 가능 연령,https://n.news.naver.com/mnews/article/029/0000085080?sid=105
