nouns,link
공모전 재난 안전 관심 안전 중요 강조 내용 포스터 동영상 분야 부문 진행 포스터 공모전 초등 학교 재학 학생 동일 연령 어린이 대상,http://www.cfnews.kr/news.aspx/88764
공모전 재난 안전 관심 안전 중요 강조 내용 포스터 동영상 분야 부문 진행 포스터 공모전 초등 학교 재학 학생 동일 연령 어린이 대상,https://www.kyongbuk.co.kr/news/articleView.html?idxno=4015357
교통안전 물놀 사고 예방 캠페인 전개 일금 적십자 사원 서울 가곡 초등 학교 하교 전교생 쿠키 소독 물티슈 현수막 피켓 여름 방학 안전,https://www.lecturernews.com/news/articleView.html?idxno=157224
강북 구청장 송천 초등 학교 운동장 솔밭 근린공원 차례 방문 물놀 시설 설치 상황 점검 관계자 철저 안전 관리 당부 이순희 강북 구청장 어린이 가족,http://www.m-i.kr/news/articleView.html?idxno=1144083
안전 중요 강조 내용 포스터 동영상 분야 부문 진행 포스터 공모전 초등 학교 재학 학생 동일 연령 어린이 대상 크레파스 물감 채색,http://www.kjdaily.com/article.php?aid=1721979978636427242
공모전 재난 안전 관심 안전 중요 강조 내용 포스터 동영상 분야 부문 진행 포스터 공모전 초등 학교 재학 학생 동일 연령 어린이 대상,https://www.dkilbo.com/news/articleView.html?idxno=453461
울산 중구 평산 초등 학교 주변 어린이 보행 안전 교통 시설물 학부모 주장 반사경 안전 펜스 사고 위험 상태 일대 골목 가장자리 불법 주정차,https://n.news.naver.com/mnews/article/003/0012691202?sid=102
안전 체험 교실 여름철 수난 사고 위험 증가 어린이 선제 안전 교육 물놀 안전사고 대처 능력 강화 기획 체험 교실 동해 중학교 천곡 초등 학교 국청 소년단,http://fpn119.co.kr/219997
양초 학교 일대 등굣길 어린이 안심 등교 보행자 중심 안전 캠페인 이날 캠페인 기초 질서 의식 함양 교통안전 사고 예방 도움 기대 시민 기자 뉴스,http://www.headlinejeju.co.kr/news/articleView.html?idxno=549112
공모전 재난 안전 관심 안전 중요 강조 내용 포스터 동영상 분야 부문 진행 포스터 공모전 초등 학교 재학 학생 동일 연령 어린이 대상,https://www.ibuan.com/news/articleView.html?idxno=52345
서울 가곡 초등 학교 여름 방학 어린이 교통안전 물놀 사고 예방 캠페인 진행 자봉 사원 사진 적십자사 서울 지사 적십자사 서울 강서구 자봉 사원 지역 사회 초등학생 대상,https://idsn.co.kr/news/view/1065577986227210
교통안전 물놀 사고 예방 캠페인 전개 적십자 사원 서울 가곡 초등 학교 하교 전교생 쿠키 소독 물티슈 현수막 피켓 여름 방학 안전,https://www.ngonews.kr/news/articleView.html?idxno=154232
강북 구청장 송천 초등 학교 운동장 솔밭 근린공원 차례 방문 물놀 시설 설치 상황 점검 관계자 철저 안전 관리 당부 이순희 강북 구청장 어린이 가족,https://www.dailyt.co.kr/newsView/dlt202407260003
예상 물놀 사고 발생 철저 안전 점검 안전 수칙 홍보 당부 서산 교육 지원 서울 대학교 연계 늘봄 캠프 운영 여름 방학 서산 지역 늘봄 교실,https://www.joongdo.co.kr/web/view.php?key=20240726010008288
안전 사고 대비 수상 안전 요원 상시 대기 구급약품 동심 장충 격기 현장 관계자 최근 연일 계속 폭우 물놀이장 시설 피해 어린이 시민,https://www.ccdn.co.kr/news/articleView.html?idxno=988278
울산 중구 평산 초등 학교 주변 어린이 보행 안전 교통 시설물 지적 지자체 반사경 안전 펜스 사고 위험 평산 학부모회 중구 의회,https://www.iusm.co.kr/news/articleView.html?idxno=1043900
미취학 어린이 안전사고 예방 보호자 동반 입장 익산시 무료 배치 안전 관리 상대 안전교육 실시 배치 안전관 리자 원광 대학교 스포츠 과학부,http://sjbnews.com/news/news.php?number=822788
노후 안전사고 우려 상황 안정 체육 활동 영위 기여 야구 협회 상하 반기 무료 초등 학교 대상 야구 교실 다문화가정 어린이 주말 야구 교육,http://www.kihoilbo.co.kr/news/articleView.html?idxno=1101809
오조 근린공원 물놀이장 계양구 최초 공원 물놀이장 지역 초등 학교 학생 의견 수렴 점검 안전사고 예방 운영 윤환 구청장 계양 어린이 물놀이장,https://www.kmaeil.com/news/articleView.html?idxno=465339
사내 어린이 자녀 등원 여성 직원 대화 자녀 초등 학교 입학 시기 타사 어린이집 비용 안전사고 이슈 세반 운영 대부분,https://www.insightkorea.co.kr/news/articleView.html?idxno=205950
남해군 생활 안전사고 예방 사고 발생 대처 능력 향상 올해 안전 취약 계층 학생 어린이 대상 교육 강화 현재 학교 어린이집 유치원 개소,http://www.gndomin.com/news/articleView.html?idxno=401571
지역 초등 학교 학생 의견 수렴 우주 정거장 콘셉트 조성 면적 규모 매주 월요일 우천 시설물 점검 안전사고 예방 운영 윤환 구청장 어린이,https://www.kgnews.co.kr/news/article.html?no=803064
오조 근린공원 물놀이장 계양구 최초 공원 물놀이장 지역 초등 학교 학생 의견 수렴 점검 안전사고 예방 운영 윤환 구청장 계양 어린이 물놀이장,https://www.startuptoday.co.kr/news/articleView.html?idxno=321373
오조 근린공원 물놀이장 계양구 최초 공원 물놀이장 지역 초등 학교 학생 의견 수렴 점검 안전사고 예방 운영 윤환 구청장 계양 어린이 물놀이장,https://www.joongdo.co.kr/web/view.php?key=20240725010008196
식중독 관리 표준 운영 절차 여름철 식중독 예방 관리 홍보물 활용 식품 안전사고 예방 계획 식중독 관리 표준 운영 절차 학교 어린이집 유치원,https://www.jeonmae.co.kr/news/articleView.html?idxno=1059311
식중독 증식 여름철 식중독 사고 예방 관리 중요 만큼 동작구 여름철 식중독 예방 관리 홍보물 적극 활용 방침 동작구 학교 어린이집 유치원,https://n.news.naver.com/mnews/article/081/0003467677?sid=102
오조 근린공원 물놀이장 계양구 최초 공원 물놀이장 지역 초등 학교 학생 의견 수렴 점검 안전사고 예방 운영 윤환 구청장 계양 어린이 물놀이장,https://www.getnews.co.kr/news/articleView.html?idxno=685579
남해군 생활 안전사고 예방 사고 발생 대처 능력 향상 안전 취약 계층 올해 안전 취약 계층 학생 어린이 대상 교육 강화 현재 학교 어린이집,https://www.newsgn.com/news/articleView.html?idxno=430672
오조 근린공원 물놀이장 계양구 최초 공원 물놀이장 지역 초등 학교 학생 의견 수렴 점검 안전사고 예방 운영 윤환 구청장 계양 어린이 물놀이장,https://www.newscj.com/news/articleView.html?idxno=3162969
오조 근린공원 물놀이장 계양구 최초 공원 물놀이장 지역 초등 학교 학생 의견 수렴 점검 안전사고 예방 운영 윤환 구청장 계양 어린이 물놀이장,http://www.incheonnews.com/news/articleView.html?idxno=419962
남해군 군민 안전 교실 운영 남해군 지난달 생활 안전사고 예방 사고 발생 현재 학교 어린이집 유치원 개소 대상 교육 진행 노민 안전 기획 담당,https://www.viva100.com/main/view.php?key=20240725010007885
안전 사고 대비 수상 안전 요원 상시 대기 구급약품 동심 장충 격기 현장 관계자 최근 연일 계속 폭우 물놀이장 시설 피해 어린이 시민,https://n.news.naver.com/mnews/article/003/0012688711?sid=102
안전 사고 대비 수상 안전 요원 상시 대기 구급약품 동심 장충 격기 현장 관계자 최근 연일 계속 폭우 물놀이장 시설 피해 어린이 시민,http://www.bzeronews.com/news/articleView.html?idxno=670325
사진 남해군 남해군 생활 안전사고 예방 사고 발생 대처 능력 향상 안전 올해 안전 취약 계층 학생 어린이 대상 교육 강화 현재 학교 어린이집,http://www.metroseoul.co.kr/article/20240725500269
오조 근린공원 물놀이장 계양구 최초 공원 물놀이장 지역 초등 학교 학생 의견 수렴 점검 안전사고 예방 운영 윤환 구청장 계양 어린이 물놀이장,https://www.wikitree.co.kr/articles/970397
안전 사고 대비 수상 안전 요원 상시 대기 구급약품 동심 장충 격기 현장 관계자 최근 연일 계속 폭우 물놀이장 시설 피해 어린이 시민,http://www.dtnews24.com/news/articleView.html?idxno=775906
남해군 생활 안전사고 예방 사고 발생 대처 능력 향상 안전 취약 계층 올해 안전 취약 계층 학생 어린이 대상 교육 강화 현재 학교 어린이집 유치원,http://www.newsmaker.or.kr/news/articleView.html?idxno=154296
미취학 어린이 안전사고 예방 보호자 동반 입장 익산시 무료 배치 안전 관리 상대 안전교육 실시 배치 안전관 리자 원광 대학교 스포츠 과학부,http://www.jeollailbo.com/news/articleView.html?idxno=739392
공모전 주제 자연 재난 산불 탐방객 안전사고 예방 포스터 공모전 초등 학교 재학 학생 동일 연령 어린이 대상 크레파스 물감 채색 그림 절지,https://www.naeil.com/news/read/517998?ref=naver
남해군 군민 안전 교실 운영 남해군 생활 안전사고 예방 사고 발생 올해 안전 취약 계층 학생 어린이 대상 교육 강화 현재 학교 어린이집,https://www.kukinews.com/article/view/kuk202407250068
미취학 어린이 안전사고 예방 보호자 동반 입장 익산시 무료 물놀이장 배치 안전 관리 상대 안전교육 실시 배치 안전관 리자 원광 대학교,https://n.news.naver.com/mnews/article/002/0002342918?sid=102
식중독 관리 표준 운영 절차 여름철 식중독 예방 관리 홍보물 활용 식품 안전사고 예방 방침 식중독 관리 표준 운영 절차 학교 어린이집 유치원,http://www.hg-times.com/news/articleView.html?idxno=263593
미취학 어린이 안전사고 예방 보호자 동반 입장 물놀이장 유아 생태 놀이터 초등 학교 학년 어린이 대상 예약 운영 회차 오전 분시 회차,https://www.asiatoday.co.kr/view.php?key=20240725010015948
안전 사고 대비 수상 안전 요원 상시 대기 구급약품 동심 장충 격기 현장 관계자 최근 연일 계속 폭우 물놀이장 시설 피해 어린이 시민,https://n.news.naver.com/mnews/article/656/0000098823?sid=102
공모전 재난 안전 관심 안전 중요 강조 내용 포스터 동영상 분야 부문 진행 포스터 공모전 초등 학교 재학 학생 동일 연령 어린이,http://www.ikld.kr/news/articleView.html?idxno=297930
안전 사고 대비 수상 안전 요원 상시 대기 구급약품 동심 장충 격기 현장 관계자 최근 연일 계속 폭우 물놀이장 시설 피해 어린이 시민,https://www.ggilbo.com/news/articleView.html?idxno=1041347
안전 사고 대비 수상 안전 요원 상시 대기 구급약품 동심 장충 격기 현장 계룡시 관계자 최근 연일 계속 폭우 물놀이장 시설 피해 어린이 시민,https://daily.hankooki.com/news/articleView.html?idxno=1110017
안전 사고 대비 수상 안전 요원 상시 대기 구급약품 동심 장충 격기 현장 시민 안전 유소 주무관 최근 연일 계속 폭우 물놀이장 시설 피해 어린이,https://www.joongdo.co.kr/web/view.php?key=20240725010008011
안전 사고 대비 수상 안전 요원 상시 대기 구급약품 동심 장충 격기 현장 계룡시 관계자 최근 연일 계속 폭우 물놀이장 시설 피해 어린이,https://n.news.naver.com/mnews/article/629/0000307499?sid=102
안전 사고 대비 수상 안전 요원 상시 대기 구급약품 동심 장충 격기 현장 관계자 최근 연일 계속 폭우 물놀이장 시설 피해 어린이 시민,http://www.ccnnews.co.kr/news/articleView.html?idxno=342247
안전 중요 강조 내용 포스터 동영상 분야 부문 진행 포스터 공모전 초등 학교 재학 학생 동일 연령 어린이 대상 크레파스 물감 채색,https://n.news.naver.com/mnews/article/016/0002340451?sid=102
야외 물놀이장 연령 대별 맞춤 풀장 개유 아풀 어린이 청소년 규모 배치 안전사고 예방 응급 환자 발생 대비 의무실 운영 안전 관리 강화 계획,https://n.news.naver.com/mnews/article/016/0002340431?sid=101
식중독 관리 표준 운영 절차 여름철 식중독 예방 관리 홍보물 활용 식품 안전사고 예방 방침 식중독 관리 표준 운영 절차 학교 어린이집 유치원,https://www.gukjenews.com/news/articleView.html?idxno=3051837
공모전 재난 안전 관심 안전 중요 강조 내용 포스터 동영상 분야 부문 진행 포스터 공모전 초등 학교 재학 학생 동일 연령 어린이,http://www.bosa.co.kr/news/articleView.html?idxno=2227743
남해군 생활 안전사고 예방 사고 발생 대처 능력 향상 안전 취약 계층 올해 안전 취약 계층 학생 어린이 대상 교육 강화 현재 학교 어린이집,https://www.dnews.co.kr/uhtml/view.jsp?idxno=202407250837535900248
물놀이장 면적 어린이 풀장 유아 풀장 워터 터널 워터 스프레이 바디 슬라이드 놀이 시설 설치 안전사고 예방 안전 요원 응급 구조 요원 상시 배치 위생 관리,http://www.jeonmin.co.kr/news/articleView.html?idxno=401979
이하 공제 중앙 학교 안전사고 학교 재난 발생 피해 최소화 학교 안전 예방 사업 교육 지원 사업 공제 중앙 회가 추진 학생 어린이 주도 재난 안전 훈련 사업,http://www.whitepaper.co.kr/news/articleView.html?idxno=236429
의료 대단위 의사 어린이 사역 약국 재능기부 안전 사건 사고 본국 안착 감사 오금희,https://www.cts.tv/mission300/detail_mission/505/9539
은퇴 노인 구성 아동 안전 지킴이 학교 주변 순찰 어린이 보호자 역할 택시 아동 교통사고 인터뷰 이인순,https://n.news.naver.com/mnews/article/655/0000019899?sid=102
야외 물놀이장 연령 대별 맞춤 풀장 개유 아풀 어린이 청소년 규모 배치 안전사고 예방 응급 환자 발생 대비 의무실 운영 안전 관리 강화 계획,http://www.kwangju.co.kr/article.php?aid=1721821800771419006
보행로 안전사고 우려 광주 남구 조례 근거 단속 착수 견인 부과 어린이 보호구역 횡단보도 진출 점자 블록 주행 사고 발생 우려 교통 약자 통행 위협,https://n.news.naver.com/mnews/article/022/0003953916?sid=102
성북 초등 학교 지난해 대형 슬라이드 설치 행사장 어린이 행사장 안전 사고 위험 대비 현장 전요 투입 행사장 근처 공공 주차장 마련,https://n.news.naver.com/mnews/article/003/0012686549?sid=102
중구 수창 공원 어린이 물놀이장 수창동 번지 운영 매주 월요일 저수조 물놀이장 청소 시설 점검 휴장 중구 관계자 물놀 안전사고 예방,https://www.yeongnam.com/web/view.php?key=20240724010003447
방연구 학교 안전사고 감소 업무 협약 체결 기관 협약 제회 직원 세대 교육 커리큘럼 어린이 유초 고교 안전 예방 노력,https://n.news.naver.com/mnews/article/003/0012686310?sid=102
양강 초등 학교 교장 김태선 방학 안전 사고 대비 학생 응급처치 교육 실시 학생 응급처치 교육 안전교육 교육 활동 적십자사 충북 지사 강사 파견 학생 안전 사고 예방,http://www.bzeronews.com/news/articleView.html?idxno=670208
초등 학교 지역 아동 센터 센터 개소 어린이 안전 일기장 배부 어린이 눈높이 제작 주변 안전사고 예방 수칙 글쓰기 그림,http://www.fntoday.co.kr/news/articleView.html?idxno=327879
초등 학교 지역 아동 센터 센터 개소 어린이 안전 일기장 배부 어린이 눈높이 제작 주변 안전사고 예방 수칙 글쓰기 그림,http://www.betanews.net:8080/article/1471525.html
재난 안전 관심 안전 중요 강조 내용 포스터 동영상 분야 부문 진행 포스터 공모전 초등 학교 재학 학생 동일 연령 어린이 대상,http://www.metroseoul.co.kr/article/20240724500160
포스터 공모전 재난 안전 관심 안전 중요 강조 내용 포스터 동영상 분야 부문 진행 초등 학교 재학 학생 나이 어린이 대상 크레파스,https://n.news.naver.com/mnews/article/119/0002854381?sid=102
어린이 안전 일기장 제작 관내 초등 학교 천부 배부 바탕 어린이 눈높이 제작 안전사고 예방 수칙 글쓰기 그림 스티커 활동,https://n.news.naver.com/mnews/article/001/0014825910?sid=102
비즈 엔터 홍선 기자 학교 전공 중앙 회이 사장 정훈 공제 중앙 학교 안전사고 학교 안전 예방 사업 교육 지원 사업 공제 중앙 회가 추진 학생 어린이 주도 재난 안전 훈련 사업,http://enter.etoday.co.kr/news/view/262580
학교 안전 공제 중앙 회이 사장 정훈 공제 중앙 학교 안전사고 학교 재난 발생 피해 체험 안전 교육 학교 안전 예방 사업 교육 지원 사업 공제 중앙 회가 추진 학생 어린이,http://www.edupress.kr/news/articleView.html?idxno=11938
초등 학교 지역 아동 센터 센터 개소 어린이 안전 일기장 배부 어린이 눈높이 제작 주변 안전사고 예방 수칙 글쓰기 그림,http://www.shinailbo.co.kr/news/articleView.html?idxno=1907332
파견 어린이 청소년 안전사고 예방 지킴이 자처 안전 요원 파견 중고 학교 체험 활동 수학여행 청소년 캠프 대상 인원 집합 인솔 안전 통제 응급처치,https://www.gosiweek.com/article/1065599148001676
차선 학교 인근 이보호 구역 지정 추후 교통 공사 기간 학생 소음 안전사고 위험 노출 버스 지하철 환승 연계,http://www.kyeongin.com/main/view.php?key=20240723020491709
지난해 부산 초등 학교 발생 사고 지게차 안전 조치 작업 초등학생 사망 부상 비극 이외 수원 이보호 구역 우회전,https://www.nbntv.co.kr/news/articleView.html?idxno=3021666
안전사고 대처 방법 중심 진행 센터 직원 자발 참여 봉사 활동 어린이 인평 자동차 고등학교 강당 청소년 평화통일 시민 교실 개최 이날,https://www.asiatime.co.kr/article/20240723500157
양재대로 성일 초등 학교 성내 중학교 통학 둔촌동역 촌역 전통 시장 이용 주민 주요 통행로 차량 보행 안전사고 위험 개선 지난해,https://www.jeonmae.co.kr/news/articleView.html?idxno=1058383
불법 주정차 아동 청소년 안전사고 우려 인지 학교 주변 어린이 활동 정형 단속 주민 신고 안전사고 예방 노력,https://www.kgnews.co.kr/news/article.html?no=802421
도서관 학교 학생 학교 수업 저녁 도서관 강좌 어린이 자료실 인근 학교 도서관 교과 연계 프로그램 조언 검토 학교 전공 제회 안전사고 보상,https://n.news.naver.com/mnews/article/088/0000893457?sid=102
물놀이장 면적 어린이 풀장 유아 풀장 설치 워터 터널 워터 스프레이 바디 슬라이드 놀이 시설 안전사고 예방 안전 요원 응급 구조 요원 상시 배치,http://sjbnews.com/news/news.php?number=822345
양재대로 성일 초등 학교 성내 중학교 통학 둔촌동역 촌역 전통 시장 이용 주민 주요 통행로 차량 보행 안전사고 위험 사업 서울 시의,https://www.siminilbo.co.kr/news/newsview.php?ncode=1160287490037380
물놀이장 면적 어린이 풀장 유아 풀장 설치 워터 터널 워터 스프레이 바디 슬라이드 놀이 시설 안전사고 예방 안전 요원 응급 구조 요원 상시 배치 방침,https://www.newscj.com/news/articleView.html?idxno=3161777
힐링 음악회 모가면 어린이 목적관 무대 설치 상정 주민 참여 예산 폐지 노인 교통사고 안전사고 발생 방지 안전교육 의무,https://www.asiatime.co.kr/article/20240722500365
물놀이장 면적 어린이 풀장 유아 풀장 설치 워터 터널 워터 스프레이 바디 슬라이드 놀이 시설 안전사고 예방 안전 요원 응급 구조 요원 상시 배치,http://www.newsmaker.or.kr/news/articleView.html?idxno=154110
성내 중학교 통학 둔촌동역 촌역 전통 시장 이용 주민 주요 통행로 최근 해당 차량 보행 안전사고 위험 개선 지난해,http://www.hg-times.com/news/articleView.html?idxno=263463
우천 운전자 시야 확보 신체 초등 학교 학생 운전자 발견 시인 안전 우산 활용 어린이 교통사고 예방 교통안전 문화 수준 향상,http://www.weeklytoday.com/news/articleView.html?idxno=640245
도로 어린이 보호구역 차량 동선 보행자 동선 안전사고 우려 해결 관계 기관 부서 현장 점검 회의 용암 초등 학교 통학 환경 개선 사업,http://www.ikunkang.com/news/articleView.html?idxno=40355
우천 운전자 시야 확보 신체 초등 학교 학생 운전자 발견 시인 안전 우산 활용 어린이 교통사고 예방 교통안전 문화 수준 향상,http://www.m-i.kr/news/articleView.html?idxno=1142160
도로 어린이 보호구역 차량 동선 보행자 동선 안전사고 우려 해결 관계 기관 부서 현장 점검 회의 용암 초등 학교 통학 환경 개선 사업,http://www.tournews21.com/news/articleView.html?idxno=75175
강원 특별 자치도 춘천 초등 학교 체육관 어린이 안전 우산 활용 안전 수칙 홍보 어린이 안전 우산 운전자 시야 확보 주목 교통사고 예방 교통안전 문화,https://n.news.naver.com/mnews/article/079/0003918669?sid=102
우천 운전자 시야 확보 신체 초등 학교 학생 운전자 발견 시인 안전 우산 활용 어린이 교통사고 예방 교통안전 문화 수준,https://n.news.naver.com/mnews/article/468/0001078930?sid=102
물놀이장 면적 어린이 풀장 유아 풀장 설치 워터 터널 워터 스프레이 바디 슬라이드 놀이 시설 안전사고 예방 안전 요원 응급 구조 요원 상시 배치,https://n.news.naver.com/mnews/article/629/0000306338?sid=102
물놀이장 면적 어린이 풀장 유아 풀장 설치 워터 터널 워터 스프레이 바디 슬라이드 놀이 시설 안전사고 예방 안전 요원 응급 구조 요원 상시 배치,https://gj.newdaily.co.kr/site/data/html/2024/07/21/2024072100037.html
조성 양재대로 성일 초등 학교 성내 중학교 통학 둔촌동역 촌역 전통 시장 이용 주민 주요 통행로 최근 해당 차량 보행 안전사고,http://www.shinailbo.co.kr/news/articleView.html?idxno=1906041
지난해 유치원 어린이 안전사고 발생 확인 유치원 사고 발생 안전사고 학교 전공 제회 접수 기준 전년 전년,https://n.news.naver.com/mnews/article/022/0003952874?sid=102
서울 용산구 안전 하굣길 조성 용암 초등 학교 통학 주변 환경 개선 공사 도로 어린이 보호구역 차량 동선 보행자 동선 안전사고 우려 제기,https://www.asiatoday.co.kr/view.php?key=20240721010013023
도로 어린이 보호구역 차량 동선 보행자 동선 안전사고 우려 해결 관계 기관 부서 현장 점검 회의 용암 초등 학교 통학 환경 개선 사업,https://n.news.naver.com/mnews/article/421/0007676695?sid=102
김해 서부 소방서 서장 윤영찬 진영 금병 초등 학교 강당 국청 소년단 안전 골든벨 소방 안전 상식 함양 조심 생활 어린이 생활 안전 사고 예방 기여,https://www.newsgn.com/news/articleView.html?idxno=429609
사진 제공 김경률 원사 공군 전투 비행단 전비 부대 인근 북초 학교 학생 교직원 프로그램 서철 물놀 안전사고 방지 어린이 안보 의식,https://kookbang.dema.mil.kr/newsWeb/20240722/3/ATCE_CTGR_0010050000/view.do
용암 초등 학교 학생 통학 이용 소월 도로는 정도 도로 어린이 보호구역 차량 동선 보행자 동선 안전사고 우려,https://n.news.naver.com/mnews/article/277/0005448503?sid=102
어린이 보호구역 차량 동선 보행자 동선 안전사고 우려 해결 관계 기관 현장 점검 회의 용암 초등 학교 통학 환경 개선 사업 추진 신설 보행 데크 길이,https://n.news.naver.com/mnews/article/003/0012678913?sid=102
유치원 어린이집 초등 저학년 유치원 대상 포함 인력 확충 고민 채용 안전사고 발생 책임 대책 장애 유아 지원 방안 보완,https://n.news.naver.com/mnews/article/421/0007676140?sid=102
도로 어린이 보호구역 차량 동선 보행자 동선 안전사고 우려 해결 관계 기관 부서 현장 점검 회의 용암 초등 학교 통학 환경 개선 사업,http://www.shinailbo.co.kr/news/articleView.html?idxno=1905625
물놀이장 면적 어린이 풀장 유아 풀장 설치 워터 터널 워터 스프레이 바디 슬라이드 놀이 시설 정읍시 안전사고 예방 안전 요원 응급 구조 요원 상시 배치,http://www.newstnt.com/news/articleView.html?idxno=393456
정원 회랑 전시실 어린이 도서관 구성 기장군 지역 문화 공간 올해 사고 발생 안전 지킴 어르신 신고 인명 피해 수습 학교 학생,https://ilyo.co.kr/?ac=article_view&entry_id=475917
공군 전투 비행단 전비 부대 인근 위치 북초 학교 학생 교직원 시행 안전사고 미연 방지 한편 어린이 안보 의식 마련 이날,https://www.joongdo.co.kr/web/view.php?key=20240720010006347
