nouns,link
이용객 안전사고 발생 소지 사항 현장 개선 조치 공단 관계자 어린이집 유치원 경계선 금연 구역 확대 초중 고교 학교,https://ilyo.co.kr/?ac=article_view&entry_id=476633
올림픽 공원 어린이 워터 파크 운영 유치원생 초등 학교 학년 어린이 프로그램 제공 안전 관리 요원 상시 배치 물놀 안전사고 사전 예방,https://n.news.naver.com/mnews/article/421/0007706073?sid=102
학교 학년 어린이 세용 세용 세용 풀장 구분 운영 풀장 워터 슬라이드 설치 탈의실 휴게 공간 마련 안전사고,https://n.news.naver.com/mnews/article/056/0011774117?sid=102
안전사고 갈등 상황 발생 지적 교사 유아 비율 초과 대책 의견 어린이집 관계자 유아 학교 시범 사업 문의 급간 식비 지원 의견 교육,https://www.ibabynews.com/news/articleView.html?idxno=119495
어린이 이용 연령 구분 풀장 운영 세용 세용 세용 풀장 풀장 워터 슬라이드 설치 탈의실 휴게 공간 마련 안전사고,https://n.news.naver.com/mnews/article/001/0014849478?sid=102
가정 학교 지진 유괴 전기 가지 안전사고 위험 대처 방법 문헌 구청장 오른쪽 지난해 개최 어린이 안전 뮤지컬 관람,http://www.m-i.kr/news/articleView.html?idxno=1146418
안전사고 갈등 상황 발생 지적 교사 유아 비율 초과 대책 시범 학교 신청 대상 유치원 어린이집 제시 선정 기준 장의,https://www.ibabynews.com/news/articleView.html?idxno=119477
물놀 안전사고 예방 예정 매주 일요일 공휴 일월 오후 어린이 관내 학교 청소년 시설 소속 청소년 동아리 참가 수원시 홈페이지 검색창 수원시,https://www.newsworks.co.kr/news/articleView.html?idxno=761164
어린이 보호구역 학로 중심 보행 약자 행량 사고 위험 고려 설치 장소 선정 고척 초등 학교 신도림역 교통 신호 보조 장치 신규 설치,https://cwn.kr/article/1065601449367903
남동구 어린이 안전 히어로즈 활동 학생 간담회 개최 행사 학교 박종효 구청장 어린이 안전 히어로즈 어린이 안전사고 예방 지역 사회 소속감,https://www.siminilbo.co.kr/news/newsview.php?ncode=1160283853580577
공연 눈높이 체험 참여 가정 학교 지진 안전 교육 어린이 안전사고 안전 문화 기여 노력 한편,https://www.ibabynews.com/news/articleView.html?idxno=119465
사고 발생 열흘 학교 소풍 여자 지역 추정 안전사고 예방 차원 발견 사살 허용 방안 검토 주민 늑대,https://www.newscj.com/news/articleView.html?idxno=3165666
물놀 안전사고 대응 태세 유지 시민 수상 구조 노고 격려 이날 김상식 공연 참가 어린이 마술 공연 눈앞 도서관,https://www.joongdo.co.kr/web/view.php?key=20240802010000447
정부 지자체 어린이 보호구역 발생 교통사고 속도 제한 다양 대책 초등 학교 주변 어린이 보호구역 확대 지정 안전 하굣길 조성 주변,https://n.news.naver.com/mnews/article/119/0002857842?sid=102
확보 대곶 초등 학교 학생 보행 안전 확보 양초 무초 어린이 보호구역 확보 양초 학생 무초 명의 보행 안전 교통사고 예방 안전 학로,https://www.ekn.kr/web/view.php?key=20240802026127198
대곶 초등 학교 학생 명의 보행 안전 확보 계획 양초 무초 어린이 보호구역 보행 안전 교통사고 예방 안전 학로 조성 지하차도 자동차 시설 설치 사업,http://www.seoulfn.com/news/articleView.html?idxno=528270
확보 대곶 초등 학교 학생 명의 보행 안전 확보 양초 무초 어린이 보호구역 특교 확보 양초 학생 무초 명의 보행 안전 교통사고 예방 안전,https://www.dnews.co.kr/uhtml/view.jsp?idxno=202408012249095730025
승강기 안전 어린이 재출 동로 운영 최근 지진 대형 화재 안전사고 농업계 학교 졸업 활용 방안 중증 장애 지원 제도 실효 확보 방안 공공 기관 전적지 활용 방안,https://www.kukinews.com/article/view/kuk202408010210
학교 저학년 등교 집중 오전 부모 적극 교통안전 관리 활동 교통사고 분석 시스템 최근 간년 전국 스쿨 이세,https://www.jjan.kr/article/20240801580190
학교 학생 명의 보행 안전 확보 양초 무초 어린이 보호 확보 양초 학생 무초 명의 보행 안전 교통사고,http://www.breaknews.com/1047788
확보 대곶 초등 학교 학생 명의 보행 안전 확보 양초 무초 어린이 보호구 확보 양초 학생 무초 명의 보행 안전 교통사고 예방 안전 학로,https://www.kmaeil.com/news/articleView.html?idxno=466370
학교 이달 우이천 다목 광장 길음동 공터 대형 물놀 시설 마련 바캉스 축제 여름 방학 어린이 바캉스 축제 인파 만큼 안전사고,https://n.news.naver.com/mnews/article/277/0005454032?sid=102
대곶 초등 학교 학생 명의 보행 안전 확보 양초 무초 어린이 보호구역 보행 안전 교통사고 예방 안전 학로 조성 전국 지하차도 침수,https://www.nspna.com/news/?mode=view&newsid=711199
대곶 초등 학교 학생 명의 보행 안전 확보 양초 무초 어린이 보호구역 확보 양초 학생 무초 명의 보행 안전 교통사고 예방 안전 학로,https://www.viva100.com/main/view.php?key=20240801010000255
확보 대곶 초등 학교 학생 명의 보행 안전 확보 양초 무초 어린이 보호구역 확보 양초 학생 무초 명의 보행 안전 교통사고 예방 안전 학로,https://www.ajunews.com/view/20240801135527666
확보 대곶 초등 학교 학생 명의 보행 안전 확보 양초 무초 어린이 보호구 확보 양초 학생 무초 명의 보행 안전 교통사고 예방 안전 학로,http://www.weeklytoday.com/news/articleView.html?idxno=642527
서원 대학교 입학 학생 처장 이형진 초록 우산 어린이재단 충북 지역 본부 위원 참여 위원 서프보드 물놀 용품 안전사고 증가 시기 기사 본격 여름 휴가철,https://www.inews365.com/news/article.html?no=825606
학하 지구 개발 이전 개교 예정 학하 초등 학교 예정지 주변 보도 포장 안전 펜스 정비 보행로 개선 사업 특교 반영 조승래 의원 총선 부모 안심 어린이,http://www.shinailbo.co.kr/news/articleView.html?idxno=1911191
확보 대곶 초등 학교 학생 명의 보행 안전 확보 양초 무초 어린이 보호구 확보 양초 학생 무초 명의 보행 안전 교통사고 예방 안전 학로,http://www.enewstoday.co.kr/news/articleView.html?idxno=2159289
신양 초등 학교 풍무 초등 학교 어린이 보호구역 방호 울타리 보수 사업 특별 교부세 확보 양초 학생 명과 무초 보행 안전 교통사고 예방 안전 학로,http://www.newsprime.co.kr/news/article.html?no=648971
동명 동부 초등학교 인도 설치 공사 지하차도 진입 차단 시설 설치 정희용 의원 특별 교부세 주민 편익 증대 생활 여건 개선 재해 피해 안전사고 예방 지역 현안,https://n.news.naver.com/mnews/article/088/0000895315?sid=004
학교 현장 여름 방학 시작 학생 대상 수상 안전 교육 실시 물놀이 돌발 상황 당황 대응 어린이 생존 수영 교육 실습 중심 운영 지난달 행정,https://n.news.naver.com/mnews/article/005/0001714860?sid=110
동명 동부 초등학교 인도 설치 공사 동명면 정희용 의원 총선 공약 어린이 놀이 시설 확충 안전 통학 조성 사업 일환 추진 예정 지하차도 교동,http://www.ksmnews.co.kr/news/view.php?idx=494720
안전사고 위험 김도읍 강서 의원 재선 정동 기장 의원 확보 의원 확보 예산 강서구 어린이 놀이 시설 도시 환경 개선 재난 안전 대비,https://n.news.naver.com/mnews/article/658/0000080032?sid=100
횡단보도 초등학교 정문 어린이 보호구역 주정차 절대 금지 구역 분류 차선 길목 시민 차량 간격 안전사고 위험 인근 주민,http://www.jeonmin.co.kr/news/articleView.html?idxno=402363
동명 동부 초등학교 인도 설치 공사 동명면 정희용 의원 총선 공약 어린이 놀이 시설 확충 안전 통학 조성 사업 일환 추진 예정 지하차도 교동 복성,http://www.m-i.kr/news/articleView.html?idxno=1145640
대학 교육 대부분 취업 집중 기본 취업 생명 건강 안전교육 안전사고 발생 안전 불감증 안전 불감증,https://n.news.naver.com/mnews/article/117/0003857026?sid=103
학하 지구 개발 이전 개교 예정 학하 초등 학교 예정지 주변 보도 포장 안전 펜스 정비 보행로 개선 사업 특교 반영 조승래 의원 총선 부모 안심 어린이 통학 환경,http://www.gocj.net/news/articleView.html?idxno=135455
칠곡군 확보 특별 교부세 어린이 놀이터 조성 사업 북삼 동명 동부 초등학교 인도 설치 공사 동명면 정희용 의원 총선 공약 어린이 놀이 시설 확충 안전,https://www.dkilbo.com/news/articleView.html?idxno=454238
학교 도설 공사 정희용 의원 총선 공약 어린이 놀이 시설 확충 안전 행정 특별 교부세 주민 편익 증대 생활 여건 개선 재해 피해 안전사고 예방 지역,https://n.news.naver.com/mnews/article/031/0000858252?sid=102
동명동 부초 학교 도설 공사 특교 확보 정희용 의원 총선 공약 어린이 놀이 시설 확충 안전 통학 조성,http://www.breaknews.com/1047545
주요 내용 학하 지구 개발 이전 개교 예정 학하 초등 학교 예정지 주변 보도 포장 안전 펜스 정비 보행로 개선 사업 특교 반영 의원 총선 부모 안심 어린이 통학 환경,https://www.joongdo.co.kr/web/view.php?key=20240731010009850
학하 지구 개발 이전 개교 예정 학하 초등 학교 예정지 주변 보도 포장 안전 펜스 정비 보행로 개선 사업 특교 반영 조승래 의원 총선 부모 안심 어린이 통학 환경,https://daily.hankooki.com/news/articleView.html?idxno=1112302
학하 지구 개발 이전 개교 예정 학하 초등 학교 예정지 주변 보도 포장 안전 펜스 정비 보행로 개선 사업 특교 반영 의원 총선 부모 안심 어린이 통학 환경,https://www.goodmorningcc.com/news/articleView.html?idxno=401970
어린이 지도 서산 시청 사격 선수 재능 기부 서산시 사격장 발생 안전사고 예방 총력 공기 국가 유현영 선수 중학교 사격,https://n.news.naver.com/mnews/article/001/0014843607?sid=102
학하 초등 학교 개교 예정지 주변 보도 포장 안전 펜스 정비 보행로 개선 사업 특교 반영 의원 총선 부모 안심 어린이 통학 환경 공약 제시 유성구 봉명동,http://www.dtnews24.com/news/articleView.html?idxno=776200
학교 도설 공사 의원 총선 공약 어린이 놀이 시설 확충 안전 행정 특별 교부세 주민 편익 증대 생활 여건 개선 재해 피해 안전사고 예방 지역 현안,https://n.news.naver.com/mnews/article/003/0012700455?sid=102
남동구 어린이 안전 히어로즈 활동 학생 간담회 개최 행사 학교 박종효 구청장 어린이 안전 히어로즈 어린이 안전사고 예방 지역 사회 소속감,https://www.startuptoday.co.kr/news/articleView.html?idxno=323019
학교 도설 공사 정희용 의원 총선 공약 어린이 놀이 시설 확충 안전 행정 특별 교부세 주민 편익 증대 생활 여건 개선 재해 피해 안전사고 예방 지역,https://www.idaegu.com/news/articleView.html?idxno=610984
학하 지구 개발 이전 개교 예정 학하 초등 학교 예정지 주변 보도 포장 안전 펜스 정비 보행로 개선 사업 특교 반영 관련 의원 총선 부모 안심 어린이 통학 환경,http://www.jbnews.com/news/articleView.html?idxno=1446141
학교 통학 대전역 인근 먹자골목 지역 평소 어린이 통학 주민 통행 상수도 전기 가스 규모 굴착 공사 아스팔트 포장 노후 보행자 안전사고,http://www.ccnnews.co.kr/news/articleView.html?idxno=342818
행정 인천 서구 루원시티 봉수 초등 학교 후문 상습 결빙 도로 열선 설치 예산 생활 안전 특교 확보 보도 아래 열선 설치 어린이 낙상 사고 예방 안전 보행 환경 조성,http://www.incheontoday.com/news/articleView.html?idxno=250990
방범 어린이 보호 도시 공원 놀이터 쓰레기 투기 단속 교통 단속 교통 정보 수집 분석 인공지능 영상 분석 인파 밀집 시군 소방 경찰 신속 대응 요청 도민 안전사고 예방,http://www.boannews.com/media/view.asp?idx=131719&kind=
시민 어린이 생활 안전 수칙 웹툰 동물 캐릭터 활용 호기심 사고뭉치 호기심 고양이 무모 안전 열정 안전 선생,http://www.ilyoseoul.co.kr/news/articleView.html?idxno=491189
오류 초등 학교 통학 로로 이용 서대전역 인근 먹자골목 지역 위치 평소 어린이 주민 통행 상수도 전기 가스 규모 굴착 공사 아스팔트 포장 노후 보행 안전사고,http://www.dtnews24.com/news/articleView.html?idxno=776168
구로동 우체국 오류동 교회 천국 어린이집 어린이 보호구역 주민 참여 예산 사업 일환 안전 교통 분과 오류동 주민 자치 위원회 제안 관계자 교통사고 예방,https://www.siminilbo.co.kr/news/newsview.php?ncode=1160285651934894
어린이 로즈 학교 주변 위험 요소 발굴 신고 안전 체험 교육 재난 안전 골든벨 안전 체험 교육 실시 계획 활동 기간 안전 문화 확산 안전사고 예방,https://www.geconomy.co.kr/news/article.html?no=287357
행량 사고 위험 고려 선정 구로동 우체국 오류동 교회 천국 어린이집 어린이 보호구역 개소 주민 참여 예산 사업 일환 안전 교통 분과 오류동 주민 자치 위원회 제안,http://www.queen.co.kr/news/articleView.html?idxno=416211
교통사고 예방 보행자 안전 강화 바닥형 보행 신호등 보행 신호 음성 안내 횡단 보도 교통 신호 보조 장치 확대 설치 올해 고척 초등 학교 신도림역 개소 바닥형,https://www.jeonmae.co.kr/news/articleView.html?idxno=1060624
어린이 로즈 학교 주변 위험 요소 발굴 신고 안전 체험 교육 재난 안전 안전 체험 교육 실시 계획 활동 기간 안전 문화 확산 안전사고 예방,https://daily.hankooki.com/news/articleView.html?idxno=1111418
행량 사고 위험 고려 선정 구로동 우체국 오류동 교회 천국 어린이집 어린이 보호구역 개소 주민 참여 예산 사업 일환 안전 교통 분과 오류동 주민 자치 위원회 제안,https://www.gukjenews.com/news/articleView.html?idxno=3055350
행량 사고 위험 고려 선정 구로동 우체국 오류동 교회 천국 어린이집 어린이 보호구역 개소 주민 참여 예산 사업 일환 안전 교통 분과 오류동 주민 자치 위원회 제안,http://www.shinailbo.co.kr/news/articleView.html?idxno=1910057
행량 사고 위험 고려 선정 구로동 우체국 오류동 교회 천국 어린이집 어린이 보호구역 개소 주민 참여 예산 사업 일환 안전 교통 분과 오류동 주민 자치 위원회 제안,http://www.m-i.kr/news/articleView.html?idxno=1144765
행량 사고 위험 고려 선정 구로동 우체국 오류동 교회 천국 어린이집 어린이 보호구역 개소 주민 참여 예산 사업 일환 안전 교통 분과 오류동 주민 자치 위원회 제안,https://n.news.naver.com/mnews/article/277/0005452413?sid=102
교육부 지난해 시도 교육청 수학여행 현장 체험 학습 어린이 통학 버스 이용 교사 학교 안전 개정 학교 안전사고 발생 중과실 교원 책임 면제,https://n.news.naver.com/mnews/article/005/0001714288?sid=102
어린이 로즈 학교 주변 위험 요소 발굴 신고 안전 체험 교육 재난 안전 골든벨 안전 체험 교육 실시 계획 활동 기간 안전 문화 확산 안전사고 예방,https://www.wikitree.co.kr/articles/971184
어린이 로즈 학교 주변 위험 요소 발굴 신고 안전 체험 교육 재난 안전 안전 체험 교육 실시 계획 활동 기간 안전 문화 확산 안전사고 예방,https://www.gukjenews.com/news/articleView.html?idxno=3055148
어린이 로즈 학교 주변 위험 요소 발굴 신고 안전 체험 교육 재난 안전 안전 체험 교육 실시 계획 활동 기간 안전 문화 확산 안전사고 예방,http://www.newstnt.com/news/articleView.html?idxno=396164
어린이 로즈 학교 주변 위험 요소 발굴 신고 안전 체험 교육 재난 안전 안전 체험 교육 실시 계획 활동 기간 안전 문화 확산 안전사고 예방,https://www.ccdn.co.kr/news/articleView.html?idxno=988851
어린이 로즈 학교 주변 위험 요소 발굴 신고 안전 체험 교육 재난 안전 안전 체험 교육 실시 계획 활동 기간 안전 문화 확산 안전사고 예방,https://www.dnews.co.kr/uhtml/view.jsp?idxno=202407291931120470622
어린이 로즈 학교 주변 위험 요소 발굴 신고 안전 체험 교육 재난 안전 안전 체험 교육 실시 계획 활동 기간 안전 문화 확산 안전사고 예방,https://n.news.naver.com/mnews/article/629/0000308701?sid=102
어린이 로즈 학교 주변 위험 요소 발굴 신고 안전 체험 교육 재난 안전 안전 체험 교육 실시 계획 활동 기간 안전 문화 확산 안전사고 예방,http://www.ccnnews.co.kr/news/articleView.html?idxno=342658
어린이 로즈 초등 학교 학년 대상 지원자 모집 학교 선발 안전 체험 교육 실시 계획 활동 기간 안전 문화 확산 안전사고 예방 우수,https://n.news.naver.com/mnews/article/656/0000099288?sid=102
어린이 로즈 학교 주변 위험 요소 발굴 신고 안전 체험 교육 재난 안전 골든벨 안전 체험 교육 실시 계획 활동 기간 안전 문화 확산 안전사고 예방,https://www.ggilbo.com/news/articleView.html?idxno=1041952
어린이 로즈 학교 주변 위험 요소 발굴 신고 안전 체험 교육 재난 안전 안전 체험 교육 실시 계획 활동 기간 안전 문화 확산 안전사고 예방,https://www.ccdailynews.com/news/articleView.html?idxno=2288255
어린이 로즈 학교 주변 위험 요소 발굴 신고 안전 체험 교육 재난 안전 안전 체험 교육 실시 계획 활동 기간 안전 문화 확산 안전사고 예방,https://www.ajunews.com/view/20240729092654510
어린이 로즈 학교 주변 위험 요소 발굴 신고 안전 체험 교육 재난 안전 안전 체험 교육 실시 계획 활동 기간 안전 문화 확산 안전사고 예방,https://n.news.naver.com/mnews/article/016/0002342357?sid=100
양초 학교 일대 등굣길 어린이 안심 등교 보행자 중심 안전 캠페인 이날 캠페인 기초 질서 의식 함양 교통안전 사고 예방 도움 기대,https://www.newsjeju.net/news/articleView.html?idxno=403480
안전사고 예방 어린이 보호구역 노약자 초중 고등학교 부근 신호 횡단 보도 대상지 활주로 횡단 보도 설치 진행,http://www.fntoday.co.kr/news/articleView.html?idxno=328368
영신 고등학교 설치 활주로 횡단보도 영등포구 제공 서울 영등포구 구청장 최호 어린이 안전사고 예방 어린이 보호구역 노약자 교통 약자 이동,https://www.jeonmae.co.kr/news/articleView.html?idxno=1060176
대영 중학교 근처 설치 활주로 횡단보도 사진 영등 포구 제공 일보 백중현 기자 도로 안전사고 예방 어린이 보호구역 노약자 교통 약자 이동,http://www.m-i.kr/news/articleView.html?idxno=1144403
물놀이장 면적 어린이 풀장 유아 풀장 설치 워터 터널 워터 스프레이 바디 슬라이드 놀이 시설 안전사고 예방 안전 요원 응급 구조 요원 상시 배치,http://www.travelitoday.com/read/contentsView/19050/41
안전사고 예방 어린이 보호구역 노약자 교통 약자 이동 초중 고등학교 부근 신호 횡단 보도 대상지 활주로 횡단 보도 설치 진행,https://n.news.naver.com/mnews/article/021/0002651188?sid=102
안전사고 예방 어린이 보호구역 노약자 교통 약자 이동 초중 고등학교 부근 신호 단보 대상지 활주로 횡단 보도 설치 진행,http://www.shinailbo.co.kr/news/articleView.html?idxno=1909497
우천 운전자 시야 확보 신체 초등 학교 학생 운전자 발견 시인 안전 우산 활용 어린이 교통사고 예방 교통안전 문화 수준 향상,https://www.ekn.kr/web/view.php?key=20240729022474378
학부모 최근 어린이 보호구역 교통 사고 발생 최소한 안전 장치 우려 동구 철거 관련 학교 협의 상황,https://www.ksilbo.co.kr/news/articleView.html?idxno=1005131
여름 불교 학교 프로그램 진행 유아 중고 학생 어린이 청소년 조계사 조계사 물놀이 진행 안전 요원 자원 봉사자 배치 안전 사고 예방 만전,https://news.bbsi.co.kr/news/articleView.html?idxno=3164191
울산시 중구 평산 초등 학교 주변 어린이 보행 안전 교통 시설물 안전 위협 신호등 평산 학부모 사이 교통사고 발생 우려 목소리,http://www.ujeil.com/news/articleView.html?idxno=351788
공모전 재난 안전 관심 안전 중요 강조 내용 포스터 동영상 분야 부문 진행 포스터 공모전 초등 학교 재학 학생 동일 연령 어린이 대상,https://www.ccdailynews.com/news/articleView.html?idxno=2287962
안전 중요 강조 내용 포스터 동영상 분야 부문 진행 포스터 공모전 초등 학교 재학 학생 동일 연령 어린이 대상 크레파스 물감 채색,https://www.ccdn.co.kr/news/articleView.html?idxno=988418
공모전 재난 안전 관심 안전 중요 강조 내용 포스터 동영상 분야 부문 진행 포스터 공모전 초등 학교 재학 학생 동일 연령 어린이,http://sjbnews.com/news/news.php?number=822917
공모전 재난 안전 관심 안전 중요 강조 내용 주제 포스터 동영상 부문 진행 포스터 공모전 초등 학교 재학 학생 동일 연령 어린이 대상,http://www.namdonews.com/news/articleView.html?idxno=781902
교통 체증 안전사고 위험 해운 대구 여로 해운대 인문학 도서관 개관 공공 도서관 부지 면적 지하 지상 규모 디지털 자료실 종합 자료실 어린이 자료,https://n.news.naver.com/mnews/article/658/0000079692?sid=103
어린이 더위 연합뉴스 초등 학교 유치원 방학 기간 대부분 안전사고 발생 워터 슬라이드 바닥 분수 대형 풀장 다양 시설,https://n.news.naver.com/mnews/article/047/0002441281?sid=103
공모전 재난 안전 관심 안전 중요 강조 내용 포스터 동영상 분야 부문 진행 포스터 공모전 초등 학교 재학 학생 동일 연령 어린이 대상,http://www.hidomin.com/news/articleView.html?idxno=555132
공모전 재난 안전 관심 안전 중요 강조 내용 포스터 동영상 분야 부문 진행 포스터 공모전 초등 학교 재학 학생 동일 연령 어린이 대상,http://www.gndomin.com/news/articleView.html?idxno=401713
재난 안전사고 예방 안전 문화 확산 국립 공원 재난 안전 포스터 동영상 대국민 공모전 개최 공모전 초등 학교 재학 학생 동일 연령 어린이 대상,http://www.kbmaeil.com/news/articleView.html?idxno=1005533
자료 사고 동영상 자료 활용 생동감 교육 교육 신청 중고 학교 교통문화 연수원 수영 원장 교통 취약 계층 어린이 노인 청소년 교통안전 교육 교통사고,http://www.knnews.co.kr/news/articleView.php?idxno=1438137
국립 공원 이용 국민 재난 안전 사고 경각심 안전 문화 확산 안전 수칙 홍보 활용 예정 어린이 포스터 동영상 분야 국립 공원 공단,http://www.jbnews.com/news/articleView.html?idxno=1445724
재난 안전 관심 안전 중요 강조 공모전 포스터 동영상 부문 진행 포스터 초등 학교 재학 학생 동일 연령 어린이 대상 크레파스,https://n.news.naver.com/mnews/article/087/0001058566?sid=102
공모전 재난 안전 관심 안전 중요 강조 내용 포스터 동영상 분야 부문 진행 포스터 공모전 초등 학교 재학 학생 동일 연령 어린이 대상,http://www.kbsm.net/news/view.php?idx=441754
안전 중요 강조 개최 공모전 포스터 동영상 분야 부문 진행 포스터 공모전 초등 학교 재학 학생 동일 연령 어린이 대상 크레파스 물감,http://www.jndn.com/article.php?aid=1722141016391212011
공모전 재난 안전 관심 안전 중요 강조 내용 포스터 동영상 분야 부문 진행 포스터 공모전 초등 학교 재학 학생 동일 연령 어린이 대상,http://www.chungnamilbo.co.kr/news/articleView.html?idxno=782815
강북 구청장 송천 초등 학교 운동장 솔밭 근린공원 차례 방문 물놀 시설 설치 상황 점검 관계자 철저 안전 관리 당부 이순희 강북 구청장 어린이 가족,http://www.shinailbo.co.kr/news/articleView.html?idxno=1909090
공모전 재난 안전 관심 안전 중요 강조 내용 포스터 동영상 분야 포스터 공모전 초등 학교 재학 학생 동일 연령 어린이 대상 크레 물감,https://www.joongdo.co.kr/web/view.php?key=20240727010008529
공모전 재난 안전사고 주제 포스터 동영상 분야 부문 진행 포스터 공모전 초등 학교 재학 학생 동일 연령 어린이 대상 크레파스 물감 채색 그림,http://www.domin.co.kr/news/articleView.html?idxno=1478558
안전 중요 강조 내용 포스터 동영상 분야 부문 진행 포스터 공모전 초등 학교 재학 학생 동일 연령 어린이 대상 크레파스 물감 채색,https://www.joongdo.co.kr/web/view.php?key=20240726010008483
