nouns,link
어린이 보호구역 안전 확보 최선 한편 김승수 의원 학교 유치원 내부 시설 운동장 발생 교통사고 스쿨 동일 처벌,http://www.newsworker.co.kr/news/articleView.html?idxno=344413
안전 교통사고 예방 예방 주제 포스터 생활 안전 수칙 시즌 참가 대상 초등 학교 학년 시즌 유치원 어린이집 미취학 아동,https://n.news.naver.com/mnews/article/001/0014883063?sid=102
최근 어린이 보호구역 교통사고 백건 발생 이중 사망자 부상자 사고 어린이 안전 위협 대구 에너지 경제 신문 중모 기자 학교 주변 공사 현장,https://www.ekn.kr/web/view.php?key=20240820023435907
어린이 보호구역 안전 확보 최선 한편 김승수 의원 학교 유치원 내부 시설 운동장 발생 교통사고 스쿨 동일 처벌,http://www.sentv.co.kr/news/view/693505
교통사고 평균 지난해 부산 초등 학교 어린이 보호 구역 지게차 운전자 별도 안전 조치 가량 자재 초등학생,https://n.news.naver.com/mnews/article/079/0003929519?sid=102
전남 박물관 백중놀이 체험 전남 박물관 테마 공원 일원 어린이 가족 연안 안전 사고 위험 예보 주의보 발령 국립 조사원 목포 시의,https://www.kukinews.com/article/view/kuk202408190174
광양시 기존 풀장 물놀 어린이 유아 청소년 미니 워터 슬라이드 분수 안전사고 예방 주력 동시 체험 음식물 취식 금지 조치 수질 관리 부문 신경,http://www.seoulfn.com/news/articleView.html?idxno=529895
결의 학교 안전사고 예방 보상 법률 개정 요구 교직원 인천 어린이 청소년 영화제 선생 영화,https://www.pointdaily.co.kr/news/articleView.html?idxno=215658
의정부 교통사고 위험 보호 음성 안내기 설치 신호 주의 발생 어린이 안전사고 예방 효과 기대 학생 안전 학교 생활 영석 고등학교 학교,https://www.ekn.kr/web/view.php?key=20240818029184961
충북 경찰청 어린이 교통사고 예방 초등 학교 통학 주변 교통 경력 집중 배치 불법 주정차 어린이 보호 위반 보행 안전 저해 요인 점검 단속 녹색 어머니 모범 운전자,https://cc.newdaily.co.kr/site/data/html/2024/08/18/2024081800079.html
초중 고등학교 주변 불법 옥외 광고 집중 정비 정비 어린이 보호구역 교육 환경 보호구역 중심 진행 노후 위험 간판 음란 퇴폐 광고 학생 안전 위협,https://n.news.naver.com/mnews/article/382/0001145058?sid=102
안전 여행 프로그램 실시 프로그램 일상 생활 안전사고 방지 사고 발생 증평 김병학 기자 증평군 별천지 인성 학교 어린이 안전 여행 프로그램 운영,https://www.inews365.com/news/article.html?no=827355
서귀포시 하굣길 인도 차도 분리 조성 어린이 안전사고 예방 귀태 흥초 학교 인근 도로 사업비 에메랄드 교목 노랑 달맞이꽃 화류,http://www.samdailbo.com/news/articleView.html?idxno=231852
프로그램 일상 생활 안전사고 방지 사고 발생 대처 능력 지난해 처음 어린이 힐링 공간 인기 별천지 인성 학교 프로그램 제공 지난해,https://www.ggilbo.com/news/articleView.html?idxno=1044962
프로그램 일상 생활 안전사고 방지 사고 발생 대처 능력 지난해 처음 어린이 힐링 공간 인기 별천지 인성 학교 프로그램 제공 지난해,https://www.ccdailynews.com/news/articleView.html?idxno=2291615
서귀포시 하굣길 린이 공원 유동 인구 독도 모형 설치 안전 사고 결정 해명 교통 공사 사장 공사 혼잡 상황 대비,https://n.news.naver.com/mnews/article/009/0005351398?sid=100
공모전 재난 안전 관심 안전 중요 강조 내용 포스터 동영상 분야 부문 진행 포스터 공모전 초등 학교 재학 학생 동일 연령 어린이 대상,http://www.asiaa.co.kr/news/articleView.html?idxno=180499
교통사고 위험 보호 음성 안인도 차도 분리 어린이 안전사고 예방 통학 환경 조성 서귀포시 사업비 토평 학교 대상 자녀 안심 그린,http://www.jejumaeil.net/news/articleView.html?idxno=339748
건의안 지하철 역사 서울광장 어내기 설치 신호 주의 발생 어린이 안전사고 예방 효과 기대 학생 안전 학교 생활 영석 고등학교,http://www.enewstoday.co.kr/news/articleView.html?idxno=2164813
프로그램 일상 생활 안전사고 방지 사고 발생 대처 능력 어린이 힐링 공간 인기 별천지 인성 학교,http://www.breaknews.com/1050583
프로그램 일상 생활 안전사고 방지 사고 발생 대처 능력 지난해 처음 어린이 힐링 공간 인기 별천지 인성 학교 프로그램 제공 지난해,https://www.ccreview.co.kr/news/articleView.html?idxno=320038
프로그램 일상 생활 안전사고 방지 사고 발생 대처 능력 지난해 처음 어린이 힐링 공간 인기 별천지 인성 학교 프로그램 제공 지난해,http://www.bzeronews.com/news/articleView.html?idxno=673221
안전 체험 놀이 중심 교육 위험 상황 능동 대처 최선 별천지 인성 학교 야외 유아 체험 다양 실내 체험 놀이 제공 어린이,http://www.jbnews.com/news/articleView.html?idxno=1448057
교통사고 위험 보호 음성 안내기 설치 신호 주의 발생 어린이 안전사고 예방 효과 기대 학생 안전 학교 생활 영석 고등학교,http://www.ilyoseoul.co.kr/news/articleView.html?idxno=491846
교통사고 위험 보호 음성 안내기 설치 신호 주의 발생 어린이 안전사고 예방 효과 기대 학생 안전 학교 생활 영석 고등학교,http://www.queen.co.kr/news/articleView.html?idxno=417264
교통사고 위험 보호 음성 안내기 설치 신호 주의 발생 어린이 안전사고 예방 효과 기대 학생 안전 학교 생활 영석 고등학교,http://www.weeklytoday.com/news/articleView.html?idxno=645321
교통사고 위험 보호 음성 안내기 설치 신호 주의 발생 어린이 안전사고 예방 효과 기대 학생 안전 학교 생활 영석 고등학교,http://www.tournews21.com/news/articleView.html?idxno=76438
교통사고 위험 보호 음성 안내기 설치 신호 주의 발생 어린이 안전사고 예방 효과 기대 학생 안전 학교 생활 영석 고등학교,https://www.dnews.co.kr/uhtml/view.jsp?idxno=202408161005276000145
학교 자녀 연령 지원 신청 시기 카드 포인트 지급 재난 안전 사고 선제 대비 체계 구축 추진 충남 서북 유일 어린이 안전,https://www.joongdo.co.kr/web/view.php?key=20240816010004109
승강기 안전 주제 진행 프로그램 매주 일요일 오후 진행 별천지 인성 학교 체험 패키지 이용객 참여 한편 야외 유아 체험 다양 실내 체험 놀이 어린이,https://www.psnews.co.kr/news/articleView.html?idxno=2063953
위원 신규 시책 학교 전담 경찰관 학대 예방 경찰관 역량 강화 심리 치유 프로그램 지원 사업 실효 추진 주문 교통 분과 위원회 경북 어르신 어린이 교통사고 예방,http://www.ksmnews.co.kr/news/view.php?idx=496805
위원 신규 시책 학교 전담 경찰관 학대 예방 경찰관 역량 강화 심리 치유 프로그램 지원 사업 실효 추진 주문 교통 분과 위원회 경북 어르신 어린이 교통사고 예방,https://www.kbmaeil.com/news/articleView.html?idxno=1007882
부모 안심 통학 교통 안전시설 개선 산구 안전사고 발생 우려 관내 어린이 교통안전 시설물 개선 사업 추진 학생 안전 보행 환경 조성 초등 학교 학로,https://www.newsgn.com/news/articleView.html?idxno=433514
성산구 안전사고 발생 우려 관내 어린이 보호구역 학로 중심 보행 환경 개선 교통안전 시설물 개선 사업 추진 학생 안전 보행 환경 조성 초등 학교 학로,http://www.shinailbo.co.kr/news/articleView.html?idxno=1917879
초등 학교 행사 집중 안전망 구축 어린이 안전사고 발생 기간 학교 교통안전 캠페인 치안 사각지대 순찰 지원 활동 시민 안전 강화 예정 한편,https://n.news.naver.com/mnews/article/382/0001144617?sid=102
위원 신규 시책 학교 전담 경찰관 학대 예방 경찰관 역량 강화 심리 치유 프로그램 지원 사업 실효 추진 주문 교통 분과 위원회 경북 어르신 어린이 교통사고 예방,https://www.dkilbo.com/news/articleView.html?idxno=456261
초등 학교 행사 집중 안전망 구축 어린이 안전사고 발생 기간 학교 교통안전 캠페인 치안 사각지대 순찰 지원 활동 시민 안전 강화 예정 한편,https://www.siminilbo.co.kr/news/newsview.php?ncode=1160265506241855
사업 대상 스마트 파크 효성 중공업 공장 남면 동원 대암 고등학교 동산 반송 중학교 부모 안심 통학 교통 안전시설 개선 산구 안전사고 발생 우려 어린이 보호구,https://www.newsfreezone.co.kr/news/articleView.html?idxno=584599
초등 학교 행사 집중 안전망 구축 어린이 안전사고 발생 기간 학교 교통안전 캠페인 치안 사각지대 순찰 지원 활동 시민 안전 강화 예정 한편 로보캅 순찰대,https://www.kmaeil.com/news/articleView.html?idxno=467903
초등 학교 행사시 집중 안전망 구축 어린이 안전사고 발생 기간 학교 교통안전 캠페인 치안 사각지대 순찰 지원 활동 시민 안전 강화 예정 한편,https://www.viva100.com/main/view.php?key=20240814010003811
건의안 지하철 역사 서울광장 어린이 공원 유동 인구 독도 모형 설치 안전사고 방지 철거 결정 설명 내선 개통,https://n.news.naver.com/mnews/article/005/0001717766?sid=102
논의 내용 하반기 교통안전 환경 개선 사업 기관 협조 사항 개인 이동형 장치 사고 예방 합동 단속 계도 경숙 학교 안전 과장 어린이 교통안전 교육청 중심 어린이 교통안전,http://www.domin.co.kr/news/articleView.html?idxno=1480820
초등 학교 학생 신청 문의 쇄도 어린이집 유치원 개소 신청 여수시 단체 신청 배분 이용 안전사고 물놀이장 이용 바닥 분수,http://www.namdonews.com/news/articleView.html?idxno=784545
전북 특별 자치 교육청 전북 교육청 학교 안전 회의실 전북 특별 자치 전북 특별 자치 경찰청 요소 적극 발굴 개선 동시 어린이 교통안전 사고 예방 교육 확대,http://www.jjn.co.kr/news/articleView.html?idxno=980306
사업 옥정동 중심 상가 도로 어린이 보행 교통사고 발생 보행 어린이 안전 양주시 캠페인 관내 초등 학교 학년 학년 학생 대상 도로 통행 방법 자각,https://www.ekn.kr/web/view.php?key=20240813024473006
초등 학교 학생 신청 문의 쇄도 어린이집 유치원 개소 신청 여수시 단체 신청 배분 이용 안전사고 물놀이장 이용,http://www.jnilbo.com/74519234235
초등 학교 학생 신청 문의 쇄도 어린이집 유치원 개소 신청 여수시 단체 신청 배분 이용 안전사고 물놀이장 이용,http://www.jnilbo.com/74518687382
사업 옥정동 중심 상가 도로 어린이 보행 교통사고 발생 사례 이후 보행 어린이 안전 도모 마련 캠페인 초등 학교 학년 학년 학생 대상 도로 통행,http://www.kihoilbo.co.kr/news/articleView.html?idxno=1104656
초등 학교 학생 신청 문의 쇄도 어린이집 유치원 개소 신청 여수시 단체 신청 배분 이용 안전사고 물놀이장 이용,https://www.cnbnews.com/news/article.html?no=676143
초등 학교 학생 신청 문의 쇄도 어린이집 유치원 개소 신청 여수시 단체 신청 배분 이용 안전사고 물놀이장 이용,http://www.newsworker.co.kr/news/articleView.html?idxno=343716
초등 학교 학생 신청 문의 쇄도 어린이집 유치원 개소 신청 여수시 단체 신청 배분 이용 안전사고 물놀이장 이용,http://www.netongs.com/news/articleView.html?idxno=320696
초등 학교 학생 신청 문의 쇄도 어린이집 유치원 개소 신청 여수시 단체 신청 배분 이용 안전사고 물놀이장 이용,https://www.nspna.com/news/?mode=view&newsid=712849
교통사고 발생 사례 이후 보행 어린이 안전 도모 마련 최근 사상자 캠페인 관내 초등 학교 학년 학년 학생 대상 도로 통행 방법 자각 사전,http://www.enewstoday.co.kr/news/articleView.html?idxno=2163530
교통사고 발생 사례 이후 보행 어린이 안전 도모 마련 최근 사상자 캠페인 관내 초등 학교 학년 학년 학생 대상 도로 통행 방법 자각 사전,http://www.weeklytoday.com/news/articleView.html?idxno=644653
사업 옥정동 중심 상가 도로 어린이 보행 교통사고 발생 사례 이후 보행 어린이 안전 도모 마련 캠페인 관내 초등 학교 학년 학년 학생 대상,https://www.joongdo.co.kr/web/view.php?key=20240813010003312
교통사고 발생 사례 이후 보행 어린이 안전 도모 마련 최근 사상자 캠페인 관내 초등 학교 학년 학년 학생 대상 도로 통행 방법 자각 사전,https://www.dnews.co.kr/uhtml/view.jsp?idxno=202408130945296090142
대전시 교육청 중고 방과 학교 자유 수강 지원 확대 전시 교육청 교육감 설동호 방과 학교 물놀 안전사고 예방 최선 노력 어린이 학생 물놀이,https://www.newsfreezone.co.kr/news/articleView.html?idxno=584327
어린이집 학교 연계 안전 체험 안전 체험 마을 체험 차량 재난 유형 한국 안전 체험 활용 홍수 태풍 낙뢰 폭염 유형 재난 안전사고 체험 안전 수칙 교육 진행,https://n.news.naver.com/mnews/article/654/0000084133?sid=100
대구 서구 안전 취약 계층 안전사고 예방 관내 어린이집 초등 학교 지역 아동 센터 경로당 복지 장애 시설 개소 대상 맞춤 안전 교육 실시,http://www.ilyoseoul.co.kr/news/articleView.html?idxno=491679
강원도 어린이집 학교 연계 안전 체험 안전 체험 마을 체험 차량 재난 유형 한국 안전 체험 활용 홍수 태풍 낙뢰 폭염 유형 재난 안전사고 체험 안전 수칙 교육 진행,https://n.news.naver.com/mnews/article/654/0000084053?sid=100
대구 서구 안전 취약 계층 안전사고 예방 지역 어린이집 초등 학교 지역 아동 센터 경로당 복지 장애 시설 개소 대상 맞춤 안전 교육 실시,http://www.ksmnews.co.kr/news/view.php?idx=496105
통학 버스 운전 보호 탑승원 안전 의식 고취 마련 연수 밀양 경찰서 경비 교통 이민우 경사 학교 우회전 어린이 보호구역 통과 운행 방법 주제 강의 진행 학교,https://n.news.naver.com/mnews/article/088/0000897517?sid=004
통학 버스 운전 보호 탑승원 안전 의식 고취 마련 연수 밀양 경찰서 경비 교통 이민우 경사 학교 우회전 어린이 보호구역 통과 운행 방법 주제 강의 진행 학교,https://www.newsgn.com/news/articleView.html?idxno=432612
대구 서구 안전 취약 계층 안전사고 예방 관내 어린이집 초등 학교 지역 아동 센터 경로당 복지 장애 시설 개소 대상 맞춤 안전 교육 실시,https://www.dkilbo.com/news/articleView.html?idxno=455666
어린이집 학교 식중독 예방 체험 교육 활용 관계자 식중독 신속 검사 차량 활용 식품 위생 안전 지속 노력 계획,https://n.news.naver.com/mnews/article/003/0012721671?sid=102
김상식 소방서 전문 지식 함양 구조 대원 능력 배양 안전사고 예방 교육 서산시 여름 독서 교실 어린이 자존 증진 초등 학교 학년 대상 다양 체험 독서 활동 진행 충남,https://www.joongdo.co.kr/web/view.php?key=20240811010002702
대구 서구 안전 취약 계층 안전사고 예방 관내 어린이집 초등 학교 지역 아동 센터 경로당 복지 장애 시설 개소 대상 맞춤 안전 교육 실시,https://www.ekn.kr/web/view.php?key=20240809024121214
간담회 최근 이용 급증 어린이 청소년 안전사고 증가 안전 관리 용인 서부 녹색 어머니 연합회 관내 초등 학교 중심 전동 자전거 안전,https://n.news.naver.com/mnews/article/031/0000860894?sid=004
안전 사고 예방 한편 놀이 시설 시설 개선 안전 쉼터 제공 목적 추진 명회 참석 이채 의원 신촌동 신기 어린이 공원 주변 학교 평촌 학원,https://www.jeonmae.co.kr/news/articleView.html?idxno=1064033
안전 사고 예방 한편 놀이 시설 시설 개선 안전 쉼터 제공 목적 추진 명회 참석 이채 의원 신촌동 신기 어린이 공원 주변 학교 평촌 학원,https://www.kmaeil.com/news/articleView.html?idxno=467322
사고 예방 안전 관리 위기 대응 중점 러닝 세이프티 솔루션 학교 주택 병원 요양원 어린이집 솔루션 공급 이력 바탕 서울시 소재 고등학교 대형 병원 교량,https://www.newspim.com/news/view/20240808000636
식품 안전 보호 지원 시스템 구축 등록 식품 사료 공장 관리 검역 검사 강화 어린이 단체 급식 재료 전면 모니터링 학교 급식 반제품 완제품 무작위 표본 검사 강화 고위험 농축,http://dream.kotra.or.kr/kotranews/cms/news/actionKotraBoardDetail.do?SITE_NO=3&MENU_ID=200&CONTENTS_NO=1&bbsGbn=403&bbsSn=403&pNttSn=217885
사고 예방 안전 관리 위기 대응 중점 러닝 세이프티 솔루션 학교 주택 병원 옥상 요양원 어린이집 솔루션 공급 이력 바탕 서울시 소재 고등학교 대형 병원 교량,https://n.news.naver.com/mnews/article/018/0005807508?sid=101
사고 예방 안전 관리 위기 대응 중점 러닝 세이프티 솔루션 학교 주택 병원 요양원 어린이집 솔루션 공급 이력 바탕 서울시 소재 고등학교 대형 병원 교량,http://www.thevaluenews.co.kr/news/view.php?idx=184775
사고 예방 안전 관리 위기 대응 중점 러닝 세이프티 솔루션 학교 주택 병원 요양원 어린이집 솔루션 공급 이력 바탕 서울시 소재 고교 대형 병원 교량 투신,https://www.widedaily.com/news/articleView.html?idxno=241938
사고 예방 안전 관리 위기 대응 중점 러닝 세이프티 솔루션 학교 주택 병원 요양원 어린이집 솔루션 공급 이력 바탕 서울시 소재 고교 대형 병원 교량 투신,https://n.news.naver.com/mnews/article/003/0012716906?sid=101
사고 예방 안전 관리 위기 대응 중점 러닝 세이프티 솔루션 학교 주택 병원 옥상 요양원 어린이집 솔루션 공급 경험 바탕 서울 시내 고등학교 대형 병원,https://www.topdaily.kr/articles/98592
사고 예방 안전 관리 위기 대응 중점 러닝 세이프티 솔루션 학교 주택 병원 요양원 어린이집 솔루션 공급 이력 바탕 서울시 소재 고등학교 대형 병원 교량,http://www.sentv.co.kr/news/view/692778
사고 예방 안전 관리 위기 대응 중점 러닝 세이프티 솔루션 학교 주택 병원 요양원 어린이집 솔루션 공급 이력 바탕 서울시 소재 고등학교 대형 병원 교량,https://n.news.naver.com/mnews/article/008/0005074547?sid=101
사고 예방 안전 관리 위기 대응 중점 러닝 세이프티 솔루션 학교 주택 병원 요양원 어린이집 솔루션 공급 이력 바탕 서울시 소재 고등학교 대형 병원 교량,https://www.cstimes.com/news/articleView.html?idxno=605259
사고 예방 안전 관리 위기 대응 중점 러닝 세이프티 솔루션 학교 주택 병원 요양원 어린이집 솔루션 공급 이력 바탕 서울시 소재 고등학교 대형 병원 교량,https://www.etoday.co.kr/news/view/2388647
사고 예방 안전 관리 위기 대응 중점 러닝 세이프티 솔루션 학교 주택 병원 요양원 어린이집 솔루션 공급 이력 바탕 서울시 소재 고등학교 대형 병원 교량,https://n.news.naver.com/mnews/article/014/0005224923?sid=101
사고 예방 안전 관리 위기 대응 중점 러닝 세이프티 솔루션 학교 주택 병원 요양원 어린이집 솔루션 공급 이력 바탕 서울시 소재 고등학교 대형 병원 교량,https://n.news.naver.com/mnews/article/277/0005456593?sid=101
특별 교부세 학교 통학 안전 시설물 방호 울타리 설치 정비 급경사 도로 열선 설치 통합 관제 센터 성능 개선 어린이 공원 노후 시설 정비 사업 노후 마을 마당,https://www.pinpointnews.co.kr/news/articleView.html?idxno=280997
안산시 개최 예정 축제 안전 대책 논의 온열 환자 안전사고 교통 대책 안전 관리 계획 경기 보완 사고 축제 진행 안산시 어린이집 학교,https://n.news.naver.com/mnews/article/586/0000084370?sid=102
특별 교부세 내역 학교 통학 안전 시설물 방호 울타리 설치 정비 급경사 도로 열선 통합 관제 센터 성능 개선 어린이 공원 노후 시설 정비 사업 노후 마을 마당 보수 정비,http://www.m-i.kr/news/articleView.html?idxno=1147760
현금 버스 버스 카드 활용 결제 운행 지연 안전사고 예방 내년 초등학생 어린이 대상 무료 탑승 버스 요금 부담,https://news.bbsi.co.kr/news/articleView.html?idxno=3165199
어린이집 유치원 초중 고등학교 학교 시설 경계 이내 금연 구역 확대 사고 안전 축제 논의 위원회 심의 제시 의견 지적 사항 축제 개최,https://www.asiatime.co.kr/article/20240807500027
박노수 서산시 자치행정 국장 생활 재난 안전사고 예방 안전 문화 확산 기여 전문가 학교 유치원 가정 교육 현장 투입 어린이 수업 진행,https://www.joongdo.co.kr/web/view.php?key=20240807010001650
특별 교부세 내역 학교 통학 안전 시설물 방호 울타리 설치 정비 급경사 도로 열선 통합 관제 센터 성능 개선 어린이 공원 노후 시설 정비 사업 노후 마을 마당 보수 정비,https://n.news.naver.com/mnews/article/021/0002652870?sid=102
특별 교부세 내역 학교 통학 안전 시설물 방호 울타리 설치 정비 급경사 도로 열선 통합 관제 센터 성능 개선 어린이 공원 노후 시설 정비 사업 노후 마을 마당 보수 정비,https://www.gukjenews.com/news/articleView.html?idxno=3061237
자리 교육감 여름 방학 기간 공사 진행 학교 현장 폭염 안전사고 야외 근로자 안전 관리 무더위 휴식 운영 김영길 중구 청장 이날 학남 어린이집 경로당,http://www.ujeil.com/news/articleView.html?idxno=352351
안전사고 관리 내용 업무 협약 체결 협약 경주 지역 초등 학교 산대 안강 사방 양동 안강 옥산 학생 기존 북경 주체 문화 센터 이용객 불편,http://www.ksmnews.co.kr/news/view.php?idx=495494
교통사고 예방 학교 주변 어린이 보호구역 통학 합동 점검 실시 학기 유관 기관 협업 교통안전 캠페인 실시 학교 전담 경찰관 협업 초등 학교 현장 교육 교통안전 교육 활동 강화,https://www.newsgn.com/news/articleView.html?idxno=432073
격려 안전사고 발생 관리 철저 당부 한편 사항 청취 함양군 군수 물놀 운동 구명조끼 착용 음주 수영 금지 어린이,https://www.kukinews.com/article/view/kuk202408060124
오수 맨홀 뚜껑 이탈 안전사고 피해 사례 발생 대비 연차 계획 노후 오수 맨홀 교체 사업 지속 추진 예정 수도 사업 소장 어린이 보호구역 시가지 주요,https://www.newsfreezone.co.kr/news/articleView.html?idxno=583662
어린이집 기본 보육 연장 보육 야간 연장 보육 보육 운영 유보 통합 실행 계획안 의미 영아 애착 형성 중요 안전사고 위험 교사 에너지 소모,https://www.ibabynews.com/news/articleView.html?idxno=119586
세종 시도 관련 업체 논의 최고 속도 학교 정문 사고 위험 구역 개인 이동 장치 주차 금지 구역 설정 울산시 지난해 전동 보드 이용 안전 강화,https://www.naeil.com/news/read/519207?ref=naver
그동안 경주 지역 의무 교육 어린이 생존 수영 실기 교육 실시 어린이 수영장 안전사고 관리 내용 업무 협약 체결 협약 경주 지역 초등 학교,https://www.job-post.co.kr/news/articleView.html?idxno=111114
키워드 안전 안정 실질 기본 보장 사회 사고 안전 기재 학교 폭력 교육위 메타 버스 방위 국제 개발 협력 외통 첨단 무기 체계 국방위 어린이 교통안전,http://www.hansbiz.co.kr/news/articleView.html?idxno=706235
정비 어린이 안심 보행 환경 조성 핵심 초등 학교 정영환 강동구 교통 행정 과장 도로 발생 사건 사고 예방 어린이 보행,https://n.news.naver.com/mnews/article/020/0003580480?sid=102
안전교육 안전사고 관리 내용 경주 지역 초등 학교 산대 안강 사방 지역 어린이 생존 수영 실기 교육 장소 제공 생각 장경국,https://www.asiatoday.co.kr/view.php?key=20240805010002420
대상 안전사고 예방 교육 자발 피서지 주요 내용 익수 구조 시범 어린이 영아 심폐 시범 동심 장충 격기 사용법 교육 생활,https://n.news.naver.com/mnews/article/003/0012709923?sid=102
확보 대곶 초등 학교 학생 명의 보행 안전 확보 신양 초풍 무초 어린이 보호구역 확보 양초 학생 명풍 무초 명의 보행 안전 교통사고 예방 안전 학로,https://www.skyedaily.com/news/news_view.html?ID=241897
세종 시도 관련 업체 논의 최고 속도 학교 정문 사고 위험 구역 개인 이동 장치 주차 금지 구역 설정 울산시 지난해 전동 보드 이용 안전 강화,https://n.news.naver.com/mnews/article/001/0014852602?sid=102
어린이 이용 연령 구분 세용 세용 세용 풀장 운영 풀장 워터 슬라이드 설치 탈의실 휴게 공간 마련 안전사고 예방,https://www.incheonilbo.com/news/articleView.html?idxno=1260710
