nouns,link
친절 결정 영향 질문 소개 스타일 손가락 굵기 모양 평소 스타일 악세사리 취향 선택지 다양,https://blog.naver.com/bebeto23/223525032121
힙스터 디자인 스타일 편안 스타일리시 연출 편안 스타일 기능 비교 분석 질문 질문 여자 사각팬티 기능,https://blog.naver.com/amuse13643/223499474291
질문 이바나 헬싱 스타일 답변 이바나 헬싱 미니 스타일 선호 여성 도시 느낌 연출,https://blog.naver.com/threat7861/223523435574
인테리어 시작 머리 평소 스타일 질문 배려 생각 스타일,https://blog.naver.com/rlafb/223245822236
오픽 시험 선택 주제 질문 만큼 오픽 기출문제 나라 트렌디 스타일 보편 생각 요즘,https://blog.naver.com/hackersingang/223192377663
취향 스타일 디자인 색상 선택 사이즈 확인 속옷 사이즈 정보 남성 속옷 세트 편안 스타일 가지 선택 질문,https://blog.naver.com/hjfrifbyn390/223495260155
스타일 수모 색상 선택 스타일리시 연출 햇볕 스타일 가지 질문 질문 수모 일반 모자 비교,https://blog.naver.com/kimyukim9/223504511560
트렁크 팬티 디자인 스타일 조화 선택 중요 기능 편안 스타일 베스트셀러 비교 분석 질문 질문 남성 팬티,https://blog.naver.com/exvvlwdxk468/223496175097
블랙 스타일링 완성 에스파 아마겟돈 정규 발매 노래 에스파 슈퍼 노바 노래 유재석 이거 노래 질문,https://blog.naver.com/jenew7575/223463547900
스타일 선택 가이드 질문 질문 지오다노 리넨 셔츠 특가 스타일 평소 스타일 활동 셔츠 선택 격식 자리,https://blog.naver.com/gztcgklwp836/223498750586
헤어 스타일 슬릭 스타일 문의 질문 나라 스타일 직업 스타일링 방식 결정 옆머리 뒷머리,https://blog.naver.com/jjuneng1015/222965915522
스타일 고려 여성 팬티 라인 시크릿 팬티 스타일 기능 비교 분석 질문 질문 원더 브라 팬티 종류,https://blog.naver.com/ivrxofamq52/223496367549
색상 평소 스타일 조화 고려 질문 반바지 코디 답변 반바지 캐주얼 스트릿 패션 힙스터 다양 스타일 연출,https://blog.naver.com/iurxjomli847/223503331919
스타일 소재 계절 분위기 고려 소재 선택 플라워 원피스 소재 계절 원피스 스타일 분석 질문 질문 플라워 원피스 스타일,https://blog.naver.com/witibynvj346/223498809215
스타일 코디 고려 스타일 코디 분위기 연출 캐주얼 스타일 선택 가이드 질문 질문 남아,https://blog.naver.com/pjour/223501781861
비츠 질문 대답 나이 관리 필요 솔로 출연 퍼스널 컬러 스타일 코칭 모습,https://blog.naver.com/peoplevittz/223319308817
본인 스타일 이미지 전문가 판단 고객 질문 문진 사전 시술 내역 평소 관리 스타일 상담,https://blog.naver.com/radianthair2023/223493119108
면접 예상 질문 청장 서류 부분 평가 항목 토대 작성 개인 예상 질문 스타일 면접 서울,https://blog.naver.com/spacepig/223030157013
디자인 취향 선택 색상 스타일 조화 선택 지프 티셔츠 스타일 업그레이드 트렌드 아이템 분석 질문 질문 지프 티셔츠,https://blog.naver.com/rzlqgyfgy602/223496947521
오늘 남자 친구 저녁 데이트 가게 스타일 제이 남자 친구 질문 정성 대답 코디 최고 남자 친구,https://blog.naver.com/oh-my-jin/223066397735
질문 대로 나중 시험 메모 이전 스타일 취미 구매,https://blog.naver.com/madeinma/223503450137
남편 스타일 머리 스타일 관심 감각 질문 남편 대화 그걸 마음 친구,https://blog.naver.com/danbinspencer/222620416445
스타일 여성 느낌 선호 모발 기장 최대한 유지 질문 고객 스타일 무드 전문가 노력,https://blog.naver.com/otium__/223409384277
스타일 색상 선택 조화 스타일 연출 도움 소재 편안 편안 스타일 가지 질문 질문 브라 팬티 세트 선택,https://blog.naver.com/jdkrmgwdu523/223493863087
여름 오쿤 남자 패션 코디 남자 스타일 질문 오쿤 쇼핑몰 성분 사실,https://blog.naver.com/hehekek/130140215303
스타일링 조언 스타일 질문 카테고리 스타일 질문 카테고리 패션 질문 플레이어 해결 신상 발매 정보 발매 소식,https://dino82.tistory.com/5
질문 손목 걱정 마세 인기 평소 컬러 평소 스타일 위주 샘플,https://blog.naver.com/minvely_kim/50185073273
스타 가지 아이템 비교 분석 질문 질문 스마트 미러 인공지능 활용 사용 체형 취향 스타일 추천 둘째 화장품 추천,https://blog.naver.com/zsttmceec824/223492279026
클래식 디자인 스타일 오랫동안 활용 스타일 완성 가지 선택 디자인 기능 가치 비교 분석 질문 질문,https://blog.naver.com/pjour/223496063508
그건 뭔데 답변 상황 질문 질문 공부 직장인 선택 질문 학업 장의,https://blog.naver.com/nahnana/223520860377
가이드 스타일 실용 가지 질문 질문 엘르 파리스 맨투맨 오버 착용 선호 선물 평소 스타일 고려,https://blog.naver.com/pjour/223496214434
티셔츠 선택 본인 피부 스타일 고려 색상 선택 질문 티셔츠 코디 답변 티셔츠 하의 조합,https://blog.naver.com/swjsvwaab282/223498914608
퍼스널 컬러 사전 질문 화장 파운데이션 색상 호수 메이크업 베이스 보라 핑크 화장 평소 화장 스타일 스타일 점검 결혼 동행 플래너 신부 하나하나,https://blog.naver.com/jin__nyv/223372775080
질문 남자 반팔 남방 선택 중요 고려 요소 가요 답변 남성 반팔 남방 선택 스타일 기능 중요 답변 스타일 측면 본인 체형 평소 스타일,https://blog.naver.com/iafqntqcv18/223495873213
질문 예작 와이셔츠 디자인 종류 스타일 답변 예작 와이셔츠 디자인 제공 디자인 스타일 조화 고려 드레스,https://blog.naver.com/qxnpenbpf785/223494010662
올리비아 로렌 티셔츠 스타일 조화 스타일 연출 도움 질문 올리비아 로렌 티셔츠 활용 특별 스타일 연출,https://blog.naver.com/helzngyfx520/223497802980
장점 다양 스타일 연출 가능 코스 숄더백 심플 미니 디자인 스타일 실용 스타일 가지 장단점 비교 분석 질문 질문 코스,https://blog.naver.com/prove536/223507473154
편안 스타일 기능 디자인 비교 분석 질문 질문 남자 흰색 흰색 느낌 연출 스타일,https://blog.naver.com/eeew23ewef983/223494132499
맞춤 질문 토픽 소개팅 소개팅 일상 박수진 생각 스타일,https://blog.naver.com/uuun4/220290120546
한국 스타일링 가이드 한국 독특 패션 감각 나라 절제 스카프 모자 선글라스 아이템 스타일 완성 사용 질문 한국,https://blog.naver.com/oynuudxy/223450811886
스타일 정의 정확 의상 컨셉 사진 하늘 정원 스튜디오 올해 운영 만큼 촬영실 위치 질문,https://blog.naver.com/babyhanle/222628288178
라이프 스타일 나이 이야기 유튜브 질문 밸런스 아들 미안 인생 설계,https://blog.naver.com/andrainyday/223456076968
스타일 신발 선택 전체 완성도 예산 합리 신발 스타일 실용 스마트 선택 분석 질문 질문 남성 명품,https://blog.naver.com/pjour/223501442305
스타일 색상 디자인 선택 보관 크기 무게 가이드 솜털 제거 걱정 인기 모델 비교 분석 질문 질문 보풀 거기,https://blog.naver.com/forth818/223507254044
화이트 블랙 옐로 레드 가지 컬러 평소 스타일 신고 수제 착화 질문 가죽 소재 제품,https://blog.naver.com/s2sue/222007160706
느낌 질문 시작 출발 프로젝트 자연 모습 여성 스타일 선글라스 윌로우 제품 착용 스탭,https://blog.naver.com/ossony10/222046795037
질문 공유 시험 이틀 공부 모의고사 문제 스타일 음악 음악 작곡가 이야기,https://blog.naver.com/amabile_sehyeon/223301908781
스타일 브래지어 선택 데이트 레이스 브래지어 운동 편안 맵시 완성 자신감 핵심 아이템 분석 질문,https://blog.naver.com/fkdqpwgwo999/223501197463
강아지 봄옷 스타일 강자 강아지 봄옷 구매 욕구 나용 날씨 강아지 포스팅 질문,https://blog.naver.com/sunjeya82/220664271261
결혼 여자 이지아 스타일 고급 스탈,https://blog.naver.com/kanghee737/220185465787
스타일 베이스 광택 피부 표현 이미지 치크 소개 면접 질문,https://blog.naver.com/dlfdmlrur/223219044527
질문 공세 나름 운영 노하우 이제 스타일 논의 구매 수다,https://blog.naver.com/stopper123/221382700133
패션 남자 이유 여자 이유 스타일 세이 내게 질문 사고 맥주,https://blog.naver.com/esthete0214/10113932173
학교 평소 진아 승아 질문 스타일 리터 말씀 만큼 엄마 사이 여아 아동복 쇼핑몰 소문,https://blog.naver.com/miujang/222663130156
편안 중시 추천 스타일 컨템포러리 트렌디 남자 속옷 스타일 편안 모델 비교 분석 질문 질문,https://blog.naver.com/iooedspuy963/223494333880
블로그 질문 미니 맥시멀 맥시멀 물건 스타일 현재 트렌드 과거 유행 자리 차지 수납공간 차지 사실,https://blog.naver.com/jjmom_0611/223443718576
몬스터 성유리 패션 관심 그녀 연기력 센스 스타일 질문 유리 기억 여자 불리,https://blog.naver.com/jaetoo56/220722942882
디자인 색상 단추 스타일 단추 선택 기관 절개 단추 질문 답변 소개 단추 일상 도움,https://blog.naver.com/okbdc04754/223366455219
시술 선생 비고 헤어 시아 실장 시술 상담 얼굴 평소 스타일 헤어 고민 질문 대답 머리카락 길이,https://blog.naver.com/dosods/223398423368
유행 스타일 자크 라캉 저서 욕망 질문 질문 발견 독서 마찬가지 마음,https://blog.naver.com/jys801020/223383921900
질문 답변 친절 배송 신속 제품 애견 주문 가능 주문 스타일 치크,https://blog.naver.com/dadoo_zip/222786250014
사이즈 질문 가지 스몰 사이즈 가능 사장 말씀 스타일 추구 박나래 한남동 데이즈 데이즈 방문,https://blog.naver.com/qkrdmsdhr95/223466181395
휠라 드로즈 스타일 연출 가능 패션 감각 휠라 편안 스타일 모델 비교 분석 질문 리뷰,https://blog.naver.com/bvcpxapma705/223500643641
소개팅 남자 스타일 오늘 블로그 질문 소개팅 여자 스타일 여자 남자 스타일 소개팅,https://blog.naver.com/dongdongruri/220290344818
여성 스타일 베이지 선택 고급 해외 직수입 쇼핑몰 특성 주정도 질문,https://blog.naver.com/juhye__/221543978997
질문 여자 해당 오피스 정장 스타일 캐주얼 스타일 마음 대박 여성 의류 쇼핑몰 이름,https://blog.naver.com/sunphil11/140208912543
질문 스타일 라떼 특가 상품 비교 분석 상품 비교 답변 스타일 라떼 특가 상품 비교 분석 쇼핑몰 특가 상품 비교 화장품 가전제품 식품 다양,https://blog.naver.com/cliff72081/223521960533
코디 스타일 질문 이미지 저장 첨부 작가 지번 코디 날짜 기억 헤어 스타일 몸매 본인,https://blog.naver.com/bound_mst/150143181429
키워드 남자 여름 민소매 탱크 민소매 셔츠 스타일 코디 정보 남자 여름철 필수 스타일 민소매 베스트 질문,https://blog.naver.com/enterprise7528/223517915873
색상 제공 스타일 개성 통기성 가이드 스타일 기능 취향 완벽 조합 질문 질문 갤럭시,https://blog.naver.com/pjour/223499337440
겨울옷 스타일 네이버 겨울옷 정리 겨울옷 스타일 겨울옷 정리 질문 워킹 아기 스타일 오피스 주말,https://blog.naver.com/w936389/60204850989
질문 취향 질문 스타일 샤랄 이해 계속 소장 인생,https://blog.naver.com/dhssl750432/223327172236
스타일 버튼 클릭 얼굴 분석 체형 분석 정차 차안 촬영 얼굴 분석 시도 질문 결과,https://blog.naver.com/wgfwgf1/223223712720
유이 헤어 스타일 최고 유이 헤어 스타일 감상 화보 마음 생각 하네,https://blog.naver.com/stylishbang/60158557314
스타일 셔츠 리본 스커트 노래 코지 질문 시작,https://blog.naver.com/hiyaa_/222511563780
아침 옷장 오늘 질문 그게 노정 패션 시야 본격 검색 스타일,https://blog.naver.com/ahbooom/223434357088
개인 취향 스타일 연출 질문 트렁크 소재 답변 트렁크 고급 소재 구성 가죽 캔버스 나일론,https://blog.naver.com/stl_nest1/223525726041
스타일 강남 미즈 컨테이너 처음 치즈 구나 마음 이웃 질문 미즈 컨테이너,https://blog.naver.com/sjwydwn/80190517025
라인 실루엣 셔츠 스타일 카라 디자인 사랑 스타일 심플 품격 스타일 디자인 분석 선택 가이드 질문 질문 라코스테,https://blog.naver.com/sfzszmqzg101/223495668265
부담 질문 여성 스타일 매장 스타일,https://blog.naver.com/igooooya/223520677265
소개팅 환영 스타일 스키니 시스루 라면 나위 자리 블로그 질문 답변,https://blog.naver.com/tenpro16/220290030808
스타일 베스트 정도 가지 질문 말씀,https://blog.naver.com/soccet7183/223371160251
유행 남자 머리 헤어 스타일 남자 질문 머리 접근성 세미 리프 스타일 고려 결정,https://blog.naver.com/junwoo7007/223397389139
컨템포러리 스타일 추구 제격 여성 패션 방문 추가 사항 댓글 질문 답변 소통,https://blog.naver.com/ahbooom/223453867391
헤어 스타일 질문 본인 헤어 스타일 피부 얼굴 모질 선호 스타일,https://blog.naver.com/coolhair52/223422327449
선호 스타일 느낌 사이즈 제공 가게 스타일링 조언 필요 질문 문의 가능,https://blog.naver.com/o_osky/223347495819
솔로 영식 건가요 질문 패션 철학 스타일 생각 터리,https://blog.naver.com/duds78/223503164170
솔로 영식 건가요 질문 패션 철학 스타일 생각 터리,https://blog.naver.com/duds78/223503164170
질문 언니 증명사진 추천 언니 증명사진 스타일링 중요 생각 차례 헤어 스타일,https://blog.naver.com/wonnie0713/223145974904
가방 세련 스타일 편안 동시 완벽 액세서리 선택 가방 구매 추천 출두 질문 취재진 국정 농단 의혹 검찰 출석 최순 명품 패션 관심 신발,https://www.realfolkblues.co.kr/2120
인물 스타일 파악 기반 시리 정보 엄마 비행기 도착 질문,https://blog.naver.com/jwlovesr/223475843256
꽃무늬 원피스 레이스 과도 블라우스 생각 사무 스타일 생각 네이버 소개팅,https://blog.naver.com/isulkuu/220289888619
연예인 패션 연예인 스타일 연예인 패션 연예인 정보 질문 패션 에디터 이용,https://blog.naver.com/jjujjuro/220994634280
롱드 보네르 도착 예약 평소 질문 생각 평소 스타일 이미지 단어 표현 옷장 색감 외보,https://blog.naver.com/hari972/223194575870
질문 오빠 출국 오빠 응원 일본 스타일 불편 장비 상시 착용 선배,https://blog.naver.com/yjlee1006/223505049919
스타일 연결 목걸이 포인트 예랑 악세사리 관심 구경 질문,https://blog.naver.com/andola07/223490619605
여자 헤어 스타일 디자인 볼륨 이미지 컨설팅 디자인 질문,https://blog.naver.com/dhtmd991/223007758570
질문 컬러 그녀 착용 네이비 검정 컬러 스타일 개성 표현 제니 지코 스팟 신곡 패션,https://blog.naver.com/ahbooom/223439145084
스타일 완성 보부상 가방 완벽 액세서리 선택법 스타일 유재석 질문 티모시 보부상 가방 비밀 가방 설명 라메 퀴즈,https://nunno.net/3759
도도 스타일 사이즈 카테 코리 이용 대부분 사이즈 전체 사이즈 생각,https://blog.naver.com/ansony80/220535644243
이성 행동 질문 대화 중요 마인드 선호 스타일 바지 조아 연인,https://blog.naver.com/ckck2190/223524655088
스타일 디자인 가격 비키니 사이즈 처음 포스팅 질문,https://blog.naver.com/borareview/221586508661
파운드 미니 크로스 리뷰 실용 스타일 세상 애정 브랜드 파운드 미니 크로스 주머니 애기,https://blog.naver.com/suastar_/223453085878
선생 비비드 색깔 이거 질문 스타일 녹차 라떼 스타일 선생,https://blog.naver.com/dal_da_li/223033047161
데즈 바인 계절 스타일 연출 질문 데즈 바인 가격대 답변 데즈 바인 합리 가격 트렌디 제공 학생,https://blog.naver.com/bomlfkhnp635/223518667691
질문 원피스 스타일 매치 답변 원피스 스타일 매치 가능 캐주얼 스니커즈 편안 연출,https://blog.naver.com/daenge767/223523295407
지오지아 반팔 선택 질문 스스로 스타일 스타일 추구 트렌디 스타일 추구 클래식 스타일 선호,https://blog.naver.com/lip41072/223524812285
질문 샤넬 샤넬 여자 허리 순서 저지 하우스 리틀블랙 스타일 학교 독후 활동,https://blog.naver.com/hebing/110120101737
질문 질문 덱스 김진영 본명 전역 매력 소유자 스타일 퀴즈 덱스,https://blog.naver.com/pma0012/223217968939
아무것 결정 스타일 스토리 질문 대답 방향 스타일 스토리,https://blog.naver.com/hazel_yoon/220658052620
강아지 디자인 스타일 강아지 편안 보호 부분 질문 피드백 영상 공부,https://blog.naver.com/petmanageracademy/223462238768
만큼 스타일 여자 데일리 쇼핑몰 순위 쇼핑몰 스타일 가요 질문 쇼핑몰 플라이 모델,https://blog.naver.com/meet011/221534277503
라이프 스타일 필요 쇼핑 리스트 라이프 스타일 질문 참고 주일 가요 출근,https://blog.naver.com/mymoostudio/223200806274
데님 팬츠 블랙 스커트 스타일 신경 소리 포스팅 본문 포스팅 위시 질문 질문,https://blog.naver.com/wing3527/223515166497
악세서리 관심 금주 뷰티 지식 동백꽃 공효진 앞머리 헤어 스타일 오늘 문자,https://blog.naver.com/pnj_parkjun/221677505879
강현 선물 아들 블로그 방문 포스팅 구입 질문,https://blog.naver.com/rladyd4179/220505860067
질문 스타일 소녀,https://blog.naver.com/shondream/220755571629
질문 남성 빈티지 스타일 쇼핑몰 남자 사이트 추천 남성 빈티지 스타일 가보세요 가격대 퀄리티 네임 카드 주소,https://blog.naver.com/omvpsrfv32/150152714309
스타일 색깔 질문 소개팅 질문 질문 신경 리액션,https://blog.naver.com/windyabout/223447901681
질문 이전 질문 리셋 트랩 사진 모습 기분 스타일 트랩 부착 이거,https://blog.naver.com/doyosae_/223470730472
뭔가 스타일 진행 가격 구성 브라 제품 진행 브랜드 제품 초반 세트,https://blog.naver.com/pink_parfait/221702130998
레이어드 얼굴 이미지 스타일 미용실 질문 처음 여자 중간 머리 스타일,https://blog.naver.com/dhtmd991/222049619773
백문 백답 양식 중복 질문 제외 질문 나만 블로그 스타일 절대 주목 무채색,https://blog.naver.com/marumj/222541140641
여름철 착용 중요 요소 통기성 흡습 기능 초점 제작 액세서리 팔찌 모자 스타일리시 연출 가능 질문 푸마 반바지,https://blog.naver.com/display12382/223524701224
질문 플리츠 마마 노백 매치 답변 플리츠 마마 노백 스타일 만능 캐주얼 청바지 티셔츠 스커트 매치 포인트,https://blog.naver.com/ddlpif/223522182921
화면 자연 질문 진스 블랙 핑크 패션 스타일 정도 트렌디 디자인 건지,https://blog.naver.com/danikang1/223330070865
질문 가능 이야기 평소 스타일 스타일 선호 청바지 니트 가디건,https://blog.naver.com/taehu12/222616354515
질문 스타일 인기 답변 스타일 출시 취향 선택 최근 심플 디자인 인기,https://blog.naver.com/panel11924/223523522526
이메일 상담 댓글 카카오톡 채널 패션 스타일 질문 감사 체형 남성 코디 남성 코디 남자 코디 체형 코디 체형 코디,https://blog.naver.com/uniquerainbowegg/223094270383
정보 휠라 샤페 기능 스타일 가지 모델 분석 질문 질문 휠라 샤페 기능 스타일 가지 모델 분석 내용,https://blog.naver.com/feed10883/223524566753
광안동 속눈썹 토털 뷰티 스타일 광안 속눈썹 수영 역속 눈썹 광안 피부 관리 광안리 이것저것 관심 질문 대답,https://blog.naver.com/picasoo123/223329886970
이메일 상담 댓글 카카오톡 채널 패션 스타일 질문 감사 체형 스타일링 체형 코디 코디 허리 코디 다리 코디,https://blog.naver.com/uniquerainbowegg/223074572099
강의 평소 질문 질문 습관 라이프 스타일 생각 취향,https://blog.naver.com/ansyd/222582532244
빈폴 가디건 스타일 완벽 가이드 가을 내기 빈폴 가디건 코디 스타일링 패션 질문 질문 빈폴 가디건 코디 답변 빈폴 가디건,https://blog.naver.com/ddlpif/223525548200
티셔츠 일상 상황 편안 착용 스타일 연출 티셔츠 선택 출처 질문 티셔츠,https://blog.naver.com/happistudio/223508988265
편안 스타일 나이 나이 여담 색깔 색깔 자체 초록색 계열 초록색,https://blog.naver.com/chkybu/220860361360
민소매 슬리브리스 스타일 부유방 커버 작년 인기 만큼 진행 제품 코디 사장 문의 포스팅 본문 질문 포스팅 기재 내용,https://blog.naver.com/wing3527/223477422931
질문 나이키 코트 레거시 스타일 답변 나이키 코트 레거시 캐주얼 스트릿 패션 데일리 스타일 청바지 슬랙스 매치,https://blog.naver.com/honeytips2014/223523505336
패션 스타일 질문 완성 무드 보드 질문 정답 대로 자유 작성 패션 스타일 이름 클래식 캐주얼,https://blog.naver.com/stylespot/223238392119
국민 다이어트 도전 요즘 질문 언니 월래 스타일 스타일 스타일 스타일 스타일 허리 스타일 작살,https://blog.naver.com/heeyeon2lord/120131375649
모임 내용 소개 옷장 쇼핑 코디 고민 처방 토크 자유 질문 신청 방법 금액 신청 방법 신청 이유 스타일 톡스 신청 참가,https://blog.naver.com/ansyd/222521667980
플리츠 스타일 이웃 소개 가격 질문 비밀 주문 양식 입금 우측 상단 이름,https://blog.naver.com/hyejinicc/110159002355
출국 질문 뭄바 이인일 아우랑가바드 엘로라 아우랑가바드 스타일 생각 추천 털실,https://blog.naver.com/indiarycafe/220379755568
정보 여성 여름 베스트 상품 스타일 마리 토끼 가지 선택 질문 질문 여름철 스타일 동시 중요,https://blog.naver.com/insufalt164/223523475357
화장법 스타일 결과 이게 의구심 스타일 스타일 질문,https://blog.naver.com/leedo9315/223339930945
이메일 상담 댓글 카카오톡 채널 패션 스타일 질문 감사 스타일 상담 스타일 마리아 앤틱,https://blog.naver.com/uniquerainbowegg/223033804539
디자인 컬러 개성 스타일 완성 느낌 색상 디자인 활용 개성 스타일 연출 질문 운동,https://blog.naver.com/tapfa13001/223522307372
스타일러 질문 사실 스타일러 마음 작성 코디 느낌 스타일 마음,https://blog.naver.com/booooooorok/220265328151
사진 병원 대화 내용 사전 조사 질문 양식 원장 답변 진료 머리 모양 특이 액세서리 스타일 나이 또래,https://blog.naver.com/ksklds75/223491932674
차트 예산 반지 스타일 이외 평소 스타일 질문 상담 납득 질문,https://blog.naver.com/1130mg/223508156300
신체 사회 규정 정보 라이프 스타일 욕망 질문 라이프 스타일 유혹 소비 대상 스타 벅스 문구 아이폰 휴대폰 케이스 음식,https://blog.naver.com/fly_hidy/221722491989
패션 코디 포스팅 브랜드 정보 해당 브랜드 질문 여성 패션 추천 코디 피팅 모델 스타일 첫인상,https://blog.naver.com/syous0/222992127192
스스로 질문 마음 사이즈 스타일 얼룩 오물,https://blog.naver.com/lovelyanna76/222348517606
이메일 상담 댓글 카카오톡 채널 패션 스타일 질문 감사 체형 스타일링 체형 코디 코디 허리 코디 다리 코디,https://blog.naver.com/uniquerainbowegg/223087868028
질문 소페 샌들 스타일 답변 소페 스타일 클래식 디자인 트렌디 디자인 인기 클래식,https://blog.naver.com/factfa10576/223523597999
아디 다스 오즈 위고 스타일 완성 스니커즈 아디 다스 오즈 위고 스니커즈 패션 스타일 질문 질문 아디 다스 오즈 위고 스타일 신발 답변 아디 다스,https://blog.naver.com/vyfbakh/223520628023
스타일 시니컬 스타일 검정 하양 군청색 시니컬 느낌 하늘색 연분홍색 느낌,https://blog.naver.com/grace_seonmi/223359845355
탠디 여성 스니커즈 컬러 디자인 출시 스타일 질문 탠디 여성 스니커즈 관리 답변 탠디 여성 스니커즈 소재 관리 방법,https://blog.naver.com/display12382/223523350296
스타일링 분위기 연출 신발 코디 스타일링 코디 질문 질문 발란스 매치 답변,https://blog.naver.com/qmffhrm4231/223525438218
스타일 코디 가족 사진 하늘 정원 스튜디오 올해 결혼기념일 선물 고민 질문,https://blog.naver.com/babyhanle/222899871146
색상 전통 색상 현대 색상 다양 스타일 선택 질문 한복 바지 관리 답변 한복 소재 관리 방법,https://blog.naver.com/bias9532/223516701869
스타일 선물 으뜸 아기 아기 아기 직원 친절 질문 대답 사진,https://blog.naver.com/xixsis/220449858553
육아 용품 아기 만큼 만큼 스타 스타일 엄마 엄마 엄마 절약 아기,https://blog.naver.com/jappy_day/223403958496
이메일 상담 댓글 카카오톡 채널 패션 스타일 질문 감사 터틀넥 코디 터틀넥 스타일링 남자 터틀넥 코디 남자 터틀넥 스타일링,https://blog.naver.com/uniquerainbowegg/223055685949
