nouns,link
사복 패션 그녀 스타 그램 피드 착장 정보 질문 뷔스 티에 반팔 매치 스타일,https://blog.naver.com/1208_sj/223523790276
질문 단점 보완 나만 스타일 안경 가지 안경 스타일 소재 밝은색,https://blog.naver.com/delight_sell/221216329940
사고 후회 질문 평상시 취향 소비 합리 일지 판단 근거 스타일 색깔 직업 활동,https://blog.naver.com/liz2958/223118542386
정보 엄브로 모자 스타일 기능 선택 가지 모델 비교 분석 질문 질문 엄브로 모자 모델 스타일 기능 답변 엄브로,https://blog.naver.com/await9790/223523292811
패션 더락 아이스 반팔 티셔츠 추천 네이버 공식 온라인 스토어 마무리 스타일 필요 댓글 질문,https://blog.naver.com/ahbooom/223424372935
질문 반지 스타일 인기 답변 반지 인기 디자인 트렌드 개인 취향 심플 디자인 사랑 심플 디자인 미니멀리즘 대세,https://blog.naver.com/sniff11753/223523348321
저질 체력 남편 임신 관심 질문 스타일,https://blog.naver.com/csar/223119487240
의식주 스타일 질문 직장 차림새 마음 출근,https://blog.naver.com/romioseo/223479152758
색상 선택 개인 취향 스타일 연출 질문 스케쳐 아치 선택 주의 가요 답변 스케쳐 아치 선택 본인 모양,https://blog.naver.com/nyubzme/223525858417
정보 샤넬 하트 선글라스 스타일 인기 모델 비교 분석 질문 질문 샤넬 하트 선글라스 모델 인기 답변 샤넬 하트,https://blog.naver.com/company8593/223524695180
모던 스타일 카테고리 인기 상품 분석 가구 소품 모던 스타일 가구 모던 스타일 완성 카테고리 인기 상품 비교 분석 질문 질문,https://blog.naver.com/deliciou12363/223522158603
이메일 상담 댓글 카카오톡 채널 패션 스타일 질문 감사 취업 면접 복장 테크 취업 면접 복장 스타일 상담 마리아 앤틱,https://blog.naver.com/uniquerainbowegg/223040650535
정보 탐스 슬립 스타일 편안 아이템 인기 모델 가지 비교 분석 질문 질문 탐스 슬립 스타일 편안 아이템 인기 모델 가지,https://blog.naver.com/purple14168/223523472982
정보 다니엘 웰링턴 반지 스타일 완성 가지 선택 질문 질문 다니엘 웰링턴 반지 스타일 인기 답변 다니엘 웰링턴 반지,https://blog.naver.com/cliff72081/223522357748
스타일 건지 해결 코스 질문 쥬얼 랜딩 코스 피플 비츠 메인 코스,https://blog.naver.com/peoplevittz/223153291529
질문 록스 맥스 스타일 가요 평소 캐주얼 답변 록스 맥스 색상 스타일리시 디자인 출시 디자인,https://blog.naver.com/curry5162/223524601540
프롬 레이 잡화점 스타일 공구 스타일 가격 문의 비밀 댓글 누락 방지 질문 댓글 판매,https://blog.naver.com/fromrei8/221261756464
데님 팬츠 스커트 원피스 다양 아이템 매치 개성 스타일 완성 질문 나이키 실버 운동 구매 답변 나이키 실버 운동 나이키 공식,https://blog.naver.com/await9790/223523346741
예약 작가 스타일 구도 질문 방법 보정 마지막 결정 프로필 사진 방법,https://blog.naver.com/0426ksj/223525154632
디자인 블라우스 부유방 완벽 커버 스타일 클링 데님 특이 위시 질문 질문 포스팅 기재 내용,https://blog.naver.com/wing3527/223499204828
패션 아이템 피플 제주 제주 젊은이 성지 스타일 악세사리 질문 제주도 편안 분위기 매장 내부 쇼핑 내내,https://blog.naver.com/senggae/223422636365
아이템 코디 추천 정보 제공 에드 하디 아이템 활용 스타일 연출 질문 아이템 구매,https://blog.naver.com/await1448/223523294272
케네스 레이디 원피스 인기 스타일 코디 가이드 패션 원피스 스타일링 질문 질문 케네스 레이디 원피스 스타일 답변 케네스 레이디 원피스,https://blog.naver.com/vyfbakh/223526226620
