nouns,link
헤어 메이크업 맞춤 코칭 스타일 컨설팅 컨설팅 스타일 고객 평소 평소 스타일 전신사진 이해 아이템 스타일,https://blog.naver.com/joyyel/222611871103
여성 주목 패셔 스타 고준희 스타일 그것 스타일링 드라마 일상,https://blog.naver.com/jin_0725/70160513008
헤어 스타일 개성 안경 글라스 악세사리 활용 중년 패셔 스타 백문 불여일견 윤종신 스타일 윤종신,https://blog.naver.com/jin_0725/70171281544
외모 심플 댄디 정일우 스타일 댓글 블로거 보람,https://blog.naver.com/jin_0725/70165538172
튜버 정수리 집중 한창 옷장 관리 옷보 관법 관리법 옷장 옷장 소개 미니 옷장 유튜브 코디 제니 스타일,https://blog.naver.com/mmt_image/222793617510
스타 소개 니어 그램 성격 유형 마케팅 공전 에니어그램 개인 유형 성격 테스트 김현정 인성 연구소 소장,https://blog.naver.com/typeofb/221562300449
일본 시티 보이 스타일 국내 매스틱 브랜드 고가 제품 위주 엔트리 제품 세일,https://blog.naver.com/diddmlduf1/222382297764
데뷔 케이블 빅뱅 다큐 멤버 매무새 정리 스타일 점검 모습 인상 센스 건가 권지용 스타일,https://blog.naver.com/jin_0725/70160638239
스타일 정리 세상 스타일 생산 스타일,https://blog.naver.com/kalua1/140155359479
자켓 가디건 원피스 날씨 스타일 러너 남자 스타일 기능 가지 측면 만족 아이템,https://blog.naver.com/nb_performance/220558708498
디자인 디자이너 심플 디자인 추천 샘플 제품 스타일,https://blog.naver.com/rjgadia/222623141009
스타일 해시 태그 코디 오늘 오늘 코디 그램 가족 스타 그램 아빠 엄마 도치 새끼 출처 반려 동물,https://blog.naver.com/scatter_8782/222110420108
일상 데일리 데일리 코디 데이트 투톤 피넛 블로그 소통 단발 조개 구이 맛집 영등포 무한리필 여자 셀카 일상 소개 스타 그램 스타일,https://blog.naver.com/2tonepeanut/220238754750
신민아 스타일 신민아 신민아 청바지 여자 청바지 캘빈클라인 캘빈클라인 신민아 코디 누군지 작품 의상 스타일 캐릭터,https://blog.naver.com/jin_0725/70169495613
빈지노 스타일 빈지노 스타일 빈지노 스냅 스냅 스트릿 댓글 블로거 보람,https://blog.naver.com/jin_0725/70173956857
아무것 시절 당시 꼬리 유행 감정 부분 막내 친구 이것저것 스타일,https://blog.naver.com/piano2221171/221357524152
남자 모자 부착 전통 모자 스타일 개성 선택 모자 아이디어 공유 대부분 디자이너 스타일,https://blog.naver.com/42ttjcj1214/223040998941
전지현 스타일 전지현 송이 입생로랑 틴트 댓글 블로거 보람,https://blog.naver.com/jin_0725/70183628068
코바늘 코바늘 대바늘 뜨개 유튜브 스타일 애기,https://blog.naver.com/ksk6847/222912537129
평소 스타일 추구 강남 사모님 현실 면바지 맨투맨 주부 남편 사랑 마음 반찬 네이버 메인 신스,https://blog.naver.com/manulaya2004/222686163589
가을 스타일 레더 스커트 산점 이블 충남 논산시 가을 스타 마스크 트랩 비즈 비즈 비즈 반지 비즈 팔찌 진주 팔찌 진주 반지 취미,https://blog.naver.com/kissingkura/222086720903
스타일 스타일 쇼핑 선정 블로거 확률 선정 가능 추가 수익 발생 체험,https://blog.naver.com/fool77x/222595441203
체험 강습 마스터 프리스타일 스핀 버트 점프 그립 스키장 스타일 제품 구입 내용,https://blog.naver.com/pinayarn/130000273612
스타일 시청자 쇼핑 도우미 스타일리스트 쇼핑 금액 낙찰자 부담 낙찰 개월,https://blog.naver.com/didwl902/222635028348
스타일 화이트 레드 오렌지 핑크 옐로우 신체 비율 외모 스타일 동경 겨울 바람 분다 복귀,https://blog.naver.com/jin_0725/70169292872
블로그 주제 일상 스타일 여행 이벤트 나스 파운데이션 무료 이벤트 소통 이벤트 무료 이웃 블로거 한남,https://blog.naver.com/venusgirl613/220476900458
매거진 보그 최근 현지 세계 스타일리시 엄마 리한나 임산부 혁신 제품 라인 임산부 스타 일의,https://blog.naver.com/pickdailynews/223183382163
오늘 스타일 스타일링 일상 오늘 데일리 스타 인스 타데이 가족 스타 그램 엄마 아빠 육아 일기 워킹 아기 스타 베이비 출산 선물 신생아,https://blog.naver.com/tlschsdlsrks/222740686195
계열 스타일 최소한 섹스 피스톨스 생각 중간 코디 끝판 아이템 문화 겉모습,https://blog.naver.com/leviousa36/223035461494
스타일 슬립 트렌드 올해 유행 스타일 클릭 하단 삭스 오프 피프스 직구 가이드 영어 직구 추보,https://blog.naver.com/eggegg500/220308751610
스타일 화이트 레드 오렌지 핑크 옐로우 그린 블루 퍼플 블랙 이민호 작품 사복 댄디 남성 스타일,https://blog.naver.com/jin_0725/70164157391
여성 입장 스타일 남자 요즘 공항 음악 방송 윤계상 스타일 여성 사랑 사실,https://blog.naver.com/jin_0725/70161108520
키워드 컨셉 대상 할지 스타일 남친 카지 스트릿 미니 다양 스타일,https://blog.naver.com/gnsl0465/221775235778
경력 유니크 스타일 구축 엄지 블로그 개월 블로그 마음 포스팅 동대문 가방,https://blog.naver.com/eomsoobok/222310669073
블러 중수 생각 화장품 친구 상태 쿨톤 블러 사용 그날 스타일,https://blog.naver.com/dbdutk1313/222410392465
평소 머리 투자 스타일 이미지 라이프 스타일 고려 고객 스타일 제안 예비 신랑 인생 스타일 발견,https://blog.naver.com/sonofelice4/221481175343
해당 도움 서울 한류 여행 안내서 목적 여행 목적 여행 방분 숙박 휴식,https://blog.naver.com/mt_hikingkorea/223417936514
그루 헤어 메이크업 스타일 면접 사치 이직 취업,https://blog.naver.com/naomifts/220227912216
스타일 캉캉 치마 에이핑크 초롱 계절 봄맞이 스타일 정보 공유 오늘,https://blog.naver.com/eunjjanglove/221440613527
김태희 마성 남자 정지훈 스타일 화이트 레드 댓글 블로거 보람,https://blog.naver.com/jin_0725/70169034600
디자인 전공 공부 여동생 도움 스타일 고객 가방 시작,https://blog.naver.com/eomsoobok/222263936872
스타일 티파니 얌냠 얌냠 스타일 태연 스타일 서현 서전 젓가락 구가 텐션 껍데기 운전자 완전 공감 훈수,https://blog.naver.com/hooi6969/220111947616
평소 캐주얼 스타일 선호 걱정 심플 장소 스타일 자유 선택 교체 가능 트랩 나토,https://blog.naver.com/1004coucou/222328699310
평생 스타일 관심 남자 남자 남자 중요 스타일 현실 입기 적용,https://blog.naver.com/joyyel/222847661820
남자 스타일 엔리 공항 엔리 엔리 외출 스타일 사랑 깨금 선택 매력,https://blog.naver.com/wlgp1137/70156449489
헤어 스타일 복고풍 스타일 시골 마을 디애나 마을 호킨스 회화 드영 주행 고민,https://blog.naver.com/sompy1004/221966206937
고전 스타일 모자 복고풍 유행 제품 마법사 고전 스타일 모자 복고풍 유행 스타일,https://blog.naver.com/take1231/90034553451
스타일 화이트 레드 오렌지 핑크 옐로우 스타일 연예인 박재범,https://blog.naver.com/jin_0725/70163550493
품절남 정겨운 스타일 남자 정장 남자 정장 브랜드 스트릿 댄디 스타일 대체,https://blog.naver.com/jin_0725/70183350639
공항 대명사 별양 스타일 화이트 레드 오렌지 핑크 공항 이슈 개인 생각 별양 스타일 남성,https://blog.naver.com/jin_0725/70165488824
코딩 스타일 추천 일상 동료 친구 강사 대신 서비스 우수 인공지능 기술 스타일 추천 코콘 사용 맞춤 체형 분석 코콘 체형 분석 서비스 개인,https://blog.naver.com/minchaeryn/223099775978
통용 스타일 한쪽 특성 강화 스타일 장난감 교구 제작 과정 설명 기교 심플 작업 과정,https://blog.naver.com/dreaming_yeoyu/222405251027
평소 스타일 가요 상당 리더 부리 헤어 스타일 스타일 각이 학생,https://blog.naver.com/chilimusickorea/60073433311
부각 스타일링 여성 사랑 패셔 니스 순수 가지 매력 패셔 스타 임수 정양 스타일 여성,https://blog.naver.com/jin_0725/70185982387
스타일 역할 표현 보통 배우 순간 군대 현빈 스타일 화이트 레드 오렌지 핑크 옐로우 그린 블루 퍼플,https://blog.naver.com/jin_0725/70165992703
올드 미키 포토샵 교육 주정도 스타일 신청 급여 면접,https://blog.naver.com/choiceadam/110084032382
디자이너 본인 헤어 스타일 디자이너 스타일 브랜드 디자이너 센스 마루 타가 염려 무시 가격 레알,https://blog.naver.com/machokingnet/20188466627
이정재 스타일 이정재 이정재 연예인 연예인 스타일 이정재 매치 댓글 블로거 보람,https://blog.naver.com/jin_0725/70186131355
스타일 해시 태그 대화방 채팅 대화 이프 랜드 제페토 캐릭터 머리 스타일,https://aintpemsun.tistory.com/190
독보 기술력 기반 서비스 인기 세대 취향 저격 통화 기록 코딩 스타일 스타일 추천 코콘 사용 맞춤 체형 분석 개인 스타일링 블랙 탠저린,https://blog.naver.com/vito_ai/223104783358
초급 중급 중급 커리큘럼 살사 댄스 강습 진행 동호회 입장 스타일 진행 수강 중간 결정,https://blog.naver.com/look4you0906/222907909883
옷차림 뉴욕 옷차림 뉴욕 스타일 뉴욕 평상 시옷 뉴욕 하이패션 머리 하이패션 스타일 마미 대디 피지컬,https://blog.naver.com/juliet7028/222342144965
컨설턴트 평소 스타일 홍보 입장 라이프 스타일 반영,https://blog.naver.com/rkckskdk/223144081775
스타일 쥬얼 타입 레이어드 악세사리 매치 레이어드 악세사리 스타일 자리,https://blog.naver.com/jzjdsybtsm/220033877367
배우 카리스마 이천희 스타일 이천희 스티브 요니 남성 정장 남자 정장 남자 셔츠 남성 셔츠 여성 남성 여자 스타일 남자 쇼핑몰,https://blog.naver.com/jin_0725/70170770970
신현민 매거진 억대 연봉 편집장 비주얼 엘레 강스 분위기 유지안 스타일 에디터 이사 첫날 이웃 주민 옆집 남남 커플 입양,https://blog.naver.com/cna1177/222612621974
평소 스타일 붙박이 평소 감옥 격리 원피스 원피스 가디건 원피스,https://blog.naver.com/jhooa11/222683387687
편안 부담 디자인 덕분 스타일 코디 스타일 스타일 코디 아이템 스타일링 모자 추천 군모 추천 청림 모자,https://blog.naver.com/moja2525/220945807468
대다수 학생 단계 정성 할애 학생 수채화 대구 패디 편입 스타일 대구 스타일 대구 일러스트 일러스트 미대 편입,https://blog.naver.com/yunsoopapa/222078564025
또래 스타일 주장 여성 건데 달리기 시작 몰두 달리기 페이스 크루,https://blog.naver.com/wndmsgp357/222860328375
스타일 집합 강남 물거리 디자인 트랜드 리더 세트 스타일 일반 예물 반지 결혼,https://blog.naver.com/yeriel2014/80210615515
농담 아키하바라 오타쿠 레벨 졸업 정도 스타일 시부야 문화 경험 시부야,https://blog.naver.com/jinna8100/223134046402
기저귀 가방 가방 스타일 무시 기저귀 가방 오늘 엄마 아가 건강,https://blog.naver.com/sweethee3/221005957894
스타일 옷장 시작 마지막 나만 스타일,https://blog.naver.com/your_warning/223066175562
쇼핑 쇼핑 스팟 편집 티서 스타일 관찰 최적 장소 가본 디자이너 개성 스타일,https://blog.naver.com/mmorrismom/220111660910
스트릿 무드 기반 스타일 추종 트렌드 베이직 감성 기본 대상 브랜드 뉴비,https://blog.naver.com/wo8x77133/222504759968
요것 만족도 네일 신발 스타일 어딘가 발란스 느낌,https://blog.naver.com/candystone/221054239452
명품 스타일 시대 변천 부자 쇼핑 스타일 디자인 잡지 백화점 브랜드 오픈 마켓 시작 판매자 상품,https://blog.naver.com/varadori/100180669264
야구 모자 아이템 하이라이트 착용 도발 소녀 이미지 소품 의상 밸런스 자연 매치 경수진 스타일,https://blog.naver.com/vreds/221701618780
제품 아기 윤지 무계 외출 스타일 실제 착용 신축성,https://blog.naver.com/dpskfkrh89/220183856152
단편 장편 예정 소재 댓글 코디 스타일 이야기,https://blog.naver.com/shee_38/221149218678
웨이터 웨이터 텐데 음식 전철 교통 카드 교통 이용 체크 카드 사용,https://blog.naver.com/fnqldi1/30051809053
스타일 스타일 다양 기술 통합 완전 영어 교과 수업 영어 선생,https://blog.naver.com/realmebookstore/223453036409
처음 관심 여기저기 이해 스타일 서비스 개인 얼굴 체형 진단 분석 스타일 추천 가지 서비스,https://blog.naver.com/favorpia/221394996257
센스 생각 뭔지 개인 스타일 목도리 니터 집중 집중 미니 미한,https://blog.naver.com/goodsilcom/220184424503
남자 얼굴 생김새 스타일 헤어 스타일 몸매 노력 여자 남자 얼굴 남자 스타일,https://blog.naver.com/choisil828/223116772130
스타일 댄디 추구 주위 액세서리 포인트 스타일 스트릿 미니 얼룩 클래식,https://blog.naver.com/rojune_design/222708312398
평소 스타일 거리 터프 도전 아이템 구경 겨울 겨울 원피스,https://blog.naver.com/ego1982/220900568444
장비 선택 필수 상급 장비 아이템 스노우 보드 나만 스타일 개성 스타일,https://blog.naver.com/xunsi486/220517977201
남자 친구 센스 요령 추천 스타일 소개 교제 시작 스타일 마음 고민 활용 남자 친구 시작,https://showroom81.tistory.com/91
센스 모델 출신 배우 다섯손가락 수트 여성 남성 워너비 스타인 주지훈 스타일 화이트 레드 오렌지 핑크 옐로우,https://blog.naver.com/jin_0725/70168767720
퍼스널 컬러 스타일 헤어 메이크업 종합 관리 진행 성형 호감 스타일 스타 종합 관리 스타일 연애,https://blog.naver.com/rhdwnsign/220796516189
라이프 스타일 순위 공간 투자 요리 커플 부엌 이닝 치중 세대 드레스 최근 특징 침실,https://blog.naver.com/ayhkk/222838835681
연예계 패셔 스타 여성 전체 관심 김민희 스타일 소개 화이트 레드 오렌지 핑크 옐로우 그린 블루,https://blog.naver.com/jin_0725/70160303902
기본 모자 신발 방법 스타일 파악 착용 블로거 레몬 홍차 제안,https://blog.naver.com/legna5003/30109889314
스타일 헤어 스타일 악세사리 중요 스타일 아이템 댄디 첼시 부츠 앵글 워크 웨어 워커 레드 아이언 레인저 캐주얼 흰색 스니커즈 플란넬 셔츠 포인트 미니,https://blog.naver.com/leeminwok/222626009821
봄맞이 스타일 백과사전 개월 만큼 스타일링 입력 수정,https://blog.naver.com/youseok0/221221270865
재택근무 오늘 주제 퍼스트 출처 여름 스타일 여성 여성 여름 여름 여름 샌들 여름 여성 구두 여성 스타일,https://blog.naver.com/kgy988/130169285757
여성 스타일 전주 효자동 리본 여름 기본 티셔츠 단돈 구입 스타일 상품 전시 공부 스터디 네이버 스마트 스토어 가입 상품,https://blog.naver.com/sochonn/221260312614
스트릿 감정 브랜드 느낌 트렌디 스타일 스트릿 세계 처음 부담,https://blog.naver.com/outback13/221677002112
자연 추구 스타일 편안 리처드 강남스타일 인터넷 인기 라디오 음악 정확,https://blog.naver.com/tigermas/220894678508
걸음걸이 스타일 컬러 쿨톤 얼굴 안경테 모양,https://blog.naver.com/style2922/221683251078
고민 여성 스타일링 입문 지은이 경험담 토대 현명 쇼핑 노하우 이야기 개성 스타일 공식 공개 싫증,https://blog.naver.com/didtkswhgkq/20158268391
행사 매력 스타일 코리아 라이프 스타일 어워드 올해 본인 컬러 차세대 패셔 스타 장재인 스타일 장재인 여자 원피스,https://blog.naver.com/jin_0725/70170102410
무대 방송 시상식 화보 그녀 스타일 화이트 레드 가지 스타일 주목 강민경 강민경 사복,https://blog.naver.com/jin_0725/70163415174
배꼽티 힙합 바지 항공모함 신발 남녀 구분 스타일 어른 부부 건지 건지 그것,https://blog.naver.com/angelcdt/222104622580
스타일 연예계 생활 센스 소희 스타일 화이트 레드 오렌지 핑크 옐로우 그린 블루 퍼플,https://blog.naver.com/jin_0725/70161108112
전성기 그녀 스타일 화이트 레드 오렌지 핑크 댓글 블로거 보람,https://blog.naver.com/jin_0725/70169358627
포스팅 사진 브라운 아이드 걸스 멤버 개성 가인 스타일,https://blog.naver.com/jin_0725/70165931664
한몫 카메라 하늘 소원 새해 사용 니즈 파악 수납 공간 스타일 디자인,https://blog.naver.com/hana8510/222196608672
관련 스타일북 시즌 신간 출간 인기 가을 정비 스타일북 만화 이야기,https://blog.naver.com/jillblog/40137705006
전문 패션모델 교대 디자인 출시 의상 스타일 디자인 디자이너 피팅 모델 스타일링 모델 패션모델,https://blog.naver.com/joycityk/220189040801
소지섭 스타일 이유 심플 스타일 선호 특유 과묵 카리스마 소간 스타일 화이트,https://blog.naver.com/jin_0725/70168894658
안녕 인생 선생 픽사 지외 반증 정형외과 엑스레이 결과 스타일 엄마 스타일 거부 기억,https://blog.naver.com/godqhrgkwk38/222266365390
평소 스타일 베이직 모던 성격 순두부 콤플렉스 느낌 문답 블로그,https://blog.naver.com/yuuuujinlog/222146245165
이효리 스타일 화이트 레드 오렌지 핑크 옐로우 그린 블루 퍼플 블랙 컬러 이효리 센스 센스,https://blog.naver.com/jin_0725/70163669305
정려원 그녀 센스 정려원 스타일링 여성 정려원 스타일 화이트 레드 오렌지 핑크 옐로우 그린 블루,https://blog.naver.com/jin_0725/70164060611
엄마 불안 엄마 불안 정보 인형 체구 걸음걸이 스타일 태도 위엄,https://blog.naver.com/landorabook/221891853129
촌장 그래픽 별똥별 기도 촌장 성방 마을 다양 스타일 시도 촌장 리젠트 나이 리젠트 개의,https://blog.naver.com/dmscoans/221645134559
시작 스타일 댄디 이미지 국민 연하 국민 박해진 스타일 박해진 이휘경,https://blog.naver.com/jin_0725/70183387531
노홍철 스타일 노홍철 닷컴 노홍철 남자 쇼핑몰 얼굴 남자 헤어 스타일 댓글 블로거 보람,https://blog.naver.com/jin_0725/70183675979
센스 관심 사랑 이민우 이민우 스타일 댓글 블로거 보람,https://blog.naver.com/jin_0725/70161320462
평소 스타일 복장 박스 바지 요즘 청바지 불편 성격 면허 나이 단짝 친구,https://blog.naver.com/jianstory/222084576190
스타일 엄마 기분 스타일 구체 생각,https://blog.naver.com/heofork/221581974166
레이디 스타일 몸매 관리 팀장 센스 스타일 여자 만족 선생 디자인 솜씨,https://blog.naver.com/audtnsdl5400/221046243711
스타일 라이프 스타일 스타일 일상 현지 감성 실력 시선 연출,https://blog.naver.com/lapomme00/222123215552
운전 실력 운전 서울 서울 식물원 동남아 스타일 커플 동남아,https://blog.naver.com/lovely_summer/222443035322
무리 방법 스타일 요즘 미모 자랑 리엔 처음 염색 컬러,https://blog.naver.com/dschool24/221883354059
스타일 탤런트 홍여진 암투병 사실 화제 페넌트 레이스 감독 삼성 라이온즈 롯데 자이언츠 바람 삼성,https://blog.naver.com/yang55557/80141981467
크리스찬 크리스토발 발렌시아가 모더니즘 엘레 강스 오늘날 스타일 상징 단어 정도 인기 사랑,https://blog.naver.com/momthetable/222644018183
시절 이야기 올봄 유행 스타일 질문 센스 영화 제작 보고회 류준열 유지태 조우진 박누리 감독 봉작 회식 사무실 주식,https://blog.naver.com/kw1359/221463806390
라이프 스타일 도구 표현 이스턴 에디션 조선 시대 후기 미학 나무 헤이 정지숙 작가 스타일 본인 그림 한눈,https://blog.naver.com/sora5242/222375700154
부분 용어 정리 시작 그녀 라이프 스타일 이야기,https://blog.naver.com/chi0208/10109094083
문외한 처음 프롤로그 스타일 작가 그녀 연예인 스타일링 담당,https://blog.naver.com/romancemoon_/70155313081
유발 여자 연예인 안녕 블로거 둥이 트렌디 스타일 여성 워너비 스타 고준희 스타일 매력,https://blog.naver.com/ronymam0116/222065819232
부위 시술자 작업 부위 부위 도안 다양 고객 스타일 도안 선택,https://blog.naver.com/dlwldms0800/222047740573
영상 스타 작사 주위 놀라움 리듬감 가사 어구 남자 정도 유학 이보람 해외 파인 스타일,https://blog.naver.com/youngdisplay/60167175448
중년 남성 의류 브랜드 사보 오랜만 코디 디렉터 아저씨 중년 스타일 사보,https://blog.naver.com/dktkghdeh/220412209230
일본 스타일 나이 취향 건지 먼가 스타일 마지막 대행수 수료 이벤트,https://blog.naver.com/mrwpar96/221977677363
그녀 스타일 독특 특유 대통령 일관 진술 아무,https://blog.naver.com/englishdrben/221542784060
서태지 스타일 오랫동안 사회인 기본,https://blog.naver.com/sunny_ever/221180691197
스노우 보드 스타일 중요 유행 최신 어깨 스타일리시 활강,https://blog.naver.com/gudwldnd/221701804082
스타일 인물 베스 라이벌 조력자 헤어 스타일 원피스 코트 당시 최신 유행 레트 느낌,https://blog.naver.com/action002/222212811708
셀린느 스타일 전통 강조 수준 브랜드 셀린느 프랑스 자체 스타일 창조성 세계 필수 존재 인식 향기,https://blog.naver.com/skyrr0715/40010378700
컨셉 노홍철 스타일 관심 가내 인테리어 스타일 감각 개성 트리 젠코 포르 라인,https://blog.naver.com/trigenco/220589577583
성장 아마추어 강사 연애 방법 스타일 코디,https://blog.naver.com/bestpua/221064861347
베이식 아이템 매치 스타일 조화 스타일링 활동 이미지 표현 스타일 생각,https://blog.naver.com/lovesunglass/100154169913
프로젝트 미니 리스트 스타일 최대 가지 아이템 개월 미싱 수업 코스 쿠션,https://blog.naver.com/paper_life/220620202913
연애 연애 실현 중요 요소 스타일 코디 운동 헬스 식단 조절,https://blog.naver.com/bestpua/221337117328
모자 스타일링 미니 인터뷰 소개 부탁 프리랜서 뷰티 전문 기자 활동 온라인 세인 마켓 운영 결혼,https://blog.naver.com/hairintrend/220868616029
스타일 화보 마지막 관련 포트레이트 수집 참여 기회 포즈 처음 촬영 베스트 보장,https://blog.naver.com/chany100/220794969104
화장품 브랜드 판매 펜슬 사용 화장 스타일 박재범 스타일,https://blog.naver.com/alphaforces/223151875980
김사랑 스타일 연일 유행 주말 시크릿 가든 가능 핫요가 시크릿 가든 회의 김사랑 가편 방송,https://blog.naver.com/14jamsil/120121329425
입문 자분 머리 싱글 골프 사랑 마음 필드 골프 라운 스타일 골프 옷차림 올해 필드,https://blog.naver.com/jaehyong5/221663456090
노동 투입 내역 누락 파악 필요 선생 네이버 스타일 고무줄 바지 고수 자식 타지,https://blog.naver.com/hnstat/220356000164
출근 양말 검정 별명 내추럴 웨어 근본 기대 편안 현실 스타일,https://blog.naver.com/cocosocks/220501162160
아이템 스타일 엄마 알짜 정보 트림 면역력 개구리 다리 엄마,https://blog.naver.com/cogiry/10097696094
스타일 바지 나비잠 기저귀 스타일 트리 마지막 나비잠,https://blog.naver.com/bjy880810/221586230997
도끼 노래 제목 관계 제목 영상 순서 스타일 배우 류준열 오늘 주인공 도끼 등장,https://blog.naver.com/kimjg19020/220855186076
스타일 라운 기저귀 기대 슈퍼 어링 허니콤 보로 내복 스타일 배앓이 방지,https://blog.naver.com/tbseowlq00/222428813730
저자 출판 상상 출판 출간 스타일 라이프 스타일 지점 출발 정답 완벽 노력,https://illusionofmoon.tistory.com/978
블로거 포스팅 이탈리아 피렌체 세계 최대 남성 이태리 감성 스타일,https://blog.naver.com/gnf1215/220247755278
아아 포스팅 시즌 스타일 색감 기존 스타일,https://blog.naver.com/stacy0322/220091072074
줄거리 디자이너 트렌디 도시 여자 이지현 윤은혜 부모 강요 작가 시나리오 윤은혜 수락 출연 성사,https://blog.naver.com/youseok0/223375139371
에피 스타일 포스팅 스타일 고도 특유 스모키 메이크업,https://blog.naver.com/kjn331/113168101
여성 머리 스타일 남산 스타일,https://blog.naver.com/snownh2o/222685809481
평소 야옹 작가 메이크업 스타일 아이돌 문화 관심 작품 반영 작품 주인공 메이크업 헤어 스타일 재미 웹툰,https://blog.naver.com/ajhjhh/221599569068
방법 여행자 교통 소개 쇼핑 숙소 패션쇼 뉴욕 전역 브랜드 소개 스타일 제안 명품 목록,https://blog.naver.com/riger303/118462198
게임 스타일 그루 이미지 나름 일가견 구축 대부분 대부분 연애 직접,https://blog.naver.com/imflife/222138372644
길복 전도연 리즈 시절 스타일 길복 넷플릭스 공식 이미지 공개 동시 광수 피지컬 스타일 외모 막강,https://incheonknews.tistory.com/6752
센스 미란다 에밀리 에밀리 영화 스타일 개인 소화,https://blog.naver.com/com3cho/110179575187
생각 스타일 겨울 보온 미션 일차 정도 효과 시작,https://tvsline.tistory.com/126
