nouns,link
루어 후르츠 바이샹 구어 포도 복숭아 관련 용어 내용 생각,http://cafe.naver.com/tnsuhak/91220
용어 정리 상품 약자 대형 소매업자 독자 제작 쿠팡 브랜드 여성 의류 신발 가방 판매 합리 가격 트렌디 디자인,http://cafe.naver.com/bugsu2008/1763
결혼 예물 반지 얼리 프러포즈 반지 기념일 선물 정보 용어 설명 이해 설명 걱정 부분,http://cafe.naver.com/06rkddkwl/2124108
브랜드 천안 커플링 얼리 액세서리 걱정 용어 등급 크기 가지 부분 가치 평가,http://cafe.naver.com/ungsangjang/708252
파리 패션쇼 참가 모습 여론 비난 노소영 자식 용어 사용 듯이 모습 일반인 도덕 관념 비난,http://cafe.naver.com/wiseinvestor/96712
니콘 광장 시장 먹거리 시장 예전 광장 시장 투리 구입 맞춤옷 대학교 양복,http://cafe.naver.com/fujipeople/681310
요구 조건 모양 스타일 평소 가지 처음 용어 말씀,http://cafe.naver.com/06rkddkwl/2123898
용어 지속 등장 초반 기술 부분 문답 관련 위주 제너 레이팅 결론 내용 이미지 통일성,http://cafe.naver.com/ganada2024a/2275
쌍수 용어 건가요 엄마 중년 쌍수 중년 쌍수 카페 회원 뷰티 정보 제공 뷰티 관련 주제 성형 쁘띠 화장품 다양,http://cafe.naver.com/euromate/33944
기본 어정 레싱 방식 레싱 외벽 마감 표면 관리 바깥쪽 시공 레싱,http://cafe.naver.com/ypbds/34877
용어 정리 업계 특성 다양 협업 진행 원활 소통 사용 용어 중요 생각 원활 소통,http://cafe.naver.com/oranke/14017
시사 경제 용어 사전 시사 경제 용어 사전 경제 수출 자율 규제 수출 세계 브랜드 백과 미국 브랜드 청바지 밀라드 드렉슬러,http://cafe.naver.com/snshomepage/1304
등급 대전 예물 평소 스타일 스펙 취향 파악 배려 감동 다이아 설명 정보 용어,http://cafe.naver.com/06rkddkwl/2123598
그놈 호흡 상압 용어 성문 상압 단어 이게 보컬 레슨 유행,http://cafe.naver.com/5vocal5/3
나중 주얼 리도 진행 요즘 결혼반지 레이어드 진행 캐럿 다이아몬드 반지 진행 용어 검색,http://cafe.naver.com/06rkddkwl/2123467
로리타 관심 중학생 아이템 용어 베이비 베이비 카라 밀푀유 취향,http://cafe.naver.com/lakeland/83008
선거 용어 개띠 집들이 선물 시계 온라인 판촉물 커피 답례품 선물 시계 커피숍 개업 펜션 개업 선물 기업 홍보 용품 기업 단체 홍보 효과 핸드폰 가방 기업 선물 관공서 판촉물 기업 선물 스타일,http://cafe.naver.com/misinggo/1400433
용기 부분 실무 적용 부분 설명 용어 뷰티 기술 특정 분야 경험 부각 전문 립니,http://cafe.naver.com/ascmchallenge/37
기본 용어 복습 마이크 미니 스타일 컬리 웨이브 보브 단발 작년 진스 대란,http://cafe.naver.com/hacademy0/2883
다이아몬드 정보 용어 설명 제품 디자이너 스케치 추천 체형 스타일 고려,http://cafe.naver.com/ungsangjang/707537
필수 용어 키워드 검색어 네이버 검색창 단어 시장 키워드 색시 쇼핑 영역 브랜드 소비자 검색 키워드 위주 소비자 만족 상품 최저가,http://cafe.naver.com/greatchallengers/6699
경영학 목표 경영학 관련 롱테일 법칙 용어 법칙 제목 패스트 순화,http://cafe.naver.com/cphs/33884
평소 관련 가지 기준 이야기 취향 다이아몬드 아무것 이해 친절 정리 용어,http://cafe.naver.com/06rkddkwl/2122702
모델 워킹 필요 용어 정리 센타 라인 웨이 무대 중앙 라인 센타 프론트 스테이지 중앙 패션쇼 마지막 부분 암전 조명 무대 상태 위크 디자이너,http://cafe.naver.com/popopo0099/32318
레스토랑 이름 용어 프랑스어 회전 교차로 의미 이름 파리 카페 음악 음량 연주 패션쇼 일렉트로닉 음악 재즈,http://cafe.naver.com/vietnamsee/60876
마라톤 완주 생각 마음가짐 기초 용어 키워드 검색어 시장 키워드 색시 가지 구성 컬러 등록 추천 에누리,http://cafe.naver.com/greatchallengers/6682
퍼블리시티 용어 생각 디드로 효과 이용 마케팅 사례 패밀리 커플 토탈 제품 관련 예술 상품,http://cafe.naver.com/cphs/33840
기초 용어 정리 키워드 검색어 시장 키워드 색시 쇼핑 영역 카테고리 키워드 색시 싸이트 이용 스마트 스토어 주문 택배 송장 문제 주류 알콜,http://cafe.naver.com/greatchallengers/6673
평소 모양 체형 체크 종로 웨딩 관련 지식 이해 정보 용어 설명 우신 등의,http://cafe.naver.com/ungsangjang/707288
카운슬링 진행 보석 용어 전문 감정사 설명 덕분 이해 결혼 예물 세트 주문 제작 자투리 디자인 액세서리,http://cafe.naver.com/ungsangjang/707261
이유 플랫 시장 용어 자체 의미 시장 종류 재화 식품 산업 마켓 컬리 화장품 산업 올리브 산업 지그재그 하루,http://cafe.naver.com/ydt2005/4750
물주 얼리 얼리 심플 데일리 제품 보석 전반 취급 부산 커플링 방문 거기 예물 처음 보석 용어 정보,http://cafe.naver.com/ungsangjang/707225
핸드 메이드 제작 디자인 그동안 평소 스타일 얼리 다이아몬드 정보 용어 다이아 반지 매장 디자이너,http://cafe.naver.com/ungsangjang/707198
용어 월드 피드 여기저기 난무 문구 텐데요 현질 패키지 텐데요 재화 티켓 향수 게임 필요,http://cafe.naver.com/grayouy89/28
웨딩 밴드 다이아 반지 해당 보석 정보 용어 마구잡이 가격 스타일 평소,http://cafe.naver.com/ungsangjang/707129
전문 용어 규모 경제 기업 산업단지 중간재 노동력 뉴욕 런던 금융 회사 로스엔젤레스 영화사 밀라노 파리 업체 산호세 기업,http://cafe.naver.com/investmentletter/2409
용어 외모 스타일 극도 정돈 감각 헤어 스타일,http://cafe.naver.com/maxwellstudy/710
허용 용어 메일,http://cafe.naver.com/anb2014/61354
계발 미용 중심 변화 포착 용어 윤선영 액티브 시니어 보급 대중 매체 정보 습득 거부 어의,http://cafe.naver.com/hdesignstudy2024/128
오페라 용어 멜로드라마 나라 텔리 비전 연속극 정물 하루 스토리 구식 베르디 음악 당시,http://cafe.naver.com/seoyawindorchestra/8729
광고 용어 대언 광고 모델 대사 앰버 지우 프렌즈 대언 광고 모델 브랜드 제품 광고 브랜드 대언 패션모델 광고 모델 대언 수석 모델 이보 배우,http://cafe.naver.com/961029/1586
기분 일쑤 이해 정보 용어 친절 부산 금반지 부산 금반지 스타일 니즈,http://cafe.naver.com/ungsangjang/706938
패션쇼 링컨 능력 감동 쿠키 몬스터 아저씨 차별 아빠,http://cafe.naver.com/starbutterflycafe/5641
보석 인식 캐럿 관련 용어 평가 가치 평가 매장 종류 얼리 다이아몬드 진주 유색 보석 다이아몬드 등의,http://cafe.naver.com/06rkddkwl/2121923
북미 서구 용어 패스트 백화점 비용 유통 업체 거부 중간 유통 최대한 재고 부담 원가,http://cafe.naver.com/jawoka0709/12042
알래스카 크루즈 지리 공부 필요 생각 과거 지도 기본 세월 네비 게이 물건 지도,http://cafe.naver.com/b2k/1838
유행 철학 리사이클링 경험 창업 분야 경제 용어 정부 지원 소개 실질 창업,http://cafe.naver.com/culturebloom/2284777
영어 한자어 생각 뷰티 개월 샘플 메이 단어 한자어 실무자 기억 가능 일상 용어,http://cafe.naver.com/academia8851/203
댓글 크리스탐린 기타리스트 캡처 사진 내용 브레이크 프라 용어 등장 해외 워십 사운드,http://cafe.naver.com/customkoa/31592
디자인 용어 지시 표현 성취 라틴어 시그나 디자인 즉흥 과장 결합 변형 특성 실연,http://cafe.naver.com/nsgirl/314
중간고사 등급 정도 기부 산업 공학 여학생 학년 물리 공학 원서 엄마 물리,http://cafe.naver.com/suhui/28144933
이유 플랫 시장 용어 자체 의미 시장 종류 재화 식품 산업 마켓 컬리 화장품 산업 올리브 산업 지그재그 하루,http://cafe.naver.com/ydt2005/4735
일본 유래 용어 국내 그라비아 모델 활동 모델링 성격 모델 의류 디자인 스타일,http://cafe.naver.com/parkstar/36714
중요 트렌드 자리 세대 밀레 니얼 세대 세대 용어 초반 초반 세대 세대 기술 사회 변화,http://cafe.naver.com/jaegebal/5140486
용어 센서스 던스 아모레 퍼시픽 분기 실적 센서스 상회 실적 신세계 인터 업계 불황 자체 브랜드 투자 맞수 아모레 퍼시픽 베트남 품질 기준 위반 세안 적발,http://cafe.naver.com/btdckr/1780
튜버 경험 노하우 공유 용어 개념 이해 유튜브 활용 장소 구애 스타일링,http://cafe.naver.com/tarajiyeonstar/52696
일반 모히칸 헤어 스타일 의상 펑크 인상 펑크 문학 문학 장르 펑크 용어 최초 사이버펑크 사이버펑크 장르 이야기,http://cafe.naver.com/qooigloo/25411
처방 용어 디테일 안경 조제 가공 피팅 안경 안경업 전문 기술 필요 아이템 일종 서비스업 비즈니스,http://cafe.naver.com/bookishman/620207
지식 중요 게임 관련 내용 용어 정리 한정 튀르,http://cafe.naver.com/grayouy89/24
구매 촉진 판로 지원 용어 설명 물류 현대 관련 설명 사업 전환 관련 문제 주식 교환 가능 생산 유통 판매 일관 관련 양방향 의사소통 참여 리더십 회계학 외부 이용자 대상,http://cafe.naver.com/kinnofedu/55538
액션 일루젼 아누 탈리 지휘 노르딕 심포니 오케스트라 아누 탈리 음악 세계 공용어 성별 나이 문화 사회 경제 지위 성별 차이 음악,http://cafe.naver.com/gray7ib3k/693
디자이너 체형 모양 스타일 고려 컨셉 용어 정보 선택 구미 커플링 친절 설명,http://cafe.naver.com/ungsangjang/705975
탐정 경험 감각 미행 정보 존재 물증 증언 범죄 조직 용어,http://cafe.naver.com/madenewworld/8748
용어 이용 놀이 일반 담뱃갑 선호 리버스 라일리 그녀 작품 패션계 차용 최신 유행 의류 패턴,http://cafe.naver.com/gray7ib3k/682
신즉물주의 양식 묘사 용어 베크만 구체 조각가 도안가 디자이너 이름 작품 예술 광고 연극 영화,http://cafe.naver.com/gray7ib3k/680
그랜 파코 그랜 파코 할아버지 옷장 스타일 의미 용어 고전 느낌 케이블 스웨터 오버 옥스퍼드 셔츠 럭비 셔츠 아이템,http://cafe.naver.com/inthepouchcommunity/8306
울프 기르 보통 보쉬 용어 인원 다양 유저 테러 고양이 보통 수준 피지컬 테스트 우승,http://cafe.naver.com/mabinogidsg/834090
용어 정리 복합 쇼핑몰 종합 쇼핑몰 일반 쇼핑몰 종류 스파 브랜드 제품 기획 생산 유통 과정 관리 업체 상표 소비자 욕구,http://cafe.naver.com/winningfund/37505
플랑드르 연상 요소 종류 그림 일반 특징 두타 로마 전경 사용 용어 독립,http://cafe.naver.com/gray7ib3k/667
이제 액티브 용어 사용 주변 의류 관리기 나이 시니어 피플 마음,http://cafe.naver.com/99881234go/8
식화 교육 아이템 의상 형태 세부 디자인 디테일 원부 자재 사이즈 스펙 내용 표기 의류 관련 실무 용어 기호 봉제 방법 현장 전문 교육,http://cafe.naver.com/fashionworking/603274
매거진 계통 온라인 홈페이지 광고 기재 시작 오프라인 스타 페이스북 광고 용어 집행 광고비 대비,http://cafe.naver.com/jawoka0709/12016
용어 비용 차이 리조트 과정 몰디브 무더위 모자 패션쇼 만큼,http://cafe.naver.com/directwedding/6488864
브랜드 분석 방향 설정 강화 접근 추가 관련 지식 정보 실무 용어 계기,http://cafe.naver.com/specup/7464335
하루 취미 재봉틀 미니 재봉틀 시작 단어 장바구니 고민,http://cafe.naver.com/blwkr/264156
업계 소비자 소비 패턴 변화 주목 소비자 의류 소비 분야 관심 확대 영향 분석 기사 경제 용어 정리 인플레이션 통화량 증가,http://cafe.naver.com/ewhakusea/2312
기념일 선물 액세서리 유색 보석 다이아몬드 이사 나이트 다이아몬드 수입 정보 용어,http://cafe.naver.com/ungsangjang/705425
버킷 플레이스 학과 플레이어 공략 클로 버추얼 게임 중독 공익 목적 다양 다양 증폭 시대 세대 시대 용어 세상,http://cafe.naver.com/culturebloom/2274566
코디네이터 피부 미용 기계 경제 테크 투자 주식 습관 형성 용어 인터넷 디지털 플랫폼 발생 현상 에너지 투자,http://cafe.naver.com/infodience/10968
아빠 법칙 아빠 언어 용어 오락 음식 아빠 주제 아빠 휴가 직장 일상 설명,http://cafe.naver.com/glbab/125464
현상 건축물 현대 첨단 도시 도시 전체 용어 나라 박물관 미술관 자료 구별 소장품 종류,http://cafe.naver.com/gray7ib3k/625
지칭 용어 세대 젠지 세대 대한민국 청년층 주축 변화 시장 막강 영향력 유행,http://cafe.naver.com/raimmd/2699
용어 정리 콘텐츠 인터넷 통신망 제공 디지털 정보 디지털 가공 콘텐츠 글로벌 확산 관광 뷰티 연관 산업 성장 정부 콘텐츠,http://cafe.naver.com/bugsu2008/1593
최대 공모전 오디션 참가자 모집 브이 멘토 취업 전문 프로그램 신입 포트폴리오 이력서 자소 경력 기술 서모 면접 완성,http://cafe.naver.com/fashionworking/603171
디자인 전공 공장 처음 공장 용어 소통 사장 환영 원단 샘플 한마 스냅 단추 패턴,http://cafe.naver.com/misinggo/1391998
의류 사업 포괄 섬유 기술 정보 분야 세분 고분자 합성 분야 고분자 주요 용어 관련 직업 주요 용어 셀룰로오스 포도당 다당류,http://cafe.naver.com/hanjy9713/35651
전문 용어 금액 걱정 맞춤 목걸이 반지 매력 도움 명품 액세서리 스타일 완성 필수품,http://cafe.naver.com/outletshop/956203
의류 업계 메종 불어 일반 기술 소프트웨어 업계 시디 어리 주요 기술 기업 자회사 용어,http://cafe.naver.com/editsociety/376
공학 계열 인지도 학과 명칭 공학 전공 용어 개인 세종 디자인 수원 디자인 숙명 여자 영상 디자인 여자,http://cafe.naver.com/migil2/43065
전문 용어 수학 계산 시크 출처 제공 논현 일보 특정 분야 몰두 시선 관심 문화 취향 결합,http://cafe.naver.com/parkhyeon6/11598
디자인 용어 지시 표현 성취 라틴어 시그나 디자인 피복 부속 장신구 디자인 디자인 장신구 디자인 미학 응용 분야,http://cafe.naver.com/nsgirl/221
전쟁 트렌치코트 군복 자연 전환 용어 양가죽 부츠 일반 스타일,http://cafe.naver.com/colortheory241/119
용어 얼굴 성숙 몸매 조합 선호 분위기 사회 전반 나무 위키 기억 브랜,http://cafe.naver.com/ideanew/2120
디자이너 전문가 눈길 피부색 스타일 액세서리 카운셀 이것저것 내색 전문 용어 관련 이야기 설명,http://cafe.naver.com/06rkddkwl/2119281
트렌드 뉴스 투명 감고 거리 명품 브랜드 행보 화제 뷰티 금융 금융 용어 제안 피니언 증권 금융 부동산 기업 글로벌 경제 정치 경제 사회 문화,http://cafe.naver.com/blackvmpqk/22915
리듬 해소 용어 통신문 부모 선생 잡지 금이,http://cafe.naver.com/purplekwctv/161560
디자이너 체형 모양 스타일 고려 디자인 권유 다이아몬드 정보 용어 이해 설명 도움 이유,http://cafe.naver.com/06rkddkwl/2119159
젊은이 감각 스타일 재치 입담 틱톡 회수 어메이징 니어 세대 특징 구분 용어 등장 캡처 시니어 세대,http://cafe.naver.com/hyodorani/68
사용 카니 명칭 비잔틴 일반 집시 용어 그리스어 차림새 동시대 유럽 시민 상당 맥주 석탄,http://cafe.naver.com/worlddollmuseum/30478
마감 시즌 주차 트랜드 파트 마감 박시영 주차 안내 괴짜 시크 가지 단어 용어 시크,http://cafe.naver.com/oranke/12585
축구 용어 나무 뉴스 정부 법원 의대 증원 자료 제출 내주 결정 서울시 무단결근 폭언 공무원 직권 면직 진스 일본 음악 프로듀서 히로시 후지와라 협업,http://cafe.naver.com/jerng/5
브랜드 조직 연상 크리에이티브 디렉터 프로듀서 차원 세계관 세라핌 천사 투모 우바이 투게더 럭키 신드롬 뉴에이지 종교 용어 아일릿,http://cafe.naver.com/supersuman/30078
트렌드 뉴스 투명 감고 거리 명품 브랜드 행보 화제 뷰티 금융 금융 용어 제안 피니언 증권 금융 부동산 기업 글로벌 경제 정치 경제 사회 문화,http://cafe.naver.com/blackvmpqk/22901
결혼 예물 얼리 다이아 웨딩 밴드 다양 개개인 체형 저게 보석 용어 정보 설명 설명,http://cafe.naver.com/ungsangjang/704702
해당 제목 블랙 최신 유행 트렌드 업계 용어 프린세스 전투복 정도 작업 마찬가지 줄기 소체,http://cafe.naver.com/ipmskorea/951
액세서리 심플 반지 다양 고민 디자이너 모양 체형 우신 전문 용어 전문가 설명 머리,http://cafe.naver.com/06rkddkwl/2118713
미니멀리즘 용어 최소한 의미 남성 트렌드 장식 로고 액세서리 의미 액세서리 옷차림,http://cafe.naver.com/outletshop/924563
머천다이징 산업 리스크 머천다이징 표현 이유 상품 주문 재고 분류 용어 상품 베스트 워스트 구분 재고 재고,http://cafe.naver.com/acapas/16413
과거 킴벌리 공모전 섬유 관련 학과 침투 파일 텍스타일 용어 반복 데이터 원단 한리,http://cafe.naver.com/misinggo/1389661
과거 킴벌리 공모전 섬유 관련 학과 침투 파일 텍스타일 용어 반복 데이터 원단 한리,http://cafe.naver.com/uniquemotto/511
최저 판매 바위 면세점 달러 사지 기계 노랑 경기 분석 상품 홍지 상품명 대치 용어 원효 로동 용어 교남 보상 벤트 자곡동 선물 구입 조원동 충청북도 울트라 원곡 문동,http://cafe.naver.com/bitmining/405
소질 거리 업계 생각 고등학교 학년 공통 과목 수학 수학 개념 용어 정확,http://cafe.naver.com/bluebjooo/18510
지속 가능 지속 가능 용어 의미 기본 환경 사회 부정 영향 최소 생산 제조 의류,http://cafe.naver.com/outletshop/918784
현직 인물 위주 포토 그래퍼 활동 지탱 스타 스타 공개 카메라 바디 디자인 결과물 작동 용어 공통 카메라 이론,http://cafe.naver.com/bangsadong/7726
한국인 레게 머리 용어 특정 스타일 설명 시작 지리 문화 경계 초월 음악 국제 영향 강조 레게 음악 문화 영향력 정도,http://cafe.naver.com/yugsamaeul/1059
패딩 용어 최근 패션계 인기 소재 스타일 편안 제공 디자이너 소재 의류 응용 풍경,http://cafe.naver.com/outletshop/915025
시작 예술 건축 사진 디자인 전문 출판사 세계 오스트레일리아 뉴질랜드 용어 작품 호주 랜드 교살 돌무덤,http://cafe.naver.com/booknbeanstalk/1275816
브랜드 크라운 스마일리 로고 사용 고급 이미지 초반 인터넷 사용 시작 옥스포드 영어 사전 용어 추가 애플,http://cafe.naver.com/yujinguard/394768
직장 생활 대학원 에코 디자인 공부 시작 영국 학교 유학 실전 활용 부록 창업 관련 정보 창업 도전 실제 도움 창업 용어,http://cafe.naver.com/culturebloom/2267000
랭크 다이아 알고리즘 네이버 얘기 용어 머릿속 여행 테크 뷰티 본인 전문 가지 주제 주제 계속,http://cafe.naver.com/blogstartup/60135
의상 제작 시스템 제공 클로 버추얼 소개 게임 보상 회로 자극 쾌감 선택 집중 기업 용어 선택 고객 단어 프레 미스 구축 솔루션 제공 플로우,http://cafe.naver.com/jhcomm/353156
용어 장소 상황 장소 상황 고려 오늘 착장,http://cafe.naver.com/bboomdongsan/821
용어 미국 서부 개척 시대 밴드 왜건 역마차 유래 당시 금광 발견 소식 업계 유명 인사 특정 대유행 시작 기술 분야 특정,http://cafe.naver.com/mbanote/21057
양쪽 남매 역주 이해 플레이 용어 방식 플레잉 플레이 유저 침입 도움,http://cafe.naver.com/ralo24/64708
사진 특정 인간 외모 행동 성격 취향 수집 인공지능 구현 디지털 휴먼 마티 레시 가트너 애널리스트 용어 선택 데이터 사용 사례 소비 자의,http://cafe.naver.com/nobleinvesment/423732
시기 일본 제품 매장 개인 디자이너 브랜드 얼리 대전 독특 용어 탄생 남성 여성 프로 포즈 문화 남자,http://cafe.naver.com/jawoka0709/11977
공부 인터넷 용어 스타일 공부,http://cafe.naver.com/mammie/3055596
가능 중고 거래 루츠 패밀리 구매 가능 레미 릴리프 계절감 우라 용어 안감 사양 안감 빈티지 반다,http://cafe.naver.com/fruitsfamilyco/143087
커뮤니티 토프 색상 우페,http://cafe.naver.com/casuallydressed/684549
현재 비즈니스 플랫 규정 구축 일본어 혼재 현장 용어 업계 특유 고집 소통 최소,http://cafe.naver.com/bfmcommunity/53
코어 업계 사용 용어 단어 자연 추구 스타일 코어 기자 회견 박지원 하이브 카카오톡,http://cafe.naver.com/tmwms/7709
용어 진심 일취월장 증거 출력 유튜브 구독 사례 설명 복습 유익,http://cafe.naver.com/userbeat/50845
선택 진행 유닛 차별 선택 유닛 선택 유닛 마케팅 실무 용어 지표 개념 정리 주차 진행 사항 필요 부분 해당 사항 주차 진행 확인 홍예진 시즌 주차,http://cafe.naver.com/oranke/12054
개저 소셜 미디어 용어 당시 각계 포진 여성 직장 사이 웃음 유발 아재 개그 아재 매너 아재 파탈 그것 시대,http://cafe.naver.com/tmwms/7629
용어 사진 패션계 뮤즈 의미 사진가 협력 의류 카메라 렌즈 연구 접근 방식 사진 혁명,http://cafe.naver.com/outletshop/885576
예물 커플링 액세서리 사기 보석 다이아 감정 차이 정보 용어 일반인 눈높이,http://cafe.naver.com/ungsangjang/703609
대구 청라 언덕 설치 비석 청라 언덕 용어 유래 설명 가곡 동무 생각 가사 코스 경상 감영 달성 한방 삼덕 봉산 문화 남산 향수 이름 교총,http://cafe.naver.com/grayfa5s5/2210
필수 용어 이해 파워 다운 단열 성능 웨이트 스타일리시 착용 패딩 단순 추위 날씨 의류 스타일리시,http://cafe.naver.com/outletshop/881885
디자인 분야 현장 용어 계속 숙지 현장 용어 일본어 한국어 어딘가 표준 용어 구두 현장 사용 언어,http://cafe.naver.com/refiner/41
이외 소셜 미디어 소셜 소프트웨어 마이크 블로그 다양 용어 혼용 마케팅 나이키 아디 다스 디즈니 에스티 컨버스 다양 브랜드 전략 수립 관여 런던,http://cafe.naver.com/booknews/621331
사용 전문 용어 짜증 필요 사용 자산 제타 체인 소셜 디파이 산업 옴니 체인 전체 생태,http://cafe.naver.com/1djr58/629586
부산 커플링 체험 방문 입구 구경 얼리 기념일 선물 정보 용어 스펙 말씀 실물 착용,http://cafe.naver.com/ungsangjang/703457
우울 지뢰 먼데,http://cafe.naver.com/lolkor/30721640
업무 전반 흐름 공부 면접 강의 전문 용어 스메 리빙 공간 다양 분야 관심 종목 관심 생각,http://cafe.naver.com/hikicks/2072172
방문 결혼 예물 진주 얼리 유색 보석 다이아몬드 여자 다이아몬드 관심 평소 정보 용어,http://cafe.naver.com/06rkddkwl/2117297
업체 표현 용어 확인 일반 브랜드 운영 셀러 반품 관련 부분,http://cafe.naver.com/soho/3619902
끌기 영화 트렌드 콘텐츠 발행 증권사 리서치 보고서 활용 리서치 투자 종사 전업 투자자 독자 용어 표현 이해,http://cafe.naver.com/mktacademy/11841
스포츠 용품 상생 기획 최대 할인 쿠폰 타임 특가 특별 기획 진행 구분 참여 업체 사용 문화재 재화 가치 사물 관점 용어 문화유산,http://cafe.naver.com/osan2023/11038
여름철 아이템 티셔츠 상품 시선 티셔츠 참고 셀프 피드백 선택 관점 전문 용어 지식 전달 지인 이야기,http://cafe.naver.com/diggingcontents/161
반지 얼리 제품 판매 부산 반지 공방 정보 용어 설명 커스텀,http://cafe.naver.com/ungsangjang/703297
얼리 부산 커플링 결정 디자이너 정보 용어 디자이너 조율 디자인 결정 평소 스타일,http://cafe.naver.com/ungsangjang/703289
세대 문화계 주도 문화 추구 한국 용어 세대 이전 기성 세대 대비 한국 사회 중년,http://cafe.naver.com/imamstory/96524
전공 업무 특성 관련 용어 예정 기본 지식 정도 근무 메일링 작성 미팅 통역,http://cafe.naver.com/fashionworking/602614
관심 취업 루트 학원 블로그 브이 멘토 실무 용어 관련 실제 경험 말씀 이해 면접 수업,http://cafe.naver.com/vmdvmentor/1989
용어 내용 설명 친절 액세서리 부산 커플링 기념일 프러포즈 중요,http://cafe.naver.com/06rkddkwl/2117031
매력 세계 계속 추세 남성 빈티지 스타일 남성 방법 빈티지 복고풍 사이 차이점 빈티지 복고풍 용어,http://cafe.naver.com/outletshop/861360
원단 용어 트렌드 근무 조건 임금 조건 퇴직금 회사 내규 면접 협의 근무 근무 형태 월금 보험 전형 방법 접수 마감 예정일 채용 마감 전형 방법,http://cafe.naver.com/rasarajob/1022
용어 프레스 파우더 고체 녹음 원단 접착 유행 전사 방식,http://cafe.naver.com/misinggo/1384533
용어 프레스 파우더 고체 녹음 원단 접착 유행 전사 방식,http://cafe.naver.com/uniquemotto/503
