nouns,link
데드 바운스 주식 용어 주가 반등 상황 거래량 거래량 가격 상관 관계 데드 바운스 수도 하락 번의,http://cafe.naver.com/wecando7/10890775
소재 제품 의미 용어 일상 제품 사용 퍼니 제품 아이템 화장품 제품군 제품 활용,http://cafe.naver.com/worldhacks/3856
마찬가지 단어 디토 소비 단어 파생 용어 등장 아이템 소품 구매 예능 프로그램 소개 음식 소비 인기 영화,http://cafe.naver.com/encreclub/11334
쇼핑몰 매치 브랜드 토템 품명 클러치 가격 배송 원산지 관부 링크 첨부 주문 내역 사이즈 정보 사진 전체 이미지 제품,http://cafe.naver.com/smartbargain/1708579
관련 용어 효과 마케팅 프로세스 핵심 가지 요소 핵심 산업 영향 플랫 신사 신발 사진,http://cafe.naver.com/djtextile/93237
존중 소셜 클럽 주제 중고품 구매 환경친화 일정 오전 마케팅 용어 생각 중고 개인 거래 핸즈 중개업자 편집,http://cafe.naver.com/oncuration/2080
명품 본질 고급 패브릭 장인 정신 명품 용어 최고 품질 특별 지위 상징 세계 명품 장인 정신 고급 재료 결합 의미 고급 패브릭,http://cafe.naver.com/outletshop/848959
게임 용어 파밍 합성어 재미 경험 적극 사회 현대 서울 온라인 기반 영패 브랜드 오프라인 팝업 스토어 운영 최단 기간,http://cafe.naver.com/mgtconsulting/11723
전문 용어 사용 공식 어투 유지 스타일 서식 신청서 서식 문장 구축 폰트 프로 완성 지원 서류 최적 애플리케이션 승률,http://cafe.naver.com/cheapshopping/77
여행 기고 기행 기도 자랑 자연 기술 일품 용어 계속 사용 녀석 이혼 의미 인생,http://cafe.naver.com/move79/5161824
잡화 시계 매입 류구 가방 잡화 창고 정리 재고 덤핑 화장품 교환 처분 회원권 법률 용어 조각 조각기 연극 조각 조각 조각 매입 콘테 이너 제품 사제품 이삿짐 물류 창고 이사,http://cafe.naver.com/greenloqo4/9
후식 원스 도너츠 개굴 루츠 이드 날씨 감사 부분 카메라 전문 용어 용어 자체 이해,http://cafe.naver.com/minimalworkspeople/19803
동행 연합 커뮤니티 필요 흐름 기후 변화 전문가 용어 사용 웨이스트 패션쇼 참관 동행 가치 성장 협의 동행 문명 지구인,http://cafe.naver.com/esgwith/30142
최근 패션계 용어 화제 독특 트렌드 전설 이탈리아 브랜드 전통 스페인 발레리나 신발 에스파 드릴 만남 탄생,http://cafe.naver.com/outletshop/840022
코코 데이지 코코넛 파트 사블레 시연 실습 코코넛 다쿠아즈 시연 실습 프룻 크레 시연 도구 이킹 용어 난이 도의,http://cafe.naver.com/delonghi/1117824
침체 의미 스태그 네이션 물가 상승 의미 인플레이션 합성 용어 강력 규제 플랫폼 쇼핑몰 추가 내고,http://cafe.naver.com/kysstock/6317
음악 사용 자포니즘 특징 서양 오랫동안 인기 중국 인도 역자 중국 서양 대비 일본 독자 문물 문화 용어 탄생 스토리 세기,http://cafe.naver.com/thepoeticsofspace/3302
클레어 여성 니트 용어 해독 안녕 친애 스타일 클레어 여성 니트 사용 신조어 이해 도움 최신 트렌드 이해 필수,http://cafe.naver.com/outletshop/836448
부산 지식 산업 센터 아이템 다양 판매 신발 가방 액세서리 쇼핑 상품 인기 브랜드 제품 합리 가격 상품,http://cafe.naver.com/ubnun/2588
첨부 스토리보드 파일 다운로드 첨부 스토리보드 파일 다운로드 워드 파일 싱크 오류 최대한 파일 감사 공동작 업자 김효미 고은,http://cafe.naver.com/ewhatogether/33000
전공 포트폴리오 제출 공간 디자인 내용 추가 이력 서도 열정 확인 질문 포트폴리오 자료 관련 전문 용어,http://cafe.naver.com/raimcolorlist/52307
유튜브 용어 설명 유튜브 유튜브 일상 일기 맛집 리뷰 여행 이야기 스타일링 다양 주제 동영상,http://cafe.naver.com/tarajiyeonstar/51282
제외 표현 용어 카페 검색창 활용 검색 습득 카페 주력 패턴 알까기 패턴 양음 패턴 코웰 주봉 일봉 카페 주력 패턴 매칭 일봉 오실 양봉 시작,http://cafe.naver.com/antjwooo/27273
용어 시대 의미 세기 세기 파리 도시 시기 경제 문화 번영 시기 예술 보석 영향 다미아니 포크,http://cafe.naver.com/01095717774/6435
용어 카페 식당 주목 고요 화장품 소품 브랜드 자리 이후 유동 인구 트래픽 매출 성장,http://cafe.naver.com/gidegachi/6730
평소 스타일 고려 카운셀 집중 장점 보석 전문가 종로 예물 반지 선택 다이아 관심 정보 용어 설명,http://cafe.naver.com/06rkddkwl/2115905
