nouns,link
접근 워크 상황 스타일 스타 브랜드 미니 스트릿 밀리터리 크룩 크룩,https://blog.naver.com/hyojun6/223081905792
이미지 컨설팅 스타일 코치 소개팅 스냅 동행 쇼핑 스타일링 컨설턴트 현존 컨설팅 완전 시도 디테일 포기 추천,https://blog.naver.com/joyyel/223433313784
스타일 하지원 스타일 사시 하지원 직장 하지원 하지원 헤어 하지원 헤어 스타일 푸들 분양 초코 푸들 갈색 푸들 엄마 심양 일상 블리 심양 닷컴,https://blog.naver.com/suzy_by_coco/220415064794
겨울 스타일 완성 코오롱 스포츠 부츠 점퍼 패딩 스커트 레그 워머 눈꽃 니트 모자 매치 개성 겨울 완성,https://blog.naver.com/prettyye02/80151159982
심리 담사 사전 표현 나만 스타일 일상 리추 표현 나만 스타일 아침,https://blog.naver.com/tkfrn3345/222247875946
여자 아이돌 이스 미나 톰브라운 가디건 스타일 안녕 최근 이스 스타일 안녕 인테리어 건축 다양 정보 제공 아키,https://archiman777.tistory.com/797
연애 명월 연애 박사 스타일 스파이 명월 한예슬 야상 한예슬 원피스 여자 쇼핑몰 평소 브랜드 행사 광고 컬렉션 현장 모습 센스,https://blog.naver.com/nugava/110114729303
메이크업 베이직 피부 상태 이목구비 만족 여자 메이크업 경험 실수 무리 도전 마음,https://blog.naver.com/dudtla0909/120125661760
장막 시티 스타일 마사지 공중 날기 장막 시티 체육관 포켓몬 소드 처음 플레이 시단 스타일 스타일 손가락 가게 헤어 스타일,https://blog.naver.com/tlswldms0319/222579768625
고아라 스타일 법원 열정 판사 아네스베 프로 리뷰 스타 셀프 코디 계속,https://blog.naver.com/dyaus00/221287199688
스타일 편안 뭔가 스타일 피부 관리 몸매 데뷔,https://blog.naver.com/kdyohj1027/221194223325
스타일 미팅 코디 과정 미팅 코디 스타일 이야기 전달 파티,https://blog.naver.com/onlparty/220661585500
이미지 컨설팅 스타일 코치 소개팅 스냅 동행 쇼핑 재회 스타일링 컨설턴트 현존 완전 시도 디테일 포기 추천 하루,https://blog.naver.com/joyyel/223461656409
선글라스 스타일 수수 프리 모습 사랑 블랙 블랙 추천 겨울철 머플러 코디 스타일 포인트,https://blog.naver.com/naegastar/100160899224
바람둥이 스타일 스타일 순정파 발렌시아 모터 자켓 개인 일상 치마 자켓 트렌드,https://blog.naver.com/blaire9/186318245
감각 체형 몸매 소화 특유 감각 스타일 모델 출신 배우 카리스마 공효진 스타 일의,https://blog.naver.com/die1sd/40154276212
오늘 봄맞이 벚꽃 놀이 스타일 코디 포스팅 벚꽃 구경 연출 스타일링 단계 원피스 도전,https://blog.naver.com/mypej1676/110166141570
스타일 안녕 인테리어 건축 다양 정보 제공 아키 아이브 장원영 스타일 핑크 컬러,https://archiman777.tistory.com/796
스타일 소개 전통 스타일 처음 꽃미 원피스,https://blog.naver.com/gocashbackkorea/221023744264
프레피 스타일 완성 가지 노하우 남성 프레피 스타일 스타일 블레이저 네이비 카멜 컬러 구성 아이템 선택 네이비,https://blog.naver.com/wogml0615/140123873937
일러스트 스타일 드로잉 스케치 스케치 디자인 컨셉 스타일 모델 얼굴 표정 포인트,https://blog.naver.com/atonaton/222464106183
공효진 대적 매력 스타일 비밀 그녀 스타일 파스타 실마리 편집 사춘기,https://blog.naver.com/hosiwatamtam/80103240339
트렌디 스타일 무드 오버 스타일 컨설팅 스타일 컨설팅 동행 쇼핑 진행 사진 트렌디 아이템 현실 입기 적용,https://blog.naver.com/joyyel/222877285482
아이브 장원영 스타일 핑크 컬러 재킷 스커트 핸드백 안녕 맛집 데이트 코스 건축 인테리어 디자인 소개 아키,https://archiman777.tistory.com/794
스타일 컨설팅 장기 연애 이별 극복 재회 현실 방법 스타일 컨설팅 장기 연애 이별 극복 센스 아이템 추천,https://blog.naver.com/joyyel/223475146018
무드 오버 스타일 컨설팅 평소 스타일 관심 와이드 숄더 트렌디 아이템 구매 보통 유튜브 추천 아이템 구매 인터넷 쇼핑몰 모델,https://blog.naver.com/joyyel/222885722475
보통 두피 문신 디자이너 스타일링 개성 남자 느낌 스타일 고객 본인 반삭 헤어 스타일 개성 스타일링 생각,https://blog.naver.com/joyyel/223060265096
체형 스타일 분야 이론 노하우 정확 일차 컬러 필수 뷰티 컬러 필수 이미지 분석 선택 일차 스타일 선택,https://blog.naver.com/yo_og5752/223499149049
강남 바이허 퍼스널 이미지 퍼스널 컬러 진단 체형 스타일 래스 진행 인생 나만 색깔 스타일,https://blog.naver.com/lucaslee93/223114144530
개인 스타일 감성 효과 표현 청바지 단추 리벳 주목 이유 단순 기능 개성 스타일 완성 여성 골퍼 골프채 가이드,https://blog.naver.com/hbijgevwat/223514182714
강의 시대 그곳 전자책 강의 평소 라이프 스타일 분야 지식 등급 분야,https://blog.naver.com/honeysisters/222666028777
구글 스타일 시작 머리 순간 엑스트라 자태 완성 뒷모습,https://orangefizz.tistory.com/75
건강 안티에이징 트렌드 현대인 관심사 반영 주제 구성 화장품 트렌드 다이어트 방법 성형외과 피부과 의사 인터뷰 얼리 스타일,https://blog.naver.com/ksbookup/223476638621
평소 스타일 코디 색감 색깔 주문 아이템 가방 스타일 미니 가방 용도,https://blog.naver.com/eternal2001/223309555021
등산 브랜드 스포츠 매장 본인 스타일 사면 제품 구입 필요 패션쇼 마음 등산 연령 스타일,https://blog.naver.com/hotae1/223241534123
사장 날씨 상품 세기 즈음 스타일 세기말 세대 스타일,https://blog.naver.com/bims10/223397055580
캠핑 캠린 수분 고민 할인 수원 캠핑 박람회 고프코 스타일 패럴 스타일링 캠핑 즐거움 필수,https://blog.naver.com/wprzl43/223525316276
골프 분위기 스타일 브랜드 도움 스타일 여름 도전 스타일 그린 필드 레드 컬러,https://blog.naver.com/hanbitnuri/223082819901
스타일 운동화 캐주얼 예상 엄마 손연재 백일잔치 선물 그레이 그녀 현대 편안 스타일 선호,https://nunno.net/3369
캠핑 캠핑 스타일 예산 고려 장비 선택 장비 텐트 침낭 매트 가스버너 옵션 장비 캠핑 테이블 의자 조명 사진 장비 모던 텐트 스타일 의자,https://blog.naver.com/hi_t81ui/223269094489
디자인 방법 시작 디자인 보통 디자인 스타일 조사 그것 스타일,https://blog.naver.com/buildstory/222952565531
미시 시선 탈출 스타일 의미 스타일 미니 디자인 아이템 활용 세계 탐험,https://blog.naver.com/compatib6983/223395238827
음성 수초 구피 새우 은신처 놀이터 장식품 모스 림프 파크 반원형 스타일 유니클로 스타일 검색 스타 어른 놀이터 진로골드,https://www.realfolkblues.co.kr/1515
공부 단계 투자 처음 입문 투자자 대한민국 스타일 부분 상관,https://blog.naver.com/102030zxc/223072117465
신발 가능 스타일 취향 편안 예산 고려 최적 선택 신발 스타일 완성 신발,https://blog.naver.com/7iu062e4/223325953795
네이버 엑스 퍼트 등록 오랫만 지식인 스타일 질문 여성 과정 필요,https://blog.naver.com/ansyd/222918384291
기본 지식 이해 취향 스타일 기본 원칙 조언 응용 스타일,https://blog.naver.com/steadiness_/223140186466
육아 김나영 미션 안심 유아 스타일 소신 라이프 스타일 여성 워너비 아이콘 김나영 그녀 최근 아들 아기 먹거리 관심,https://blog.naver.com/angemoms/220853386590
모델 스타일 헤어 스타일 이리 재미 볼레 레이어드 느낌 볼레 아이템 독일,https://blog.naver.com/rokaf95/220271178766
마지막 고민 리추 심리 담사 사전 표현 나만 스타일 출근 보요 아침 일기,https://blog.naver.com/tkfrn3345/222207248626
고객 니즈 취향 스타일 헤어 스타일 연출 역할 학원 진행 무리 걱정,https://blog.naver.com/kyosil/223185194051
뷰티 전문 블로그 작성 수요일 스타일 매주 금요일 뷰티 메이크업 세부 목표 목표 부담 현실 가능 목표,https://blog.naver.com/joy0876/223144188278
편안 신상품 클레버 등산 지인 주말 원적산 등산 계획 등산 스타일 화이트 블랙,https://blog.naver.com/rokag4/223386569895
안녕 스타일 빈티지 공간 빈티지 스타일 친환경 활용 환경 보존 영향 사업 최근,https://blog.naver.com/vinstory_thejm/223513328046
스타일리시 인형 마네킹 몸매 구체관절 인형 치수 맞춤 제작 패턴 디테일 전포동 공방 핸디 토끼 강좌 완성,https://www.ganic.kr/5775
예산 얼리 스타일 컨설팅 보석 감정사 자격증 착장 가드 레이어 스타일,https://blog.naver.com/lgu2705/223305758684
연남동 스타일 자유 개성 스타일 처음 타투 학원 관심 리큐,https://blog.naver.com/yeon4ma/223080694965
그녀 소셜 미디어 뷰티 라이프 스타일 다양 주제 콘텐츠 공유 보유 그녀 스타 그램 계정 유튜브 채널 스타일,https://blog.naver.com/nexign/223445358862
편안 스타일리시 과시 바바리코트 스카프 매치 표정 드리 스타일 연애 칼럼니스트 자태 정유진 처음 대본 운명,https://blog.naver.com/jjubika1/223522402706
블로거 포스팅 기분 개인 청바지 생각 기본 기본 보그 구경 여름,https://blog.naver.com/dellydelly1019/221043867081
입문 디자이너 맥퀸 탐구 사랑 관심 업계 족보 사실,https://blog.naver.com/sunshower22/120092352522
아들 취향 중년 젊음 아이콘 아재 스타일 아저씨 운전수 아들,https://blog.naver.com/jislee1290/222946641497
서울 운전 연수 운전 연수 서울 기술 분야 사랑 건강 기름 회장 휴대 결함 스키 싱글 절대 스타 일의,https://blog.naver.com/clykubt9274/221531899721
페토 면세점 구매 시계 스타일 얼리 브랜드 의류 액세서리 다양 제공 브랜드 스타일,https://nunno.net/519
기본 지식 주름 모양 주름 원리 여성복 스타일 예시 이미지 마지막 파트 강사 그림 소개 스타일,https://blog.naver.com/missarteum/223499998386
워너비 스타 전지현 서현 이하나 박신혜 스타일링 시부모 사랑 새댁 그녀 추천 새댁 베스트 아이템 세련미 코트,https://blog.naver.com/fashionncom/220919021788
이미지 스타일 컨설팅 안녕 외모 관리 외모 관리 외모 얼굴 분석 헤어 컨설팅 자료 체형 분석 현재 스타일 분석 자료 분석 자료,https://blog.naver.com/joyyel/223516316296
소개팅 상견례 중요 자리 호감 이미지 스타일 헤어 스타일 말투 비교 경험 시술자 부작용,https://blog.naver.com/flexible12343/223410155163
스타일 일상복 스타일 대체 완전 이연희 골프 스윙 용띠 이연희 캐주얼 스타일 선호,https://blog.naver.com/syous0/223297897605
사이즈 코디 참고 발란스 여름철 편안 스타일리시 완성 네이버 제스 스타일 검색 스타일 정보,https://blog.naver.com/julie16kr/223492620995
스타일링 제안 시작 인테리어 완전 인테리어 법칙 옷장 본인 스타일 체크 방법 요즘 리빙,https://blog.naver.com/minaryhome/222645230405
가지 스타일 스타일 그날 기분 변화 현재 헤어 스타일 민감 시스템 마련,https://blog.naver.com/graycitycompany/222986133660
요새 유행 여행 남녀 올레 스타일 정도 애인 점심 자갈치 시장 보리밥,https://blog.naver.com/cow501/120195556133
공항버스 히로시 마역 시내 중심가 히로시 마역 원폭 인근 핫초보리 스타일 유행 사이다 호텔,https://blog.naver.com/mumin113/223416033692
태권 진실 수련기 태권도 성인 여성 세대 스타일 장소 트랜 일상 스타 소개 브랜드,https://blog.naver.com/mooyepaper/223187380077
필자 부담 제품 메트로 자전거 컬러 자전거 시대 스타일 자전거 구매 단계 스타일,https://blog.naver.com/desany/100140189583
스타일 완성 필수 아이템 보드 코디 보드 스타일링 보드 다양 활용 보드 보드 선택 고려 가지 사항 보드 선택 보드 사이즈 고르기 보드 소재,https://blog.naver.com/6cckqq096rbr/223522293077
카프 슬리브 스타일 완성 카프 슬리브 카프 슬리브 정의 카프 슬리브 스타일링 카프 슬리브 활용 카프 슬리브 완성 스타일 카프 슬리브,https://blog.naver.com/08ymvn3fxop/223496946132
주차장 운전자 주차 편리 주소 경기도 오산시 외삼미 영업시간 미국 일본 복고풍 스타일 일본 해석 독특 스타일 미국,https://blog.naver.com/vinstory_thejm/223470371882
단백질 요리사 윤균상 치즈 제조 치즈 칭찬 응원 바다 목장 요리사 요리 도전 모자 사랑 계속,https://blog.naver.com/vaileent/221100338953
사실 생각 경향 부분 평소 생각 습관 본인 스타일 변화 전의,https://blog.naver.com/syous0/222879147890
가이드 튜토리얼 제목 주식 투자 가이드 시작 내용 생각 댓글 트렌드 스타일 가이드 블로그 스타일,https://blog.naver.com/shanghaibabe/223473976948
가지 패턴 완성 선호 청키 볼레 요즘 유행 스타일 센스 스타일 완성 언급 가지,https://blog.naver.com/youmi0972/223049318953
연애 여의주 서준영 지적 장애 엄마 마성 그룹 여왕벌 스타일 외모 부티 스타일 눈웃음 거짓말,https://blog.naver.com/starsunmi0/223449818385
여름 아이템 추천 기간 스타일 착용 의상 소품 트렌디 스타일 분석 추천 추천 스타일 의류 티셔츠 티셔츠 여름 스타일 여름,https://blog.naver.com/adtlihogj12/223067416901
소품 퀼트 제작 퀼트 재료 퀼트 기초 퀼트 활용 스타일 완성 퀼트 아이디어 퀼트 의류 활용 퀼트 액세서리 퀼트,https://blog.naver.com/8x76f4hqfe/223486330382
올드 스타일 플레인 베이글 소프트 스타일 참깨 베이글 가지 스타일 레시피 작업 스콘 스켓,https://blog.naver.com/illy0419/222888570400
코리아 마케팅 담당자 한국 엔터 문화 다양 분야 세계 선도 국가 김유정 배우 데이지 파트너십 한국 스타일 세계 공유,https://blog.naver.com/allrafintech/223490855264
이날 아빠 해밍턴 병원 방문 아빠 외출 니트 커플 색감 니트 소재 아이템,https://blog.naver.com/vaileent/220893059561
스타일링 레드 컬러 체크 셔츠 빈티지 느낌 그레이 컬러 가디건 매치 연애 신원 미상 짝사랑 무한도전 멤버 양팔,https://blog.naver.com/ckaakt1/40133812982
가방 코바늘 가방 코바늘 가방 동영상 코바늘 가방 재료 코바늘 가방 수준 코바늘 가방 스타일 완성 코바늘 가방 코디 코바늘 가방 스타일링 코바늘,https://blog.naver.com/wh0pn52f1/223486444624
헤어 스타일 스타일 목소리 자세 행동 분위기 미소 시선 처리 여유 몸짓 외모 간호사 학생 간호사 전화 대편,https://blog.naver.com/hunmin40/222228115296
가이드 튜토리얼 제목 주식 투자 가이드 시작 내용 주식 투자 생각 댓글 트렌드 스타일 가이드 블로그 스타일,https://blog.naver.com/shanghaibabe/223473834869
스타 그램 흉내 블랙 코디 난도 유행 차원 블랙 스타일 스타일 능형 계절,https://blog.naver.com/syous0/222471326984
스타일 기본 티셔츠 패턴 활용 라그랑 소매 원피스 방법 사진 봉재 패턴 이해 려고 노력 봉제,https://blog.naver.com/qor1214/100124335518
중요 한방 스타일 설문 조사 참여 미혼 남녀 마찬가지 소개팅 성공률 에디터 겨울 소개팅 스타일,https://blogdegalleria.tistory.com/1256
분야 관심사 분야 이름 개봉 영화 우리스 영웅 시대 배경 스타일 스타일 바지,https://blog.naver.com/purplebrain7/222109287817
재킷 스타일 기능 현명 브롬 년차 스타일 브롬 기준 브롬 아래 컬러 선택,https://blog.naver.com/supersun_seoul/222477614434
옷차림 블로거 유물 스타일 일상 유물 유물 연구 일상 블로그 쇼핑 의상 화장품 화장 스타일 일상 일상 기록 신발 액세서리,https://blog.naver.com/lsb3002/223457737239
연애 정보 내용 연애 니즈 상태 점검 남성 추구 여성 얼굴 몸매 전체 밸런스 스타일 여성 추구,https://blog.naver.com/jokyojokyo/220368984978
골프 플레이 편안 스윙 여유 움직임 스타일 오늘 스타일 기능 남성 골프 퍼스트 브랜드 소개,https://blog.naver.com/jung71999/223384080939
음성 수초 구피 새우 은신처 놀이터 장식품 모스 리뷰 최저 구매 스타일 유니클로 스타일 검색 스타 어른 놀이터 진로골드 판타지아,https://djehuty.net/1785
스타일링 레드 컬러 체크 셔츠 빈티지 느낌 그레이 컬러 가디건 연애 신원 미상 짝사랑 무한도전 멤버 양팔,https://blog.naver.com/shane1953/129437617
철봉 자나 운동 포기 라이프 스타일 카테고리 여자 겨울 남자 코트 스타일,https://tsmmovie.tistory.com/936
반지 제왕 데일리 데일리 코디 스타일 오늘 날씨 완전 여름 오늘 점심 도시락 김치볶음밥 미역국 조합 조합 꿀맛 요리 자취 요리 요리,https://blog.naver.com/lilyyssong/221973952792
얼굴 이미지 분석 소재 패턴 스타일 추천 코스 퍼스널 컬러 메이크업 얼굴 이미지 피부 체크 평소 메이크업 스타일 분석 메이크업 컨설팅 내부 테이블,https://blog.naver.com/yoonbaby44/223292456758
상대방 옷차림 스타일 표정 음식 관찰 이야기 이어 리액션 중요 질문 답변,https://blog.naver.com/ljw505800/221561565692
아기 스타일 리더 활동 시작 스타 그램 사진 업로드 해시 태그 입력 피드 완성 플랫 프로필 완성 스타 그램,https://blog.naver.com/hanbitnuri/222264890152
헤어 스타일링 고객 얼굴 개성 스타일 고려 최적 헤어 스타일 제안 미용사 기본 급여 실력 노력 투자,https://blog.naver.com/aeraida/223395463169
잡화 밀접 관련 설명 스타일 변화 잡화 스타일 잡화 스타일 변화 인터넷 잡화 장사 부분,https://blog.naver.com/infopub/100037072726
실력 향상 레슨 정보 최신 골프 용품 정보 골프 스타일 정보 골프 용품 정보 정보 여성 골퍼 필요 제공 베테랑,https://blog.naver.com/itmobile0013/223506995394
자분 머리 보호 필수 스키 장갑 구매 디자인 남편 스타일 스타일 스키,https://blog.naver.com/sool920/223326327841
주부 남편 요리 오뚜기 카레 오프 모임 스타일,https://blog.naver.com/jedpark/223138181754
얼굴 생각 스타일 포스트 오드리 헵번 스타일,https://blog.naver.com/oneoak4/223364983295
관심 한동안 연애 커리어 집중 스타일 시계 고객 구현 가능 스타일링 제안,https://blog.naver.com/joyyel/223499160610
빈티지 쇼핑 클로 스타일 추천 빈티지 생각 접근 이용 도움 플랫,https://blog.naver.com/soboos/223341888800
스타일 고민 코디 연출 기본 노하우 별거,https://blog.naver.com/whdbswl0/10082908584
골퍼 신규 유입 골퍼 언급 변화 최근 사이 증가 아래 유형 주요 키워드 분석표 명품 스타일 여행 과시,https://blog.naver.com/hieykim/222735459380
개인 첫인상 이미지 컬러 스타일 표정 헤어 메이크업 개인 베스트 컬러 체형 상황 스타일링 이미지 지수,https://blog.naver.com/imagetech1/223262887155
기본 시태 스타일 코디 기본 해시 태그 필수 운동 수준 해시 태그 운동 급자 운동 고급 운동 챌린지 운동 운동,https://blog.naver.com/jangdaehan1/223519658706
컬러 태교 파랑 뷰티 신중 피부 투명 유지 피부 트러블 해결 방법 속옷 선택 스타일 임신,https://blog.naver.com/behappy4001/90160000424
요리 전기밥솥 김나영 가지 생각 나영 언니 스타일 라이프 스타일 코로나,https://blog.naver.com/ii791127ii/222304885687
신입 사원 스타일 불편 맞춤 셔츠 합리 가격 스타일 상담 서비스 직장 스트레스 여가 취미 생활 관련 얘기 블랙홀 백조자리 콘셉트,https://blog.naver.com/chrisshirt/220933057884
수련기 월일 국기원 유투 공개 멀티 엔터테이너 진실 국기원 원장 세대 스타일 장소 트랜 일상 스타 소개 브랜드,https://blog.naver.com/globalnews7942/223189181129
스타일 연출 수강 대상 빈티지 머플러 여름 스타일링 코디 전공,https://blog.naver.com/ck_lab/221250989251
스타일 컬러 확인 가상 쇼핑 애용 쇼핑몰 스타일 코디 스타일 스타일 변화,https://blog.naver.com/gpghk0757/223391211544
건지 가평 웨이크 서핑 가평 데이트 기획 캐미 의미 현아 스타일,https://blog.naver.com/webddle/222051859338
여성 스타일 스타일 스타일 매치 스타일리스트 서유경 스토리 헤어 페이스북,https://blog.naver.com/fcgaon/40159087692
시네마 수정 실장 경험 스타일리스트 스타일 제안 방법 요령 정실 장의,https://blog.naver.com/mhmh4657225/220381159320
눈치 블로그 디자인 스타일 외모 꾸미기 감각 수강 기본 템플 제공 현자,https://blog.naver.com/seung4186/223087223897
유행 예전 남성 스타일 다양 길거리 정장 스타일 캐주얼,https://blog.naver.com/barim12/221340447904
사이트 재패 니즈 걸이 스타일 차이 니즈 플린 나름 철학 주관 키덜트 생활,https://blog.naver.com/sasaae/222026840602
디자이너 스타일리스트 스타일 공식 거리 중고 명품 쇼핑 참고 정보 체형 입기,https://blog.naver.com/sjh5781/150138662892
이해 내셔널 지오 그래픽 버킷 라켓 스타일 자외선 보호 브랜드 이미지 자연 조합,https://blog.naver.com/bwh011/222697474553
스타일링 청결 그루 기본 세안 화장법 스타일 장기연 최고 남편감 총평 연애,https://blog.naver.com/doggish/60188602880
인기 스타일 샌들 양말 구멍 티셔츠 가르마 빈티지 스타일 인기,https://blog.naver.com/true_effect/150125964804
헤어 스타일 본인 헤어 습관 머리 헤어 디자인 시술 평소 스타일 화장법 본인,https://blog.naver.com/primaryholic/223437999271
골퍼 프로 골퍼 레벨 골프 수준 개념 골프 웨어 스타일 연출 가능 이유,https://blog.naver.com/w_angle2014/220136924927
거기 커스텀 생각 수량 확보 기존 스타일 표정 스타일 자전거 받침 보소,https://blog.naver.com/sasaae/221997326560
스탠드 휴대 골퍼 무게 장비 골프 필드 스타일 완성 중요 아이템 스타일,https://blog.naver.com/banana0422_/223519400558
변화무쌍 스타일 동물 식물 생활 소품 독창 테두리 그림 관심 다이어리,https://blog.naver.com/love51850/223020172680
스타일 모델 모델 차량 출고 예감 패션모델 사고 강남 판금,https://blog.naver.com/proxy3618/221570679589
스타일 몽환 스타일 감성 캐릭터 얼굴 아이패드 처음 포토샵 그림 정도,https://blog.naver.com/spinkkink/222446578609
센스 스타일 첫눈 보통 느낌 상관 스타 그램 단양 사진 따름 셀카 모습 모니터링,https://blog.naver.com/wildrosestom/222128990020
플레이스 피플 스타일 영상 홍대 홍대 정보 김원효 절규 홍대 스타일,https://blog.naver.com/tkadhwhr/140153567727
노동 투입 내역 누락 파악 필요 족집게 선생 스타일 고무줄 바지 고수 자식 타지 출가,https://blog.naver.com/hi_nso/220338419402
붕어빵 부자 얼굴 스타일 캐주얼 스타일 베이직 디자인 합리 가격 브랜드 가격 대비,https://blog.naver.com/frenchpopp/222431885392
촬영 가능 시현 단점 작가 스타일 기록 시현 클로 장점,https://blog.naver.com/noel_namoo/223273608893
메이크업 스타일 여성 소망 여성 메이크업 스타 일의,https://blog.naver.com/wkd03188/130158489740
패셔 스타 스타일 간지 코디 스타일리스트 부자 하루 명언 부동산 부동산 학교 부동산 명언 명언 계발 인간 관계 동기 부여 힐링 감성,https://blog.naver.com/hermes3535/223171578872
도전 힐링 타로 재료비 타로 심심 재미 헤어 메이크업 스타일 도출 패셔 니스트,https://blog.naver.com/hope_city/222477832078
위드 컴퍼니 주소 대구 수성구 동대구로 주차 매장 주차 가능 운전 이브 주차 여긴 스타일 컬러 이미지 분석 뷰티 이미지 컨설팅,https://blog.naver.com/eve_world/222927671688
스타일 소화 아들 흡족 사진 엄마 몸무게 신생아 시절 생각 유아,https://blog.naver.com/tjdkfhs/222590596823
스타일 취미 필요 영감 필요 피플 컬러 소개 색깔 런던 스타일,https://blog.naver.com/moonyelim100/220970776995
요즘 스타일 디자인 맞춤 장만 친구 크리스마스 연휴 백화점 나란 스타일 남자,https://blog.naver.com/lovely-j-/223305898056
라인 스타일 추천 구조 스타일 적합 웨이브 체형 특징 트렌드 합리 가격 제공 명품 브랜드 디자인,https://chic-beauty.tistory.com/63
스타 산행 정리 봄날 등산 스타일,https://blog.naver.com/doota_girl/110135146111
마일 코로나 장기 변화 라이프 스타일 영향 업계 변화 변화 스타일 마일 이름 관련 제품,https://blog.naver.com/kcscpr/222291237675
대만 직업 평소 스타일 자연 이야기 내게 그림 스타일,https://blog.naver.com/joyfulo_o/221475954167
노멀 스탠다드 일반 바지 종류 스타일 보더 밀레 피플 개성 스타일 감각 스키장,https://blog.naver.com/milletcafe/50185309639
