nouns,link
화이트 베이스 디자인 구두 리틀 블랙 드레스 빈티지 스타일 최고 왼쪽 가을 스타일 플랫 단화 다코타,https://blog.naver.com/jupiter1011/220456038801
스타일 안녕 인테리어 건축 다양 정보 제공 아키 최근 드라마 출연 손나은 배우 스타일,https://archiman777.tistory.com/795
블로거 오늘 내서 포스팅 머릿속 포스팅 생각 댓글 쪽지 스타일 스탈 고집 사진 사진,https://blog.naver.com/subboota/130129508181
속옷 스카프 코디 기본 이론 속옷 멋쟁이 속옷 그날 스타일 과언 속옷 시작,https://blog.naver.com/37sweety/70044935893
매치 직구 방법 직구 경험 매치 스타일 리포트 구경 디자이너 영감 인터뷰,https://blog.naver.com/elizaroom/222834506430
보헤미안 스타일 빈티지 일본어 의상 편안 자유 추구 스타일 남친 보통,https://blog.naver.com/486332/222988073926
스타일 옥수동 수제자 박수진 행사 교육 박수진 스타일 집중 파스텔 컬러,https://blog.naver.com/yukihana96/220711601558
산세 법흥 계곡 캠퍼 노을 스타일 음식 솜씨 인테리어 센스 그녀 캠핑,https://blog.naver.com/ulipin7/120196053257
월요일 클래식 명화 화요일 스타일 텃밭 스포츠 댄스 입문 우쿠 렐라 통기타 건강 웰빙 요리 대중 음악 스포츠 영화,https://blog.naver.com/runninghani_/70185840298
일본어 자막 시청 가능 드라마 드라마 일본어 한글 자막 스타일 마음 로노 메트로놈 박자 기계,https://blog.naver.com/hidduck/191851546
스타일 스타일 스타일 정원 보트 캡틴 기념비 바다 부력 보강 누들 플로트 제공,https://blog.naver.com/fura0/221869185196
사용 사용법 설계 색상 스타일 옵션 래빗 밴드 종류 기본 디자인 밴드 스타일 밴드 스포츠 전용 밴드 특별,https://nextdoorped.tistory.com/1998
센스 스타일 기준 추구 예전 빈티지 시도 스타일 마지막,https://blog.naver.com/sbi20_socialteam/223504440819
필수 아이템 스타일 회사 신입 이제 산행 사회 초년생 스타일링 제안 가을 워크 문제,https://blog.naver.com/k2blog/120170647726
최고 기량 하드코어 스쿠버 다이버 스노 유리 여성 스타일 호주 맛집 음식 유럽,https://blog.naver.com/jrkimceo/221644030219
디자이너 박시영 영화 포스터 디자이너 매력 그건 캐릭터 포스터 주목 이유 아이러니 전공 여서,https://blog.naver.com/scarlett_29/223508205708
올해 몸무게 변화 올해 올해 요리 올해 스타일 평상시 쥬얼 원피스 올해 아침,https://blog.naver.com/ksc1837/223308701829
거기 스타일 재미 드라마 이유 이청아 배우 스타일링 배우 유튜브 이현아 캐릭터 과정,https://blog.naver.com/chris8941/223242883862
상담 고수 사이즈 걱정 웰시 코기 웰시 코기 애견 용품 웰시 코기 스타일 웰시 코기 견복 웰시 코기 우비 코디,https://blog.naver.com/soha456/223123214537
예술 학부 이기열 교수 전문 내용 소개 스타일 스타일 제안 스타일 패셔 피플 조언,https://blog.naver.com/sac_art/60103776243
단순 무늬 중급 배색 무늬 저서 송영예 스타일 손뜨개 송영예 스타일 손뜨개 첫눈 카디건,https://blog.naver.com/jeumediablog/220129432959
주변 추석 추석 연휴 여행 남대문 아동복 주니어 가을 고민 아동복 스타일 선도 남대문시장,https://blog.naver.com/sabuzack_kids/223221649201
키즈 스타일 라이프 매거진 아망 향기 아망 미세먼지 패션모델 종류 한계 가지 아이템 이용 스타일링,https://blog.naver.com/rrouen/220981842606
누군가 컨텐츠 생각 인물 스타일 추상 사진 미술 작품 풍경 식물 브랜드 로고 무드 보드,https://blog.naver.com/empty0829/223102916699
일본 헤어 스타일 수십 스타일 블로거 마인드 선택 생각 일본 여행 계획 러닝,https://blog.naver.com/mickey119/223293029691
코트 거울 거울 신발 노래 헤드셋 데일리 선팔 스트릿 스타일 스트릿,https://blog.naver.com/zz3978/221238978823
후드 점퍼 스타일 이미지 출처 휘닉스 파크 홈페이지 설원 웨이 스타일 보드 마니아 스키장 패션쇼 출사표,https://blog.naver.com/parklanding/20203533898
스타일 미니 스타일 유튜브 남자 미니 마음 캡쳐 스파,https://blog.naver.com/holynight0414/223271689173
스타일 안경 감한 스타일 목소리 고객 페인트 페인팅 방법 설명 교수 윤대표 페인팅 경험,https://blog.naver.com/norooblog/221316237234
스타일 이후 문제 대화 매력 계발 라이프 스타일 구축 표준 그레이트 라이프 연애 최고 수준 정상급,https://blog.naver.com/bestpua/220682788187
아이템 임산부 플리츠 원피스 인기 아이템 여성 변화 편안 스타일 동시 제공 관심,https://djehuty.net/619
일까 스타일 눈길 코코미 코코미 기무라 타쿠야 영향 톱스타 기무라 타쿠야 가수 구도 시즈카 장녀 감각,https://blog.naver.com/kshulk/223060010907
한국 한국 스타일 일본 한국 유행 일본어 상급자 무료 레벨 테스트 일본어 공부 아래,https://blog.naver.com/mimityan1/90176121972
고수 쇼핑 선택 최선 그게 지은 효리 지은이 스타일 스타일,https://blog.naver.com/dasogo/221089286722
위생 사장 문제점 백종원 골목 시장 뚝섬 배윤경 성격 평소 스타일 백종원 골목 식당,https://blog.naver.com/davle9073/221302392076
목차 디자인 다이어리 느낌 목차 부분 스타일 용어 정리 부분 감성 일러스트 관련 스타일링,https://blog.naver.com/haha1126gk/130154947422
남성 관심 남성 전용 컬렉션 한남동 스타일 디자인 진열대 원목 블루진 색감 대비,https://blog.naver.com/iauro/223366462974
성별 연령 직업 취미 스타일 종류 다양 공부 시작 패기 옷거리 활동,https://blog.naver.com/ot_geori/220330923381
옷장 정리 기본 스타일 구매 기본 브랜드 코디 시작 신경 스타일,https://blog.naver.com/zroce83/222697082758
정보 코디 쇼핑몰 운영 이야기 다양 주제 포스팅 브랜드 스타일 공부 세계 정리 공부,https://blog.naver.com/liz_nliz/223403666868
이성 매력 어필 보편 매력 이론 실전 스타일 연애 입장 레이트 라이프,https://blog.naver.com/bestpua/220749291374
라이프 스타일 구축 표준 그레이트 라이프 연애 연애 고수 코칭 이론 실전 스타일 종합 매력 계발 매력 변화,https://blog.naver.com/bestpua/220592205060
드라마 엄마 성숙 여인 그녀 스타일 화제 시크 스타일 연출 품명 어반 시티 상품,https://blog.naver.com/stscott_bag/220192575449
오늘 용어 스타일 종류 네이버 블로그 러닝 전문가 착용 가능 곡선 구조,https://blog.naver.com/avengerscompany/223048709254
작년 운전 시작 개월 처음 내부 순환로 선호 스타일 레이디 자켓 치마 원피스 스타일 신발,https://blog.naver.com/jsyuk/222635613647
메이크업 스타일 감각 여성 소망 여성 메이크업 스타일 고수,https://blog.naver.com/mindboxpub/40178938374
인생 얼굴 인생 외모 얼굴 미인 미녀 미남 외모 지상주의 외면 스타일 부동산 부동산 학교 부동산 명언 명언 계발 인간 관계 동기 부여 힐링 감성,https://blog.naver.com/hermes3535/223160338405
환대 세상 미인 미녀 화장 스타일 코디 외모 외모 지상주의 부동산 부동산 학교 부동산 명언 명언 계발 인간 관계 동기 부여 힐링,https://blog.naver.com/hermes3535/223166426735
모습 채널 잡지 스타일 스타 그램 조합원 이야기 살림 관계,https://blog.naver.com/hansalim/221149654037
레벨 해제 스타일 다양 게임 심즈 프리플레이 묘미 디자이너 경험 레벨,https://blog.naver.com/iamjejeon/110189259418
다양 스타일 매치 스니커즈 운동 캐주얼 스트릿 다양 스타일 연출 러너 사카우 러닝 스니커즈 템포 러닝,https://socialstory.kr/5291
스타일 매칭 스타일 블로그 작성자 김홍천,https://blog.naver.com/syagerl/140173840633
리뷰 구입 신어 워커 스타일 연출 워커 방법 스타일 슈즈 데일리 워커 데일리,https://blog.naver.com/ayr0831/222640355460
강유미 개그맨 워너비 뉴요커 알짜 지식 뉴욕 쇼핑 여행 밑그림 완료 이한욱 스타일리스트 남녀노소 중요,https://blog.naver.com/dksroql53/100117977155
변화무쌍 스타일 창의 발휘 디자이너 기본 그리기 원피스 외출복 최신 유행 스타일 소녀풍 스타일 커플 복고,https://blog.naver.com/seolae929/40187435488
나름 스타일 초코 스콘 초코 스콘 초코 우산 스타일 아이템 생애 오랜만 서울 카페 투어 최고 최고,https://blog.naver.com/tbox1227/222298285461
코칭 봉제 공장 제작 상담 개인 스타일 표현 개선 사장 부분 시작 고민 안내,https://blog.naver.com/stylook/223225268019
마인드 스타일 파트 파트 완숙 숙달 연애 시절 마스터 픽업 아티스트 연애 고수로 성장 과정,https://blog.naver.com/bestpua/221307677960
승리 전투 몸매 라인 승리 코디 스타일 간지 외모 다홍치마 인생 부동산 부동산 학교 부동산 명언 명언 계발 인간 관계 동기 부여,https://blog.naver.com/hermes3535/223142477030
스타일 포지셔닝 소비자 대상 고정 제품 스타일 제품 표현 디자인 컨셉 주류 스타일 유행 시장 주도 제품 지류 스타일 유행,https://blog.naver.com/songtt2321/223140796557
레트 스타일 해외 투어 전형 린즈 바이크 경력 인생 사진,https://blog.naver.com/joyrde/221333276094
연애 매력 남자 성장 과정 연애 지침서 외모 성격 요소 스타일 실용 기술 습득,https://blog.naver.com/bestpua/220591179708
목걸이 여름 분위기 여행 분위기 스타 북유럽 소녀 소년 감성 여름 스타일,https://blog.naver.com/lotusms12/220053207179
아기 스타일 아기 스타일 실용성 실용 다양 강조 북유럽 스타일 코디 엄마,https://blog.naver.com/philipsavent/220551899956
헤어 스타일 본인 헤어 스타일 신발 벨트 고수 고수 시절 관심 노력 매력,https://blog.naver.com/young2_2_2/223208927622
평소 스타일 진주 귀걸이 목걸이 액세서리 얼리 질문 이것저것 착용 욕심,https://blog.naver.com/rjgadia/223177196289
스타 그램 스타일 계정 스타 그램 코디 데일리 일상 코디 스트릿 아웃핏 캐주얼 겨울 코디 일상 소통 스타일 남자 코디,https://707070.tistory.com/226
궁금증 해결 순간 사용 스타일 주제 전문가 용자 중요,https://blog.naver.com/ll2h_umm4/223136907060
스타일 마인드 고집 마인드 사항 세상 분야 세분 연애 세상 스타일 이미지,https://blog.naver.com/jokyojokyo/220459257742
내면 외면 신경 대로 외면 외모 얼굴 스타일 외모 지상주의 패셔 스타 코디 화장 부동산 공부 부동산 부동산 명언,https://blog.naver.com/hermes3535/223104326131
스타일리시 코디 데일리 착용 전현무 정보 바시 자켓 구경 전현무 자켓 브랜드,https://blog.naver.com/style_070/223005268445
스타일 추구 디자인 남성 스타일 고정 관념 탈피 라이프 스타일 변화 모델 크로스 섹슈얼 트렌드 부상,https://blog.naver.com/su12192000/80034327501
어른 엄마 아기 신상 평소 애기 스타일 아기,https://blog.naver.com/xhuiying_/223087176474
스트릿 스타일 코디 강도 참고 오늘 스트릿 스트릿 코디 전체 블랙 느낌,https://blog.naver.com/dlwlqk/222622376593
스타일 소장 남자 후드 티셔츠 코디 후드 데일리 코디 처음 입문 코디 그건 후드,https://blog.naver.com/hihi4003/223023890283
평생 초반 공무원 남자 일반 스타일리스트 남자 스타일 컨설팅 평생 동행 쇼핑 스타일링 클래스 이미지 분석 스타일 문제점,https://blog.naver.com/joyyel/222977118183
도쿄 스타일 포스팅 정도 업자 첫날 저녁 쇼핑몰,https://blog.naver.com/junghae3144/220713459020
스타일링 사회 초년생 그녀 센스 카피 방법 캐롤라인 무드 캐롤라인 스타일 마음,https://blog.naver.com/idohc/90158275789
기존 축구 블록 코어 관심 종류 유니폼 가지 사진 사진 실수,https://blog.naver.com/rahyunel/223135371996
그녀 스타일 헤어 스타일 액세서리 표정 보디랭귀지 화장법 헤어 스타일 행동 몸매 쇼핑 명품 스타일 액세서리 귀걸이 목걸이 반지 구두 시계 부츠 명품,https://blog.naver.com/the_capitalist/221798903318
스타일 탐색 저널리즘 스타일링 관련 프로젝트 저널리즘 필수 기술 스타일링 크리티컬 분석 저널리즘 인터뷰 사진,https://blog.naver.com/fsearang/222562260002
바람 병방 니스 여행 정선군 방산 군립 공원 자연 오감 만족 힐링 모험 동시 제공 니스 관광지 탈바꿈 최근 방산 군립 공원,https://blog.naver.com/wellnessofnature/223487279155
신발 스타일 효과 데일리 최고 인정 인정 리뷰 이유 블린 방문 감사 연애 신발,https://blog.naver.com/sonmin0912/222665243600
배려 패커 걸음 야외 숙박 스타일 진열 백패 스타일 의류,https://blog.naver.com/tina7780/221733127019
스타일 변화 시절 인기 스타일 인기 블랙 화이트,https://blog.naver.com/doonibounce/223416434556
해외여행 결혼 정보 뷰티 국내 여행 반려 동물 자동차 리뷰 스타일 스타 방송 리뷰 건강 블로그 이웃 도움 절대 필요 이웃 신청 수락 댓글,https://blog.naver.com/mamre-land/222905940055
인기 유아 니트 조끼 착용 스타일 스타일 동시 아이템 겨울철 필요 아이템,https://storyzzang.com/2059
인테리어 디자이너 라이프 스타일리스트 리빙 크리에이티브 디렉터 다양 이름 옷장 스타일 체크 소품 색상 소재,https://blog.naver.com/designpress2016/221734434008
유행 스타일 색깔 관심 잡지 포스팅 시대 지도 시대 설명 느낌,https://nurisam.tistory.com/36
컬러 조합 트랩 교체 가능 고유 스타일 사용자 취향 기분 장소 스타일 자유 선택 가능 트랩 일상 특별,https://blog.naver.com/plumshine/221718419318
음악 스타일 재미 조나단 펀드 앨리 스탠드업 코미디 브루클린 나인 나인 모던 패밀리 최애,https://blog.naver.com/forever420/221470800869
표본 회전 김포 영어 회화 적용 핵심 구성 요소 분석 유형 유형 스타일 사무직 기획 기술 자문 창의 평가 담당,https://blog.naver.com/sdhujokl/223189606563
아마추어 반려 식물 애호가 관리 시클라멘 특징 종류 스타일 머리 스타일 중년 여성 헤어 스타일 모음,https://alphamom1.tistory.com/262
운전자 주차 맞은편 건물 아이원 프라자 스타일 제안 헤어 메이커 스타일 악세사리 향수 퍼스널 종합 컨설팅 제공 여니,https://blog.naver.com/yeonyvibes/222987999326
유행 스타일 예전 인기 스타일 문화 현재 해석 사장 유리 단점 가맹 초기 비용 개인 카페 장점 대로,https://blog.naver.com/ecof9415/223162533180
인간 마리 아방가르드 스타일 치킨 사진 블러 제품 블러 선호 보통 베이스 발레 슈즈,https://blog.naver.com/cendre_mello/223160207508
제니 스타일 표현 제안 블랙 핑크 제니 아이스크림 요즘 아이스크림 스타일,https://blog.naver.com/greenn79/222098941320
스타일 관심 스타일링 노하우 소개 전직 승무원 승무원 면접 후기,https://blog.naver.com/rhdtkscneo/222971510702
남성 관심 클래식 스타일 스타일 포토 포토 느낌 연출,https://blog.naver.com/nefangel/80197442345
여성 골퍼 여성 골퍼 신경 골프 필드 스타일,https://blog.naver.com/ssoicolor/220406527658
평소 스타일 체크 머리 방향 연령 스타일 샴푸 헤어 체크 걱정 지원 사랑 감사 아들,https://blog.naver.com/rlftjdqkqh/90168992916
백문 백답 챌린지 친구 지목 블로그 나중 지목 평소 스타일 입음 동생 입음 성격 콤플렉스 손가락 존경 인물,https://blog.naver.com/zlzlbe55/222738813896
용모 헤어 스타일 여성 확보 그룹 영화 등장 배우 축구 축구 래이너 사이먼 클리포드,https://blog.naver.com/jabk72/50005329613
중요 큰일 다크 느낌 타투 스타일 스타일 감각 친구,https://blog.naver.com/yooo8180/222849019182
선택 이유 청담동 지점 청담 스타일 얼리 장점 언니 평소 스타일 부산 예물,https://blog.naver.com/blooming0211/222170772259
빈티지 의상 리뷰 인터뷰 트랜 스타일 보드 여정 스타일 탄생 헌신 의상 전도사 글쓰기,https://blog.naver.com/erica_93/221490795972
실력 게임 테니스 플레이 문회 스타일 출신 대학 직업 자산 수준 구별 현재,https://blog.naver.com/wannaflyaway15/223108087576
오늘 집사 플릭스 신작 전쟁 도전 전쟁 이력 출연자 전력 독특 스타일 작업 스타일,https://blog.naver.com/part-time_artist/222488477522
스타일 연출 헤어 센스 스타일 헤어 스타일 손재주 입담,https://blog.naver.com/ddegihouse/80135053996
사혜 준이 드라마 모델 배우 직업 캐릭터 센스 스타일 직구 난이도 하인 직구 쇼핑 청춘 기록,https://blog.naver.com/hu_sh_go/222088974122
일러스트 스타일 디자이너 디자인 디자이너 스타일 하운드 투스 체크 소요,https://blog.naver.com/luisparan/223051537665
수천 스케치 스타일 태블릿 작가 작가 지망생 문제 고민 이야기 구체 방법 취재 구성,https://blog.naver.com/sigong_art/221907794889
해시 태그 스타일 관련 시태 음식 맛집 시태 여행 관련 시태 육아 관련 시태 스타 그램 스타일 스타 데일리 룩스 그램 코디 음식 맛집 시태 먹스,https://myuncle-mrahn.tistory.com/911
교시 스타일 종류 출처 핀터 레스 출처 스타 스타일 스타일 대박 기초 스트릿,https://blog.naver.com/jgit112/223092935207
상담 가능 무드 오버 채팅 올드 느낌 헤어 스타일 고객 옷장 매치 평소 스타일 전신사진 이해,https://blog.naver.com/joyyel/222734932261
은둔 스타일 미모 남성 시청자 마음 전역 오랜만 복귀 김지훈 웹툰 작가 매력 발산 연기 변신,https://blog.naver.com/baristyle/150155983434
스타일 공유 입소문 우먼 패션계 권유 게임 멤버 해커 여울 심은경 세상 완벽 조작 사실,https://blog.naver.com/rtpcqf87/223207258311
등산 쇼핑 등산 부담 등산 코스 등산복 여자 여름 산복 차림 서울 베스트 선화 등산복 의상 서울 등산 코스 도시 여자,https://blog.naver.com/yaming111/222546165088
스타일 맞춤 신경 온리 물안경 수영 팬티 아재 수영 대회 경기 수영 각양각색 스타일,https://blog.naver.com/unstopbubble/222405776157
소재 농부 활동 지장 편안 작업복 완벽 마음 작업복 뷰크 행운 경험 리뷰 소통 주말 스타일 블로그,https://blog.naver.com/2848yoyo/222319075290
스타일 사랑 미스신 주도 공식 필요 유용 전직 모델 출신 몸매 스타일 여배우,https://blog.naver.com/ncyberzone/130026472027
스타일 스타일 기술 가지 예술 재능 단계 어중간,https://blog.naver.com/udt413/223434222036
스타일 탐색 저널리즘 스타일링 관련 프로젝트 인테리어 저널리즘 과정 기사 인터뷰 기사 작성 저널리즘 평론 통합,https://blog.naver.com/fsearang/222562798508
헤어 스타일 평소 스타일 고려 일자 머리 고급 여성 표현 매직 진행 스타일,https://blog.naver.com/seohan20/223096588654
평소 스타일 겨울 교복 츄리닝 패딩 다님 초봄 늦가을 청바지 맨투맨 청바지 니트 나머지 계절 공작새 스커트,https://blog.naver.com/jamongstory_/222708191668
점주 안성맞춤 걸스 사업 경험 걸스 스타일 여성 보세 의류 프랜차이즈 걸스 문의,https://blog.naver.com/ondagirls14/221448897377
블라우스 예능 친절 매너 이수경 회사 출근 스타일 홍현희 자켓 정보 기적 영화 홍보 행사 동료 배우 선물,https://blog.naver.com/dalcome5/222516896902
스타일 모드 여자 여자 인형 마루 인형 관심 어버이날 어버이날 카드 처음,https://blog.naver.com/lilmine_luv/223111938887
스타일 파스텔 고스 양산 독특 게임 공략 입장 스티커 노력 다이소,https://blog.naver.com/saki0307/222659593903
동생 다년간 시청 연예인 스타일 체득 본능 가늠 재능 어필 의상 스타일 동생 평가 가혹 요새,https://blog.naver.com/valentine153/100122556746
권사 생각 스타일,https://blog.naver.com/didco14712/223192837296
걸스 사업 경험 맹점 추후 홀로서기 문제 정도 스타일 여성 보세 의류 프랜차이즈 걸스 맹문 홈페이지,https://blog.naver.com/ondagirls14/221418272954
블로거 열정 파워 블로거 시작 평소 스타일 최고 최고 성격,https://blog.naver.com/seb0213/222679374283
헤어 스타일 액세서리 스타일 색상 전반 리더 이미지 리더 메시지 정도 기업 리더 신년사 리더 제스처,https://blog.naver.com/osil0928/222204399650
스타일 칭찬 몰입 정장 제작 다방면 스타일 장인 표현,https://blog.naver.com/ghdwndlf12/223015736374
복고 캐주얼 해석 스타일 이론 차이 소개 도움,https://blog.naver.com/csw3054/222613666237
스타일 자연 연출 아이라인 자연 연예인 메이크업 방법 오늘 연예인 메이크업 방법 헤어,https://blog.naver.com/nova415/223188964310
감각 스타일 표현 생각 세계 인구 대변 스타일 인구수 다양,https://blog.naver.com/justices77/223236608921
중요 부분 차지 스타일 히피 히피 스타일 등장 스타일 사랑 스타일,https://blog.naver.com/artstudies/221344269564
평소 스타일 키치 느낌 그림 배경 정국 노래 이게 요리 프로 이게 요리 자신감 요리 음식물,https://blog.naver.com/hohonghonghong/222111429353
트랩 가지 색상 스타일 사쿠라 핑크 루프 오렌지 파이트 블랙 민트 색중 스타일링 분위기 운동복 대부분,https://blog.naver.com/hamilworld/222174969351
사업 경험 점주 걸스 프랜차이즈 노하우 향후 매장 걸스 스타일 여성 보세 의류 프랜차이즈 걸스 문의,https://blog.naver.com/ondagirls14/221450632894
다방 다방 냉커피 아메리 치노 아이스 아메 아이스 아메리카노 스타일 피팅 스타 스타 그램 중독 스타 스타 시작 스타 친구 인친 인친 환영 스타 친구 인친,https://blog.naver.com/firstclass_3/221065838938
스타일 취미 상대 브랜드 스타일 어필 상대 취향,https://blog.naver.com/escoffier2/222610938967
효과 아이템 스타일리시 패치 종류 패치 패치 스타일 창조 패치 관련 정보 풍자,https://epopo.tistory.com/1101
본사 적극 지원 행사 판매 매장 운영 전반 걸스 스타일 여성 보세 의류 프랜차이즈 걸스 문의,https://blog.naver.com/ondagirls14/221452683937
공간 스타일 드림 시작 이유 블로그 부업 포스팅 알바 수입 대학생 알바 주부 부업 직장 부업,https://blog.naver.com/young236358w/222633041370
주변 내두 정도 주차 수차례 도움 요청,https://blog.naver.com/anchor14826/223140688479
서비스 일상 통화 기록 스타일 추천 대화 학습 절차 개인 스타일링 블랙 탠저린 운영 스타일 추천 애플리케이션 코콘 이용자,https://blog.naver.com/lovelyzooa/223100019301
세기말 진스 스타일 릭오웬스 바라 라바 라바 리정 모자 고양이 비니 찰스 제프리 비니 유니크 스타일 착용 애착 일상,https://blog.naver.com/oldpopsong/222947898056
스타일 총장 제외 평소 스타일 총장 절분,https://blog.naver.com/lkrlkyung/223474852084
고양이 강아지 가방 밀리 밀리 반려 동물 라이프 스타일 브랜드 반려 동물 배려 디테일 기능 반려 동물 집사 편안 스타일 제품 다양,https://blog.naver.com/nyanghaf4/223050181685
이마트 구매 등산 모자 가방 고트 코어 스타일 품명 포터 탱커 더플백 스몰 사이즈 어깨 스타일,https://blog.naver.com/kby212/223041766305
혼란 스타일 페미 스타일 중점 소비자 소비자 입맛 가공,https://blog.naver.com/andlovej/221592153258
신뢰 커뮤니티 목적 변경 개월 참여 개월 커뮤니티 엄마 스트레스 해소 커뮤니티 엄마 심리 이해 접근 타깃,https://blog.naver.com/tigermas/221216358421
세상 디자이너 스타일 소화 스타일 고집 도전 계속 디자이너 감사,https://blog.naver.com/hmhm919/221907360913
스타일 한국인 덕분 한국인 순간 운전자 심정 운전자 직진 고속도로,https://blog.naver.com/babblingsilvia/120171948967
제작 아이템 아이템 스타일 스타일 해외 시작,https://blog.naver.com/ch0b0isnew/223288293221
예능 예능 이미지 양산 화제 관심 편안 트레이닝 선호 스타일 역시,https://hightechlowtech85.tistory.com/506
그동안 녀석 스타일 입맛 덕분 예전 아빠 탈탈이 운전 시절 논두렁 기억 추억,https://blog.naver.com/comfort7/70179462613
블로거 볼거리 장소 이거 블로그 체험 사진 그램 스타일 네이버 예약 방문,https://blog.naver.com/boogionnon/223005776894
네이버 스타일 크리에이터 활동 시작 선택 네이버 스타일 다양 스타일 처음 셀렉 크리에이터 활동,https://blog.naver.com/you_are_my_starlight/221531751773
경력 유니크 스타일 구축 엄지 블로그 시작 블로그 이웃 출처 블로그,https://blog.naver.com/eomsoobok/222297589698
